id,created_at,text
693164572333772800,2016-01-29 20:11:27,": Needless to add, any normal USG employee whose personal email had TS items ""somehow"" in it would be frog-walked in lite…"
693163751051239426,2016-01-29 20:08:11,What a surprise. We can ask the Russians or the Chinese for them.
693144606125461504,2016-01-29 18:52:06,George P.'s service falls into realm of textbook special treatment for children of political dynasties...read more:
693097976571502592,2016-01-29 15:46:49,". &amp; are a formidable team. Well done last night, guys."
693070886249840641,2016-01-29 13:59:10,Doubtful candidates could gamble the way did and come out looking strong w m raised for vets. Interested to see the 's.
693058032587112449,2016-01-29 13:08:06,"Trump used to be 's human shield during debates. With him gone, was able to bruise him. Trump should send a thank you."
693052977964306432,2016-01-29 12:48:00,"Voters need a ""Washington to English dictionary"" before he zinged on snow removal. ""Maybe he needs my help."""
693047369752023040,2016-01-29 12:25:43,"One of the best parts about watching both events last night? Getting to see my very dear old pal on CNN. Miss you, friend."
692943855839244288,2016-01-29 05:34:24,: watching try to dish out sick burns
692934184877301760,2016-01-29 04:55:58,You really do become the person you disdain. Many pundits have become far ruder &amp; nastier toward Trump than they ever accused him of being.
692924052378361856,2016-01-29 04:15:42,"Come on, Marshall. You know you missed him."
692918530359033856,2016-01-29 03:53:46,. does better when he has Trump on stage as sparring partner. Some of his policy positions are really solid. It's just the style...
692912858288517120,2016-01-29 03:31:13,Helluva compliment for Trump from one of the greatest men in business history.
692911747993333760,2016-01-29 03:26:49,Way better than milkshakes.
692911561145479168,2016-01-29 03:26:04,. lies to the faces of families of those who died in Benghazi. Only a soulless person would do that. 's best pt.
692908977894637568,2016-01-29 03:15:48,. should have run in .
692908462234300416,2016-01-29 03:13:45,One Cuban on the stage brought the Latin passion toward his opponent. The other one looked at the camera.
692906785410322432,2016-01-29 03:07:05,You crushed it tonight! She looks beautiful.
692905956489961473,2016-01-29 03:03:48,I hope Jeb wasn't kidding about all that cool stuff he could be doing if he isn't running for President.
692903802198949888,2016-01-29 02:55:14,. had one of the best announcement speeches. How did it all go so wrong.
692902791296212993,2016-01-29 02:51:13,. is the best on the stage at going negative on Hillary Clinton.
692900462987579392,2016-01-29 02:41:58,The same government that couldn't build a website can't properly vet refugees. It even admits that.
692898600574017536,2016-01-29 02:34:34,"Oh, I'm now seeing why those rumors about everybody secretly hating in the Senate started."
692897764548579328,2016-01-29 02:31:15,"Curious, will your son George P. be joining the fight embedded in Iraq, Jeb? Oh wait, that's right, he's also planning to run for President."
692897070030532608,2016-01-29 02:28:29,If there were a red carpet at things like this we'd know who made Chris Wallace's glasses. Dammit.
692896563983622144,2016-01-29 02:26:28,"Thought bubble over every Trump hater's head during the bathroom break: ""God, I really miss him."""
692895965791940608,2016-01-29 02:24:06,"When do you think they'll stop talking about Reagan? I mean, I REALLY love him, too but..."
692895410688405505,2016-01-29 02:21:53,"""Arm the Kurds"" and the Keystone pipeline. Come on, guys. Reach higher."
692894399160659971,2016-01-29 02:17:52,We can't be strongest country in the world when we're busy spending $$ making other countries strongest in the world
692893684212244481,2016-01-29 02:15:02,Father vs. son q. Really good .
692868146701561856,2016-01-29 00:33:33,Diplomacy at work.
692866475682476034,2016-01-29 00:26:55,"Here, here."
692854082470486020,2016-01-28 23:37:40,"Proof to back up Huma Abedin's confession that Hillary is ""often confused""..."
692848311229808641,2016-01-28 23:14:44,"So good I need a cigarette after this. And I don't even smoke. Trump Is Shocking, Vulgar and Right"
692842782117855233,2016-01-28 22:52:46,That's assuming they indict at all.
692790605932535808,2016-01-28 19:25:26,There is no greater waste of words than conventional widsom. This election cycle proves it.
692410239929417729,2016-01-27 18:14:00,Caught in the background of the Sanders White House press conference...
692361899070099457,2016-01-27 15:01:54,Did I just say the most petty &amp; desperate attack yet? Sorry. I didn't scroll down enough in timeline to see this.
692361122863828992,2016-01-27 14:58:49,"As a woman with a credit card who likes to speed &amp; got a traffic ticket once, this is the most petty attack yet."
692360223693115392,2016-01-27 14:55:15,The always prescient Paglia...Hillary’s “blame-men-first” feminism may prove costly in via
692357049364123649,2016-01-27 14:42:38,"I'm no Chris Matthews fan but ""Who will watch two Cuban guys?"" tomorrow is pretty funny. (though if a Republican said it...)"
692203245289234432,2016-01-27 04:31:28,Don't even...
692170378626650112,2016-01-27 02:20:52,"From his press release: Trump ""will instead host an event in Iowa to raise money for Veterans &amp; Wounded Warriors"""
692162590152196100,2016-01-27 01:49:55,"Nicely done. Liberals who keep arguing Hillary did nothing wrong, please see the below:"
692118532558082052,2016-01-26 22:54:51,"That's a lot of effort by Obama's FBI and IG for someone who alleges they ""did nothing wrong."""
692058523358855169,2016-01-26 18:56:24,"America's self appointed ""grandma"" responded by reminding him she's been doing this long before he was born. Hmm."
691985788318400512,2016-01-26 14:07:23,"Hillary said she's a ""progressive who likes to get things done."" So why couldn't she name accomplishment when Wolf Blitzer asked in Sept?"
691797849806340097,2016-01-26 01:40:35,Tough to argue with logic - National Review: How dare you say we endorsed McCain &amp; Romney. To be clear we endorsed... McCain &amp; Romney.
691794302528311297,2016-01-26 01:26:29,I didn't hear any complaints from Trump critics when I said this...
691790491143270401,2016-01-26 01:11:20,"""New energy""? That's not what her fmr campaign mgr Solis-Doyle told Axelrod: ""You know she’s tired. She gets tired."""
691729914744180736,2016-01-25 21:10:38,"If they want to whine and cry that's fine - weird - but fine, just don't allege my facts are wrong when they aren't."
691728562345369600,2016-01-25 21:05:15,"Fact: National Review endorsed Romney in ' &amp; McCain in '. Hence, they endorsed Romney &amp; McCain just as I said."
691722943878012928,2016-01-25 20:42:56,"FACT: Hillary &amp; Rubio both support child tax credit, foreign policy views on Libya (Arab Spring) &amp; immigration (Rubio flipped on refugees)."
691693663735410688,2016-01-25 18:46:35,: Family hopes public can help them find missing teen in Long Beach who has special needs
691686562170572805,2016-01-25 18:18:21,Benghazi survivors don't consider being lied to by Hillary her taking responsibility-I'll take their word over hers.
691685187051220994,2016-01-25 18:12:54,It can be. You know what else seems to work: karma. You really do reap what you sow. Ultimately cream rises.
691643251632312321,2016-01-25 15:26:15,The establishment insisted he was credible. They have a serious blindspot.
691639138001522688,2016-01-25 15:09:55,But will they work with her where it really matters and give her cover if the FBI recommends charges?
691622185379708928,2016-01-25 14:02:33,"Do as I say, not as I did."
691619122535370752,2016-01-25 13:50:23,. nails it again. A Monday must read.
691613138861580288,2016-01-25 13:26:36,Attacking Trump now won't work
691477470038589441,2016-01-25 04:27:30,"I wouldn't call this Hillary ""taking responsibility"" for Benghazi."
691473888589512705,2016-01-25 04:13:16,That's my entire point.
691463764940562432,2016-01-25 03:33:02,It sure does. Such a beautiful pic from such a beautiful charity.
691438231674556416,2016-01-25 01:51:35,"NR endorsed McCain for Senate over Hayworth in ', not '. Their rationale wasn't true conservatism said McCarthy:"
691409555838861313,2016-01-24 23:57:38,"To Hillary, how a terrorist died is worth k. How four Americans died, at this point, doesn't make a difference."
691405568477663232,2016-01-24 23:41:47,"Both Hillary and Obama said this was a ""mistake""...that didn't ""endanger national security."" What will they say now?"
691403222091710464,2016-01-24 23:32:28,I wouldn't mock Trump supporters saying they can't read when so many never read mood of the party to see him coming.
691381206135541760,2016-01-24 22:04:59,"Weird. They asked if they can have til November , ."
691378592840810496,2016-01-24 21:54:36,"So Hillary takes responsibility for success in getting Bin Laden, but zero responsibility for failures in Benghazi?"
691358534689296388,2016-01-24 20:34:54,Kickin' it
691310227996725248,2016-01-24 17:22:56,"The vast, right wing Federal Bureau of Investigation."
691308862285160450,2016-01-24 17:17:31,GOP keeps dreaming about adding millennial women &amp; Latinos. Trump adding working class voters makes more sense.
691304382940450816,2016-01-24 16:59:43,"Nobody should be getting paid to give speeches about the Bin Laden raid. Not anyone, but especially not her."
691084521865908224,2016-01-24 02:26:04,Just posted a photo
690681840752009216,2016-01-22 23:45:57,"Past candidates weren't ""conservative"" or exciting yet establishment embraced &amp; they lost. Finally, someone electrifies &amp; they trash him."
690680259130294272,2016-01-22 23:39:40,It's one big Dem coverup. They all knew about her server: NY Times buries the news of Clinton's classified emails
690663014429667328,2016-01-22 22:31:09,: .: Here's the Counterpunch to National Review's Attack https://…
690644506685919232,2016-01-22 21:17:36,Trump has crossover appeal. Elites have never met a blue collar worker (unless they were fixing their jacuzzi).
690643581816676353,2016-01-22 21:13:56,Good luck with that. There aren't many.
690642311903076352,2016-01-22 21:08:53,"NRO ENDORSED Romney &amp; McCain &amp; gave us W's wars, huge deficits, amnesty, bailouts. They helped create Trump's rise."
690639454445395969,2016-01-22 20:57:32,:
690638977712439299,2016-01-22 20:55:38,It is. William F. Buckley used to publish a stellar series of conservatives who lead to the Reagan Revolution.
690638267138572291,2016-01-22 20:52:48,"National Review has endorsed Mitt Romneycare &amp; John McCain. Movement ""conservatism"" by the elites has not worked."
690606473165021184,2016-01-22 18:46:28,"I respect but they should've blasted the SOURCE of conservatism crumbling which lead to Trump's rise: THE FAILED, ELITE ESTABLISHMENT."
690602118743494656,2016-01-22 18:29:10,"Despite refugee crisis Obama at all costs: ""I will stand w them should political winds shift in an ugly direction."""
690589371951620097,2016-01-22 17:38:31,The most powerful terrorist recruitment tool out there is the Obama Administration.
690586167134310401,2016-01-22 17:25:47,"""Movement conservatism"" has not been a powerful enough force to make things better for the working classes in the US"
690564375023882240,2016-01-22 15:59:11,"Everyone is talking about this article today. Perhaps ""conservatives"" aren't as popular as they thought:"
690562196032589826,2016-01-22 15:50:32,A MUST read this morning: How an obscure adviser to Pat Buchanan predicted the wild Trump campaign in
690270639618408448,2016-01-21 20:31:59,Ironic to hear these words from the same RINO career politicians in DC who put the Republican party on life support.
690244131470315521,2016-01-21 18:46:39,: Proven over and over again...
690232364711157762,2016-01-21 17:59:54,"Yes. is uniquely suited to win a bellwether, blue collar &amp; notably purple state like PA."
690164918541221888,2016-01-21 13:31:53,You really can't make it up... New feminist dilemma: men are TOO helpful around the house
689925229389422596,2016-01-20 21:39:27,: How Hillary's Insane Paranoia Led Her To Put Classified Material On Her Homebrew Server
689913108861734912,2016-01-20 20:51:17,"Even Lena knows, a woman who bullies other women bc of the pervy, wrongful actions of her husband is the worst kind."
689910747833462785,2016-01-20 20:41:54,LOVING this book &amp; how it's enriched our daily devotionals. Thanks &amp; for the personalized copy!
689903994265812992,2016-01-20 20:15:04,"Interesting timing Petraeus demotion talk. Sounds like a threat but it only reminds ppl that HRC must suffer, at minimum, same punishment."
689902849866776581,2016-01-20 20:10:31,"Very little, IMO. While there is some short term benefit + a dunk on Cruz, Palin needed it more than Trump did."
689900983967678464,2016-01-20 20:03:06,%. There isn't some guy in a room with a rubber stamp labeling emails 'classified'. Hillary knew full well.
689852591778484232,2016-01-20 16:50:49,"""Hmmmmmm"""
689821068509462528,2016-01-20 14:45:33,"NYT echoes this today w piece on how even Lena Dunham ""disturbed"" by Clinton sex scandals"
689618885713248256,2016-01-20 01:22:09,Too big to NOT jail
689615538180456452,2016-01-20 01:08:51,The markings DO NOT MATTER. Content of the msg is what determines its classification. Some docs are born top secret.
689613105945538560,2016-01-20 00:59:11,"Big tonight: Bill has at the top, director at the end, and me in the middle."
689611010265747459,2016-01-20 00:50:51,"""Poorly scripted""...b/c a jihadi ambush should produce more entertaining dialogue than that Stick to covering Davos."
689601918776246273,2016-01-20 00:14:44,This is personal. Payback for the way the establishment treated her.
689600525197795328,2016-01-20 00:09:12,There is a pickle maker somewhere watching this Palin endorsement press conference who just found a title for his memoir: Art of the Dill
689598149233659905,2016-01-19 23:59:45,This is very serious. Anything less than what Petraeus received is overt special treatment for an obvious criminal.
689596643474292736,2016-01-19 23:53:46,Call your bookies:
689592072240766977,2016-01-19 23:35:36,"She's violated numerous federal laws, most serious re: espionage. FDR would've had her summarily jailed."
689587267443232772,2016-01-19 23:16:31,If only they asked the Iranian militia group in a nicer way...
689476145360846848,2016-01-19 15:54:57,
689454496586473472,2016-01-19 14:28:56,"To those who say it's ""ludicrous"" this is a version of 's policy proposal applied to nightlife."
689231415444172801,2016-01-18 23:42:29,Ain't that the truth.
689229976143572993,2016-01-18 23:36:46,"Funny. It was Bill who flew that flag as Gov over the state house in AK calling us ""Confederate States of America."""
689200187764531201,2016-01-18 21:38:24,She did. Then she covered it up. If anyone sees &amp; still votes for Hillary they're a criminal.
689173903483256836,2016-01-18 19:53:57,She has no choice but to give full throated support for Obama to shore up left...&amp; she might need him to pardon her.
689124854612754433,2016-01-18 16:39:03,Can't take my eyes off this live rally.
689105212989136899,2016-01-18 15:21:00,Left often prides itself on diversity. First candidate to be under federal investigation is certainly a new one.
689079099432787969,2016-01-18 13:37:14,"Bernie already capitulated &amp; said he's ""sick"" of hearing about Hillary's emails at first debate. He's not serious."
688901070748299265,2016-01-18 01:49:49,Obama's soft power &amp; capitulate at all costs foreign policy has now put a bounty on the head of every American.
688845486598524930,2016-01-17 22:08:56,While the Administration is busy celebrating the dreadful Iran deal...
688843482887225348,2016-01-17 22:00:59,"""ISIS is not getting stronger....they have been contained"" - , /15"
688834435022729216,2016-01-17 21:25:01,Tea time with Notorious ING
688818821910638592,2016-01-17 20:22:59,The Obama Admin is actively now funding terrorism against the US &amp; our allies.
688816067486068738,2016-01-17 20:12:02,From the man who so wrongly assured us that ISIS was the JV squad.
688813572084883456,2016-01-17 20:02:07,"The biggest point of all on Iran is that there's no deal. Islamists don't believe they have to honor deals with infidels. Not now, not ever."
688767333909811200,2016-01-17 16:58:23,"There is no deal. Islamists do not believe now, or historically, that they have to honor agreements with infidels."
688765912753827840,2016-01-17 16:52:44,The sailor video was a Shia commerical to Sunni Saudi Arabia &amp; the world that Iran brought America to its knees.
688490481727238144,2016-01-16 22:38:17,This is a very dark day. We just armed a grave enemy. Congratulations .
688463501443117060,2016-01-16 20:51:04,Putting multiculturalism &amp; fear of Islamophobia over women's safety &amp; rights. Tragic &amp; unacceptable. We're next.
688158658929102848,2016-01-16 00:39:44,Everyone should see this movie. Such an important film.
688066020611895296,2016-01-15 18:31:37,"The genius of 's comeback wasn't just /11, it was standing up for law enforcement (blue collar men) a group under attack."
688062738250231809,2016-01-15 18:18:35,Our made insightful point on whether Trump will regret being too chummy w Cruz for too long
688061911091556352,2016-01-15 18:15:17,So good
688047160563253248,2016-01-15 17:16:41,"Cruz did very well on the citizenship q but really screwed up on the ""NY Values."" Trump flattened him and came out looking more tolerant."
688005763999121409,2016-01-15 14:32:11,Values might not be in NY but the campaign cash is. Every candidate on stage except Trump has come to the Big Apple to beg the big bankers.
688005022756552704,2016-01-15 14:29:14,Good observation
687859609198026752,2016-01-15 04:51:25,First person to make a meme for me with a middle finger to use as my screensaver gets a RT - friend
687858763689275392,2016-01-15 04:48:03,"Observers who underestimated Trump &amp; said he was a joke and not to take him seriously for months have finally changed their tune, it seems."
687857399168892928,2016-01-15 04:42:38,"This was the best debate night yet. Well done, ."
687856740805808128,2016-01-15 04:40:01,Frontrunners strong: Trump: Ready &amp; unflappable. Cruz: On point &amp; nailed closing but bungled the counterpoint where it counted with Trump.
687855730184032256,2016-01-15 04:36:00,
687853828356595712,2016-01-15 04:28:27,Yessss
687853400730546177,2016-01-15 04:26:45,. chose the best and the most rightful theme for a closing statement.
687852373524496384,2016-01-15 04:22:40,"First ""asunder""....now ""mind's eye"""
687851391856017409,2016-01-15 04:18:46,Laws already exist to use against companies who let terrorists use their social media platforms &amp; SCOTUS precedent. Need an AG to enforce it
687849459234009088,2016-01-15 04:11:05,Legit funny.
687849224290054144,2016-01-15 04:10:09,How failed that: . It's not just radical Islam manipulating our immigration system. . Radicals didn't just appear yrs ago
687848534025072642,2016-01-15 04:07:24,"Is it me or is getting weird...er in these settings. Much better in a small group, or an operating room."
687845345183838208,2016-01-15 03:54:44,That attack by on re: Planned Parenthood isn't going to stick. Christie vetoed funding for the group times.
687843585761370112,2016-01-15 03:47:45,"Nobody gets Iran was humiliating a SAUDI ally, the US, w Iran incident. They are telling Saudis to not count on American abject weaklings."
687843018423046145,2016-01-15 03:45:29,Nobody has said Iran incident is about sending a signal to the Saudis &amp; Gulf sheiks that US is weak in light of execution of Shia cleric.
687840551207616517,2016-01-15 03:35:41,"W's brother advocating for the Sunnis. A top fundraiser of his, Ignacio Sanchez is a top lobbyist at DLA Piper who reps Sunni Saudi Arabia."
687839232946245632,2016-01-15 03:30:27,That was good answer by but it assumes that Muslim refugees aren't already prone to radicalization no matter where which is naive.
687836303434641412,2016-01-15 03:18:48,"Dramatic Lindsey Graham head nodding, shadowed cameo. Taking your thoughts."
687835563093848064,2016-01-15 03:15:52,"Tomorrow's editorial question: Can Republicans throw deeply blue, ISIS terror target, post /11 New York, under the bus?"
687834707426471936,2016-01-15 03:12:28,For the love...
687834038627876864,2016-01-15 03:09:48,"Reagan's pollster Dick Wirthlin used to say ""motivate by reason, persuade through emotion"" is using reason. Trump is using emotion."
687833175997968384,2016-01-15 03:06:23,. is consistent with the counterpoint. Cannot get a glove on him.
687832656684433409,2016-01-15 03:04:19,Not a lot of conservatives come out of Manhattan. Daaamn.
687828656996134912,2016-01-15 02:48:25,Excellent question on Bill's past but it should have been posed to one of the equivocators who think Clinton is off limits like Jeb &amp; Kasich
687827888121470976,2016-01-15 02:45:22,. is elevating the conversation.
687826933669851136,2016-01-15 02:41:34,. made look petty. And petty on behalf of the establishment is a bad look.
687826492735262721,2016-01-15 02:39:49,Oh boy. These two.
687825470461734913,2016-01-15 02:35:45,"Now, the rest play Who Does the Establishment Hate More... &amp;"
687824730020253698,2016-01-15 02:32:49,Wow. &amp; prepared but this sounds like a deal gone bad.
687823445229498373,2016-01-15 02:27:43,Does anyone get they might run against who bases her entire campaign on women? Might want to bring up Europe's rape crisis.
687822435597561856,2016-01-15 02:23:42,If linked rape in Germany to how American women are in danger w importing male refugees that would've been a better answer.
687820822090805248,2016-01-15 02:17:17,"First time the word ""asunder"" has been used in a Presidential debate &amp; not a love song."
687820481085476864,2016-01-15 02:15:56,Somebody's been studying. That was the best answer W's brother has given yet. His parents must be BEAMING.
687818671209725952,2016-01-15 02:08:44,"Conducting my own real time focus group. ""Who is this?"" - friend next to me watching debate. Not good for ."
687795760893685761,2016-01-15 00:37:42,Belly laughs w
687772437933604869,2016-01-14 23:05:02,"Best point of the day, below. Obtuse Obama sees no ""existential threat"" to the US &amp; ""We can absorb another /11"""
687689719048761344,2016-01-14 17:36:20,The Obama foreign policy &amp; crippling rules of engagement: capitulation at all costs
687662487454511105,2016-01-14 15:48:07,"Kris Paranto, on the ground the night of Benghazi &amp; author of , on : ""There was a stand down order given."" So who gave it?"
687353017092431877,2016-01-13 19:18:24,Obama/Jarrett/Rice rules of engagement looking more like capitulation at any cost.
687350313272016896,2016-01-13 19:07:39,"Iran holds hostages, pulls off deliberate propaganda victory &amp; we eress gratitude &amp; hand them $100B. Unreal."
687343280552460288,2016-01-13 18:39:42,Only the feeble foreign policy of the Obama Admin could THANK an enemy for humiliating the United States of America.
687332628161236992,2016-01-13 17:57:23,Watch this. Then go see this film.
687303373792530432,2016-01-13 16:01:08,Lucky enough to attend 's movie screening last night on Benghazi. Such an important film &amp; so well done. A MUST see.
687055467466457088,2016-01-12 23:36:02,. removed the Democratic symbol known as the confederate flag. Liberals are deeply threatened by her.
687052537812275201,2016-01-12 23:24:24,Weak and wrong. What happened to Hillary the hawk? VIDEO: Clinton Says 'White Terrorism' As Dangerous As ISIS
687020816593059840,2016-01-12 21:18:21,The UN is a corrupt racket oppositional to US interests &amp; basic human rights. We should kick them out of NYC.
686999084285100032,2016-01-12 19:52:00,": I wonder if my fallen SEAL Brothers in Benghazi feel like their lives were changed ''fundamentally"" by ISIS... LLTB https:…"
686998168827899904,2016-01-12 19:48:21,Nailed it.
686991622714691584,2016-01-12 19:22:21,The ignorance of the left is astounding. That same ignorance is what got Europe into its massive refugee crisis.
686983343305445376,2016-01-12 18:49:27,"It's scary. We were encircled &amp; assaulted twice. We got away, but sickening to hear liberals condone &amp; stay silent."
686915953154719744,2016-01-12 14:21:40,"Happy birthday, ! Thanks for being such a loyal fan of"
686720950637858816,2016-01-12 01:26:47,Another reason why the Republican Party can't stomach the establishment candidates.
686717113940180994,2016-01-12 01:11:33,"The potential for crossover support is real, esp with blue collar men. Democrats are rightfully nervous."
686710146144272384,2016-01-12 00:43:51,"True feminists are fearless. We defend the rights &amp; safety of women at all costs, no matter how politically incorrect it may be."
686705676261928961,2016-01-12 00:26:06,"Before you hear Obama advocate for importing a culture that does not value women at the , you must watch this:"
686622198749081600,2016-01-11 18:54:23,True feminists condemn assault &amp; rape no matter who commits it &amp; where. The silence from liberal women is very loud.
686578756111171584,2016-01-11 16:01:46,Tough to read. If you cannot protect the women in your country you may want to rethink accepting more refugees.
686573224742809601,2016-01-11 15:39:47,"If there were coverups in Sweden, England and Germany, are assaults and rape being covered up here? …"
686569857765240832,2016-01-11 15:26:24,"If the choice is cover up rape &amp; asault of women or look Islamaphobic, liberals horrifically choose the former."
