id,created_at,text
630937274692300800,2015-08-11 03:02:23,Two's company
630925303733469185,2015-08-11 02:14:49,The worst part was I believed you.
630922185033547776,2015-08-11 02:02:25,On now. After Trump's advisor Michael Cohen we discuss how Trump handle his campaign &amp; join after
630908075529117696,2015-08-11 01:06:21,"This much needed break from the mania of the political news cycle brought to you by Tim Riggins. Thank you, GQ."
630798873187983360,2015-08-10 17:52:25,"More Republicans get off the issues &amp; hit each other w/ personal attacks, the bigger Hillary's smile gets. Let's keep our eye on the ball."
630792842709991424,2015-08-10 17:28:27,Based on the General's answer it doesn't sound good.
630756270048415744,2015-08-10 15:03:08,Today on Gen. Jack Keane joins to talk ISIS and more. See you at noon!
630727512369307648,2015-08-10 13:08:51,Monday morning motivation: the basebodybabes Love you!
630587204360896516,2015-08-10 03:51:19,: The administration was temporizing on radical long before showed up.
630539235779547137,2015-08-10 00:40:43,Winding down the weekend
630470066996441088,2015-08-09 20:05:52,"Big brothers teach you about cars, classic rock and tell you how guys really think. And they always…"
630171623266615296,2015-08-09 00:19:57,sunset for real
630156757063598080,2015-08-08 23:20:53,Wannabe mermaid
630121600042582016,2015-08-08 21:01:11,Life's a bath
630099784821526529,2015-08-08 19:34:30,: Rudeness is Not a Conservative Principle
630059628542435329,2015-08-08 16:54:56,Beach cruiser
629703603561852928,2015-08-07 17:20:13,I say it all day long with deep breaths!
629701066209259522,2015-08-07 17:10:08,When you play not to lose you never win.
629700540163862528,2015-08-07 17:08:02,:
629688506235944960,2015-08-07 16:20:13,About last night. Are you watching ? We got and all the good stuff from the on a Friday!
629666486236368896,2015-08-07 14:52:43,During all the debate drama Obama suffered a major blow as NY Senator Chuck Schumer came out against his Iran deal:
629661790234898432,2015-08-07 14:34:03,Early morning ballerinas (and accidental twins)
629499749448744960,2015-08-07 03:50:10,Kim... it's P-R-E-S-I-D-E-N-T
629497166613118976,2015-08-07 03:39:54,"Today's winners: Fiorina, Trump. Rubio and Christie did well. Bush was weak."
629490765979381760,2015-08-07 03:14:28,Who performed the worst?
629489578362191872,2015-08-07 03:09:45,Who was your favorite tonight?
629487466169430016,2015-08-07 03:01:21,We're live …click now!
629481590087880704,2015-08-07 02:38:00,Was just filing a missing person's report for . What'd I miss?
629476629308416000,2015-08-07 02:18:18,Glad clip on Iran was played. She nailed it. She should be on stage with them now. Way sharper than some of these guys.
629474621784518657,2015-08-07 02:10:19,"Ouch RT well, maybe too much TL."
629473834085826560,2015-08-07 02:07:11,: Talk time: Trump :06 Bush :29 Crz :30 Rbio :00 Chrstie :50 Carson :45 Kasich :11 Huck :03 Paul …
629469813774151680,2015-08-07 01:51:13,If anyone wants to know what Hillary is up to tonight.
629468095363596288,2015-08-07 01:44:23,Exchange between Paul &amp; Christie was terrific. Represents a key fault line in GOP: security v privacy. They did well
629467327759798272,2015-08-07 01:41:20,HUGHAZI
629466750694883328,2015-08-07 01:39:02,THE HUG.
629465555892834304,2015-08-07 01:34:18,That answer from Rubio on immigration was on point and passionate. He shouldn't run from the issue. Be an advocate for legal immigration.
629464007670411264,2015-08-07 01:28:08,Trump is right. GOP has been scared to talk about illegal immigration. Some of the candidates on stage have been obessed with amnesty.
629463161951907840,2015-08-07 01:24:47,Jeb looks nervous. This forum is not his strong suit.
629462953255899138,2015-08-07 01:23:57,Megyn asked a question the Clinton camp would have eventually hit him on. It was fair. He had to be ready &amp; he was.
629461443902107648,2015-08-07 01:17:57,These questions are really tough. Impressively tough.
629460876488245248,2015-08-07 01:15:42,Trump should have stopped after saying he doesn't have time for political correctness. The dig at wasn't necessary.
629460046322270208,2015-08-07 01:12:24,"""I don't have for total political correctness."" Masterful."
629459329696051201,2015-08-07 01:09:33,Rubio should have nailed Hillary on saying the GOP is hostile to immigrants as a first generation immigrant. He is scared to go there.
629457056307781633,2015-08-07 01:00:31,Here we go… on starts now
629456339031470080,2015-08-07 00:57:40,You really are excited…Instagram:
629410745437028353,2015-08-06 21:56:30,Trump touches down via Air Trump while swoons behind the scenes at prospect of years of Melania.
629408672649728000,2015-08-06 21:48:16,"A fav . ""I keep thinking we're done with George Pataki — but like an order of bad clams, he keeps coming back up on me."""
629406992386408449,2015-08-06 21:41:35,"Lindsey Graham is pro-nation building, pro-illegal immigration, pro-Ex IM Bank, pro-climate change regs &amp; never met a war he didn't like."
629403102496448512,2015-08-06 21:26:08,I would love to see debate Hillary Clinton.
629400885836156929,2015-08-06 21:17:19,I would not be surprised if Carly's last answer on Trump ends up in the pm debate and is put back on him.
629400617283272704,2015-08-06 21:16:15,"SNAP on Trump -""I didn't get a call from Bill Clinton"" and ""he's changed his position on amnesty, healthcare and abortion."""
629396894452551681,2015-08-06 21:01:27,I cannot control .
629381889040592896,2015-08-06 20:01:50,Awesome! I'll make sure not to wear as much blush on the live show.
629377057861017601,2015-08-06 19:42:38,If they are scared of Trump then how are they going to take on Hillary?
629373320337694720,2015-08-06 19:27:47,You might want to let know
629370143336996864,2015-08-06 19:15:09,Our coverage on starts at . Log onto Facebook now!
629318284983291904,2015-08-06 15:49:05,Today's the big day on - we've got all angles w &amp; on in minutes!
629303659713662976,2015-08-06 14:50:59,"Typically candidates are reacting to the news cycle, but with Trump, the news cycle seems to be following his message - esp on immigration."
629280158957051904,2015-08-06 13:17:36,Iran won't be the difining issue tonight as all candidates agree on it. I'll be watching immigration &amp; foreign policy questions closest.
629248993948794880,2015-08-06 11:13:45,": Republicans View Rubio, Walker Most Positively on Debate Eve..."
629057715868930048,2015-08-05 22:33:41,Tonight on another illegal rapes and kills a woman in CA. When will the Dems stop supporting sanctuary cities? pm
629048170086027270,2015-08-05 21:55:45,I'll be co-hosting our online coverage w your favorites from -7 and -11 on
629030634376294400,2015-08-05 20:46:04,"The vast right wing conspiracy is now a vast, evil server that nobody can find."
628966489031315457,2015-08-05 16:31:11,: This is the gobbledygook portion of the speech.
628964577456357376,2015-08-05 16:23:35,I agree. It's not a tough call -- it's bad for US security and a win win win win win for Iran.
628958884586237952,2015-08-05 16:00:58,"That's not a bad name, actually. I see a memoir title, JR..."
628944432226811904,2015-08-05 15:03:32,Go &amp; there will be a tab on the main page where you can watch our complete coverage at p!
628925086859436032,2015-08-05 13:46:40,"Iran's Ayatollah just published a book: ""How to Outwit and Destroy Israel"" &amp; the ""Great Satan."" He could have just pointed to the Iran deal."
628914094431711232,2015-08-05 13:02:59,A sign that this Admin does not have her back. Could this be paving the way for Biden?
628912689356607488,2015-08-05 12:57:24,They say it's diversity...more like stupidity
628724651951263745,2015-08-05 00:30:12,I'll be cohosting online coverage with some of your and my all time favs Thursday night
628723279327535104,2015-08-05 00:24:45,"I'm not upset that won't be on the stage Thursday night bc she's a woman, I'm upset that she won't be there bc she's good."
628719516802019328,2015-08-05 00:09:48,Tonight I join advisor Michael Cohen and to talk and his place on center stage w seanhannity p
628688695923752960,2015-08-04 22:07:20,Breaking: the others are Bush Walker Huckabee Carson Cruz Rubio Paul Christie Kasich
628688071207321600,2015-08-04 22:04:51,. to take center stage at
628627157028372485,2015-08-04 18:02:48,"And push policies that do the same. Because to liberals, black lives matter, just not in Democratic cities."
628610372019355649,2015-08-04 16:56:06,And I don't even like bacon that much. But turkey bacon is okay.
628594630184075265,2015-08-04 15:53:33,comin' right up!
628581372643385344,2015-08-04 15:00:52,Summer of crime-- spike seen in more blue cities across America not just NYC is back on at noon ET!
628573547896668160,2015-08-04 14:29:46,. Trump . Bush . Walker
628561125899157505,2015-08-04 13:40:25,GOAL DIGGERS
628547814088417280,2015-08-04 12:47:31,"Hillary's latest ad is all about her mom and being a grandma, which tells me her camps' internal numbers on female support are even worse."
628538801468637184,2015-08-04 12:11:42,Without women she loses.
628391226572697600,2015-08-04 02:25:18,"Dear no, I don't want any warm chocolate chip cookies. Thanks though!"
628365850358251521,2015-08-04 00:44:27,"Hot night, cool down"
628359029039984641,2015-08-04 00:17:21,"Not unlike ""Bruuuuce"" at a Springsteen concert."
628336682119626753,2015-08-03 22:48:33,"A Biden play is way better for Obama who is obsessed w impression managing his legacy. Biden won't trash it, Hillary eventually will."
628231408574726144,2015-08-03 15:50:14,It's debate week - lots of political news - see you on at noon!
628203445972004864,2015-08-03 13:59:07,Josh Earnest has huge smile on his face when he tells that Biden's eressed interest in running for the presidency.
627984749995388929,2015-08-02 23:30:06,Surfer envy
627631737347145728,2015-08-02 00:07:21,One of us is bored at this shin dig. Guess who?
627562851868274688,2015-08-01 19:33:38,Jenner pressured by trans community to change conservative views. Hasn't she changed enough? So much for tolerance.
627544707313332224,2015-08-01 18:21:32,"My sister texts ""Like your nephew's new blowout. I think it makes him look slimmer."" …"
627493973020553216,2015-08-01 14:59:56,I agree w that women should do nice things for their boyfriends. Feminists meltdown in fury. Declare war on kindness.
627456188897193984,2015-08-01 12:29:47,Παρακαλώ! ήταν εύκολο
627453329178820608,2015-08-01 12:18:25,We're working on it!
627309882295873537,2015-08-01 02:48:25,". is a quiet, humble hero who - when you watch her in action - gets it done. Saves lives. Coolest woman in Congress."
627309148011675648,2015-08-01 02:45:30,"I was w in Moldova in ' and she helped arrange surgery here in the US for Aurica, a paralyzed sex slave who can walk now."
627307403541901312,2015-08-01 02:38:34,Kudos Bono for acknowledging the amazing for her work on AIDS. She is the REAL deal &amp; doesn't get it enough. In awe of her.
627304683086966784,2015-08-01 02:27:45,"Sorry Bono loved the show but brought peace to Ireland, not . He showed up at the end. He was (getting) busy."
627299302935785472,2015-08-01 02:06:23,Hope so
627264319634448384,2015-07-31 23:47:22,You know you're getting older when you write a note to yourself to remember to bring your glasses to a concert.
627240208908554240,2015-07-31 22:11:34,The Friday exhale
627185581139886080,2015-07-31 18:34:29,Nice running into you at Fox - loved your brother Randy Macho Man Savage...but esp Miss Elizabeth!!
627177409620672512,2015-07-31 18:02:01,Maybe you should ask yourself why you don't. My guy brings me wine and makes dinner. We do nice things for each other.
627176496231264256,2015-07-31 17:58:23,No free speech here!
627160545272156160,2015-07-31 16:55:00,I am disgusted by both
627149991744770048,2015-07-31 16:13:04,Could Cecil the Lion's killer face jail time and extradition to Africa? It's Friday and we've got on
627101032863154176,2015-07-31 12:58:31,Everyone should follow Her pearls of wisdom from Proverbs are a great way to start your day. (And she's 's better half!)
626833028959105025,2015-07-30 19:13:34,"Best column I've read on immigration yet, via:"
626823315861151744,2015-07-30 18:34:58,"If your man is hungry, why not do something nice for him? And vice versa men for women. It's called kindness."
626816017625321472,2015-07-30 18:05:58,I gotta keep it clean for daytime TV!
626763361238274048,2015-07-30 14:36:44,Handstand tall and strong each day Psalm :2
626735401252823040,2015-07-30 12:45:38,: ROLLING STONE editor who oversaw U-Va. 'rape' story to step down...
626564515774222336,2015-07-30 01:26:36,"I thought sex lives were ""a personal matter""? (At least Bill Clinton said so)"
626524573383675904,2015-07-29 22:47:53,Tonight on - Soros group Black Lives Matter threatens white reporter &amp; Republicans but not Democrats - we debate pm ET
626463511271444481,2015-07-29 18:45:14,. Norwegians I'm guessing
626458292257165312,2015-07-29 18:24:30,"If you think you're having a bad day, remember, you could be Rep. 's press secretary."
626451731057123328,2015-07-29 17:58:26,. hmmm
626449718952902657,2015-07-29 17:50:26,LOL Pretty perfect for me
626448655508242432,2015-07-29 17:46:12,. Love it!
626447996293656576,2015-07-29 17:43:35,My sister told me she is having a message t-shirt party. What should I put on my shirt?
626441837646057472,2015-07-29 17:19:07,Candidates making the rounds on &amp; thx to
626425773713436673,2015-07-29 16:15:17,"Why would we trust the Iranians more than North Korea, a nation we gave the same deal to?"
626406108949835776,2015-07-29 14:57:09,. takes on Westboro Baptist church and talks guns after LA shooting - our on -hope to see you! ET
626381696137564161,2015-07-29 13:20:08,Some good news for once.
626206652484722688,2015-07-29 01:44:34,The one and only in a fascinating interview…says Bill Clinton is like Bill Cosby
626198799438979072,2015-07-29 01:13:22,I thought I had seen it all…until this video. (PS - I wish I owned that dress!)
626104207444197376,2015-07-28 18:57:30,Super flattered! (Blushing) I never win anything.
626085994232594432,2015-07-28 17:45:07,Bad hours yes. Bad days no. Life's too short!
626084181253206016,2015-07-28 17:37:55,How else do you think I prepare for a show??
626036016806240256,2015-07-28 14:26:32,Today on : more hopefuls - joins the couch ... joins tmrw
626018683429765120,2015-07-28 13:17:39,Concrete jungle where dreams are made of...
625852481864605696,2015-07-28 02:17:14,Uptown meets downtown
625744270041948160,2015-07-27 19:07:14,She did not have classified relations with that server.
625728009379704832,2015-07-27 18:02:37,. reports: The amount of your tax money that goes to Planned Parenthood by the numbers:
625718275121487872,2015-07-27 17:23:56,These smiles made Monday so much better!
625710851455078400,2015-07-27 16:54:26,Sick and tired of the tyranny of the minority.
625700846047752192,2015-07-27 16:14:41,That laugh can only come from one man is on - are you watching?
625465727236112385,2015-07-27 00:40:24,Making sandcastles is still really fun
625373072539951105,2015-07-26 18:32:14,. is my inspo
625332965657190400,2015-07-26 15:52:51,It's not hard to do the right thing
625320398943457280,2015-07-26 15:02:55,"Even though Sanders is nuts, you have to find a shred of respect for actually believing the insane things he says...and for annoying Hillary"
625308651511648258,2015-07-26 14:16:14,"Whoever said the phrase ""don't take this the wrong the wrong way"" has a % success rate was brilliant."
625297152063967232,2015-07-26 13:30:33,"But Clinton's base has nowhere else to go ""Tension...Clinton and Bush struggle with angry bases."
625295628038467584,2015-07-26 13:24:29,It truly is.
625059376341090304,2015-07-25 21:45:43,Do not disturb...️️️
625022303596847104,2015-07-25 19:18:24,"Well, that settles that."
625018202515501056,2015-07-25 19:02:06,"Friend asks ""Who would you rather invite to the beach - England Dan or John Ford Coley?"" Me: ""Don't they come as a package?"""
625013158743306240,2015-07-25 18:42:03,"The look your neighbors give when rather than pull in the driveway, you drive around the block to listen to the end of a really good song"
624998592235880448,2015-07-25 17:44:10,"Does laying horizontal on the couch count as ""up""?"
624712674744602624,2015-07-24 22:48:02,Beats the gym!
624675281878536192,2015-07-24 20:19:27,Just need salt
624587894745776129,2015-07-24 14:32:13,"Bergdahl's at a pot farm instead of in a prison, and the Taliban are out of prison and running wild."
624431461538627584,2015-07-24 04:10:36,.: I hate these Constitution hating pricks who want to enjoy the life it offers them.
624422011725606912,2015-07-24 03:33:03,And I never will.
624418503672598528,2015-07-24 03:19:07,Just what she needs to win
624413336290127872,2015-07-24 02:58:35,Why would anyone want to do this? I hate opening my own mail enough as it is.
624412285939916800,2015-07-24 02:54:24,": UPDATES: Death Toll Rises to in Shooting at Louisiana Movie Theater, At Least Injured http:/…"
624353298284474368,2015-07-23 23:00:00,AMAZING
624351868840493056,2015-07-23 22:54:20,just heard you on the radio!
624339502371328000,2015-07-23 22:05:11,Thanks!
624337780743774208,2015-07-23 21:58:21,Me too! Summer of '!
624281568698306560,2015-07-23 18:14:59,hells yes
624271420441411584,2015-07-23 17:34:39,"""I really enjoy doing nothing on the weekends"" - ...God, I love that man."
624061299073359872,2015-07-23 03:39:42,"Perfect weather, perfect night"
624038033902436352,2015-07-23 02:07:16,I always thought I didn't know how to wink. hmmm.
623997914310967296,2015-07-22 23:27:50,"nite on -The sanctity of life &amp; the left...btwn Steinle's murder and Planned Parenthood, why all lives don't matter. pm ET"
623946040195084288,2015-07-22 20:01:42,No longer the party of Clinton or Kennedy...crunchy abortions and crime: vote Democrat
623940146040303616,2015-07-22 19:38:17,You don't have to be strictly pro-life to be appalled by the atrocious actions of Planned Parenthood in these videos.
623916532914069504,2015-07-22 18:04:27,: Army Chief of Staff pretty sure we could have stopped the rise of ISIS - Hot Air
623909455260950528,2015-07-22 17:36:20,Thanks for watching! The field is making the rounds on
623898738004754432,2015-07-22 16:53:45,Do we really need FBI agents to investigate what the motive of the Chattanooga shooter was? What a waste.
623869567337635840,2015-07-22 14:57:50,"Sanctuary cities, abortion of infants and selling of baby parts, pro-crime and anti-cop...the core values of the left are on full display."
623865821371232256,2015-07-22 14:42:57,The insult generator is a thing. Because why should John McCain and Mexico have all the fun?
623695340357726208,2015-07-22 03:25:31,"""That's not fair. Adults don't have play dates"" - 's daughter when she learned Aunt A wasn't coming over and Mom was going out"
623638568817328129,2015-07-21 23:39:56,"Get called a name by a radio host, Obama will call you to see if you're ok. Your daughter gets gunned down by an illegal, you get silence."
623612391750770689,2015-07-21 21:55:55,Watch dem cheeks.
623597612789297153,2015-07-21 20:57:11,: FOX News Channel Tops Cable in Primetime Viewers for the Week
623528614366199808,2015-07-21 16:23:00,. That was the best presidential announcement speech yet. Guy's got skills.
623525663690072065,2015-07-21 16:11:17,LOL. Subliminal messaging?
623523378608119808,2015-07-21 16:02:12,announces his run for the White House. He's spent a lot of time in government but doesn't sound or act like it.
623491047952379904,2015-07-21 13:53:44,Time to cut funds. cut PP funding in NJ - a blue state - TWICE- and got re-elected. It can be done.
623486834585272320,2015-07-21 13:36:59,Why won't the White House do the same?
623352445603856384,2015-07-21 04:42:59,": 'Lone Survivor' rips decisions by Obama, Marine Corps after ."
623351397346578432,2015-07-21 04:38:49,Great meeting you too! Hope you had fun in NYC today.
623330122796519424,2015-07-21 03:14:16,"Just to clarify, global warming caused ISIS and not all lives matter."
623317002367696896,2015-07-21 02:22:08,". apologized for saying that all lives matter. Finally, a liberal who is honest about their party's position that not all do."
623305539443924992,2015-07-21 01:36:35,And yoga pants. Climate change AND yoga pants created ISIS.
623283867974303744,2015-07-21 00:10:28,Good point. Someone should ask Trump about Benjamin Netanyahu's military service or Gerald Ford's football days.
623274570993246208,2015-07-20 23:33:32,"Some people take so long ordering I just wanna tap them on the shoulder and and whisper ""You're choosing a meal, not a major."""
623253429889167361,2015-07-20 22:09:31,I like it!
623250567666778112,2015-07-20 21:58:09,Careful what you wish for! I must marry .
623248706821865472,2015-07-20 21:50:45,"Truth right there : As if you need another reason to be jealous of me, my plans for tonight were just canceled."
623247054098296833,2015-07-20 21:44:11,": I'm going to start wearing a sign on Monday's that says ""I don't give a shit about your weekend"""
623213500349972480,2015-07-20 19:30:51,"Cheating website Ashley Madison was hacked. Lots of people are having a really bad Monday. In other news, flower &amp; jewelry orders soar."
623183919790301184,2015-07-20 17:33:19,And you matter to WHOM?
623178333027741696,2015-07-20 17:11:07,". You just had to come to me first on the marriage question, huh?"
623175565735010304,2015-07-20 17:00:07,"Empathy for people who are disabled, different or special needs is one of the most important things parents can teach their children."
623172673661718529,2015-07-20 16:48:38,I rarely agree with Hillary but she is smart for trying to shut up young campaign workers/supporters from talking to the press as surrogates
623158744738844672,2015-07-20 15:53:17,"We light up WH for gay marriage, Empire State building for Ramadan but we can't lower WH flags to half mass for murdered marines? Disturbing"
622870457814003714,2015-07-19 20:47:44,Feeling sunny
622816991448035328,2015-07-19 17:15:16,Right?
622509225202352128,2015-07-18 20:52:19,I want candy.
622136715591950336,2015-07-17 20:12:06,I don't think we invented it : The Greeks may have invented sex but the Italians added women.
622124948665040896,2015-07-17 19:25:20,.
622026762311069696,2015-07-17 12:55:11,Liberal logic
622017691398860800,2015-07-17 12:19:08,"Guest on Fox and Friends, Dr. Gorka - This is not a year old war …radical Islam has existed and been killing for centuries."
621889731522101249,2015-07-17 03:50:40,If and I were Barbies
621871098855096320,2015-07-17 02:36:38,Appears we don't share the same ones. I miss having a President who would call our enemies our enemies
621865436976664576,2015-07-17 02:14:08,How many people have to die before this White House and President acknowledge radical Islam is our enemy?
621830182782017536,2015-07-16 23:54:03,I always try to remember ...
621820896576163844,2015-07-16 23:17:09,I believe I was in th grade when and Life came out.
621802513415733248,2015-07-16 22:04:06,CD's in Best Buy's sale bin
621740841695055872,2015-07-16 17:59:02,It gets firey with us Mediterraneans! Same when is on the couch.
621724697277952001,2015-07-16 16:54:53,We basically paid billion to the Iranians in ransom. You'd think we could have gotten our hostages in return for that.
621714309895323648,2015-07-16 16:13:37,Detente didn't work. Reagan threw detente out the window. Broke the Soviets with SDI and defense spending.
621700857629962240,2015-07-16 15:20:09,We basically paid B in ransom to Iran and got nothing -not even our hostages back - in return. We'll debate more at noon
621493333756669952,2015-07-16 01:35:32,"Shhh ...don't blow my cover It's no surprise that firebreathers are the warmest people. i.e.,"
621425780476780545,2015-07-15 21:07:06,Tonight on Mexico is refusing US help in capturing El Chapo. We discuss why pm ET.
621411671500812288,2015-07-15 20:11:02,Always a good time when Stormy Watters joins the couch.
621392932755652608,2015-07-15 18:56:34,So Obama is powerful enough to get a nuclear arms deal with Tehran but doesn't have enough influence to get American prisoners released?
621391686510473216,2015-07-15 18:51:37,: Pres Obama said he makes it a practice not to comment about possible criminal or civil legal cases. But then commented abo…
621362316781690880,2015-07-15 16:54:55,"It's indefensible the President didn't make the US hostages part of the Iran deal but traded Taliban terrorists for Bergdahl, a traitor."
621333240763297792,2015-07-15 14:59:23,"Stormy Watters, back on the main stage today. at noon"
621169466479611904,2015-07-15 04:08:36,". Right. I mean, besides starting an arms race…smaller q: why isn't this Admin helping us here in the US get nuclear energy?"
621167373471608832,2015-07-15 04:00:17,"I love how Iran claims they need to enrich uranium for nuclear energy purposes…yeah, they don't have a lot of natural resources in the area."
621165678393995264,2015-07-15 03:53:33,. You must have missed this - USA Today: Several US cities see homicide rates surge
621163771780837376,2015-07-15 03:45:58,. Ha. Is that code for I'm really short?
621146667765661696,2015-07-15 02:38:00,When crime is spiking Obama wants to reduce prison sentences. DeBlasio wants bail gone. Progressives have now become the party for criminals
621119653201453056,2015-07-15 00:50:39,Heavily meditated
621112386158772224,2015-07-15 00:21:47,"We meddled in Iran first. We helped create the Iranian regime by insisting on ""democratic reforms"" and undermining the Shah, a US ally."
