id,created_at,text
659530432980086785,2015-10-29 00:41:23,Brilliant answer by Rubio on media double standard. Awful timing by Jeb! stepping on his applause &amp; siding with the liberal MSM's argument.
659528800041070593,2015-10-29 00:34:54,Does anyone know 's middle name? Filling out his missing person's report.
659528381428576256,2015-10-29 00:33:14,Trump scalp : Trump scalp Can't wait to see who's next...
659527658938761216,2015-10-29 00:30:21,CNBC moderator's greatest weakness? Dumb questions.
659526165082820608,2015-10-29 00:24:25,I like where Trump's head's at.
659525166423252992,2015-10-29 00:20:27,Poor Jeb! Even his tie is screwed up.
659510275872301057,2015-10-28 23:21:17,Amy from VEEP is my spirit staffer.
659342460427087872,2015-10-28 12:14:27,Kinda funny
659339477459013632,2015-10-28 12:02:36,Another reason to watch
659336562489106432,2015-10-28 11:51:01,Why didn't they have the political courage to do this with stand alone border security bills??
659183325714739200,2015-10-28 01:42:06,Better than candy in this bag!
659093571602108416,2015-10-27 19:45:27,I was thinking more like a little bit Rodney Dangerfield and a little bit Judge Smails
659081353275772928,2015-10-27 18:56:54,"If Obama is in Chicago, city w highest crime rate &amp; strictest gun laws he should blast criminals &amp; ILLEGAL guns, not call for more gun laws."
659076991753310209,2015-10-27 18:39:34,"What's with the OJ gloves, ?"
659076511895539712,2015-10-27 18:37:40,"Haha! Don't love mustaches, though."
659061964115677184,2015-10-27 17:39:51,Looks good!
659030052257013761,2015-10-27 15:33:03,"Surprise, surprise"
659006703258726401,2015-10-27 14:00:16,Dogs in costumes. If you don't enjoy watching this there's something wrong with you.
658997723526471682,2015-10-27 13:24:35,And I know first hand many people in my field who are self loathing libs riddled w/ white guilt. They'd prob agree.
658993830780358656,2015-10-27 13:09:07,Exhibit A on why is leading
658971089880641536,2015-10-27 11:38:45,Not quite the way to be flexing our muscles right now
658855766825283584,2015-10-27 04:00:30,Reunion with one of my best friends in the whole world - lucky to have someone as loyal as you in my…
658797682295709696,2015-10-27 00:09:41,Amazing tribute by on &amp; inspiring msg about finding light in the darkness that losing a loved one brings. You're a warrior.
658783801557045248,2015-10-26 23:14:32,"Not true. Same author wrote abt CEO Romney in ' ""unhurried &amp; Socratic"" &amp; had a ""diplomatic, low-drama approach"""
658782152587366400,2015-10-26 23:07:59,This story is sexist garbage. I'll say it bc won't. The NYT would NEVER write this about a male CEO.
658779425094410240,2015-10-26 22:57:09,"There's a lot of sexism in the Clinton family. Bill molested women, then HRC targeted them. A woman glass ceiling."
658773790076346368,2015-10-26 22:34:45,Mrs. Garrett finally spills. I am so getting this book.
658741020084084736,2015-10-26 20:24:32,Thanks for digging up my NY Daily News column predicting a Trump run. I forgot I wrote it!
658710573195120640,2015-10-26 18:23:33,They're - my new fav brand! PS - love
658681087380619264,2015-10-26 16:26:23,.
658629649619144704,2015-10-26 13:01:59,A rare moment of political honesty
658621011856855040,2015-10-26 12:27:40,This confirms what we've seen anecdotally. Progressive policies ruin cities. Thanks
658441893655785472,2015-10-26 00:35:55,Here we go. Celeb women are going come out in full force. They want to look serious &amp; Hillary needs to look cool.
658298741514895360,2015-10-25 15:07:05,Just posted a photo
658290691278262273,2015-10-25 14:35:05,"""Libya was the country where she was the midwife to chaos. She shouldve watched that baby like the lady Hawk she is"""
658289147438845952,2015-10-25 14:28:57,She's not the only one
657922369349029890,2015-10-24 14:11:31,Weekend warrior
657649829162676224,2015-10-23 20:08:32,ha! His lucky day.
657638087447572480,2015-10-23 19:21:53,Day off
657635553622396928,2015-10-23 19:11:48,Just posted a photo
657578780387487745,2015-10-23 15:26:13,A good morning
657240592502673408,2015-10-22 17:02:22,The only supporter of the gay community in America that liberals won't defend is Ambassador Christopher Stevens.
657233285916053505,2015-10-22 16:33:20,"If she cannot handle &amp; is confused about basic job duties as Sec if State, it is inconceivable Clinton is competent enough to be President."
657229366737444864,2015-10-22 16:17:46,A wouldn't say Libya is stable today. Last time I checked jihadists were doing swan dives into our Embassy pool.
657226393336619010,2015-10-22 16:05:57,We didn't have to remove Gadaffi. When we did ISIS emerged. If we oust Assad we'll have a Benghazis a week.
657225267618934784,2015-10-22 16:01:29,Progressive hawks who advocate nation building are the worst kind.
657224595083239424,2015-10-22 15:58:48,"Hillary, did you not know they wanted more security or did you and couldn't get the funding? Which one is it? Pick a story."
657224262537887744,2015-10-22 15:57:29,If a consulate is attacked x prior &amp; the nearby British embassy/Red Cross closes &amp; Amb says he's not safe how could you not pay attention?
657223531365822464,2015-10-22 15:54:35,"She can't follow record keeping laws, can't tell classified info, didn't see security requests. At best, she was not up to the job."
657210437692444672,2015-10-22 15:02:33,I find it amazing that liberals can turn Michael Brown into an icon but not Ambassador Christopher Stevens
656914187646554112,2015-10-21 19:25:21,"But the media would still need to cover it, which they won't. All I'll say is three letters in agreement: IRS."
656899509071519744,2015-10-21 18:27:02,: lol
656890111993511937,2015-10-21 17:49:41,"Coverup begins. No Hillary indictment. No Grand Juries empaneled. Investigation will be ""ongoing."" The FBI is now an appentage of the regime"
656888660277788673,2015-10-21 17:43:55,He already has. During his recent min interview he went out of his way to give her cover.
656880096075235328,2015-10-21 17:09:53,Both Benghazi &amp; server are ADMIN wide scandals. With Biden not running she gets even more WH cover. Timing of day announcement indicates it
656870142295560192,2015-10-21 16:30:20,: Hillary right now
656868238022823936,2015-10-21 16:22:46,"Even though I've decided not to run, think of all the free time I'll have to awkwardly hug strangers."
656850637880217601,2015-10-21 15:12:50,"If you love mustaches, you're going to love today's see you at pm ET!"
656831667001270272,2015-10-21 13:57:27,Talk about ...that is one of the biggest problems for Jeb Bush
656816607663144960,2015-10-21 12:57:36,Too bad she didn't prioritize embassy security
656812544171077632,2015-10-21 12:41:28,Empathy...interesting
656810832739831809,2015-10-21 12:34:40,Hillary thrives on having an enemy in Republicans and playing the victim.
656698713444892672,2015-10-21 05:09:08,She's done kicking our butts in NYC - before she heads back to LA my FAV instructor is coming to DC. Lucky ducks!
656644356296843265,2015-10-21 01:33:09,Thanks for kindly capturing our pics every day!
656615796668502016,2015-10-20 23:39:39,Liberal San Fran goes bonkers again - we'll get into tonight plus Bill has choice words for Dems who blocked pm
656566338807316480,2015-10-20 20:23:08,By blocking Dems put the interests of illegals who commit crimes over interests &amp; safety of the citizens they pledge to represent.
656557701506441216,2015-10-20 19:48:48,Crunchy abortions and crime: vote Democrat
656550063498526722,2015-10-20 19:18:27,Webb's right. His party is no longer that of JFK or even Clinton. It's been comandeered by far left progresives.
656545770498338816,2015-10-20 19:01:24,Senate Democrats just blocked which would cut off funding to sanctuary cities &amp; deport illegals who commit crimes. Despicable.
656540943911358465,2015-10-20 18:42:13,"If Hamas, Hezbollah, ISIS, Iran...put down their arms we would have peace in the Middle East. If Israel does they'll be completely finished."
656520139240812544,2015-10-20 17:19:33,I love that your Twitter handle is grandma and grandpa Alexander and you GET my sense of humor!
656514737967136769,2015-10-20 16:58:05,"FBI was hugely political under Hoover. It can happen, esp under an Admin as political as this. Look at Obama's IRS."
656458999634788352,2015-10-20 13:16:36,"Have fun with that, Canada!"
656265763112644608,2015-10-20 00:28:45,Monday night Mexican
656237931288489984,2015-10-19 22:38:09,"If you need a hearty laugh, some suggested reading"
656164748514480128,2015-10-19 17:47:21,It's comments like this that make you wanna high five
656161797884522500,2015-10-19 17:35:38,The woman who gave me the honor of emceeing the Special Olympics National Games &amp; inspired so many- RIP Kristen
656122778412781568,2015-10-19 15:00:35,From what I've seen thus far I'm wondering if he can fight a cold.
656119782492786688,2015-10-19 14:48:40,When wishes me a Happy Monday on
655961107056730112,2015-10-19 04:18:09,"Wow. What a sick, twisted yet well-written read How the Kardashians eloit and destroy for reality ratings"
655863798755164160,2015-10-18 21:51:29,Be flexible
655776163441307648,2015-10-18 16:03:15,He's indignant abt nefarious activities in corporate boardrooms but not ones at State? How about the term hypocrite?
655774545312370688,2015-10-18 15:56:49,After the Admin conflates Israelis with Hamas this wk we send in the guy w the yacht named the Scaramouche. Genius.
655771022155718661,2015-10-18 15:42:49,It already has.
655769663910096896,2015-10-18 15:37:26,FDR would have had her summarily jailed had she been his Sec of State after eing her files to foreign spies.
655767541277728768,2015-10-18 15:29:00,The most important security breach in decades while US military is dying in combat is no laughing matter.
655559074713640960,2015-10-18 01:40:37,": Since we're talking about Afghanistan, more troops have died there under Obama than under Bush. I'm telling you because the …"
655518259731677184,2015-10-17 22:58:26,Two hours with the master nancynorby
655218458146308097,2015-10-17 03:07:08,NO ONE.
655178522605068288,2015-10-17 00:28:27,Thank you! Shoes are Aquazurra
655177786974433280,2015-10-17 00:25:31,You know what they say about the haters. PS - your brows are perfection!
655110906528034816,2015-10-16 19:59:46,Newsflash for liberals &amp; those obsessed w Islamophobia: plotting killings and jihad in name of religion is not protected speech
655099178029293568,2015-10-16 19:13:09,"We've lost a dear friend &amp; tireless advocate for those with special needs, Kristen Ritter. Shocked &amp; truly saddened."
655086225347452928,2015-10-16 18:21:41,Good times w this bunch. Have a great weekend!
655036820988805120,2015-10-16 15:05:22,"I have many times. The rule of law has completely broken down. This is why erting our ""democracy"" is such a farce"
655034443900538880,2015-10-16 14:55:56,We're a banana republic now. Laws may or may not be enforced due completely to the political needs of the the regime
655033721846956033,2015-10-16 14:53:03,"Ha! If I get busted in Miami I'm calling you, counselor, not the Ticket Clinic!"
655013001804779520,2015-10-16 13:30:43,"As I've said, this is an Admin wide scandal &amp; the WH is giving her cover. Her behavior is their MO not an outlier."
655010307761446912,2015-10-16 13:20:01,"""This makes them fear that no matter what they find the DOJ will take the president’s signal and not bring a case."""
654842149062750208,2015-10-16 02:11:49,Did the court just give de facto first &amp; th amend protections to radical Islam? by
654829979017093122,2015-10-16 01:23:27,"La Pecora Bianca, bathroom selfie"
654774597816946688,2015-10-15 21:43:23,State Dept spox Kirby's comments equating Israel &amp; Hamas were offensive &amp; embarassing. Providing reasoning is really just providing excuses.
654773100324651008,2015-10-15 21:37:26,"With Obama's meddling we've handed Libya &amp; soon Syria, Afghanistan &amp; Iraq to jihadists. Might be time to give back that peace prize."
654758373095686149,2015-10-15 20:38:55,"UNREAL. Court reinstates lawsuit against NYPD mosque surveillence citing history of ""racist scares"""
654729284938960896,2015-10-15 18:43:20,It's always his world. We're just living in it.
654666981279297542,2015-10-15 14:35:46,The best part about when appears on is that it's like a show within a show. ET.
654473266149593088,2015-10-15 01:46:00,"Did anyone else catch Hillary say she knew what was in that trade deal, but how if it is so secret?"
654451470776037376,2015-10-15 00:19:24,: It was just announced that I will be hosting Saturday Night Live on Nov. th -- look forward to it!
654384224376619008,2015-10-14 19:52:11,"Your tweet made my day, buddy!"
654336362167037952,2015-10-14 16:42:00,Tweet your questions for and we'll ask him during Overtime
654321245954179072,2015-10-14 15:41:56,Not one American boot should be on this ground to oust Assad so ISIS can step in
654293904397873152,2015-10-14 13:53:17,"Bill O'Reilly leaves the no spin zone to be at noon. We'll talk debates, Killing Reagan &amp; he'll make fun of my nail polish."
654291404194246656,2015-10-14 13:43:21,"Pretty disorienting to watch liberals rail against Bush as if he were still in ofc, yet tout Bush-like nation building in the Middle East"
654289663453171712,2015-10-14 13:36:26,". Owning a home is the American dream, not a fundamental right."
654288452192763904,2015-10-14 13:31:37,If you lie to a friendly crowd &amp; your competition looks more like a clown car than a competition for presidency does that make you a winner?
654133212185235457,2015-10-14 03:14:45,Just molesting female interns in the Oval Office.
654125861453594624,2015-10-14 02:45:33,"Can't tweet, nails dryin'"
654115254826344448,2015-10-14 02:03:24,Someone should point out that it was Hillary's husband's policies that lead to the housing crisis &amp; entire mortgage meltdown.
654114520034639872,2015-10-14 02:00:29,So Jim Webb is the only liberal who thinks that all lives matter.
654112442092531712,2015-10-14 01:52:13,Forget feeling the Bern. You feel that giant sucking sound?
654112361289265152,2015-10-14 01:51:54,What the hell was that? Sellout.
654110241139884032,2015-10-14 01:43:28,Democrats are horrendous on foreign policy.
654109348147412992,2015-10-14 01:39:56,"Thanks to Hillary &amp; Obama Tripoli, Libya is a beacon of democracy, constitutionalism and order."
654108509445951490,2015-10-14 01:36:36,Here we go: Hillary the cheerleader for democracy promotion.
654106678745538561,2015-10-14 01:29:19,It was Clinton promising to hit that Russian reset button &amp; fumbling it that first advertised to Putin how weak we are.
654105426275995648,2015-10-14 01:24:20,Hillary is talking like Putin hasn't always been in power.
654104585641066496,2015-10-14 01:21:00,I hate when politicians tell personal stories of people they met on the trail.
654102735923597313,2015-10-14 01:13:39,I love when they start speaking in the third person.
654101709669728257,2015-10-14 01:09:34,Jeb! just called his dad to ask Bill what Hill's on to give her all that energy.
654100950391607296,2015-10-14 01:06:33,: Times Hillary Has Flip-Flopped
654097979335438336,2015-10-14 00:54:45,Fact: if you boo O'Malley loud enough he'll apologize and switch his position.
654097667992240129,2015-10-14 00:53:31,O'Malley. Mr. All Lives Don't Matter.
654096114946338816,2015-10-14 00:47:20,Hillary looks annoyed she even has to do this. Again.
654088542885421057,2015-10-14 00:17:15,Do I really have to stop binge watching The Affair for this ?
654062365533712384,2015-10-13 22:33:14,Pre debate analysis on tonight &amp; Bill readies for his appearance tomorrow at noon
654046955136491520,2015-10-13 21:32:00,"This is the news from new poll: Hillary is beaten by Carson, Trump, Fiorina &amp; Rubio. She can't break %."
654020246475538432,2015-10-13 19:45:52,Tonight Hillary should be asked if she would overturn her husband's Religious Freedom Restoration Act.
654018159809294336,2015-10-13 19:37:35,"They are, but Obama hasn't helped. The irrational hate for Putin on the right - and the left solves nothing."
653946848009396224,2015-10-13 14:54:12,"Happy Birthday, my dear co-host and friend!!!!"
653936885404975104,2015-10-13 14:14:37,"Obama on CBS: ""Clinton server did not put national security at risk"" AP: ""Clinton server raised risks of hacking"""
653936260243947521,2015-10-13 14:12:08,"That dirty Clinton authenticity lens could use some wiping, like, with a cloth."
653711954482171904,2015-10-12 23:20:49,We get it. You're a woman.
653694666760695808,2015-10-12 22:12:08,"That was my cohost, not me. I'm upset that you mixed us up. Please do YOUR homework!!!"
653606325721694210,2015-10-12 16:21:06,Come and knock on my dooooooor!
653422898355552256,2015-10-12 04:12:13,: Poll: Clinton drops points in just days
653407599002521600,2015-10-12 03:11:25,Obama lives in a progressive fantasy land that isn't rooted whatsoever in reality.
653405533219745792,2015-10-12 03:03:13,WH is covering her.
653404235049103360,2015-10-12 02:58:03,So much for that whole I-don't-comment-on-active investigations-thing
653326036839571456,2015-10-11 21:47:20,Just posted a photo
653204225137201152,2015-10-11 13:43:17,Just posted a photo
653004241368444928,2015-10-11 00:28:38,This picture totally reminds me of my sorority rush photo!
652980270505848832,2015-10-10 22:53:22,Strike a pose
652557185499709440,2015-10-09 18:52:11,"Guys don't care. But most girls will overlook a few spelling errors depending on his err, um, other skills"
652551879671566336,2015-10-09 18:31:06,Happy FRIDAY !
652542042787213314,2015-10-09 17:52:01,If you can help it
652535223612252161,2015-10-09 17:24:55,Oh ...we love you. You could have just called us.
652235505371754496,2015-10-08 21:33:57,Outnumbered!
652176200106942464,2015-10-08 17:38:17,Bombshell
652173342712156160,2015-10-08 17:26:56,"No, what I said was entire House leadership could be in jeopardy, which includes McMorris. Conservatices want change"
651902251447939072,2015-10-07 23:29:43,Just posted a photo
651875262175551488,2015-10-07 21:42:28,Right said Ted
651873437124853760,2015-10-07 21:35:13,Vast right wing Federal Bureau of Investigation at it again
651867463462842368,2015-10-07 21:11:29,Happy th Birthday Channel!
651817229181390849,2015-10-07 17:51:52,Ouch. gonna need some aloe for that nd degree burn.
651810478902091776,2015-10-07 17:25:02,"Agree. I think a lot of people have fallen on hard times in their lives, doesn't make them cheaters or liars."
651810038110138368,2015-10-07 17:23:17,Givenchy
651809219780444162,2015-10-07 17:20:02,"Stole it from my th grade biology teacher Mr. Thompson who was always yelling, ""Tantaros, give the gums a rest!"""
651774113825091584,2015-10-07 15:00:32,Putin does care about defeating ISIS.
651771296972410880,2015-10-07 14:49:21,Great read . Suicides happen in clusters. Media should not be giving killers fame. It triggers more.
651601383846604801,2015-10-07 03:34:10,Just posted a photo
651556768523223040,2015-10-07 00:36:53,Too soon?
651549895766212608,2015-10-07 00:09:35,Should Obama go to Oregon to meet with the families of shooting victims? We debate it on up next
651460873370906624,2015-10-06 18:15:50,How could u leave out the only person who accomplished anything of real significance in that house?
651458096062156800,2015-10-06 18:04:48,"We do, actually. Love her."
651456477178298368,2015-10-06 17:58:22,"I forgot housing &amp; transportation, too. Just wish I had that 's metabolism. Maybe I should have t-shirts made."
651408093637705728,2015-10-06 14:46:06,"Media at it again. is leading polls but gets asked about dropping out, is in single digits but is in it to win it?"
651201335056969734,2015-10-06 01:04:31,Told u I have a thing for making spooky food recipes Voila-severed finger cookies!
651089818957545472,2015-10-05 17:41:24,I feel sorry for men. Feminists are trying to ruin them.
651052945153368065,2015-10-05 15:14:52,Tune into to watch wish me a Happy Monday while I give her a loving side eye scowl back.
651042318745796609,2015-10-05 14:32:39,We should use our military to strategically eliminate threats to US not impose democracy where it's not realistic
651025873991266304,2015-10-05 13:27:18,"He's talking about Bush, too."
651023820137070592,2015-10-05 13:19:08,"""If US elites continue to intervene to make [nations] conform to our ideal of good society &amp; legit govt we are headed for endless conflict."""
651023156719820804,2015-10-05 13:16:30,"“An aggressive foreign interference has resulted in destruction. Instead of democracy &amp; progress we got violence, poverty &amp; social disaster"""
651021003569676288,2015-10-05 13:07:57,"Buchanan: ""self-conceit"" &amp; ""belief in one’s exceptionality &amp; impunity,” drove US to ert “so-called democratic” revolutions."
651016357874663424,2015-10-05 12:49:29,His best yet: NAILS IT --
650879702354264064,2015-10-05 03:46:28,That JV team at it again
650841860429225985,2015-10-05 01:16:06,Yea &amp; those freedom fighters we trained at m a pop handed our weapons to Al Nusra. Genius
650711918395674628,2015-10-04 16:39:45,. is right. And sadly Christians were treated better under Hussein &amp; Gaddafi than ISIS.
650710228355424256,2015-10-04 16:33:02,": If the had targeted Muslims instead of Christians, Obama would personally do the eulogy &amp; declare a nation…"
650371416785846273,2015-10-03 18:06:43,For the love.
650366767320145920,2015-10-03 17:48:15,"Half measures in wars w no strategic mission &amp; a checked out, politically motivated Commander in Chief give us this:"
650053343331622912,2015-10-02 21:02:49,"Nobody on the road, nobody on the beach"
650029322460381185,2015-10-02 19:27:22,My fav yoga/barre teacher in the country is coming to NYC from LA for wkend only! A few spots left!
650025657460760577,2015-10-02 19:12:48,Nobody in either establishment - Republican or Democrat - has their eye on the ball in the Middle East: U.S. national interests.
650020152679993344,2015-10-02 18:50:55,"Why are we sending military to help the rebels?? If rebels Putin's attacking were to take power, it would not be order &amp; constitutionalism."
650017998816845824,2015-10-02 18:42:22,"We didn't help, but to hint that there wouldn't be a refugee crisis without our meddling is off the wall."
650017452865269760,2015-10-02 18:40:12,Said the lady who's so darkly paranoid she talks to people &amp; kept illegal server to avoid FOIA record keeping laws
649999907844132864,2015-10-02 17:30:29,"I wanted to add ""and suck his thumb"" but there weren't enough characters."
649723861412540416,2015-10-01 23:13:34,come back soon!
649620107740741634,2015-10-01 16:21:17,Netanyahu is the MAN
649613069031743490,2015-10-01 15:53:19,There is no greater blessing than a loyal friend
649603396467601408,2015-10-01 15:14:53,Way better weather in Athens than Burlington.
649602643204157440,2015-10-01 15:11:53,The last thing US needs is Obama stumbling into war half heartedly or starting WW3 w Russia &amp; Iran. I want him to play golf &amp; watch Netflix.
649550434005307392,2015-10-01 11:44:26,Start the day
649371044063670272,2015-09-30 23:51:36,"We ousted Saddam in Iraq to impose a ""political solution."" Same w Mubarak in Egypt &amp; Gaddafi in Libya. They're all worse bc of our meddling."
649366340814393344,2015-09-30 23:32:54,"This is the governing body that the Obama Admin today said should craft the ""political solution"" for Syria."
649268058008211456,2015-09-30 17:02:22,Bingo. Putin's not a hard guy to figure out. He cares about Russian power &amp; interests alone. Obama should take notes
649266686982520832,2015-09-30 16:56:55,"Kerry &amp; Obama's speeches on Syria at the UN, full of idealistic bromides are - quite-literally-the equivalent of magical incantations."
649258733864939520,2015-09-30 16:25:19,Kerry had harsher words for Assad than he did ISIS. This Admin is a bunch of decadent Westerners who live in a progressive dream world.
649247736357908484,2015-09-30 15:41:37,"Sometimes, it really does take a village. See you at the top of the hour!"
649237650184908800,2015-09-30 15:01:32,"Putin fighting ISIS despite ""eerts"" said he's not interested. What will Obama do now? Fight Assad, ISIS &amp; Russia??"
649216348736856064,2015-09-30 13:36:54,Reason Obama should give his Nobel peace prize back
649211165063647232,2015-09-30 13:16:18,Pls encourage your Congressman to get involved. There is strength in numbers!
649074920924815360,2015-09-30 04:14:55,"Pick a part, Erica!"
649070150038196224,2015-09-30 03:55:57,I strongly dislike people who sing both parts of a song
649067049625513985,2015-09-30 03:43:38,. Green Beret discharged for shoving accused Afghan rapist speaks out |
649065178903003136,2015-09-30 03:36:12,love that one too!
649063367085264896,2015-09-30 03:29:00,What does a girl gotta do to get a little Taylor Dayne's Prove Your Love around here?
648980193789509632,2015-09-29 21:58:30,That woman needs to start using the erection comeback. Works every time!
648958490921291776,2015-09-29 20:32:15,Dasss right!
648941327065989120,2015-09-29 19:24:03,Which it is it feminists: can we pay our bills or do we need the govt? Can we handle our liquor or can't we? Are we victims or warriors?
648940035052580864,2015-09-29 19:18:55,Which : are we incompentent victims who need our husbands and can't manage a server? Or are we adept powerhouses?
648874728711700481,2015-09-29 14:59:25,The real question is who is Jimmie Nicol?
648845708997586944,2015-09-29 13:04:06,Sickening when groups &amp; candidates play the woman card to obfuscate their bad actions. Neither Clinton nor Planned Parenthood are victims.
