id,created_at,text
822472253438906368,2017-01-20 15:54:00,: . host Chris Wallace with ahead of
822469101134217216,2017-01-20 15:41:29,Showtime. Chris with brit_hume marthamaccallum for foxnews coverage of…
822461573344149504,2017-01-20 15:11:34,Chris with ahead of
822364259795484672,2017-01-20 08:44:52,is finally here! Stay with for live coverage throughout this historic day.
822233401705066496,2017-01-20 00:04:53,Chris with and ahead of
822233388295852037,2017-01-20 00:04:50,Chris with and marthamaccallum ahead of
822185118186008577,2017-01-19 20:53:02,What would you like to ask the panel about what Trump’s top legislative priority should be in Congress?
822155356159832066,2017-01-19 18:54:46,: TUNE IN: this weekend w on Address &amp; …
822132757027557376,2017-01-19 17:24:58,: BREAKING: President-elect Trump arrives in Washington D.C. ahead of Friday's inauguration
822128096589598720,2017-01-19 17:06:27,of Chris with in April .
822122851922755585,2017-01-19 16:45:36,"Just days after the , we’ll discuss Trump’s first weekend in office in an exclusive sit down w/ Trum…"
821740954541559809,2017-01-18 15:28:05,Our set on the National Mall is almost ready for Inauguration Day! Just two more days to go!…
820673950862704645,2017-01-15 16:48:11,More from our Power Player Tom Barrack on how President-elect Trump is paying tribute to police and firefighters...
820670902442528768,2017-01-15 16:36:05,Our Power Player of the Week - head of the Presidential Inaugural Committee Tom Barrack. He gives us a surprising...
820669640372322304,2017-01-15 16:31:04,: Great to be back on with Chris Wallace. Check it out.
820664896132091905,2017-01-15 16:12:13,CIA Director John Brennan says President-elect Trump has to understand that national security issues aren't...
820659178511462400,2017-01-15 15:49:29,CIA Director John Brennan responds to President-elect Trump’s recent remarks on the intelligence community saying...
820654103579725824,2017-01-15 15:29:19,Big show today as and CIA Director Brennan stopped by. Be sure to catch at p…
820648296888856576,2017-01-15 15:06:15,Vice President-elect Mike Pence says the U.S. has a “terrible relationship with Russia” wants to elore better...
820647257770983424,2017-01-15 15:02:07,Vice President-elect Mike Pence says he respects Congressman John Lewis but was “deeply disappointed” by his...
820646471011803136,2017-01-15 14:59:00,Big show today with and CIA Director John Brennan. Will air on at P and P.
820638641332555776,2017-01-15 14:27:53,Brennan tells Chris the Intel community had the responsibility to advise PEOTUS Trump of unsubstantiated Russian Do…
820638007615254533,2017-01-15 14:25:22,"re: Briefing, CIA Dir John Brennan: Making sure the PEOTUS was aware if it, I think that's the extent that the Intel Chiefs wanted to do."
820634658304102400,2017-01-15 14:12:03,. on if there was contact between Trump campaign and Russia: All the contact by the Trump campaign was with the American people.
820633563087441922,2017-01-15 14:07:42,. tells Chris Wallace that he hopes Rep. John Lewis reconsiders his decision not to attend the inauguration.
820633088132792322,2017-01-15 14:05:49,". on John Lewis' ""legitimate"" comments : It's deeply disappointing to me, I hope he reconsiders it."
820632465861726208,2017-01-15 14:03:21,"""I have great respect for John Lewis.""-"
820600877794885636,2017-01-15 11:57:49,This &amp; John Brennan join Chris today. Be sure to tune in!
820443906244481024,2017-01-15 01:34:05,: Joining tomorrow at AM on your local Fox affiliate and again at PM on . I hope you can wat…
820398656905969670,2017-01-14 22:34:16,: Sunday--We'll have the latest from Vice President-elect —live here in Washington.
820398637574475782,2017-01-14 22:34:12,": Sunday—We’ll have an exclusive sit-down with outgoing Director of the CIA, John Brennan."
820364181945905153,2017-01-14 20:17:17,": Joining this weekend Jane Harman, &amp; ."
820302154485420032,2017-01-14 16:10:48,Check out a preview of tomorrow's :
820018458108788736,2017-01-13 21:23:30,"Joining this weekend Jane Harman, &amp; ."
820013274292977664,2017-01-13 21:02:54,"Chris makes his pick on for sunday's game...as only ""One of the Best-Mannered Peopl…"
819935539667369985,2017-01-13 15:54:00,": This , Chris will sit down with Vice President-elect and Outgoing CIA Director John Brennan. ht…"
819934593604354048,2017-01-13 15:50:15,"Sunday—We’ll have an exclusive sit-down with outgoing Director of the CIA, John Brennan."
819933918463979520,2017-01-13 15:47:34,Sunday—We’ll discuss President-elect Trump’s testy relationship with the intelligence community &amp; the report...
819926753611235330,2017-01-13 15:19:06,Chris w/ chairman on what eect inauguration for our power player
819923687184994305,2017-01-13 15:06:55,What Qs do you have for the panel about the DOJ’s IG investigation of FBI Director Comey’s handling of Hillary Clinton’s email practices?
819562717686169600,2017-01-12 15:12:33,Sunday--We'll have the latest from Vice President-elect —live here in Washington.
819207200128307201,2017-01-11 15:39:51,Inauguration Day preparations continue at the a little over a week away from the big day.…
818116782431105024,2017-01-08 15:26:55,Rep. Devin Nunes (R-CA) blames the Obama Administration for intelligence leaks. Do you believe politics should...
818111298642837504,2017-01-08 15:05:08,Incoming White House Chief of Staff Reince Priebus says President-elect Donald Trump accepts that Russia was...
818103234866933761,2017-01-08 14:33:05,Our panel: &amp; is up next
818102024625680386,2017-01-08 14:28:16,.: We would like to be friends with the Russians I just don’t know if it’s possible.
818101841984634880,2017-01-08 14:27:33,on Trump/Russia: He wouldn’t be the first President to want to be buddies with President Putin.
818101144560041984,2017-01-08 14:24:47,". on : I think the FBI would tell you this isn’t what the FBI wants, they do a good job but obviously they missed this one."
818100657316040705,2017-01-08 14:22:50,"Incoming WH Chief of Staff tells Chris Wallace, PEOTUS Trump accepts findings of reports on Russian hacking."
818099777808334848,2017-01-08 14:19:21,". on Confirmation hearings: They have to get moving, they have to move faster…change was voted for and change we will get."
818098397169254404,2017-01-08 14:13:52,. on Report: it started as a spearfishing eedition…just so happened that the DNC had almost no defenses on their system.
818097592517218304,2017-01-08 14:10:40,". on Report: Here’s what we have, we have the DNC as a siting duck."
818097283073998849,2017-01-08 14:09:26,. on Report: The primary actor was the foreign entity…Russia.
818095774806511616,2017-01-08 14:03:26,"We are live with incoming WH Chief of Staff &amp; Rep. , House Intelligence Committee Chairman."
817810475564011520,2017-01-07 19:09:46,: Excited about ? Our panel: &amp; make their predictions for t…
817801846379003904,2017-01-07 18:35:28,Check out a preview of this week's show:
817431779988688898,2017-01-06 18:04:58,: Looking forward to making predictions on panel this weekend w/ htt…
817431592880795650,2017-01-06 18:04:13,What Qs do you have for our panel on whether anti-Trump rhetoric played a role in the attack on a disabled white man by black adults?
817426777148715008,2017-01-06 17:45:05,Excited about ? Our panel: &amp; make their predictions for the year to come.
817374501277233152,2017-01-06 14:17:21,What would you like to ask the panel--about the political danger for Republicans if they replace Obamacare.
817116848735010820,2017-01-05 21:13:32,This and join us. Be sure to tune in.
817062976427585536,2017-01-05 17:39:28,The nation’s top intelligence official told the Senate Armed Services’ Committee that Russia interfered with the...
817056751090593793,2017-01-05 17:14:44,"With less than two weeks until the inauguration, Donald Trump’s administration is taking shape. Trump’s incoming..."
815569558618722304,2017-01-01 14:45:09,Former Obama Economic Advisor Austan Goolsbee gives President-Elect Trump “some credit” for jobs saved. What did...
815568767975424000,2017-01-01 14:42:01,. on : I'd give Trump some credit for bringing jobs back but I think they need to speed up job creation to match Obama
815567760805634048,2017-01-01 14:38:01,"Next on : Austan Goolsbee, and Steve Moore on the economy under a Trump presidency."
815567040543150080,2017-01-01 14:35:09,Trump Transition Supreme Court Advisor Leonard Leo on what President-Elect Trump is looking for in his Supreme...
815564237703524352,2017-01-01 14:24:01,"Coming up on the latest on Donald Trump's Supreme Court nominee options with Leonard Leo, Trump Transition Sup…"
815562223330480129,2017-01-01 14:16:01,On the panel today:
815562005755076609,2017-01-01 14:15:09,Sen. Tom Cotton (R-AR) is holding the Obama Administration responsible for the U.N. Resolution on Israel moving...
815560713074864128,2017-01-01 14:10:01,. on : President Obama was much harsher on his allies than on his enemies this week.
815559957949120516,2017-01-01 14:07:01,. on : The DNC is just one small example of Russia's nefarious actions over the many years.
815559499713040384,2017-01-01 14:05:11,Sen. Tom Cotton (R-AR) says the Obama Administration’s measures against Russia are “not enough” and “too late.”...
815559206292099072,2017-01-01 14:04:01,. on : The Obama administration has been weak on Russia
815535548576264193,2017-01-01 12:30:01,Coming up on -- an exclusive interview with
814564494722695168,2016-12-29 20:11:24,"We'll have the latest on growing tensions between Israel &amp; the U.S. w/ who says: ""President Obama is…"
814490447741616128,2016-12-29 15:17:09,: Pls join me on - EXCLUSIVE w/ on Israel/UN vote/Russia/Tillerson/immigration and more! https…
814320753004990465,2016-12-29 04:02:51,: Pls join me on - EXCLUSIVE w/ on Israel/UN vote/Russia/Tillerson/immigration and more! https…
814218027906592768,2016-12-28 21:14:39,"We'll discuss Trump's economic plans w/ Austan Goolsbee, one of President Obama's long-time economic advisors &amp; Ste…"
814217175347163137,2016-12-28 21:11:16,"This , we'll have the latest on Donald Trump's Supreme Court nominee options w/ Leonard Leo, Trump Transition S…"
814169090130640896,2016-12-28 18:00:12,": I'm in for Chris this week, and we want to hear from you!"
814167579891761153,2016-12-28 17:54:12,What questions do you have for the panel about the Mideast moves by the Obama administration before Donald Trump takes office?
813036604495433728,2016-12-25 15:00:06,"A Wallace Grandkids Christmas tradition… From our family to yours, have a very Merry Christmas!"
813036354519072768,2016-12-25 14:59:07,Our Power Player of the Week – Founder of Wreaths Across America Morrill Worcester. His mission to honor our...
813032555125424128,2016-12-25 14:44:01,The panel is now back on:
813031574933565440,2016-12-25 14:40:07,"Trump Evangelical Advisor Jerry Falwell, Jr. on the North Carolina bathroom bill: “it just seems like common..."
813031298117812224,2016-12-25 14:39:01,Jerry Falwell Jr. on : is one of the most prosperous universities
813030820478861313,2016-12-25 14:37:07,"Trump Evangelical Advisor Jerry Falwell, Jr. on supporting Trump: “He never pretended to be a theologian….We are..."
813030036932468737,2016-12-25 14:34:00,Jerry Falwell Jr on : never pretended to be a theologian. He was the best candidate to support our values.
813029286642786304,2016-12-25 14:31:01,Now on - the President of Jerry Falwell Jr: I just couldn't afford to stay silent in this election so I endorsed Trump early
813027522036105218,2016-12-25 14:24:01,"Up next on : Jerry Falwell Jr., President of &amp; member of President Elect Trump's Evangelical Executiv…"
813025280969347072,2016-12-25 14:15:06,Former House Speaker Newt Gingrich on what he thinks will be the decisive moment of Trump’s domestic presidency....
813025256965369856,2016-12-25 14:15:01,On the panel today:
813024751652401152,2016-12-25 14:13:00,. on : My access to the administration is fairly overwhelming
813024248713408513,2016-12-25 14:11:00,. on : has recruited a cabinet of winners
813023280370171904,2016-12-25 14:07:09,"Former House Speaker Newt Gingrich believes President-Elect Trump’s use of Twitter is “brilliant” saying, “we..."
813022771156570113,2016-12-25 14:05:08,Former House Speaker Newt Gingrich on President-Elect Trump’s nuclear policy and whether the U.S. is back in an...
813022741624328192,2016-12-25 14:05:01,. on : We need to get used to 's tweets.
813022488338857984,2016-12-25 14:04:01,. on : The Russians have increased their nuclear capabilities. We have to candidly over-match that.
813022237896736769,2016-12-25 14:03:01,". on : The truth is the Russians have been rebuilding their nuclear capability, ours has weakened"
813021480892203009,2016-12-25 14:00:00,. begins right now
812888662643970048,2016-12-25 05:12:14,Happy Holidays from the Fox News Sunday family to yours!
812674447282946048,2016-12-24 15:01:01,Coming up on this week -- Former House Speaker Newt Gingrich. Check your local listings.…
812317204393918464,2016-12-23 15:21:28,On the panel this week: Check your local listings:…
812307603867004928,2016-12-23 14:43:19,A preview of what's coming up on this week
812284989626839041,2016-12-23 13:13:27,"Sunday--we'll sit down w/ Jerry Falwell Jr., President of &amp; member of President Elect Trump's Evangelical…"
812008925323296768,2016-12-22 18:56:28,A preview of what's coming up on this week.
811663968838320128,2016-12-21 20:05:44,Sunday-- we'll get the latest on the Trump transition from one of the President-elect's most outspoken...
811625383607095296,2016-12-21 17:32:25,What would you like to ask the panel-- about President Obama’s th-hour actions in his final days in office?
810528565326475264,2016-12-18 16:54:03,More from our Power Player - MGM Resorts International CEO Jim Murren on the eected crowds at his newest resort.
810523925272821761,2016-12-18 16:35:37,"Our Power Player of the Week is ""betting” on the Potomac. MGM Resorts International CEO Jim Murren takes us..."
810500906684973056,2016-12-18 15:04:09,Rep. Don Beyer (D-VA) wants to let the two step electoral process play out. Should electors be trying to delay...
810499503581253632,2016-12-18 14:58:34,Incoming White House Chief of Staff Reince Priebus on whether President-elect Trump accepts the intelligence...
810493350277156864,2016-12-18 14:34:07,. on : I hold responsible for attacking the intelligence community.
810493069011390464,2016-12-18 14:33:00,. on : The real issue here is why there isn't more interest from Republicans to look into Russian interference.
810491712992935936,2016-12-18 14:27:37,. on : We should give the electors the opportunity to see the intelligence reports about Russian interference.
810490853554843649,2016-12-18 14:24:12,. a Rhode Island elector-- I hope will change his tone and stand up against Russian interference.
810490656183488512,2016-12-18 14:23:25,. - a Rhode Island elector on : will be elected president but we should get the facts about what happened.
810490343510704128,2016-12-18 14:22:10,. on : Let's honor the will of the American people and get them the information they deserve.
810488251232489477,2016-12-18 14:13:51,Next on -- &amp; on tomorrow's Electoral College vote.
810487686595284992,2016-12-18 14:11:37,. on : I'm % sure Tillerson will be confirmed.
810487541996679169,2016-12-18 14:11:02,. on on Tillerson: We've been working with to get them on board.
810486848954966016,2016-12-18 14:08:17,. on : People didn't like the product-- that's why lost.
810486699130286080,2016-12-18 14:07:41,. on : Of course we didn't interfere with the Russians. The Democrats need to face the reality they lost the election.
810486504514535424,2016-12-18 14:06:55,. on : All of the people that are spinning the intelligence reports are doing it to delegitimize the election results
810486096161337345,2016-12-18 14:05:18,. on : There's no evidence the outcome of the election was changed because of a couple John Podesta emails.
810485916049571840,2016-12-18 14:04:35,. on : I think would accept the conclusion of the intelligence community if they release an official report
810485652542328832,2016-12-18 14:03:32,". if there is a conclusive opinion from the intelligence agencies, they should issue a report."
810485361528999936,2016-12-18 14:02:22,Now on -- 's incoming WH Chief of Staff Priebus
810484710216450048,2016-12-18 13:59:47,On the panel today --
810459845228949507,2016-12-18 12:20:59,Coming up on Congressman &amp; Elector preview tomorrow's Electoral College vote.
810450443084120064,2016-12-18 11:43:37,A preview of what's coming up on today.
810439097189859328,2016-12-18 10:58:32,Coming up on -- an exclusive with incoming WH Chief of Staff Priebus Check your local listings &amp; watch…
810433425563906048,2016-12-18 10:36:00,: Sneak Peek: Power Player of the Week; CEO Jim Murren;
810160514869460992,2016-12-17 16:31:33,A preview of what's coming up on
810115245951815680,2016-12-17 13:31:40,What questions do you have for the panel about President Obama saying he could not have done more to stop the carnage in Syria?
809861215656833024,2016-12-16 20:42:14,Sunday on - Incoming WH Chief of Staff Priebus Only on Check your local listings.…
809858335763734528,2016-12-16 20:30:48,Sunday—as members of the U.S. Electoral College get ready to cast their votes—we’ll speak to Congressman Don...
809440663062409216,2016-12-15 16:51:07,Our Panel this week: &amp; . Be sure to tune in!
808142607943606272,2016-12-12 02:53:06,We hope you enjoyed the show today w/ President-elect Trump as he spoke in his first Sunday show interview since wi…
808142149359456256,2016-12-12 02:51:17,: Watch Chris Wallace's exclusive interview with President-elect tonight at pm ET &amp; am ET on …
808079033497960448,2016-12-11 22:40:29,": On , President-elect shared his thoughts on China."
808078981538938880,2016-12-11 22:40:17,": In an exclusive interview on , President-elect discussed government spending."
808077365930762240,2016-12-11 22:33:52,Watch Chris Wallace's exclusive interview with President-elect tonight at pm ET &amp; am ET on…
808076408878723072,2016-12-11 22:30:03,: And P ET on FNC
808020587373268992,2016-12-11 18:48:14,"You can catch the ""must-see interview"" with Chris Wallace and President-elect at pm ET on…"
807965791660425217,2016-12-11 15:10:30,"Aboard Trump Force One en route to the Army-Navy game yesterday in Baltimore, Mr. Trump shared some surprising..."
807962234752212992,2016-12-11 14:56:22,". on says he felt ""ok"" on election night. ""I thought I was going to win big."""
807961289771327488,2016-12-11 14:52:37,: . defends choice of military generals for Cabinet
807961077472460801,2016-12-11 14:51:46,For our viewers in New York City -- you can watch on at am ET &amp; later on at pm &amp;…
807960265643806720,2016-12-11 14:48:33,Coming up on -- describes what went through his mind on election night.
807960251467239424,2016-12-11 14:48:29,"After our sit down interview with the President-elect, we also went on a road trip to the Army-Navy game. See..."
807959600507056128,2016-12-11 14:45:54,President-elect Donald Trump on his stake in “Celebrity Apprentice” and his real estate business. See what else...
807958254949122048,2016-12-11 14:40:33,President-elect Donald Trump comments on his call with Taiwan and why he doesn’t want China “dictating” to him....
807957109866369025,2016-12-11 14:36:00,". says he spoke to on Saturday. ""There are things we disagree on but we do get along well."""
807956872963780608,2016-12-11 14:35:04,on : I turned down deals with last week because I thought it could be perceived as a conflict of interest.
807956385988124672,2016-12-11 14:33:08,Next on -- the panel reacts to the interview …
807956131222003718,2016-12-11 14:32:07,President-elect Donald Trump says he’s getting “very close” to selecting his pick for Secretary of State and...
807955838342221824,2016-12-11 14:30:57,. on : We're going to have to impose a major tax on companies that leave to other countries.
807955363408543745,2016-12-11 14:29:04,". on : ""I don't want China dictating to me"""
807955019530203136,2016-12-11 14:27:42,". on his phone call with the leader of Taiwan: ""I don't know why we have to be bound by a One-China policy."""
807953930747518976,2016-12-11 14:23:22,". on Rex Tillerson as a possible Secretary of State pick: I have tremendous respect for him, he's a world-class player."
807953225580236803,2016-12-11 14:20:34,"Trump on on the Dakota Access Pipeline: I will tell you, when I get to office, if it's not solved, I'll have it solved very quickly."
807952906729230336,2016-12-11 14:19:18,". says he is ""open-minded"" when it comes climate change. ""Nobody really knows."""
807952700935696384,2016-12-11 14:18:29,". on : With the EPA, you can't get things approved. People are waiting in line for years before they get rejected,"
807952224156610560,2016-12-11 14:16:35,". on the new Air Force One order: ""I don't need a $4.2 billion airplane to fly around in, okay."""
807951660484005888,2016-12-11 14:14:21,": . : Claims of Russian interference in race 'ridiculous,' Dems making excuses"
807951216189837312,2016-12-11 14:12:35,. on the presidency: It's a big responsibility. We have to make the right decisions. it's a daunting responsibility.
807951040331005952,2016-12-11 14:11:53,President-elect Donald Trump reacts to the CIA’s conclusion that Russia intervened in the U.S. election. Watch...
807950740232826880,2016-12-11 14:10:42,. on : I would love to have Ivanka and Jared involved. We're looking at that from a legal standpoint right now.
807950522762280960,2016-12-11 14:09:50,". on : ""I won't be involved in my business at all...I just don't want to do it."""
807950300321644545,2016-12-11 14:08:57,On says he will live at the White House with his family.
807949843557732353,2016-12-11 14:07:08,". on ""I don't want anyone hacking us, and I'm not only talking about countries. I'm talking about anyone"""
807949640322650113,2016-12-11 14:06:19,. on : “I think President Obama has been terrific.”
807949465290215424,2016-12-11 14:05:38,". on his decision to skip some daily briefings “If something should change... I'm available on one-minute's notice."""
807949299921408000,2016-12-11 14:04:58,. on his decision to skip some daily briefings “I don't have to be told the same thing in the same words every single day.”
807948906231369728,2016-12-11 14:03:24,On blames the Democrats for putting the Russia story out there.
807948639318528000,2016-12-11 14:02:21,". tells Chris Wallace the CIA assessment Russia interfered in the election to help him win is “ridiculous"""
807948345276702721,2016-12-11 14:01:11,"Today on -- ""The Trump Way"" An exclusive with Watch now in most cities in the east coast. Che…"
807948071116177408,2016-12-11 14:00:05,. begins right now
807939906576273408,2016-12-11 13:27:39,On the panel today: Check your local listings…
807934140968529921,2016-12-11 13:04:44,Watch a preview of our exclusive interview with President-elect Donald Trump. You can see it on Fox News today...
807933056124383232,2016-12-11 13:00:25,You can also watch on at pm &amp; pm ET Check your local listings to see what time airs in your city.…
807932646189834240,2016-12-11 12:58:48,Watch on your local station. Check the local listings to see what time airs in your market.…
807932303162757120,2016-12-11 12:57:26,Coming up -- our exclusive interview with President-elect . Watch on at p &amp; p ET. Che…
807929862086234112,2016-12-11 12:47:44,"Coming up on - ""The Trump Way"" - an exclusive with Watch on at p &amp; p ET. Check y…"
807774354822037504,2016-12-11 02:29:48,"Tomorrow on - our exclusive interview with taped at Trump Tower, on his plane and at the Army…"
807757771810738176,2016-12-11 01:23:54,A preview of our exclusive interview with : Tillerson is 'much more than a business executive'
807755872151670784,2016-12-11 01:16:21,Some behind the scenes photos from our exclusive with Watch Sunday at pm &amp; pm ET on C…
807755207857803264,2016-12-11 01:13:43,Some behind the scenes photos from our exclusive interview with President-elect Donald Trump. Watch the...
807750278636306432,2016-12-11 00:54:08,Sunday-- our exclusive interview with President-elect Watch on at p/10p ET Check your…
807749806940626948,2016-12-11 00:52:15,"Sunday on ""The Trump Way"" -- an exclusive interview with President-elect Donald Trump. Watch on Fox News at..."
807690656814682112,2016-12-10 20:57:13,A preview of tomorrow's exclusive interview with President-elect Donald Trump. As questions swirl as to who Trump...
807669030605582336,2016-12-10 19:31:17,Tomorrow on -- our exclusive interview with President-elect
807655142682230784,2016-12-10 18:36:06,Sunday-- our exclusive interview with President-elect Watch on at p/10p ET Check your…
807634027251400704,2016-12-10 17:12:11,What do you want to ask our panel about the CIA's conclusion that Russia attempted to help Trump win the election?
807252833997357060,2016-12-09 15:57:28,What Qs do you have for our panel about Trump’s decisions to choose people to lead departments who have opposed those dept’s missions?
806889882903678976,2016-12-08 15:55:14,Sunday on -- sits down with Chris Wallace for his first Sunday show interview since becoming…
806888889264865280,2016-12-08 15:51:17,A preview of this weekend's exclusive interview with President-elect Donald Trump.
806597998050496513,2016-12-07 20:35:23,Join us this week on for President-elect 's first Sunday show interview since winning the elec…
