id,created_at,text
770038471301931009,2016-08-28 23:20:52,someone left the shirt on the hangar in the bathroom.
770038144427327489,2016-08-28 23:19:34,"Dylan Sprayberry was like, ""this is definitely the shirt,"" and so it was."
770037024590008320,2016-08-28 23:15:07,Sprayberry doesn't get any more Sprayberry than this
770036113482416128,2016-08-28 23:11:30,Teen Wolf News: it's Hair and balanced.
770035631850393601,2016-08-28 23:09:35,"this guy's ""got it going on."" (you can quote me on that)."
770035094140686336,2016-08-28 23:07:27,"looks like she's about to be swallowed whole by a fish. (which is her right, and I salute it)"
770034446271713280,2016-08-28 23:04:53,i don't know who they are but i am so happy for the child!
770033434769186817,2016-08-28 23:00:52,someone's comfortable in their own skin! (referring to snake)
770031654186446848,2016-08-28 22:53:47,hey everyone - Troy is on the red carpet. in case you're planning to rob Troy's condo. (I kid the Troy!)
770030070660493313,2016-08-28 22:47:29,Heads up - they have the Office on Netflix now. In case you never saw it.
770029233217437697,2016-08-28 22:44:10,i own this robe. wear it when i get the paper in the morning.
770028318041239552,2016-08-28 22:40:32,as a response to I will remain seated throughout the McChicken video.
769712453861138432,2016-08-28 01:45:24,"also, in minutes"
769712390443241473,2016-08-28 01:45:09,its true. she would not lie.
769648307719331840,2016-08-27 21:30:30,: Don't miss tonight at pm!
769355262738239488,2016-08-27 02:06:03,i kind of agree
769347124706312193,2016-08-27 01:33:42,"sorry to disappoint Broad Street, but no. You'll find someone."
769346377277181952,2016-08-27 01:30:44,I want Trump's doctor.
769338236783173632,2016-08-27 00:58:23,: basically the same.
769334343210762240,2016-08-27 00:42:55,Great show. Watch tomorrow !
769297425508945920,2016-08-26 22:16:13,"yeah, cuz you're the apex of social commentary."
769291951191523335,2016-08-26 21:54:28,: looks like a villain with a cute dog
769247600595697665,2016-08-26 18:58:14,"yes, and i'm also running for president"
769242879147376640,2016-08-26 18:39:28,"Oh Barbara, you're such a scream!"
769240395855253504,2016-08-26 18:29:36,It's just too easy.
769222924788076544,2016-08-26 17:20:11,: This is somewhat apt this week
769016591531073541,2016-08-26 03:40:17,"unemployed. claims to be a writer. defends RHCP, aging shirtless millionaires who ignore her"
768987470927101953,2016-08-26 01:44:34,"when they play it at Gitmo, even the guards confess to crimes they never committed."
768981320240422913,2016-08-26 01:20:08,there is none
768979928553586688,2016-08-26 01:14:36,Radio does free PR for terrible band of shirtless millionaires who don't care if they exist.
768940880736780288,2016-08-25 22:39:26,": .: 'Assange's Leaks Have One Thing in Common, And It's Not Principle'"
768934808059731968,2016-08-25 22:15:19,alternating between upper &amp; lower case; repeating asshat; demands for ear cleaning. :
768906627453943809,2016-08-25 20:23:20,About to Facebook live with
768878103280046080,2016-08-25 18:29:59,"let me know when you become a ""fellow musician."""
768585419734732800,2016-08-24 23:06:58,those were summer songs silly
768574957534281728,2016-08-24 22:25:23,: .: Hillary and Trump Are Playing Chicken With Their Own Flaws
768573080511938560,2016-08-24 22:17:56,My apology to
768563162618748929,2016-08-24 21:38:31,My apology to coming up in minutes
768552903292444672,2016-08-24 20:57:45,Please watch to see my heartfelt apology to on the five
768244886822871040,2016-08-24 00:33:48,On in a few minutes to discuss things in a manner that makes kittens yawn.
768241912667144192,2016-08-24 00:21:59,:
768239808829333504,2016-08-24 00:13:38,Not a real person. :
768238538882060292,2016-08-24 00:08:35,Troll pain
768238205233692672,2016-08-24 00:07:15,"""Switch to instead"" sez Greg"
768235887599714304,2016-08-23 23:58:03,
768234585826222080,2016-08-23 23:52:53,
768234344913797124,2016-08-23 23:51:55,:
768208493203554304,2016-08-23 22:09:12,: . on What Statistics-Armed Leaders Get Wrong About Terror
768202830947684352,2016-08-23 21:46:42,"Greg Gutfeld: So, are you a troll? | Fox News |"
768195237286150145,2016-08-23 21:16:31,: Gary Johnson is joining us on set tonight for - what would you ask him if you were there?
768156311011799041,2016-08-23 18:41:50,"this was my tribute to you,"
767847827955474433,2016-08-22 22:16:02,: .: CNN Headline Shows the 'Subtle Racism of the Liberal Media'
767847308973207553,2016-08-22 22:13:59,Obsessed with excrement. Lame Name calling. Creepy Attachment. :
767845847967096832,2016-08-22 22:08:10,no
767840074813829121,2016-08-22 21:45:14,Yes I have bone spurs
767497124896448513,2016-08-21 23:02:28,so you don't understand a retweet do you
767495802361184256,2016-08-21 22:57:13,Are Americans offended by UC Davis' 'Words That Hurt'? .
767202020503748613,2016-08-21 03:29:50,"thanks for not calling me ""a bunch of queers."" I'll remember that come Christmas time!"
767201323582390273,2016-08-21 03:27:04,"thanks TrumpZone16! and excellent use of the phrase ""retard!"" you're really painting a great picture of your candidate!"
767199623593287680,2016-08-21 03:20:18,You are absolutely correct!!!
767198931134611456,2016-08-21 03:17:33,"mystery is the spice of life, Spud."
767196692554903552,2016-08-21 03:08:39,how do i know these things? i'm just shouting into a camera behind a desk drinking coffee!
767196276064595968,2016-08-21 03:07:00,thank you Red Blooded American!
767195849994665984,2016-08-21 03:05:19,you're an hour late.
767194730287472640,2016-08-21 03:00:52,"They removed it but screenshots are forever. Run Team Trump, Run!"
767192041738670081,2016-08-21 02:50:11,"at least they aren't mincing words, these official Trump guys!"
767191582009397250,2016-08-21 02:48:21,"hey everyone, it's official!!!"
767187569650102272,2016-08-21 02:32:24,"yep, i do pardner! now fetch me a Nehi and some ribbon candy."
767185478487515136,2016-08-21 02:24:06,i've never been to your house!
767184596345712640,2016-08-21 02:20:36,Hey - this guy says you're a cuck.
767183820697309185,2016-08-21 02:17:31,shine a light on a cockroach - that's what happens.
767183453024555008,2016-08-21 02:16:03,"shitbag just called a dude whose legs were blown off, a ""cuck"" - infinity."
767181883792879616,2016-08-21 02:09:49,Vice versa
767180613056995328,2016-08-21 02:04:46,: New tonight pm with if you're watching let me know
767178949818548224,2016-08-21 01:58:09,"a new starts in mere minutes. and its going to change your life! (in the sense that for an hour, you won't do anything bad)"
767170723685212161,2016-08-21 01:25:28,: Tune in and watch me and tonight p est …
767167941842440192,2016-08-21 01:14:25,"i'm a Westinghouse guy, myself. Good for storing cold cuts, beer, AND YOU."
767166757278740480,2016-08-21 01:09:42,is that an amana?
767143782513045504,2016-08-20 23:38:25,recall harder
767136098950742018,2016-08-20 23:07:53,who hasn't? She's in line behind Omarosa and Sheriff Joe.
767132601198972928,2016-08-20 22:53:59,"Seamless texts after you eat, gauging your satisfaction, are like small talk after an event one regrets."
767124124040892417,2016-08-20 22:20:18,:
767122238680211456,2016-08-20 22:12:48,"Now, about that wall...."
767120828765003781,2016-08-20 22:07:12,Genetic eert. Ideologically false. Blames the Jews. For trump. :
767118912295231488,2016-08-20 21:59:35,Antisemitism. Misogyny. Tiny hand empathy. :
767114918260793344,2016-08-20 21:43:43,. Likely a virgin male with micropenis
767112246468247556,2016-08-20 21:33:06,Would be funnier in the detergent aisle
767105417654767616,2016-08-20 21:05:58,Thank god it's rigged
767033415363391488,2016-08-20 16:19:51,Remember folks. Lock your phone when you're on the stairclimber.
767028103340236800,2016-08-20 15:58:45,Hughzcxk
766956698200371200,2016-08-20 11:15:00,: . Show-Saturday /20 w/
766840080392605697,2016-08-20 03:31:37,we just get each other's mail. same catalog.
766838939080503296,2016-08-20 03:27:04,"to be fair, it did look like the neck massager I ordered."
766838433285218304,2016-08-20 03:25:04,"that was yours? I signed for it. I put it back in the box, but i would boil it in a pot of water."
766824675376664576,2016-08-20 02:30:24,let her handle it
766822581907312640,2016-08-20 02:22:05,"it's a good one, people."
766822290323410944,2016-08-20 02:20:55,and you cling to it.
766821925364510720,2016-08-20 02:19:28,get over me.
766821445829742592,2016-08-20 02:17:34,"first: try not saying you're a ""christain"" then demeaning folks anonymously on a social network."
766819393678356480,2016-08-20 02:09:24,"no, just your spelling and your grace."
766817649426780160,2016-08-20 02:02:29,: ICYMI: Dana Perino's honesty makes her the No. trending story on Facebook
766817267568914432,2016-08-20 02:00:58,"describes self as ""seriously christain"" - actual spelling before he changes it. :"
766810993917726720,2016-08-20 01:36:02,that was not me.
766810321445007360,2016-08-20 01:33:21,repeat tweets show envious obsession w/ strangers lives; an egg - anonymous to hide sadness. :
766802220327309313,2016-08-20 01:01:10,: Hanging with an American Hero on
766759636535877633,2016-08-19 22:11:57,"references to bodily functions; attacks on physicality; calls people losers, than debate. :"
766758995616944128,2016-08-19 22:09:24,mixing upper and lower case. calling women eletives because you disagree. :
766751086480912384,2016-08-19 21:37:59,I'm writing slam poetry
766745500968165377,2016-08-19 21:15:47,Their one &amp; only tweet. Advocates death. :
766743290553204736,2016-08-19 21:07:00,: The Gutfeld Troll Factor is a feature I never knew I needed
766724861209161728,2016-08-19 19:53:46,conspiracy graphic with arrows; conspiracy hashtag; sick obsession with bodily functions :
766724196822978560,2016-08-19 19:51:08,thinks women who talk are angry; mixes upper &amp; lower case; humorless judging what's funny. :
766718847327932416,2016-08-19 19:29:52,as long as i get a royalty!
766718126960414720,2016-08-19 19:27:01,Demands firing rather than debate; eends great effort on a poll; sad plea for support :
766683945773563904,2016-08-19 17:11:11,"fact-free commentary, misuse of ""you're,"" followed by defensive insult. :"
766683591594029057,2016-08-19 17:09:47,"by tuesday next week, the will be up and running!"
766682786304450561,2016-08-19 17:06:35,"Comment on physical looks, times more tweets than followers. :"
766677740745478145,2016-08-19 16:46:32,"yeah, i'm just grateful when responsibility is taken."
766677327950417920,2016-08-19 16:44:53,"yeah, but did the right thing and corrected it."
766486522250092544,2016-08-19 04:06:42,"Clark, we've notified the PhD stolen valor department. You must delete your account immediately or face jail time."
766485689949097984,2016-08-19 04:03:23,okay. we win. You have no Ph.D. thank you for playing.
766485139400581120,2016-08-19 04:01:12,can you help those who cant figure out what your PhD is in?
766484616597340160,2016-08-19 03:59:07,
766484476906074112,2016-08-19 03:58:34,"cool! Clark, PhD! What's your PhD in?"
766484002739978240,2016-08-19 03:56:41,"thank you Clark, PhD. (Note: he's a PhD - in what? not important!)"
766482897008197633,2016-08-19 03:52:17,"hey everyone, clark wants you to know he's a PhD!"
766468656553422848,2016-08-19 02:55:42,"On November th: the announcement of Trump Entertainment Network, or TEN, for short. It's a PERFECT TEN!"
766455218024382464,2016-08-19 02:02:18,"yes, but you're in the middle of a reverse mortgage and purchasing a chair lift."
766454461313249280,2016-08-19 01:59:18,another troll
766449981456781313,2016-08-19 01:41:30,this adds nothing to the conversation.
766449558033428481,2016-08-19 01:39:49,i was once robbed at needlepoint
766449341435371520,2016-08-19 01:38:57,"troll assessment: All caps, but spells ""you're"" correctly. :"
766447026590588928,2016-08-19 01:29:45,troll: old man in bad vacation hat who can't count to characters.
766445827996971008,2016-08-19 01:24:59,weird that everyone thinks Trumps big pivot tonight is due to Conway. Or Bannon.
766421220074070016,2016-08-18 23:47:12,: Uncuck
766410088810557440,2016-08-18 23:02:59,: “I Will Never Lie to You” by
766402260498731008,2016-08-18 22:31:52,My monologue on driverless cars.
766397852209643520,2016-08-18 22:14:21,: troll
766337117123260417,2016-08-18 18:13:01,true. will he fix?
766334752328527872,2016-08-18 18:03:37,"hey jack - your portrayal of me on yesterdays segment is incorrect. Rewatch, and consider adjusting. Thanks."
766325937021431809,2016-08-18 17:28:35,STUPID! ARTICLE DUM RINO!
766075377445924864,2016-08-18 00:52:57,whats not to like?
766075264585633794,2016-08-18 00:52:30,"only the best people, people."
766067628133781504,2016-08-18 00:22:10,too late! i'm busy doing my hair.
766067425108488193,2016-08-18 00:21:21,that wasn't.
766065406629085184,2016-08-18 00:13:20,i disagree. We have no problem with facial hair on men.
766065055230197760,2016-08-18 00:11:56,You've convinced me with your perceptive response! Do you have any pamphlets I might peruse at the bus stop?
766062495597494272,2016-08-18 00:01:46,"this ""cuck"" thing is really winning over America. Keep going!"
766059791324180481,2016-08-17 23:51:01,"you don't need me, pal. You're"
766059206038417408,2016-08-17 23:48:42,"kudos for hashtag. such things stopped in third grade. You're bringing it back, which reflects deep intellect!"
766058188395409409,2016-08-17 23:44:39,i have thought about this at great length and concluded that Chad had made it too uncomfortable for others.
766057740879990784,2016-08-17 23:42:52,it mite be my eellance in speling.
766044934629720065,2016-08-17 22:51:59,You're right PJR: will they go from No. to Coco?
766043290693201920,2016-08-17 22:45:27,: : Worries about Trump's Campaign 'Pivot': 'Do They Challenge Him?'
766037182821826560,2016-08-17 22:21:11,So bright when they threaten
765710634856185856,2016-08-17 00:43:36,: Trump isn't going to lose. I will be back to remind you on November .
765707068867276800,2016-08-17 00:29:26,Missed my point. I'm mirroring excuses of panicked trump insiders
765699796149669888,2016-08-17 00:00:32,"When Trump loses, its on the hacks who didn't choose the actual republican who would already have this sewn up. (mirror logic that works)"
765690562305466368,2016-08-16 23:23:50,"Wednesday: Trump gets intel briefings. Thursday: ""so they tell me we got agents in Isis...where? Oh west Berlin...anyway.. its amazing."""
765688544253870085,2016-08-16 23:15:49,this is crazy shit.
765671848772300804,2016-08-16 22:09:28,: 'A Clichéd Smear': Rips New York Times Editorial on Trump Foreign Policy Speech ht…
765668146497945600,2016-08-16 21:54:46,Classy
765666607691595780,2016-08-16 21:48:39,You are not real.
765642121609084928,2016-08-16 20:11:21,I loved this guy.
765303681814331392,2016-08-15 21:46:31,: .: Milwaukee Violence Based on Nothing More Than the Chance to Riot https:…
765276903972282369,2016-08-15 20:00:06,my latest on Milwaukee:
765262648988438528,2016-08-15 19:03:28,"a year younger, a year younger...than trump"
764993186276270081,2016-08-15 01:12:43,I don't eat popcorn but now i might start
764910896502235136,2016-08-14 19:45:43,"WATCH: Greg Gutfeld Interviews 's 'Sleeper Candidate,' Gary Johnson"
764910626372194308,2016-08-14 19:44:39,": ""Ping Pong Of Wrong"" Gutfeld: No need to shoot the messenger in https:/…"
764886701495975937,2016-08-14 18:09:35,It was great!
764672682386395136,2016-08-14 03:59:09,that hurts.
764664920952737793,2016-08-14 03:28:18,i'll take that as a compliment.
764659871824416768,2016-08-14 03:08:14,"the best interview, second to"
764657198093987840,2016-08-14 02:57:37,"watch it again, or for the first time, gents and ladies."
764656100843061248,2016-08-14 02:53:15,"the band, obviously"
764656004139220992,2016-08-14 02:52:52,"yes, you got me! a fake conservative! go hug your cat"
764654399494946816,2016-08-14 02:46:30,"satan, or flipper. I cant make up my mind."
764653079644045312,2016-08-14 02:41:15,: I kinda want Gary Johnson for president after that interview !!
764652867219251201,2016-08-14 02:40:24,: Just saw Gary Johnson () on I don't know but the more I see the more I like
764652660595298304,2016-08-14 02:39:35,: After watching Greg's interview with I'm surprised to see there's someone running that's actually a hum…
764652414825881602,2016-08-14 02:38:36,you left out pro-golfer
764652287750967296,2016-08-14 02:38:06,: That interview made total sense... To anyone currently sitting at home on their couch stoned out of their mind.
764652249792516097,2016-08-14 02:37:57,": All Candidates should be required to go on , just to see how well they hold up to unconventional questioni…"
764652056993038336,2016-08-14 02:37:11,are you sure this is the right number?
764647992104194048,2016-08-14 02:21:02,it gets better - an off the rails sloppy joe of fun!
764647628319625216,2016-08-14 02:19:35,always a big thrill to receive these tweets during a show.
764644129833881600,2016-08-14 02:05:41,someone's obsessed with sexuality!
764643726471925760,2016-08-14 02:04:05,it's really taken three to four weeks off my age.
764643206231420928,2016-08-14 02:02:01,: is about to start! Don't miss and …
764637718102085632,2016-08-14 01:40:12,": ""Back To The Gutfeld"" pm ET &amp; htt…"
764623434676666368,2016-08-14 00:43:27,": Vladimir Putin wishes ""dear friend"" Fidel Castro a happy th birthday"
764619440797413376,2016-08-14 00:27:35,": Tonight on , interviews and it is the best interview of all time. You think I am joking…"
764604174977949696,2016-08-13 23:26:55,Philip Loyd » The Accident. To me this is The perfect short story
764591053928271877,2016-08-13 22:34:47,: Light entertainment in the 's....
764582581555920896,2016-08-13 22:01:07,": Two of my buddies, Greg and together!!!"
764580721470140416,2016-08-13 21:53:43,make sure you watch
764577335785947136,2016-08-13 21:40:16,Awesome interview with Gov. Gary Johnson that will no doubt make news and change the face of politics forever.
764563919465746432,2016-08-13 20:46:57,great piece on a forgotten movie that scared the crap out of me.
764302386848534528,2016-08-13 03:27:43,:
763874804160204800,2016-08-11 23:08:40,Gutfeld: The case for Gary Johnson | Fox News Video
763873113285259264,2016-08-11 23:01:56,yet u follow me. Who's the dope head?
763871948115935233,2016-08-11 22:57:19,: FOX NEWS CHANNEL - Gutfeld: The case for Gary Johnson:
763510177408622592,2016-08-10 22:59:46,: Watch Bring Shep Some Iced Coffee During Coverage of Trump Tower Climber
763504791498715136,2016-08-10 22:38:22,: Impressive Chinese dive.
763499767863382016,2016-08-10 22:18:24,: . hand delivers iced coffee to Shepard Smith during Trump Tower climber cvg.
763194763482959872,2016-08-10 02:06:25,campaign season recalls the end of Perfume. After a sad orgy of chaos &amp; idiocy - how many on the right will pretend it never happened?
763154560156303362,2016-08-09 23:26:40,what did I miss something
763133507682074625,2016-08-09 22:03:01,: speaks highly of on
763131850332184577,2016-08-09 21:56:26,: .: Orlando Terrorist's Dad Is More Evidence of Hillary's 'Lax Security Disorder' ht…
763129733315952640,2016-08-09 21:48:01,"do your research, dbag"
762772448790061056,2016-08-08 22:08:18,: . Rips Piers Morgan for Anti-Gun Tweet After U.S. Wins Olympic 'Shooting' Event htt…
762442637068476416,2016-08-08 00:17:44,To be fair. It was just a hobby
762428665862901762,2016-08-07 23:22:13,"A dbag is someone who mocks a woman's achievement, linking it to violence. U win the gold on that"
762387028323467264,2016-08-07 20:36:46,I can only read this one way
762383001795821569,2016-08-07 20:20:46,I don't want your bar eertise. I want your big warm arms to cradle me
762371975666868224,2016-08-07 19:36:57,She found my love letters to Chad Everett
762362513476448257,2016-08-07 18:59:21,He'll never be cleaned up by dinner.
762360669199069184,2016-08-07 18:52:02,That time I fell into a vat of tar.
762359020715905025,2016-08-07 18:45:29,She's said nothing so far. Not even a thank you for the flowers.
762358610949185536,2016-08-07 18:43:51,Should not have eaten an entire pelican last night.
762358157440090115,2016-08-07 18:42:03,She offered to buy me a drink and now I'm listening to her life story.
762329744167825408,2016-08-07 16:49:09,Also least surprising: piers is a dbag
762329368379154432,2016-08-07 16:47:39,": Thanks for trolling. Realize it was a pellet gun, she defeated heavily favored Chinese, &amp; proud …"
762114697487347712,2016-08-07 02:34:37,This is exactly the right way to respond to adversarial opinions.
762104569874833408,2016-08-07 01:54:23,Hey starts in five minutes!! It gets ugly!
762100767096508416,2016-08-07 01:39:16,Also the ones that followed you home only slashed of your tires
762099794638692352,2016-08-07 01:35:24,"They weren't booing you, they were really booing you."
762075856890130432,2016-08-07 00:00:17,": Yep, it's Sick-Of-Schappert Saturday. I'm on pm EST, then pm EST. I apologize in advanc…"
762016677911465984,2016-08-06 20:05:08,His last steps on his own feet
761991629859352577,2016-08-06 18:25:36,: New tonight pm w/guests Dan Soder Terry Schappert &amp; Michael Ian Black !
761912074222043136,2016-08-06 13:09:28,:
761911892105396224,2016-08-06 13:08:45,: . Show-Sat /6 w/
761819536077324288,2016-08-06 07:01:45,": Havin' a time! We love you,"
761307813855502336,2016-08-04 21:08:21,back Monday
761302014479437824,2016-08-04 20:45:19,"note: if anyone questions your conservativism as their icon implodes, local law stipulates that you can play a tiny violin."
761222214649778176,2016-08-04 15:28:13,: THIS IS AMAZING
761185370839085056,2016-08-04 13:01:49,Self-congratulation. Lol.
761039325760892929,2016-08-04 03:21:29,Congrats to on the View gig! Remember the little people (literally) !
761036504827240448,2016-08-04 03:10:16,Me tending bar. Edward hopper with an elephant
761010221665939456,2016-08-04 01:25:50,long predicted: trump mouthpieces blaming the right for not supporting a RINO that mouthpieces would denigrate if it wasn't trump. HA!
760999008051531776,2016-08-04 00:41:16,"Eminem, Clint Eastwood and Mariah are trending. When did Twitter suddenly become ? I wouldn't mind but i'm still ."
760997519044247553,2016-08-04 00:35:21,"sorry, new show is on at est. I'm on vacation so don't blame me."
760992616842457088,2016-08-04 00:15:53,"yo alums, watch new show tonight :30 est. it will be the opposite of suck!"
760979246038786048,2016-08-03 23:22:45,this should have been America's destiny
760975508318322688,2016-08-03 23:07:54,"wife just said Trump can't do too much harm, cuz of separation of powers. She just became a citizen &amp; knows."
760970616858087426,2016-08-03 22:48:27,that was my doppleganger
760848025996623872,2016-08-03 14:41:19,How will trumpet &amp; never trumpers reconcile in November? It won't be this pleasant
760654513791504389,2016-08-03 01:52:23,Best cookie I have ever had. Anyone had this?
760650754399019008,2016-08-03 01:37:26,if only someone saw this coming.
760630484686766080,2016-08-03 00:16:54,please do.
760610020417499136,2016-08-02 22:55:34,"Heroes don't get captured; strong women don't get harassed. Apple, not far from tree."
760584989624926208,2016-08-02 21:16:07,: Congrats M! htt…
760528726530621440,2016-08-02 17:32:33,: Adding Eric Trump to Twilight photos is the only thing that soothes me
760528659518201857,2016-08-02 17:32:17,": A few setbacks have been reported for the upcoming Rio Olympics, we sent and to investigate h…"
760310245591805952,2016-08-02 03:04:23,no i had a bacon cheese burger and a lime popsicle. but I was thinking about taquitos.
760306060565643264,2016-08-02 02:47:45,"They look so natural together, says a mule with a head injury"
760304433951629312,2016-08-02 02:41:17,"(shirtless, eating taquitos - Chad nods - because he doesn't tweet much)"
760303357462478848,2016-08-02 02:37:00,Chad's thinking: that could have been me! (Jordan and Chad could have had an awesome condo right by the beach in Venice.)
760301488480616448,2016-08-02 02:29:35,i once slept myself to tears.
760300725675106305,2016-08-02 02:26:33,Australian version of Robbie:
760300010655379456,2016-08-02 02:23:42,"i could see it in his eyes. He was blinking in Morse Code, ""What monster wrote this epic novel?"""
760299710137634816,2016-08-02 02:22:31,"I met Piper Perabo in Sundance around . She seemed annoyed by me. For more information, consult a public library"
760299278048854016,2016-08-02 02:20:48,that's a really long tease for Chris - and over applause - but he pulled it off.
760298536902819840,2016-08-02 02:17:51,"no man should ever be forced to ask a woman why she dumped him, on tv, unless he's being paid at least bucks."
760296471761682433,2016-08-02 02:09:39,"still don't know why jo-jo stopped at jo-jo. could have been jo-jo-jo or jo-jo-jo-jo, or jo-jo-jo-jo-jo. LOSER."
760295368043159552,2016-08-02 02:05:16,i totally feel for Robbie. One time i was hurt and confused when i didn't marry a woman on a national television show.
760293381595656193,2016-08-02 01:57:22,weird how palm trees are associated with relaxation. their coconuts can kill you.
760292996134871040,2016-08-02 01:55:50,"Well, this is it! Not the finale. I'm about to throw up a bag of chocolate covered macadamia nuts."
760292251654381568,2016-08-02 01:52:52,"she's crying a lot. Can you blame her? At some point, we all die. (unrelated)"
760287164903153664,2016-08-02 01:32:40,"note to single woman: a man can't commit to both you AND his abs. If he has abs, run screaming."
