id,created_at,text
813966975307313152,2016-12-28 04:37:04,A great book. Underlined nearly every sentence
813943757800357888,2016-12-28 03:04:48,great piece by
813932686314274816,2016-12-28 02:20:49,hence my number of followers
813924076771229696,2016-12-28 01:46:36,🇺🇸
813915805226270725,2016-12-28 01:13:44,I hate whoever is the cut.
813783146730815488,2016-12-27 16:26:36,my life as an inflatable unicorn - the five's secret santa -
813518241725353985,2016-12-26 22:53:57,"yeah, this is exactly what i was trying to avoid"
813505978205425664,2016-12-26 22:05:14,"no, but i have directions to a club downtown"
813505360162123777,2016-12-26 22:02:46,you can do that without being a bird.
813504739673571332,2016-12-26 22:00:18,"whatever you do, don't watch the last minutes."
813439814846607360,2016-12-26 17:42:19,"for once i'd like a family to issue a press release that says, ""Contrary to his wishes to spend more time with his family, we prefer not."""
813164393714352128,2016-12-25 23:27:53,"its okay. All the time, you aren't funny."
813150547570212869,2016-12-25 22:32:52,NYC christmas: I've placed christmas lights around the trap door in front of the bodega so when u fall to your death it will be festive.
813149283323150336,2016-12-25 22:27:51,But it's your best work.
812833181007249409,2016-12-25 01:31:46,: my wife thinks is among the funniest people alive. This judgment makes me uncomfortable
812824943297695744,2016-12-25 00:59:02,I would like to announce that I will be taking a job in order to spend less time with my family. They suck.
812801449591709696,2016-12-24 23:25:41,I prefer to be surprised!
812800596877123584,2016-12-24 23:22:18,"better if u wrap em in butcher paper, then w/a sharpie write, ""arm,"" ""leg"" and ""thigh."" then toss into a hat. and choose!"
812798775722995712,2016-12-24 23:15:03,i put names on each one. And then chew. And chew. And chew.
812798592159203328,2016-12-24 23:14:20,: what is Seamless ?
812798137832275968,2016-12-24 23:12:31,"if i don't order Seamless for a few night straight, I wonder if they worry if I'm okay."
812793606402621440,2016-12-24 22:54:31,scientists say fig newtons are the closest approximation to human flesh. Just passing that along.
812792737011535872,2016-12-24 22:51:04,and then he started eating crackers!!
812792456722968576,2016-12-24 22:49:57,it makes me sadder when adults are carrying bedroom pillows onto a plane.
812788736438272000,2016-12-24 22:35:10,"idea for Delicatessin where you eat on a toilet. call it DEL-EAT. Don't try to rip this off, because i've copyrighted it. 🤠"
812776652463808512,2016-12-24 21:47:09,Which is GQ
812776529415598081,2016-12-24 21:46:39,I subscribe to Teen Readers Digest.
812776369964793860,2016-12-24 21:46:01,weirdest thing: there's a teen Vogue. Where the hell is teen Esquire?
812532460303032321,2016-12-24 05:36:49,"hey there's a fake me on twitter. look at spelling of my name when he follows or tweets you. he's spells it ""Gerg."""
812515771163308032,2016-12-24 04:30:30,my appearance on
812456451486654464,2016-12-24 00:34:47,On in about minutes. I hope he doesn't chew me up and spit me out.
812439755816337408,2016-12-23 23:28:26,an unfortunate screen grab
812094944190021633,2016-12-23 00:38:17,He was not sitting
812083819767562240,2016-12-22 23:54:05,: So 's One More Thing included an impression of a certain competing network's anchor https:/…
812067202945941504,2016-12-22 22:48:03,": . Slams 'Divisive, Alienating' YouTube Hoaxer Who Claimed Racism on Delta Flight"
811760908531855360,2016-12-22 02:30:57,this asshole jeopardized people's travel to draw attention and make money. How is this not a crime?
811759942256443392,2016-12-22 02:27:06,"she still hasn't admitted she pushed a lie, and indulged a smear about Americans and a decent company like"
811753228895481856,2016-12-22 02:00:26,yeah they should only do it during the rest of the year.
811749384979447808,2016-12-22 01:45:09,pretty good summary of the how MSM thinks
811742219795304448,2016-12-22 01:16:41,need to make a pledge that never gets a paying job in the western world again. he can be 's colonic therapist.
811740351044194304,2016-12-22 01:09:15,my review of new show:
811735253408710657,2016-12-22 00:49:00,and anyone else.
811734320083828736,2016-12-22 00:45:17,": It was awful how many did zero investigating, just spread the faker's story with righteous glee because it confirmed t…"
811731669254291456,2016-12-22 00:34:45,"i was just pulled off plane for speaking pig latin -they yelled ""short man must die, go Trump!"" why doublecheck"
811728560947953668,2016-12-22 00:22:24,same dude?
811727250383110144,2016-12-22 00:17:12,all the assholes defending the shitbag prankster &amp; damning would've been first to whine if their flight was delayed.
811726718796959744,2016-12-22 00:15:05,right now should boycott using her brain for stuff.
811725464695926784,2016-12-22 00:10:06,"without evidence, rich actress swallows word of hoaxer and happily smears - a company of thousands of hardw…"
811711967618539520,2016-12-21 23:16:28,red wine and more red wine
811709607332708352,2016-12-21 23:07:05,: . : Wishful thinking doesn't save lives |
811398101357436928,2016-12-21 02:29:17,"i would put him between the giant spider from Gilligan's Island, and the tiki doll from the Brady Bunch"
811396452538847232,2016-12-21 02:22:43,"i'm a wait and see guy. So far, Satan - what have you done for me lately?"
811394730806378496,2016-12-21 02:15:53,Imagine if 's mom was as smart as Lena!
811391488206798848,2016-12-21 02:03:00,do you really wish?
811384069468618752,2016-12-21 01:33:31,on in a few with Bernie to talk about Satan. Spoiler alert: Bill doesn't like Satan. I'm ambivalent about the red guy.
811366449063350272,2016-12-21 00:23:30,I agree about Juan!
811364192913682432,2016-12-21 00:14:32,I just glad you watch!
811362575711633408,2016-12-21 00:08:07,it won't last
811358319193440256,2016-12-20 23:51:12,in the back!
811347345996582912,2016-12-20 23:07:36,today's monologue
811334461325459457,2016-12-20 22:16:24,It's my mono today
811049389867364352,2016-12-20 03:23:37,then we'd have to redo the popular vote
811043498438823936,2016-12-20 03:00:13,my masculinity is so overpowering i have to treat it delicately.
811042327980605440,2016-12-20 02:55:34,a message guaranteed to reelect Trump. A bunch a moronic racists who only see white people as dumb aggressors.
811041617448697856,2016-12-20 02:52:44,"wait - he said i was, or i said he was. this will bother me for at least a week."
811040593107361793,2016-12-20 02:48:40,Seriously thinking we need a recount of the electoral college. i can't help but think the vote was hampered by the cold weather.
811038668769071104,2016-12-20 02:41:01,i bet.
811036533285392385,2016-12-20 02:32:32,another monologue about the bitterest of people
811036372396077056,2016-12-20 02:31:54,"microaggressions: begin tweet with ""when,"" followed by overuse of emojis, randomly picked to suggest a drunken game…"
811035535724658688,2016-12-20 02:28:34,": The number of dead ticking up in the last few hours and CNN is already leading with...speculation of a ""fallout"" / potentia…"
810986939398717443,2016-12-19 23:15:28,"MTV's achievement: finding self-satisfied, humorless dopes who transcend all identity."
810934164946124805,2016-12-19 19:45:46,": A truck plowed into a Christmas market in Berlin, causing multiple injuries and at least one fatality, according to German m…"
810625349809819649,2016-12-18 23:18:38,my head = actual size
810620160520421376,2016-12-18 22:58:01,"hey Stephan, got any video of the attack? people, must have smart phones. since you're implicating cops as a…"
810617259618136064,2016-12-18 22:46:29,"how did they know they're trump supporters? how did beat up ? are the police involved, since the victims say at…"
810615182082920449,2016-12-18 22:38:14,people attacked by four trump supporters. what's the police report tell us?
810607891967262720,2016-12-18 22:09:16,"Technically, if i'm a pathetic pseudo-intellectual, that means i'm a legitimate intellectual. thank you."
810550694386274304,2016-12-18 18:21:59,"Finally - an identity i can embrace. Life, as a plant."
810527345371213825,2016-12-18 16:49:12,: Did you miss w/ and Bernie McGuirk last night? Catch them tod…
810335701048971265,2016-12-18 04:07:41,"fairly certain tonight's repeats in hours (i.e. am eastern), but it's hard to say because i'm just a tweet."
810333571693105154,2016-12-18 03:59:13,your tweet reminds me of an old porn movie that was really poorly written
810326748978151424,2016-12-18 03:32:06,: is fired up tonight! Check out his monologue here
810316120917966848,2016-12-18 02:49:52,"in ten minutes, a brand new begins, and your life will change for the better. If not, that's your fault."
810258069083090944,2016-12-17 22:59:12,its amazing how hate brought us together!
810255456014831617,2016-12-17 22:48:49,that was !
810255289295446016,2016-12-17 22:48:09,whats the good part.
810254580382658560,2016-12-17 22:45:20,"tell them I sent you, and you get a discount on syllables."
810254186898194432,2016-12-17 22:43:46,"In total, Heimlich saved k lives, never considering a non binary pronoun when assisting a choking victim. Great man."
810253094810480640,2016-12-17 22:39:26,have you considered a billboard in your local village?
810252344776622084,2016-12-17 22:36:27,no idea what you mean. but you're welcome!
810252266112516096,2016-12-17 22:36:08,Have you considered not telling this to strangers on twitter?
810176219505393664,2016-12-17 17:33:57,it's a positive delight! I know because i was there!!!
810080645246488577,2016-12-17 11:14:11,: . Show - Sat /17 w/ Bernie McGuirk
809875651138359296,2016-12-16 21:39:36,: New show tomorrow night at pm w/ and Bernie McGuirk!
809596509016702976,2016-12-16 03:10:23,
809537742501773312,2016-12-15 23:16:52,todays mono on the Muslim hate crime hoax:
809249527421169664,2016-12-15 04:11:37,me being stupid on
809206087765393408,2016-12-15 01:19:00,hey everyone! Brian says the subway hoax story PUSHED by media to trick people merits followup coverage! thanks Br…
809194716759785473,2016-12-15 00:33:49,"so the recanting of the crime is ""allegedly,"" but not when Yasmin claimed the crime occurred?"
809193119044534285,2016-12-15 00:27:28,"media wanted this to be true, to prove dreams of male trump thuggery. doing so insulted all new yorkers, for assumi…"
809174625087324161,2016-12-14 23:13:59,Now buzzfeed says allegedly:Woman Arrested For Allegedly Making Up Story Of NY Subway Attack By Trump Supporters
809165442354970624,2016-12-14 22:37:29,: .: Election Was 'Rebellion' Against Political Correctness
809163208955199489,2016-12-14 22:28:37,Another hate crime hoax. Every news organization who ran the Yasmin story without an ounce of skepticism must do an equal length retraction
808834768611770368,2016-12-14 00:43:30,"about to do live tonight. Perhaps you should watch, and predict how much weight I've lost since I replaced food with soil"
808828369194418176,2016-12-14 00:18:05,my monologue on diblasio and counseling for the trump loss:
808753639959490560,2016-12-13 19:21:08,tweet of the week
808752774792052736,2016-12-13 19:17:42,": Likewise Fox News swept Saturday's ratings too, capped by big numbers for and"
808731872352157696,2016-12-13 17:54:38,: The new Conservatarians podcast is up: helps me &amp; choose the best albums of .
808731542885400576,2016-12-13 17:53:19,i did it because of your hair.
808503014441046016,2016-12-13 02:45:14,you're right!
808479184951660548,2016-12-13 01:10:33,my picks for best music of .
808465334063759360,2016-12-13 00:15:30,Gutfeld: Did outsourcing help make America great again?
808401426267459587,2016-12-12 20:01:34,: ICYMI: figured out how to solve the problem of ISIS Click here to see entire segment:
808059552797171712,2016-12-11 21:23:05,Gutfeld: Trump is picking his Cabinet like a teenage boy
808055570381078528,2016-12-11 21:07:15,Walter White as head of the DEA. Haven't seen the skit but how does it not make sense?
808009330062716929,2016-12-11 18:03:31,that's in roughly four hours - giving you plenty of time to make me food.
807797869679902720,2016-12-11 04:03:14,"miss ?you can watch it again in hours at am east coast time. in the meantime, write me a sonnet."
807796146584383488,2016-12-11 03:56:24,": .: top militaries in the world? USA, USA, USA, USA, USA"
807789168382398464,2016-12-11 03:28:40,sounds like that! i would watch the show again at am east coast to be sure
807784861746479105,2016-12-11 03:11:33,"so far show is really good, and I'm not saying it because i'm the host. (okay, it's because I am)"
807780303817342976,2016-12-11 02:53:26,in just minutes a brand new with and a load of stuff that will blow your mind through your ear holes!
807760933170847744,2016-12-11 01:36:28,: Saturday nights are for ! Catch and at pm EST…
807746631999324160,2016-12-11 00:39:38,"tonight we pepper Ambassador Bolton with many questions, some of which he can answer!"
807737774136852480,2016-12-11 00:04:27,"observation: if you don't care that the Russians interfered with our election, you should not be employed in any news organization."
807731625819828224,2016-12-10 23:40:01,"here's an existential victory: today is Santacon, and no one cares."
807730663789133824,2016-12-10 23:36:11,"on that note, I would also like to wish everyone a happy Tricentennial !"
807725330974830592,2016-12-10 23:15:00,its December th.
807654444082958336,2016-12-10 18:33:19,excellent debate style! I wish you continued success!
807632023951130624,2016-12-10 17:04:14,": Here's a sneak peak of tonight's show airing at pm EST on Fox News Channel! Don't be late, we're eecting you... …"
807438895868760064,2016-12-10 04:16:48,so it's okay to instagram a picture of what you're about to eat. but now after you eat it?
807438086464569344,2016-12-10 04:13:35,"when government threatens private enterprise away free market principles, it's lurching to socialism."
807420231849222144,2016-12-10 03:02:39,"i'm not. the tariff is on US products by the government. that's socialism, champ."
807402255007813632,2016-12-10 01:51:13,: Hot show tomorrow night at pm EST!! Don't miss it
807014057853251589,2016-12-09 00:08:39,my monologue on Leo's visit to Trump Tower:
807013858372190209,2016-12-09 00:07:52,Read this - then read their self description. Classic.
806646959784202241,2016-12-07 23:49:56,": .: ""[] did something many dreamt of trying: Slaying the beast called Political Correctness."" …"
806596091336683520,2016-12-07 20:27:48,": 's thoughts on Defense Secretary nominee, General James “Mad Dog” Mattis. Watch the full monologue here: h…"
806503132972756992,2016-12-07 14:18:25,why are you punishing America?
806311481692327936,2016-12-07 01:36:52,"another hour profound interview, this time with u don't need drugs for this one."
806193959492059144,2016-12-06 17:49:52,: Congrats Top Cable News Show -49 Demo-SAT &amp; M total viewers …
805935519754551296,2016-12-06 00:42:56,is it true that the most effective target of nigerian prince emails are gullible tweeters?
805924035460796416,2016-12-05 23:57:18,are those pushing actually sexual deviants using that lie as a false flag to keep police from focusing on their crimes? Hmmm...
805921120532791296,2016-12-05 23:45:43,My monologue on Castro's pathetic hearse:
805877458167853062,2016-12-05 20:52:13,: Should the govt allow a company to use more advanced technology without retribution or consequence? Slap a % tax on any…
805771914748841988,2016-12-05 13:52:49,Obama blocks pipeline. I hate it when government interferes with business...until..eh...nevermind
805768643313274880,2016-12-05 13:39:49,"daily, one would tweet me about that pizza nonsense, ""are u too afraid to cover this story?"" No, just not a moron who fall for this shit."
805764086923411458,2016-12-05 13:21:43,"in the good old days, we mocked conspiracy thinking. now we retweet it."
805579454428938240,2016-12-05 01:08:03,"i also predicted that it would be sunny, warmer, no winds, too."
805268776694456320,2016-12-04 04:33:32,"or perhaps we are the same person, cleverly employing quantum mechanics to our advantage."
805242603105120260,2016-12-04 02:49:31,why would i want to be foot five?
805241435402412032,2016-12-04 02:44:53,"in minutes begins, as does your new life as an all around neat person!"
805230526655295488,2016-12-04 02:01:32,": If u support 'consequences' for US firms moving production overseas, do u support 'consequences' for foreign travel? http…"
805172659810091012,2016-12-03 22:11:36,"or at least, a height crime"
805138121385971713,2016-12-03 19:54:21,How many Trump supporters does it take to screw in a lightbulb? Whatever it is HRC supporters will demand a recount.
805118243048407040,2016-12-03 18:35:22,"this qualifies as a hate crime, FYI"
805099034406952960,2016-12-03 17:19:02,why do i keep rereading this story. even when I just read it before???
805089142895943684,2016-12-03 16:39:44,: . Show - Saturday /3 w/
804873170540961792,2016-12-03 02:21:32,It's one of the greatest stories ever told (including that one)
804863495460323329,2016-12-03 01:43:05,: New show tomorrow night at pm EST on !! Don't miss and …
804474271309463552,2016-12-01 23:56:27,: . Rips NY Times Over Piece That Asks: 'Can TV Be Fair to Muslims?' https:/…
804419368532615168,2016-12-01 20:18:17,"if you only read one piece about President Obama slamming FNC, make it this one:"
804178981599805440,2016-12-01 04:23:04,"Agreements to temporarily save jobs won't stop the robots. Technology is responsible for most job loss, and will only get worse."
804176111831842816,2016-12-01 04:11:40,: Team Trump dishes out generous corporate welfare to Carrier using taayer money before they even take office
804118625678491648,2016-12-01 00:23:14,: WATCH: Blasts Obama for Blaming Fox News for Democrats' Defeat
804094233833590794,2016-11-30 22:46:19,no
804086089258594304,2016-11-30 22:13:57,": .: ""True, the country's divided, but it's not right and left. It's left and not-left."""
804029032773910531,2016-11-30 18:27:14,watching get high with &amp; chat for hours is way more awesome than it initially sounds
803802329183043586,2016-11-30 03:26:23,i liked him more when he had the beard
803787581792129024,2016-11-30 02:27:47,: .: Another knee-jerk response from the left over guns |
803776859737653248,2016-11-30 01:45:11,"i believe i'm on now, or later"
803776518698758144,2016-11-30 01:43:50,i called that too!
803773771106709505,2016-11-30 01:32:55,the guardian is officially the opposite of a guardian.
803772828302581760,2016-11-30 01:29:10,called it!
803407494303387648,2016-11-29 01:17:27,"speaking of ""fake"" news. i call BS on this ""anonymous"" piece."
803389309160222724,2016-11-29 00:05:12,"Gutfeld: Finally, we can say something nice about Castro"
803379079848349696,2016-11-28 23:24:33,: Huge congrats to for officially becoming a contributor to the .
803376557326761984,2016-11-28 23:14:31,": Love this. on Ohio State today: ""a car &amp; a knife were used to harm innocent people. A gun was used to prot…"
803376277512134656,2016-11-28 23:13:25,: ICYMI 's rant on the Castro worshippers in America
803223296519139328,2016-11-28 13:05:31,That's not me. That's
803021706046488576,2016-11-27 23:44:28,"Lets be honest: should be leading a boy band, not a country. And i'm talking about a lesser boy band, like O-town."
803018628043927553,2016-11-27 23:32:14,"the worst thing you could be in Cuba, is a Cuban. the best thing to be is a American, naive celebrity tourist."
803013662826864640,2016-11-27 23:12:31,"castro sent gays to camps, executed citizens, yet this fellow traveler pushes propagandist debunked BS to protect a…"
802961155329097729,2016-11-27 19:43:52,let me guess: were these evil old white men twirling pencil thin mustaches? (you have the subtlety of a Herblock ca…
802703746526392320,2016-11-27 02:41:01,: If you know anyone enamored with Fidel Castro you might remind them of his record as one of the worst dictators. https:…
802699520274374656,2016-11-27 02:24:13,": While you're at it, you should ask for a recount of the last Cuban election. % for the incumbent seems a bit fishy https…"
802663324034793472,2016-11-27 00:00:23,What we've learned is you can never judge a country by its horrid leader. But enough about Trudeau - so I hear Castro croaked.
802653875316486144,2016-11-26 23:22:51,its a strain
802642631079493632,2016-11-26 22:38:10,Remember that Fidel was an excellent ball player before he executed people so there's that.
802642412719833088,2016-11-26 22:37:18,well played my mustachioed maestro!
802642282339913728,2016-11-26 22:36:47,"When u begin a sentence with awful stuff about a tyrant then add a ""but"" consider the victims where such insight has no relevance"
802640451199086592,2016-11-26 22:29:30,"U can see the ""but"" coming miles away."
802637121727041536,2016-11-26 22:16:16,only a communist could turn an island paradise into misery mountain
802633854762635264,2016-11-26 22:03:17,"And no, he is not ""larger than life."" he died."
802627450572156929,2016-11-26 21:37:50,"finally, something positive about Fidel Castro."
802624203635556352,2016-11-26 21:24:56,"another excellent, new, topical show tonight!"
802334123977097216,2016-11-26 02:12:16,: New show this Saturday at pm ET w/ !
801922701342306304,2016-11-24 22:57:25,: I'm thanking/kinda sorta blaming for out discussion topic at the table today. I hope you're having a great…
801921819884167169,2016-11-24 22:53:55,i love dumb people.
801519611233435648,2016-11-23 20:15:41,yes. And he just took it
801511767998275584,2016-11-23 19:44:31,Wonder where he got that Jenner joke.
801505150049234944,2016-11-23 19:18:13,"Also stop weaponizing the word ""weaponizing"". Just say ""using""."
801504881596997632,2016-11-23 19:17:09,"Dear media, please stop normalizing the word ""normalizing""."
801495831236874240,2016-11-23 18:41:11,What's this
801389208397107200,2016-11-23 11:37:31,"No more climate hoax. No more water boarding. No more ""lock her up"". Holy cuck."
801204573494976512,2016-11-22 23:23:50,Gutfeld: How the '60s spoiled this year's Thanksgiving | Fox News Video
801150489664557056,2016-11-22 19:48:56,: Congrats ! show in cable news Sat -49 &amp; -54 …
800839418105987073,2016-11-21 23:12:50,: .: 'Hamilton' stars violate terms of service |
800830351878852608,2016-11-21 22:36:49,I went to cal with him u dope
800542702068793344,2016-11-21 03:33:48,that movie causes cancer. look it up.
800541995726798848,2016-11-21 03:30:59,"People who keep telling people that ""they should look in the mirror,"" should look in the mirror!"
800536854013612032,2016-11-21 03:10:33,They need to combine with - not sure how. but i'll leave that to your collective imaginations.
800535640412540928,2016-11-21 03:05:44,Hey u made fun of a woman's eastern european accent! hysterical! so - Africans and Mexicans tomorrow?
800533950577963009,2016-11-21 02:59:01,"lets be clear: the is the worst kegger at a teenagers house, and the sensible among them, hopes it ends like Carrie."
800487616474820608,2016-11-20 23:54:54,: boring. that's a week-old clip.
800481848635879424,2016-11-20 23:31:59,"Amazed how easy they were to come by. It wasn't like the writer was looking for them, right!?"
800481559539236864,2016-11-20 23:30:50,It's amazing how these anecdotes just unfolded before the writer. What luck!
800478290402275333,2016-11-20 23:17:51,"so this story is just ""too"" perfect. my compliments"
800476740292198401,2016-11-20 23:11:41,i was just told that by a kind man at the local kiosk as he handed me a post with his fingerless glove!
800476081983627264,2016-11-20 23:09:04,"is it me, or does this sound slightly contrived? who sits in the front seat of Uber and starts discussing politics?"
800475814844305409,2016-11-20 23:08:01,it feels that way to me.
800475588658130948,2016-11-20 23:07:07,"go do something constructive, please."
800475509410955264,2016-11-20 23:06:48,and would you want someone to sit in the front seat?
800475331551436800,2016-11-20 23:06:05,hmm...hmm...i don't buy it!
800474847814029312,2016-11-20 23:04:10,"and she made sure to tell us that she sat in the ""front seat."" because she'd never treat ""my"" uber driver like a chauffeur."
800473757982801920,2016-11-20 22:59:50,the first paragraphs smells funny.
800459571408105472,2016-11-20 22:03:28,my monologue on trump hysteria and hoaxes:
800374227526447104,2016-11-20 16:24:20,It could be he's using trump as an excuse!
800184928574898177,2016-11-20 03:52:08,"thank god i have over k followers, then. now please return to your fruitless masturbation."
800176411973746688,2016-11-20 03:18:17,"its roughly . and no, we don't need fat smelly dudes."
800163779153690624,2016-11-20 02:28:05,roughly minutes until graces your television and makes your eyeballs elode with delight.
800155376863813632,2016-11-20 01:54:42,What are you going to do? Sue...lu
800154760385089536,2016-11-20 01:52:15,One hour from now. So put on the shorty robe and order the clams
800135090756079616,2016-11-20 00:34:06,thanks!
800134982694039552,2016-11-20 00:33:40,king for a day
800130798909325312,2016-11-20 00:17:02,thank you for spelling out the joke.
800121969547026433,2016-11-19 23:41:57,"if gets the treasury sec job, i would like to suggest the first headline be ""Bolling for Dollars"" (you can thank me later)"
800078444096679936,2016-11-19 20:49:00,"""We Are Closed"" is a bad name for a band"
800064038550077440,2016-11-19 19:51:45,: You don't single out an audience member and embarrass him from the stage. A terrible precedent to set.
799828728100556800,2016-11-19 04:16:43,yes
