id,created_at,text
836038466085453825,2017-02-27 02:21:17,sometimes i wish the snowpiercer train would run through the oscars telecast
836038109372510208,2017-02-27 02:19:52,"yes, i eect nothing less!"
836037821743906816,2017-02-27 02:18:44,"try to figure out how police brutality played a role in the death of people murdered by OJ Simpson, and I will buy you a sandwich"
836036194567917568,2017-02-27 02:12:16,he really does think our thoughts.
836035341316415489,2017-02-27 02:08:52,"made fun of those too, of course."
836034775664193537,2017-02-27 02:06:37,"if you're gunna make that joke, why use it on the person who's already made it, a number of times?"
836034194203635712,2017-02-27 02:04:19,tone of commercials and telecast are interchangeable. I don't know where I am.
836032810515316736,2017-02-27 01:58:49,: Don’t miss my interview with in tomorrow’s . Sign up at .
836030177356439552,2017-02-27 01:48:21,LyIN dev patel
836026821825159168,2017-02-27 01:35:01,otherwise known as four minutes of audience discomfort.
836026487035817984,2017-02-27 01:33:41,i like watching people dance while they stand in place. reminds me of having to go pee.
836026172173606913,2017-02-27 01:32:26,if i boycotted every product that jon hamm shamelessly hawks i'd be buying nothing but top ramen and depends.
836023887385214976,2017-02-27 01:23:21,": Did Michael Strahan just call Matt Damon ""Ben""?"
836019656603414528,2017-02-27 01:06:33,thought the La La Land movie was insulting. Stuttering is no laughing matter.
836018643121147908,2017-02-27 01:02:31,so nice for Nicole to bring her teenage son!
836015029510078464,2017-02-27 00:48:10,Judge Wapner dead. Trusty bailiff Rusty Burrell died years ago. together again in the People's Court in the sky.
835995259851194369,2017-02-26 23:29:36,ironic that I don't give a poop!
835983990846795776,2017-02-26 22:44:49,I was there first!!
835706555278442498,2017-02-26 04:22:24,nice opening rap
835703569533788160,2017-02-26 04:10:32,Email gregtix.com for info!
835703477095575555,2017-02-26 04:10:10,Email gregtix.com for info!
835701142646624257,2017-02-26 04:00:53,okay gutnuts - show returns in hours - gives you more than enough time to buy beer and restraints.
835700459407036416,2017-02-26 03:58:10,
835699398961135616,2017-02-26 03:53:57,many skeletons (literally - i collect them)
835698550705094657,2017-02-26 03:50:35,how dare you. Slater is no Swanson!!
835696274179567616,2017-02-26 03:41:32,its the eyeliner.
835694997005565952,2017-02-26 03:36:28,"that's the goal, apparently."
835694732932222976,2017-02-26 03:35:25,:
835694070920015873,2017-02-26 03:32:47,i have a feeling this is one of these recursive infinity machines
835693722138468353,2017-02-26 03:31:24,he really nails it!!!
835691619873669121,2017-02-26 03:23:03,: . just spelled out a bad word! Bless her
835691423278252032,2017-02-26 03:22:16,yeah - the Original Vampire Slayer!!
835690868459859970,2017-02-26 03:20:04,": .: wonder if Ben Carson's party invites say, ""conjoin us!"" Well done, sir..."
835689867409522693,2017-02-26 03:16:05,uh yes. that's what we do
835689443684192256,2017-02-26 03:14:24,its the eyeliner isn't it?????
835689330274357248,2017-02-26 03:13:57,they forced it on me. said no one would notice. i told them no. I feel horrible now.
835688719453679616,2017-02-26 03:11:31,uh. no
835688289571078144,2017-02-26 03:09:49,or an insane Glen Campbell
835687979301679104,2017-02-26 03:08:35,: I've heard of - is he brave enough to retweet this bear priest?
835687647389548544,2017-02-26 03:07:16,that's like saying you like me but hate my parents. ️
835687393516630016,2017-02-26 03:06:15,you got me jon!
835687104420188160,2017-02-26 03:05:06,: !
835687075051622400,2017-02-26 03:04:59,: Time for !
835686992792932353,2017-02-26 03:04:40,no you don't. no one does.
835684625611640832,2017-02-26 02:55:15,"in minutes, will you find the secret to life? No, but you will watch - which is far superior to such spoilers."
835679707060387840,2017-02-26 02:35:42,: Poetic. I'll be sure to watch!
835676786029654016,2017-02-26 02:24:06,roughly minutes til the very best hour of tv which will blow your mind the way guest did to UBL.
835673551118221312,2017-02-26 02:11:15,"Matthew :17 ""Do you not understand that everything that goes into the mouth passes into the stomach, and is eliminated?"" (sadly, yes)"
835669062164316160,2017-02-26 01:53:25,"uh, AP, bite me:"
835667594170482688,2017-02-26 01:47:35,read Monica Lewinsky's diary entries after her life was ruined.
835658466073137152,2017-02-26 01:11:18,"I hate myself for what I ate. (this is something at least half of you also feel, right now)."
835655043982503937,2017-02-26 00:57:42,this IS a fantastic opening - the H.Reporter only chooses to highlight the jokes they deem interesting.
835651151144095745,2017-02-26 00:42:14,without consulting any eerts i'm going to go ahead and say that Keanu Reeves is the Chuck Heston of our generation.
835619662595571712,2017-02-25 22:37:07,"you can hate everyone, equally."
835618940495802370,2017-02-25 22:34:15,next time you complain about your life lacking a certain surprise. be grateful. jesus.
835617899008118787,2017-02-25 22:30:06,"if there's a slogan for the Trump WH, it's ""more balls than any so-called radical."""
835613713990356992,2017-02-25 22:13:29,proof
835613321684529152,2017-02-25 22:11:55,"WHCD is for scholarships. but if u asked most attendees, they couldn't tell you which or why. they just want selfies with Will Smith"
835612089469239297,2017-02-25 22:07:01,"rent that tux. tell your jokes. somewhere in America, Trump's gunna do a veteran's benefit and make you look even more irrelevant. 🤣"
835611544637562880,2017-02-25 22:04:51,"Prez just deflated the WHCD tantrum. who's gunna carry that horrible event, if he isn't there? U can have it."
835610874652012547,2017-02-25 22:02:12,"so smart. now, hold a competing event. just for the helluva it."
835592688112185347,2017-02-25 20:49:56,hey you're getting dangerously close to a perm.
835592005111660545,2017-02-25 20:47:13,"maybe he can provide debate questions to you, for a change."
835591401354235906,2017-02-25 20:44:49,"NYT couches the BS's crimes: ""what prosecutors said was a campaign of urban terror"" ""They said it included the …"
835589939991625732,2017-02-25 20:39:00,Perez is going to burst a vessel
835570200271540224,2017-02-25 19:20:34,That's like punishing us by canceling Girls
835568944790536194,2017-02-25 19:15:35,Omg they can't have their fun party! No pictures with actual famous people from mediocre sitcoms!
835542766511869952,2017-02-25 17:31:33,pm tonight people (east coast)
835542167699488769,2017-02-25 17:29:11,: Venn Diagram of the Day VII
835337367242309632,2017-02-25 03:55:22,he's right. I am quite hygienic!
835306209511104512,2017-02-25 01:51:34,
835303657553932288,2017-02-25 01:41:25,: is new tomorrow night at pm ET w/ and !!
835204246706479110,2017-02-24 19:06:24,: Sign up for at to be the first to get my interview with on Monday!
835156729897893890,2017-02-24 15:57:35,": Alan Colmes died yesterday. This is how the losers at respond. Pathetic. RIP, Mr. Colmes"
834945008356757505,2017-02-24 01:56:17,yet you follow me. what's that say about you?
834934501310615558,2017-02-24 01:14:32,"acc to this, economic inequality occurs when u end disease, starvation &amp; war. So to stop inequality? increase all!"
834933540873777152,2017-02-24 01:10:43,you see how nice it is when a little silence breaks in between applause.
834932521875955712,2017-02-24 01:06:40,nothing more tedious than a speech to the choir. not Pence's fault. but you don't have to applaud every line. jeez
834930665133080576,2017-02-24 00:59:17,: ALAN COLMES -2017: Shep says goodbye to “one of the good guys” in both life and TV
834930509058801668,2017-02-24 00:58:40,: I'm hosting LIVE .. is going to call in and talk to us about his good friend and colleague Al…
834920261958905858,2017-02-24 00:17:57,My mono on media treatment of protests
834919942743068672,2017-02-24 00:16:41,: Our friend has passed. Alan’s kindness and sense of humor will be missed. Here he is on our first show as…
834871325151916032,2017-02-23 21:03:29,": Can't be repeated enough: if you're worried about America's economic interest, focus more on automation/education than trade…"
834555929207177218,2017-02-23 00:10:13,Gutfeld: 'Sanctuary cities' cloak evil consequences | Fox News Video
834495226400096256,2017-02-22 20:09:00,: We're all Trumpatized now (via )
834427656624013314,2017-02-22 15:40:30,my latest piece on how to live in Trump's America.
834247152540975104,2017-02-22 03:43:15,"the absolute best thing since Fernwood Tonight. Fake hosts, real guests. with brilliant watch it all:"
834229620480294917,2017-02-22 02:33:35,"the lady just on is now in a green room taking deep breaths and reading tweets that tell her, ""you showed him."" they're lying"
834222986207096832,2017-02-22 02:07:13,"oh Susan, it didn't work out. you need to move on."
834217918988697601,2017-02-22 01:47:05,"on in mere minutes. I make no sense, as usual"
834178677298589696,2017-02-21 23:11:09,my mono on the Whittier police shooting.
833908420013068288,2017-02-21 05:17:15,": . - Happy Birthday, with love, from your fans!"
833883117710692352,2017-02-21 03:36:42,
833879940651241473,2017-02-21 03:24:05,: our speaks national security issues. 's Batchelor show speaks his personal issues. https…
833870699152416772,2017-02-21 02:47:21,vanessa's dad is a bad ass.
833868264337965057,2017-02-21 02:37:41,i love that Vanessa's family keeps asking about Nicks future employment. as if he has even thought about that.
833867764142051329,2017-02-21 02:35:42,"vanessa's family doesn't buy Nick. HA. let him go to Corinne, the wannabe model. (i'm turning into something bad)"
833867131947192322,2017-02-21 02:33:11,"if he doesn't choose this canadian chick, with her smart, caring family - then nick is a loser."
833866004639993856,2017-02-21 02:28:42,Vanessa works with the mentally disabled. this is a hard decision?
833865057335439361,2017-02-21 02:24:56,Vanessa is the opposite of the blonde with extensions.
833861556756701188,2017-02-21 02:11:02,they're like shoulder mullets
833860966576189440,2017-02-21 02:08:41,i don't think that's her real hair. or at least the bottom half
833860601436860416,2017-02-21 02:07:14,that's what the wine is for.
833860485153959936,2017-02-21 02:06:46,if it weren't for sulfur we wouldn't know who just ate hard boiled eggs.
833859921577914370,2017-02-21 02:04:32,you spelled annoying wrong. (this tweet is brought to you by the year )
833859747686277121,2017-02-21 02:03:50,my secret to winning over parents is smelling like cocoa butter
833858845260787712,2017-02-21 02:00:15,"physical connection has been undeniable, says about Corrine. that's all he's said about her for a month."
833858683062792192,2017-02-21 01:59:37,key to never being grilled by parents. (date adult orphans)
833857951676952577,2017-02-21 01:56:42,"i agree, unless it's mine. I spent a lot of time making ""art"" films."
833856481304903681,2017-02-21 01:50:52,"wondering - if this were a black dude meeting a white girls fam, &amp; mom pulled this (so, you date white girls?)"
833853579475685380,2017-02-21 01:39:20,my hometown date would be when my date meets my current wife and kids.
833852984379449345,2017-02-21 01:36:58,or buy a president on Car day!
833847217291132928,2017-02-21 01:14:03,nick doesn't need to wear a helmet
833844248990666753,2017-02-21 01:02:15,chocolate covered almonds. bottle of pinot noir. The Bachelor. Thank God NONE of these play a role in my life.
833839573910355968,2017-02-21 00:43:41,i just ate a pile of boneless spareribs. (this is knowledge for anyone missing a pig)
833839069746561024,2017-02-21 00:41:40,"""Random House kept lena dunham's book after reading her draft of what she did to her sister,"" says a person with a long memory, at a bar."
833833451249819648,2017-02-21 00:19:21,i know i'm screwed when I agree with
833832525915103233,2017-02-21 00:15:40,: Please keep the men and women of the Whittier Police Department in your thoughts and prayers as they deal with this difficu…
833830623429193729,2017-02-21 00:08:07,"hilarious, but while we're posing questions for self-serving attention - is your dad still sodomizing interns and l…"
833562868649963520,2017-02-20 06:24:09,": With new dating apps like Trump Singles and Maple Match, wanted to get in on the action with some ideas o…"
833562546003132416,2017-02-20 06:22:52,call the police to report your suspicions!
833561662665932800,2017-02-20 06:19:21,why are you covering up your own involvement under a fake name?
833560212757950464,2017-02-20 06:13:36,"the ""tiki barber running a barber shop"" commercial makes every sad inside and it should go away."
833559879973556224,2017-02-20 06:12:16,"have you contacted the police over this? if not, and you know something, then you're complicit."
833557097639972866,2017-02-20 06:01:13,have you called the police about this? why haven't you?
833555683798827009,2017-02-20 05:55:36,"for fun, read the last sentences of this article without projectile vomiting all over your pets."
833549650254823424,2017-02-20 05:31:37,this is extremely useful and entertaining (like a candle made of pizza)
833546849395027969,2017-02-20 05:20:30,: Landmark Vaping Study Finds E-Cigs ‘Substantially Improve’ Health
833501450063978497,2017-02-20 02:20:06,: Sorry 's got you beat
833432569047822337,2017-02-19 21:46:23,min to and it's the best thing since the thing you did last summer with that drifter u met in a park.
833422693399724035,2017-02-19 21:07:09,I will not tell you where I am but it rhymes with awesome
833418622307557377,2017-02-19 20:50:58,In a little over an hour will return and it will blow your mind. Or possibly just your nose.
833387867682516994,2017-02-19 18:48:45,it could be why i stopped growing at years old
833362435163693057,2017-02-19 17:07:42,: Recaps Highlights from 's FL Campaign Rally
833356711964659712,2017-02-19 16:44:57,thanks pal! My sister had the scratch and sniff album when I was a kid. For some reason that has stay r with me
833353343242268673,2017-02-19 16:31:34,i.e.
833352670278717440,2017-02-19 16:28:54,its a good morning when the lead singer from the Raspberries starts following you. no longer . .
833351018721185792,2017-02-19 16:22:20,short and sweet and smart:
833338150604926982,2017-02-19 15:31:12,: Your father sent men with guns into a private home to kidnap a legal resident and deport him to a Communist dictatorship. http…
833202416069836800,2017-02-19 06:31:50,": Hope you all enjoyed tonight's episode of the show!! If you missed it, you can catch re-airs at am ET and Sunday at …"
833196543176011776,2017-02-19 06:08:30,"is repeating now, and that's good for america"
833177019257122817,2017-02-19 04:50:55,: Check out 's monologue from tonight's LIVE show!!
833085479318908933,2017-02-18 22:47:10,"""SHE STOLE THAT FROM THE BIBLE,"" says reporter"
833077534099120128,2017-02-18 22:15:36,"wrote this monologue years ago, about the media - before Obama took office. read it."
833057119872114688,2017-02-18 20:54:29,i became of libertarian because of drugs and Nick's jacket.
833046561135480833,2017-02-18 20:12:32,this is the best compliment i have received in my life
833044466122551296,2017-02-18 20:04:12,"doing live tonight - rebooked the audience, worked very hard. bummer when a guest cancels last minute just because. SAD!"
833038032680919040,2017-02-18 19:38:38,i will be addressing this tonight on live. pm!
833026673008377857,2017-02-18 18:53:30,"""blocked"" (the third one pushed me over the edge)"
832729851899449344,2017-02-17 23:14:02,
832717563461193731,2017-02-17 22:25:12,"That was me, sexy!"
832697586205093888,2017-02-17 21:05:49,how come this is not all over the place. or did i miss it?
832658522064056320,2017-02-17 18:30:36,heartbreaking
832418220611137536,2017-02-17 02:35:44,"i have my go-bag packed, but i do have dietary restrictions, so as long as the cafeteria has gluten-free muffins i am in"
832416587437182976,2017-02-17 02:29:14,yes. am i in?
832411328430108674,2017-02-17 02:08:20,just to keep you informed: I have not turned down the position of national security advisor.
832378435272056834,2017-02-16 23:57:38,MY monologue on the student suspended for filming a professor
832098655616147456,2017-02-16 05:25:53,why haven't you called the police?
832006210119487489,2017-02-15 23:18:33,"Gutfeld: Under Trump, media lapdogs rediscover their bark | Fox News Video"
832003506106138628,2017-02-15 23:07:48,: Sage advice from a man who knows
831959977233354752,2017-02-15 20:14:50,protectionism is but a paltry band-aid against the coming reality
831869862670692354,2017-02-15 14:16:45,Robot judges solve this
831694437503873025,2017-02-15 02:39:40,prove it. (sound of me blocking you)
831694126974394368,2017-02-15 02:38:26,"that was not pretty (yes, referring to last tucker segment)"
831688265510051844,2017-02-15 02:15:09,"nah. if you can't back up your claims, troll, you be gone!"
831687734939025411,2017-02-15 02:13:02,"couldn't do it, could ya? 🤣🤣🤣 cowardly troll!"
831685835359666177,2017-02-15 02:05:29,"cite it, anonymous troll"
831684503118688257,2017-02-15 02:00:12,: You are % right. It's killing to play as her …
831684047541850112,2017-02-15 01:58:23,that's all ya got? how's it feel to be emasculated on twitter?
831683436763021313,2017-02-15 01:55:57,"never did, dumbshit"
831683152749920256,2017-02-15 01:54:50,go dunk your head in a bucket of gruel and get back to me.
831678249872814080,2017-02-15 01:35:21,liking this puts you on a list.
831675903793061888,2017-02-15 01:26:01,"on in a few minutes. I discuss stuff that frankly, won't blow your mind. In fact, it might unblow your mind. sorry in advance"
831669191791017985,2017-02-15 00:59:21,it's always the kid.
831662182257590272,2017-02-15 00:31:30,"says EODM's hughes is wrong on gun control, times. never says why. But a decent review."
831657667986935809,2017-02-15 00:13:34,"watching journos congratulate themselves over hardcore reporting, after years of hiding under their beds."
831649077913858048,2017-02-14 23:39:26,Gutfeld: where was Jerry Brown? | Fox News Video
831623043629867009,2017-02-14 21:55:59,: Valentine's Day Cards
831575305148104709,2017-02-14 18:46:17,"what, no cuckoo for caca?"
831572412340793344,2017-02-14 18:34:47,spicer really likes quoting
831361546035011584,2017-02-14 04:36:53,first PewDiePie and now this.
831360842776064000,2017-02-14 04:34:05,what does don draper do after april th. hope he's still in touch with his kids
831359895362498560,2017-02-14 04:30:19,"so, it's a GOOD sign!"
831356745243041792,2017-02-14 04:17:48,Flynn violated law from . i imagine you wouldn't have to go back that far 9999 percent of DC
831355771069792256,2017-02-14 04:13:56,"observation: when flint water crisis hit, everyone wanted Repub governor gone. anyone calling for Jerry Brown to go?"
831355170541953025,2017-02-14 04:11:33,"""wonder if this will stall the investigation into pizza gate,"" says my cousin Seth who eats his own hair."
831352194196705281,2017-02-14 03:59:43,how about stop reading twitter?
831349915502645249,2017-02-14 03:50:40,"dam crisis occurs under MIA jerry brown, but still manage to pin on trump! amazing!"
831336895615553541,2017-02-14 02:58:56,I hope that one day nick gets successful enough to own a business that I can boycott in response to his awful decisions.
831325507673260032,2017-02-14 02:13:40,"honest mistake, of course!!!"
831292194296324096,2017-02-14 00:01:18,"TV anchors are either telling you ""there's a lot to unpack,"" before telling you ""we'll have to leave it right there."""
831279501669756932,2017-02-13 23:10:52,Cuz You asked. Today's mono : Media double standard over immigration raids | Fox News Video.
830993020757667841,2017-02-13 04:12:29,lot of stuff going on
830966889652350976,2017-02-13 02:28:39,i am resisting katy perry's music
830963723636453376,2017-02-13 02:16:04,"how can you not know the lyrics to this, Mr. Legend."
830961478433914880,2017-02-13 02:07:09,no tariff threat is going to stop this.
830959559988613125,2017-02-13 01:59:32,"cool it, she's performing for"
830959001504509954,2017-02-13 01:57:19,"crap, did someone spike my vitamin water"
830950307169443841,2017-02-13 01:22:46,of Grammy political gestures before first commercial break: . on pace to have by end of evening.
830948793176752129,2017-02-13 01:16:45,"Yeah, Paris - those pipeline protests could really use you and your amazing talents. (that was Paris, right?)"
830948461465964546,2017-02-13 01:15:26,Chance the Rapper just mentioned God more times in his speech than the all the previous award shows combined.
830877883065327620,2017-02-12 20:34:58,to learn more about Victima: and return to at pm!
830828688690249729,2017-02-12 17:19:30,: Thanks to for calling out the comedians who lost their cojones during the Obama years.
830828114225819649,2017-02-12 17:17:13,: Sundays are for brunch and encores! Catch to…
830629969051140096,2017-02-12 04:09:51,": now sponsored by, Victima: When identity politics is dead, we breathe new life into your dying party https://…"
830628673954971648,2017-02-12 04:04:42,Best damn thing on tv this week
830620745499869186,2017-02-12 03:33:12,Great point
830619339564924928,2017-02-12 03:27:37,Why
830617814465728512,2017-02-12 03:21:33,thanks pal! That means a lot
830614643580219392,2017-02-12 03:08:57,": ""Screw 'em!"" -"
830608341596508163,2017-02-12 02:43:55,If you keep stuff in jars in the closet you're weird. But put it on a shelf and it's cool restaurant.
830583253291638785,2017-02-12 01:04:13,in less than hours you will be graced with a brand new which will change forever how you eat bran.
830572948809535488,2017-02-12 00:23:16,you think i'm crazy for appeasing our robot overlords ahead of time.
830569983914688512,2017-02-12 00:11:30,"this is a story worth pursuing, no?"
830513431858053121,2017-02-11 20:26:47,what? did no one watch Black Mirror???
830508373221183488,2017-02-11 20:06:40,i look smashing in a cape.
830503793791995904,2017-02-11 19:48:29,typical leftist!
830502393062313984,2017-02-11 19:42:55,"oh Doris, get off twitter."
830502237994700800,2017-02-11 19:42:18,preview of tonight with
830465845000286209,2017-02-11 17:17:41,"""thank you Mr. Assad. Up next, we interview an oil spill on the increase of ducks covered in oil. You'll be surprised what we find!"""
830464777931595776,2017-02-11 17:13:27,getting Assad's opinion on fleeing refugees is like asking a cigarette for advice on lung cancer.
830457027755384832,2017-02-11 16:42:39,snow storm canceled flights
830455385169477632,2017-02-11 16:36:07,: is new tonight at pm ET !!
830278932842893312,2017-02-11 04:54:58,your stupidity caused me to block you
830233280389771264,2017-02-11 01:53:33,: TGIF! Got weekend plans? Neither do we! Join Sat. at…
830125122812047360,2017-02-10 18:43:46,Absolutely brilliant tweet.
829875790678462464,2017-02-10 02:13:01,"so wait; I received evidence of threat from specific countries, but the courts didn't? how is that possible?"
829869279935864833,2017-02-10 01:47:09,i did.
829868788476682241,2017-02-10 01:45:12,"yes because the satirists held their fire for cowardly years, morons."
829860450854543360,2017-02-10 01:12:04,"Untuckit shirts should be called, ""i'm - age and waist."""
829860140853624832,2017-02-10 01:10:50,a real tough grilling Erin.
829859824947040256,2017-02-10 01:09:34,"you flatter him with ""writer"""
829859725009358848,2017-02-10 01:09:11,i can't wait to go to (insert any country not America) and exercise my due process rights!
829858279396352000,2017-02-10 01:03:26,imagine if Sen Mccain was doing this to Prez Obama in . anyone remember Obama's amazing first month?
829857158464434177,2017-02-10 00:58:59,Media replaying this like it's the moon landing. comically horrendous.
829856690241728512,2017-02-10 00:57:07,washington state flacks congratulating selves on their bravery. the media cheers. sycophancy from both sides is vomit-inducing.
829853374568886273,2017-02-10 00:43:57,judge ruling ignores security; indulges media/academia/enternainment troika. theylll be played by damon and affleck in miniseries.
829852507543392256,2017-02-10 00:40:30,"look - if u know media will drown you with adulation if u come against trump, why wouldn't the court? it's shallow &amp; dishonest, but i get it"
829851938237845504,2017-02-10 00:38:14,my sense: the court chose their emotional need for popularity over your real security. Ban = mean; rejecting ban = cool.
829851336481050624,2017-02-10 00:35:51,court did this cuz it was emotional high drama rewarded by cloying media.
829849841811480576,2017-02-10 00:29:54,tweeting like this reminds me of standing outside the ball park with a transistor radio cuz you don't have a ticket.
829823656507371523,2017-02-09 22:45:51,Gutfeld: Look who supports a ban on Muslim migration | Fox News Video
829794045090267136,2017-02-09 20:48:11,: A rather ominous warning
829709421089550336,2017-02-09 15:11:55,": Destroying the pristine environment to ""save"" the pristine environment????"
829704219359846400,2017-02-09 14:51:15,It's another gutfeld!
829541742479282177,2017-02-09 04:05:38,love it when music writers suffer emotional pain when a genius won't match their pedestrian assumptions.
829467720722833412,2017-02-08 23:11:30,Gutfeld: Democrats still cling to identity-driven politics | Fox News Video
829466772927553536,2017-02-08 23:07:44,read Christina hoff Sommers
829386832710422531,2017-02-08 17:50:04,acts like this often go unnoticed
829346755749769216,2017-02-08 15:10:49,because now these brave souls can speak truth to power without upsetting their peers.
