id,created_at,text
870032098349940736,2017-05-31 21:39:51,"This time, even the winner is eager to relitigate the election."
870031438351126531,2017-05-31 21:37:13,It's normal for partisans to want to wallow in relitigation of a close election. But usually the candidates help the electorate move on.
870029772025470978,2017-05-31 21:30:36,You didn't answer my question.
870028191225831426,2017-05-31 21:24:19,"Not everything you don't like hearing about your side is a ""false equivalence."""
870027872135720962,2017-05-31 21:23:03,Why shouldn't people have a similar concern about the bank speech fees?
870027781769441280,2017-05-31 21:22:42,Why were ppl bothered by the RT payment? Because ppl thought the payment (and hope of future ones) wo…
870026423993597953,2017-05-31 21:17:18,Surely you understand my point doesn't rest on them being the same. Must I lay it out pedantically fo…
870026084309454848,2017-05-31 21:15:57,"Yeah this is a garbling of the story. Affiliate had no footage to send, but also chose not to air Jacobs' own foota…"
870022201021476865,2017-05-31 21:00:31,: What's more helpful for Democrats right now: - Hillary consuming news cycles &amp; relitigating the past - Hillary not being o…
870007308209750016,2017-05-31 20:01:20,"I think Jimmy Carter provides an excellent model -- write a memoir, do good works, don't sit on corporat…"
870006611632431104,2017-05-31 19:58:34,The idea that conflicts of interest on your side don't matter because your pols have pure hearts is both incorrect and politically foolish.
870006436260175872,2017-05-31 19:57:52,Might you not entertain the idea that past &amp; future payments from banks would lead her to make policies that wouldn't alienate bankers?
870006012614369281,2017-05-31 19:56:11,"Imagine that you, like the median voter, didn't think Hillary was the bees knees. Mightn't you care who made big payments to her?"
870005793684422660,2017-05-31 19:55:19,"You personally may be a partisan and assume your party's pols operate in good faith, but why would you assume other voters assume that?"
870004087806279680,2017-05-31 19:48:33,"Jeb is not on a sabbatical from office, he is very retired from office"
870003817202450434,2017-05-31 19:47:28,"Democrats need not defend officeholding as a path to vast personal enrichment, unless they are a cult of personality for the Clintons."
870003010965057537,2017-05-31 19:44:16,"No matter how often Clintonites say ""everybody does it,"" it will still be true that taking such fees on sabbatical from office is not normal"
870002213057433600,2017-05-31 19:41:06,This is not a good argument. It's not even an argument at all. Why did Mike Flynn go to the RT gala? They paid him.
870001421126574081,2017-05-31 19:37:57,": Hillary Clinton mentions bots following Trump on Twitter, which has been debunked by Twitter"
870000988320432128,2017-05-31 19:36:14,: MTA has not restored service all the way to pre-2010 levels. They could run more trains on some lines. They have not upgraded…
870000948097273859,2017-05-31 19:36:04,": Blaming ""overcrowding"" buys into the MTA's excuse for bad service. The MTA has created conditions that have lead to overcrowd…"
869998236878221312,2017-05-31 19:25:18,"They say Trump is unconcerned Mar-a-Lago may end up below sea level, but he just proclaimed June homeownership mont…"
869997042025869312,2017-05-31 19:20:33,": Worth remembering that Spicer said similar about the ""tapp"" accusation and then the WH did say a lot more about it https:…"
869995628407009283,2017-05-31 19:14:56,"A large group of people know what he meant. It was a complaint about media coverage, and a note that he's awesome a…"
869995191058538497,2017-05-31 19:13:11,: Lol. Good luck with that.
869984450549035008,2017-05-31 18:30:31,"Under Trump, US wasn't going to provide climate leadership, in or out of Paris. But our exit could catalyze others."
869984140183130112,2017-05-31 18:29:17,Why Trump withdrawing from the Paris Agreement may actually make the agreement more useful:
869982611875221504,2017-05-31 18:23:12,"I mean, she's . I'm sure my college admissions essay was hackneyed, too."
869979720863162368,2017-05-31 18:11:43,"I suspect it has to do with the huge fiscal problems of the state, the city of Chicago, and CPS."
869979226941919232,2017-05-31 18:09:45,I think the main takeaway here is most states do a good job of equalizing education funding.
869978794978889730,2017-05-31 18:08:02,"That looks only at local-source funding. You want this combined state-local chart, quite different."
869975483928256512,2017-05-31 17:54:53,well that's a headline
869962625957974016,2017-05-31 17:03:47,: CNN BREAKING: Comey to testify publicly about Trump confrontations
869962131537616896,2017-05-31 17:01:49,"«Ce n'est pas moi, c'est vous». Emmanuel Macron, the anti-Costanza."
869961461270847488,2017-05-31 16:59:10,": Responding Page claim that Dems won't let him testify,Schiff says pace of interviews won't be dictated by ""preferenc…"
869954289690693632,2017-05-31 16:30:40,: I wrote about a flavor of this argument yesterday:
869950861232963584,2017-05-31 16:17:02,"I mean, who's going to follow Trump out of the deal?"
869950704529674241,2017-05-31 16:16:25,"Since the accord is nonbinding, withdrawal is mainly symbolic. Symbolism matters for pushing action, but Trump may catalyze reaction."
869950239540744192,2017-05-31 16:14:34,"Trump does a lot, globally, to discredit causes he associates himself with. If Trump is against climate action, more people will be for it."
869950107986391041,2017-05-31 16:14:03,"Much in the way that Trump seems to be pushing EU nations closer together. If you can sell emissions cuts as ""what Trump doesn't want"" ..."
869950014839246848,2017-05-31 16:13:41,I wonder if Trump's rejection of the Paris accord makes it easier for other countries to make politically difficult choices to cut emissions
869948452507197440,2017-05-31 16:07:28,They've been selling these at the airport for years. They're delicious.
869948052865527808,2017-05-31 16:05:53,: Coal power falls in US states – a clear sign of why we can reach goals with or without Washington htt…
869943492491063296,2017-05-31 15:47:46,: Latest Tory poll leads: YouGov: pt Survation: pt Kantar: pt FT poll of polls: pt ICM: pt ComRes: pt Panelbas…
869942954407976962,2017-05-31 15:45:37,: Comments? I take it back. Bring Spayd back.
869942233256132608,2017-05-31 15:42:45,: Sean Hannity : Assange needs to be arrested Sean Hannity : Hey Julian come host my show
869938736133541888,2017-05-31 15:28:52,: Donald Trump is now being mocked by a train.
869931464837787649,2017-05-31 14:59:58,": Every time I bring up OTC oral contraception, someone gets outraged thinking no-copay *must* disappear. Physician visits are…"
869931294691655682,2017-05-31 14:59:17,": Context: ferry ridership is less than a single middling bus route like the M5, B25, or Bx10 ht…"
869930458334863360,2017-05-31 14:55:58,"I'm a little worried that sleeping more will make me less irritable, though."
869929803578847232,2017-05-31 14:53:22,"This ""covfefe"" nonsense makes me feel really good about my decision to start going to bed before midnight."
869929477635289089,2017-05-31 14:52:04,: sorry i'm not going to get any work done today too many important pieces to read
869929450884005888,2017-05-31 14:51:58,: time to log off
869928481269968897,2017-05-31 14:48:07,": This was a new issue in '16. In the past, weighting by education barely mattered. Many pollsters caught flat-footed https://…"
869924062872690688,2017-05-31 14:30:33,: We knew that Uber burns a ton of cash to subsidize growth. Now we have a case study that shows just how much
869922435554050048,2017-05-31 14:24:05,": Locally, BDB, who won't streamline street space for transit &amp; is handing out K parking permits, is holding another ferry pr…"
869921960129695744,2017-05-31 14:22:12,Ben he's investing in transit by building a new train from Flushing to LaGuardia
869921815048708096,2017-05-31 14:21:37,": ""We won't invest in transit but watch me drive this old car across a new bridge."" Practice what you preach, buddy. https://…"
869921679648182272,2017-05-31 14:21:05,": To come back from a NATO summit and conclude that America is locked in a zero-sum struggle with Canada, Italy, Greece, et…"
869920221351616513,2017-05-31 14:15:17,": Multiple GOP Hill chiefs say Trump allies have called in past week, wanting recommendations to replace Reince. Brutal way o…"
869919377759625216,2017-05-31 14:11:56,"This gets Switzerland all wrong, for one."
869918498725797889,2017-05-31 14:08:27,
869912496299286529,2017-05-31 13:44:35,"This is a bad example. Trump didn't do what social conservatives wanted on ""religious liberty.""…"
869900521653633024,2017-05-31 12:57:00,: Don't forget: It's just not Sanders/Warren backing Perriello. It's also Obama + Hillary World. And who stars in Perri…
869899836593754112,2017-05-31 12:54:17,"It's true things used to be worse, but I think this aspect of our culture has declined relative to, say,"
869893068736090116,2017-05-31 12:27:24,: New Kaiser Poll Dec - % think repeal will their raise costs NOW - % think repeal will raise their costs htt…
869890309777485826,2017-05-31 12:16:26,": Interesting that Trump's tweeting about Carter Page—a man we've been assured Trump doesn't know—claiming Page ""blows away…"
869885404178239488,2017-05-31 11:56:56,:
869884696267763712,2017-05-31 11:54:07,/10
869883845340004353,2017-05-31 11:50:45,: The guy's name is Lorne Grabher.
869883795444572163,2017-05-31 11:50:33,Like Dr. Assman!
869881785500532737,2017-05-31 11:42:33,: Actual footage of Josh waking up this morning...
869880647338401793,2017-05-31 11:38:02,"It's a typo of ""coverage."" You guys spent all night on this?"
869760731499175936,2017-05-31 03:41:32,"There should be some interesting questions about Mike Flynn at KT McFarland's confirmation hearing, too."
869760015376187392,2017-05-31 03:38:41,": Much like shredding documents is legal, but shredding documentary evidence of tax fraud is a felony."
869757970686586880,2017-05-31 03:30:34,": This is an extraordinary paragraph from McMaster and Cohn's op-ed, and I don't mean ""extraordinary"" in a good way. https://…"
869756689062514688,2017-05-31 03:25:28,:
869755570663903240,2017-05-31 03:21:01,": ) Yes. ) The issue is not to keep score in some kind of galactic outrage competition. Bad things really can happen, don’t…"
869753441362620417,2017-05-31 03:12:34,I'd actually been hoping Mitt Romney would return to the discourse. Maybe he could say something about the importance of NATO.
869753110578823170,2017-05-31 03:11:15,": As usual, this isn't well thought out. A Priebus confirmation hearing would be so risky for Trump b/c of questions abou…"
869743897559400448,2017-05-31 02:34:38,": The Fox reporter who wrote now-retracted Seth Rich story RT'd a ton of conspiracy stuff yesterday. After I contacted Fox,…"
869740832844283908,2017-05-31 02:22:28,"Al Franken on Ted Cruz: ""He is just a toxic guy in your office. He's the guy who microwaves fish."""
869729265603969024,2017-05-31 01:36:30,Happening now: David Letterman and Al Franken at the nd Street Y
869726695414272001,2017-05-31 01:26:17,Listen
869724433082187777,2017-05-31 01:17:18,"Honestly, who isn't gaining weight because of this administration?"
869722815678775298,2017-05-31 01:10:52,:
869721210313211904,2017-05-31 01:04:29,: ---&gt; read it and in general.
869689557763194885,2017-05-30 22:58:43,"Why else would he be so nice to Flynn? Trump believes in loyalty to Trump, not from Trump."
869689284214890496,2017-05-30 22:57:38,I increasingly think Flynn has the goods on Trump.
869689191621382144,2017-05-30 22:57:15,"People mocked that bit about Kushner's sister, but I do think Trump's view is all the graft is supposed to accrue to Trump, not underlings."
869688787600896001,2017-05-30 22:55:39,So Trump is annoyed that Kushner's sister traded on his name but isn't mad that Flynn was selling access to the Turks? 🤔
869684967365894144,2017-05-30 22:40:28,Stark Raving Mad did a rating to be the th-most watched show on TV and was canceled after one season. Different times.
869684017808986112,2017-05-30 22:36:42,Then you'll love my idea about a former congressman from Brooklyn and Queens with a prominent nationa…
869683455902322691,2017-05-30 22:34:28,Lol of course
869681392006942722,2017-05-30 22:26:16,I would like to be excluded from this narrative
869680255841308673,2017-05-30 22:21:45,"It sounds crazy, but consider, Parker/Spitzer was an actual television show for several months."
869679698611232769,2017-05-30 22:19:32,": Watch as Stuart Jones, a high-level acting official in the State Dept, is asked why they criticize Iranian elections b…"
869676080889769984,2017-05-30 22:05:10,"Idea: Crossfire reboot, hosted by Mike Cernovich and Louise Mensch"
869665605158416384,2017-05-30 21:23:32,Was a Lucian Wintrich takedown really necessary?
869648424022528001,2017-05-30 20:15:16,": I DO NOT endorse this use (actually, misuse) of the business model..."
869632496186658820,2017-05-30 19:11:58,You'd think she'd at least get her hair done first
869631084467769345,2017-05-30 19:06:22,: UK polls seem to keep overestimating youth turnout
869626666594832385,2017-05-30 18:48:48,will the embassy be moved?
869625919492816896,2017-05-30 18:45:50,I'm not wrong.
869625141415825409,2017-05-30 18:42:45,"When people see the giant chip on Sean Spicer's shoulder, they naturally assume he is from Rhode Island."
869624483111481345,2017-05-30 18:40:08,": Sean is upset about bad viral tweets. Which, I mean, join the club."
869624036615172096,2017-05-30 18:38:21,: At a certain point you have to wonder if not preparing for the press briefings is actually a means of protecting himself l…
869623243191320580,2017-05-30 18:35:12,Remember a couple years ago when Republicans used to think it was important to demonstrate commitment to our allies?
869623078661353473,2017-05-30 18:34:33,We now know that Trump can take a dump on the NATO alliance and the GOP will say he executed the dump to perfection.
869622600598777856,2017-05-30 18:32:39,"""Unbelievable,"" like ""interesting,"" is not necessarily positive or negative."
869618317400711168,2017-05-30 18:15:38,"""The men all had erections, and every single one of the women were ovulating left and right."""
869616904528416769,2017-05-30 18:10:01,: Oops: Supreme Court disciplines wrong lawyer
869613328406020096,2017-05-30 17:55:48,": Per , the House Intel Committee has already subpoenaed Cohen"
869613097249624064,2017-05-30 17:54:53,": I agree, we can do better. The Cassidy-Collins plan gets us there. Bring down premiums, provide great coverage and give po…"
869612992928899072,2017-05-30 17:54:28,Conor.
869602108844146690,2017-05-30 17:11:13,": This is correct &amp; those who rightly criticized Obama for doing this with Iran, Turkey etc. should say so https…"
869601030924840960,2017-05-30 17:06:56,Adrienne's Pizzabar is good
869595525397573633,2017-05-30 16:45:04,"""butter""? I think you mean soybean oil, water, salt, vegetable mono &amp;…"
869594917869375488,2017-05-30 16:42:39,"You all live in New York, why the hell are you ordering Papa John's?"
869590520967831552,2017-05-30 16:25:11,: lol
869588148690583554,2017-05-30 16:15:45,: NEW: Russia investigation eands to include the President's personal lawyer
869587346265604097,2017-05-30 16:12:34,"I think you mean Dr. Seb Gorka, Ph.D."
869584573591629825,2017-05-30 16:01:33,": Every single thing attributed to TMZ's purported ""law enforcement sources"" was incorrect re: Tiger Woods DUI arrest …"
869583959084216320,2017-05-30 15:59:06,wow did Carter finally talk with a lawyer
869580180456656896,2017-05-30 15:44:05,"Trump also couldn't get over people saying he has short fingers, which is also true."
869579067019939840,2017-05-30 15:39:40,Kinsley gaffe
869576844248571906,2017-05-30 15:30:50,": You really don't change, do you?"
869574211626573824,2017-05-30 15:20:22,: Trump returns to US soil to attack Germany and defend Russia from hacking charges.
869557163974381568,2017-05-30 14:12:38,: Tiger blew a .000 on his breathalyzer.
869556910923685889,2017-05-30 14:11:37,: i think it shows his advisers lie to him a lot
869555817758023680,2017-05-30 14:07:17,": Trump's lawyers pressed him not to tweet about the Russia investigation, for fear tweets wld be used against him. He d…"
869555476098404354,2017-05-30 14:05:55,Oh man that sucks
869554520682094592,2017-05-30 14:02:07,JERRY JERRY JERRY
869551152601456640,2017-05-30 13:48:44,"""Maybe you lead a more virtuous life. Maybe you just lead a smaller one. It is difficult to say without being teste…"
869544079419461632,2017-05-30 13:20:38,:
869541397854027776,2017-05-30 13:09:59,Could it pee...
869540784697114625,2017-05-30 13:07:33,"Trump keeps saying he's going to sign one of the largest tax cuts ever, so rich people cut estimated tax payments &amp; delay income to ."
869540655793672192,2017-05-30 13:07:02,"The funny thing is, this is another mess Trump made for himself. Why are tax receipts weak? It's probably not an ec…"
869539726772117504,2017-05-30 13:03:20,This is like firing the pastry chef on the Titanic
869538603021500416,2017-05-30 12:58:52,"Of course, if the problem was excessive fiscal probity in Germany, they could fix that by spending on remilitarization..."
869538130726178817,2017-05-30 12:57:00,"But there's supposed to be a German part of the German-French deal, which is that Germany accepts econ policies that work for Europe."
869538020072067078,2017-05-30 12:56:33,"Maybe it's wishful thinking, but it's possible to squint and see a way that Trump's antics strengthen the EU."
869537018988113920,2017-05-30 12:52:35,: Friday vs. Monday
869536877271035904,2017-05-30 12:52:01,: Remarkable attack on Trump's treatment of Merkel by her chief rival Martin Schulz.
869366145719169024,2017-05-30 01:33:35,: Odd that this story has no byline
869365410164027393,2017-05-30 01:30:40,: This is a weird thing to have forgotten about on your SF-86 form.
869365224067014660,2017-05-30 01:29:56,Lao Sze Chuan delivers
869354343207665666,2017-05-30 00:46:41,"Well, it sort of was:"
869329408036831232,2017-05-29 23:07:36,The game involved identifying partially-completed words by using crossword clues
869326559458594816,2017-05-29 22:56:17,I want a refund.
869326431997878272,2017-05-29 22:55:47,"Speaking of Chuck Woolery being full of crap, the Scrabble game show wasn't even about Scrabble, it was about crossword puzzles."
869324762891374593,2017-05-29 22:49:09,ugh is there anything worse than people?
869324107577425924,2017-05-29 22:46:33,: We'll be back in Jew and Jew.
869323632354492416,2017-05-29 22:44:39,The Price is Right involves knowledge and estimation skills. But there's also Plinko and such.
869323536015478784,2017-05-29 22:44:16,Shouldn't most game shows give people an appreciation of how random chance can great…
869318997455581185,2017-05-29 22:26:14,Lenin wasn't one of these... Lenin wasn't one of these
869305644616232960,2017-05-29 21:33:11,: No. I don't watch the Olympics. But sure. Nativism is the natural order of things. Among the lower primates and herd an…
869251880777633792,2017-05-29 17:59:32,: Those giving Potus kudos for getting thru trip w/o major gaffe/incident missing the point: the trip weakened core element…
869245470836707328,2017-05-29 17:34:04,: Recommend this article criticizing Merkel's speech:
869222352181219329,2017-05-29 16:02:12,This is bizarre. Poutine is Canadian because Quebec is Canadian.
869220027916066816,2017-05-29 15:52:58,": The unemployment rate in April-May, was %."
869209405857947648,2017-05-29 15:10:46,"no, there isn't."
869193781953925120,2017-05-29 14:08:41,: I tend to agree with this . I know it's not your thing but one day you should write it up as an academic arti…
869191479620767746,2017-05-29 13:59:32,": Hey, guys, this is Nevada's Republican National Committeewoman. So proud."
869191034848382976,2017-05-29 13:57:46,": This article of mine from has been tweeted hundreds of times today, all exactly the same way."
869187053988261888,2017-05-29 13:41:57,: Trump took another family's coat of arms as his own without permission—&amp; changed “Integritas” (integrity) to “Trump” https:…
869186647879012354,2017-05-29 13:40:20,": Both Merkel and Macron have publicly rebuked Trump after their meeting. His trip was a disaster, leaving us less respected and…"
869185698296889345,2017-05-29 13:36:33,: Trump proposed a budget last week that did not include any info about tax cuts. Trump's Treasury secretary said they don't…
869185341634347011,2017-05-29 13:35:08,": Remarkable Macron comment re: Trump compares him to Putin and Erdogan, says handshake is ""diplomacy by public abuse"" https:…"
869017083434151936,2017-05-29 02:26:32,": NYT: Jared Kushner urged Trump to fire Comey and assured him it would be a political “win,” six West Wing aides say https:/…"
869015461211631616,2017-05-29 02:20:06,: Subtle
869015389874921472,2017-05-29 02:19:49,Have you tried it?
869005961775767556,2017-05-29 01:42:21,I make the pea guacamole every so often. It is better than regular guacamole.
869003250208575490,2017-05-29 01:31:34,: Pea guacamole : Pea cake
868994857792135169,2017-05-29 00:58:13,"And I'm sure he was like ""who told reporters that? You? You?"" And nobody admitted it, so the sources were fake."
868994723532476417,2017-05-29 00:57:41,I'm not kidding. % Trump's biggest beef with this trip is the suggestion that someone might want lawyers to revi…
868994316785651712,2017-05-29 00:56:04,: My guess is that she said “I am angry about the leaks!” and he believed they were on the same side because he too is angry…
868993245740765186,2017-05-29 00:51:49,: the Democratic Socialists of America would also like to add more dollars to Healthcare
868986995137269762,2017-05-29 00:26:59,"It's clear, of all the things Trump is sad about from this week's coverage, he's most sad about his own staff grous…"
868986595575291905,2017-05-29 00:25:24,: It will be amusing when Dems use this in pro-Trump districts against GOP Congressmen who voted for AHCA and fewer dollars…
868986536628547584,2017-05-29 00:25:09,: when you go abroad and forget that you already submitted a budget
868986416881074176,2017-05-29 00:24:41,"?? ""add more dollars"" have you read any of your party's work product?"
868974518177587201,2017-05-28 23:37:24,: How bad was Trump's first trip? THIS bad ...
868968329314275330,2017-05-28 23:12:49,: Merkel saying Europe cannot rely on others &amp; needs to take matters into its own hands is a watershed-&amp; what US has sought…
868925632012591105,2017-05-28 20:23:09,Ted.
868916770253549570,2017-05-28 19:47:56,": It's really hard to hold ""meetings"" when it's raining outside."
868909998365179904,2017-05-28 19:21:01,: Hard to understand why Corker would make such a statement unless he knows Tillerson is going to go and he still really wants…
868909936209797122,2017-05-28 19:20:47,: I don't want to live in a country where wages are flat but outrage is endlessly increasing
868902844224729088,2017-05-28 18:52:36,: Leaving this here without comment. A senior administration official to reporters on Air Force One:
868890396079816704,2017-05-28 18:03:08,Remember when Republicans prattled on about Obama showing insufflent commitment to our allies? Those frauds say thi…
868889738031366144,2017-05-28 18:00:31,"""Phone chat"" lines like LiveLinks are voice-based social networks"
868888198969163776,2017-05-28 17:54:24,: one reason we are viewed as unreliable by Europe is... it's true!
868888089116254209,2017-05-28 17:53:58,": to be more specific, Trump claimed that Carla Bruni dumped Mick Jagger for him"
868878939380469761,2017-05-28 17:17:36,": My God, do smart people get brainwashed about Borowitz when they start at The New Yorker?"
868877341937856513,2017-05-28 17:11:15,": TMI, . TMI."
868876404603203584,2017-05-28 17:07:32,": Macron say Trump handshake was no accident: “One must show you won’t make small concessions, even symbolic ones.”"
868860869903618048,2017-05-28 16:05:48,: Merkel's comment that US &amp; UK are no longer reliable was applauded for a full minute. In domestic terms she wasn't going…
868854809520205824,2017-05-28 15:41:43,Ha ha we're all going to die
868854176318705664,2017-05-28 15:39:12,: Agree. Gave Saudis blank check for sectarian war &amp; spooked Germany into thinking of going its own way. Game changer. https:/…
868853777163583488,2017-05-28 15:37:37,"I thought they were both named after Barron Hilton, a real person whom Trump imagined to be his friend."
868853197087100929,2017-05-28 15:35:19,": I'll do three: Promoting the breakup of the European Union, undermining NATO's Article V credibility, slowing renewable e…"
868851836358467586,2017-05-28 15:29:54,"If there are incriminating emails, they're probably sitting in various people's Gmail archives, discoverable."
868851662617759744,2017-05-28 15:29:13,"This may be bad for Trump. A well-organized, corrupt firm would have had a document-retention policy that deleted s…"
868851240435945472,2017-05-28 15:27:32,th President: Louise Mensch.
868847573213294592,2017-05-28 15:12:58,": If there's one constant in European history, it's that everybody always looks forward to a German military buildup."
868847001231929345,2017-05-28 15:10:42,Maybe Trump just saved Greece.
868846855060430858,2017-05-28 15:10:07,"Well, we've been complaining Germany doesn't spend enough. military buildup could increase German consumption, helping outer EZ economies..."
