id,created_at,text
758501382592790529,2016-07-28 03:16:36,"""She is fit and ready to be the next commander-in-chief """
758500778957037568,2016-07-28 03:14:12,". ""More qualified than me or Bill"" That's a pullout quote."
758499400721235968,2016-07-28 03:08:44,Now on to
758496860021530626,2016-07-28 02:58:38,Reference Obama making Boston convention speech put him on path to White House
758496276119973888,2016-07-28 02:56:19,"Thunderous reception for Obama. It's electric in the hall. ""Hello America"""
758495029782519808,2016-07-28 02:51:21,Powerful intro video. This is Obama's rd convention speech
758493923153248256,2016-07-28 02:46:58,Rahm Emanuel in video introducing Obama
758490677395197952,2016-07-28 02:34:04,Obama arrived at the Wells Fargo Center in Philadelphia at :40 pm for his speech
758489051922046977,2016-07-28 02:27:36,Trust an issue for - that's why Kaine bringing it up
758487971196706820,2016-07-28 02:23:19,"""Why I trust """
758487444907921408,2016-07-28 02:21:13,winning the room
758420887477575684,2016-07-27 21:56:45,Bernie backer Susan Sarandon getting mobbed at
758418057417007104,2016-07-27 21:45:30,"Also part of tribute.. Abner Mikva, Muhammad Ali..."
758417623017062401,2016-07-27 21:43:46,"Chicago Mayor Jane Byrne, former Rep. Cardiss Collins D-Ill., Rainbow PUSH Willie Barrow part of tribute..."
758417245605285888,2016-07-27 21:42:16,Tribute to Dems &amp; allies who have passed away since last convention in . Touching.
758417087870095360,2016-07-27 21:41:39,"Reprise of '92 Bill, Hill, Al, Tipper post NY convention bus trip: Bill Clinton, Anne Holton-Kaines wife-to join part of PA, Ohio bus tour."
758394186194296833,2016-07-27 20:10:38,". said prod to to hack Clinton email shows Trump ""bromance"" with Putin."
758292737242361856,2016-07-27 13:27:31,"""Hillary Clinton is the most famous unknown person in America:"" Labor Sec Perez to Illinois delegation"
758285819820044288,2016-07-27 13:00:02,Speaking THURSDAY Illinois Senate contender vs Sen Mark Kirk
758284540943208448,2016-07-27 12:54:57,. running for Senate at delegation breakfast. She speaks tonite
758162025159790592,2016-07-27 04:48:07,"My take: Streep on 'What does it take to be the st female anything and this big night for women,"
758138883146149889,2016-07-27 03:16:09,". via video to little girls ""I may be st women president"" one of you will be next"
758138009443237889,2016-07-27 03:12:41,An important night in feminist history -Alicia Keyes
758137731058982913,2016-07-27 03:11:35,"""We are stronger together,"" Alicia Keyes"
758136866457649152,2016-07-27 03:08:09,Alicia Keyes
758135536276140033,2016-07-27 03:02:51,on female firsts.
758134855024738306,2016-07-27 03:00:09,"""What does it take to be the first female anything"""
758134280451198977,2016-07-27 02:57:52,Quite a different speech than for in . Almost all personal
758133763134160896,2016-07-27 02:55:49,. Bustos
758132704554651652,2016-07-27 02:51:36,"""The best darn change maker,"" Bill Clinton making case for"
758131994735865857,2016-07-27 02:48:47,. lifetime pal Betsy Ebeling
758130043734396932,2016-07-27 02:41:02,"is a ""change maker"" Lauren Beth Gash and"
758128151922868224,2016-07-27 02:33:31,"Cook County Board Member left, Illinois Attorney Genera"
758127578418974720,2016-07-27 02:31:14,"""My daughter had the best mother in the world"" Bill Clinton laying it on thick"
758126196752285696,2016-07-27 02:25:45,Bill Clinton speech full of references
758123668287414273,2016-07-27 02:15:42,owning
758123082758447104,2016-07-27 02:13:22,Bill Clinton wild reception talking about how he met
758110679656230912,2016-07-27 01:24:05,Elizabeth Banks at She's pitch perfect.
758087735064354816,2016-07-26 23:52:55,Protestors - many holding Bernie signs - have invaded the convention press file center. Partial lockdown Massive police presence.
758082870367883265,2016-07-26 23:33:35,When Sen. Boxer speaks: her grandson is nephew. Boxer daughter once married to Clinton brother.
758073477559640065,2016-07-26 22:56:16,History.
758073231278505984,2016-07-26 22:55:17,"Bernie is on the floor w Vermont delegation. in unity sign, Sanders asks chair to make the vote, by acclamation all for"
758070339494612992,2016-07-26 22:43:47,passes. Sanders state will move to make it unanimous. Will Sanders join delegation on floor?
758057526357270528,2016-07-26 21:52:52,"""This one is for you, Hill."" Lifelong pal Betsy Ebeling casting Illinois votes for"
757944802390450176,2016-07-26 14:24:57,"democratic state party chair Michael Madigan: Gov Rauner, ""extreme"""
757930622849384448,2016-07-26 13:28:36,Chris Kennedy mulling a run for Illinois governor spoke to delegation at
757781740782022657,2016-07-26 03:37:00,Michelle Obama Democratic convention speech. Transcript.
757774189830995968,2016-07-26 03:07:00,"""Hillary Clinton must become the next president of the United States"" Bernie says"
757773504238485504,2016-07-26 03:04:16,A lot of this is Bernie stump speech writ large. Eventually will get to Hillary and Trump
757772234014519298,2016-07-26 02:59:13,"""The revolution continues ..the struggle continues,"" Bernie says"
757771803754455048,2016-07-26 02:57:31,Bernie delegates wild when Bernie talks about how they will get a roll call vote.. Deal earlier announced
757770850384961536,2016-07-26 02:53:44,His time
757770451628220416,2016-07-26 02:52:09,Here's Bernie.
757758971382001664,2016-07-26 02:06:31,Hard to believe it's been years
757758567344517121,2016-07-26 02:04:55,Michelle signs just like in in the house
757749231767678976,2016-07-26 01:27:49,Remarkable. Paul Simon has calmed heated Bernie / Hillary shouters. Perfect song
757748452478427136,2016-07-26 01:24:44,"Perfect song Paul Simon ""bridge over troubled waters"""
757748027113115650,2016-07-26 01:23:02,"Sarah Silverman tells Bernie people and she is one - ""they are being ridiculous """
757741200518643712,2016-07-26 00:55:55,"Sen Al Franken wielding humor to dissect Trump University, filet"
757715342286348288,2016-07-25 23:13:09,"Meanwhile, worry press tent may collapse as giant storm hits"
757694938309984257,2016-07-25 21:52:05,To watch: when is about not
757694610407731200,2016-07-25 21:50:47,Afscme Paul Booth speaking now came out of labor movement
757687266584166400,2016-07-25 21:21:36,Mayor skipping first days of Chicago problems follow him to Philly.
757686393841786880,2016-07-25 21:18:08,Chaotic open for the Up to to help get a handle on this. issues apology for email hack
757671820963278848,2016-07-25 20:20:13,"Baltimore mayor, not departing chief Debbie Wasserman Schultz calls to order. Wasserman Schultz decided better not to show."
757557872549068800,2016-07-25 12:47:26,". can ""be trusted"" on issues ""that matter"" Rev Jesse Jackson telling delegates"
757556563762614272,2016-07-25 12:42:14,"J B to delegates: ""Illinois is not a given"""
757554885999067136,2016-07-25 12:35:34,"Connecticut Gov. Dan Malloy to delegates: I 'm a Democratic governor. You need one of those"""
757334598187614208,2016-07-24 22:00:13,Manafort uses email hack as peg to call for to drop out over her private email server.
757306323784437761,2016-07-24 20:07:52,Breaking: chair Wasserman Schultz to step down after convention.
757284068807544832,2016-07-24 18:39:26,Lots of merchandise
757283864935096322,2016-07-24 18:38:37,"With for decades, Illinois pals Mike Conway and Elaine Weiss"
757262367302553600,2016-07-24 17:13:12,The convention stage
757261711736971268,2016-07-24 17:10:35,Not the greatest seats
757260830903668736,2016-07-24 17:07:05,All decked out
757214903350374400,2016-07-24 14:04:35,"Hacked emails mar opening of convention Sanders said plotting against him outrageous, not surprising"
757002869455421440,2016-07-24 00:02:03,Philadelphia
756978556748623872,2016-07-23 22:25:26,Neighbors fondly call Mountain Jack.
756974133053829120,2016-07-23 22:07:51,Talking about breaking glass ceiling with
756964208777039872,2016-07-23 21:28:25,Ran into Former state Rep. David Miller at
756878093889916930,2016-07-23 15:46:14,First convention Myles White to be page in Philadelphia; works for Speaker/DPI chief Madigan
756875961497444357,2016-07-23 15:37:45,"Heading to in Philadelphia, Illinois Sanders delegates and laurA Sabransky"
756648078963200000,2016-07-23 00:32:14,Tim Kaine is vice president pick. Always at the top of the list.
756359807897051136,2016-07-22 05:26:45,:
756348817797185536,2016-07-22 04:43:05,Breaking down the set.. Folks burst most of the balloons
756338137903665152,2016-07-22 04:00:38,"Music playing ""can't always get what you want """
756337198568464388,2016-07-22 03:56:54,"top Ivanka line: “My father told me, Ivanka, you’re going to be thinking anyway, you might as well think big.”"
756335399543402501,2016-07-22 03:49:45,"Podesta: Next week in Philadelphia, Democrats will focus on issues, not anger."
756334919052386304,2016-07-22 03:47:51,It's a wrap. Convention . On to Democrats in Philadelphia
756332351370723329,2016-07-22 03:37:39,Balloon Drop!
756330099293687808,2016-07-22 03:28:42,"""Melania and Ivanka, did they do a job."" Ivanka Trump big winner tonight. Don't get why she's not out on the trail more. She is Trumpinice"
756329597675929604,2016-07-22 03:26:42,"Seems an ad libbed line: Trump thanking evangelicals even if ""I am not sure I deserve it."""
756329347498188800,2016-07-22 03:25:43,Here's why GOP react to the Supreme Court line is instructive: It's the argument to vote for Trump even if you don't like him. Might work
756328966441562112,2016-07-22 03:24:12,"Just not true: ""My opponent"" essentially wants to abolish the second amendment,"" Trump says."
756328831577841664,2016-07-22 03:23:40,"Biggest biggest roar yet - Trump on his Supreme Court nominee to replace ""beloved"" Justice Scalia."
756328477641494529,2016-07-22 03:22:15,"Trump's mention of release of point plan to help VA - reminds me, how's that release of income taxes going?"
756328015295021056,2016-07-22 03:20:25,Line about TSA lines at airport got good reception. Something that unites us!
756327862056001536,2016-07-22 03:19:48,"Fundraising appeal just emailed from Trump/Pence using ""I am your voice line"""
756326516024156160,2016-07-22 03:14:27,Have never seen this before..the Trump speech text was released with footnotes
756326414828212224,2016-07-22 03:14:03,"Trump domestic ""policy"" focus is trade deals"
756325291295903745,2016-07-22 03:09:35,Building wall line got folks jumping out of seats
756325235650138112,2016-07-22 03:09:22,"""Greatest compassion for our struggling citizens.."
756322623219494912,2016-07-22 02:58:59,Take a look footnoted speech text
756320323427983360,2016-07-22 02:49:51,Pandering to Bernie Sanders supporters
756319547284680705,2016-07-22 02:46:46,"So far, no fresh material, going hard on Hillary as crook"
756319085231833088,2016-07-22 02:44:56,Protestor near press stand just escorted out
756318901290565636,2016-07-22 02:44:12,. squinting because Telepromoter far away
756318888342777856,2016-07-22 02:44:09,Skybox Where the donors deplores are watching convention
756318414277341185,2016-07-22 02:42:16,"The Trump headline, soundbite: ""I am your voice"""
756317540461244416,2016-07-22 02:38:48,"Team Clinton Dispatch ""Trump On Foreign Policy: Arrogant, Ignorant and Dangerous"""
756316506590367746,2016-07-22 02:34:41,Trump claims he can read Pres. Obama mind: says Potus regrets making Clinton SecState.
756313953110790144,2016-07-22 02:24:32,. using TelePrompTer
756308974580797442,2016-07-22 02:04:45,
756277145878536196,2016-07-21 23:58:17,brown singing the national anthem
756267436186431488,2016-07-21 23:19:42,"Some delegates rocking out as band plays ""Sweet Caroline"" No relation ."
756266331176075265,2016-07-21 23:15:18,Former Cook County GOP chairman Aaron Del Mar
756265256570220544,2016-07-21 23:11:02,delegates sign re
756263003893497857,2016-07-21 23:02:05,The balloons before the drop
756182030132674560,2016-07-21 17:40:19,. to speak convention Philadelphia
756150596470706176,2016-07-21 15:35:25,. slams for not endorsing in convention speech.
755944930879631360,2016-07-21 01:58:10,Massive boos for Ted Cruz .. Did not endorse in prime time speech
755944243332603904,2016-07-21 01:55:27,"Ted Cruz in November ""vote your conscience"""
755929824225439744,2016-07-21 00:58:09,"Just Hillary bashing tonite? at Could use a few doses of aspiration. Some of Reagan's ""shining city on a hill"" stuff"
755916720749940736,2016-07-21 00:06:05,"GOP revokes Trump delegate credentials for ""racist"" Facebook post"
755814872756080640,2016-07-20 17:21:22,"Melania Trump speech writer Meredith McIver apologizes for speech quote lifting ""mistake."" Not fired."
755767338608185344,2016-07-20 14:12:29,"Rep to delegates: wall is ""code"" may not be literal"
755750317430607873,2016-07-20 13:04:51,"Rep. Issa R-Calif to Illinois delegates: Clinton voters r ""people who genuinely believe the truth doesn't matter"""
755591518933643264,2016-07-20 02:33:50,On convention floor Illinois national committeewoman Demetra Demonte
755590823241068544,2016-07-20 02:31:05,Chris Christie in press scrum on convention floor by New Jersey delegation
755588787783266304,2016-07-20 02:22:59,"Sen. ""Stop the bickering"""
755581614176952320,2016-07-20 01:54:29,"Oh, the Trump we've never seen. Tiffany, daughter of"
755581027121139713,2016-07-20 01:52:09,Chris Christie says should never get within miles of White House. Surely he exagerrates
755578416485675009,2016-07-20 01:41:47,"Red meat from Chris Christie re ""guilty"""
755578173417410560,2016-07-20 01:40:49,"Whoa. Chris Christie presenting his own indictment against . Blaming her for ISIS, Al Queda."
755575963476373504,2016-07-20 01:32:02,"And BTW, really didn't say all that much about But unity good, yes?"
755575764758634497,2016-07-20 01:31:14,"""Unity is everything!...Show our best and nothing less!,"" rousing end to speech"
755574119790284800,2016-07-20 01:24:42,"As bashes her campaign puts out this: ""Paul Ryan Holds Nose, Embraces Trump"""
755573592520220672,2016-07-20 01:22:36,"Ouch. calling Democratic convention next week an ""infomerrcial."" And this is not?"
755573398806208512,2016-07-20 01:21:50,Last time around was Mitt Romney's running mate. Speaking to convention now -perhaps a future president.
755541631013642240,2016-07-19 23:15:36,Ok. is the official GOP presidential nominee. Getting tired of writing clunky presumptive.
755541133330087936,2016-07-19 23:13:38,Trump's son cast New York votes for taking him over the line at roll call
755539566996688896,2016-07-19 23:07:24,Ohio casts its votes for Gov. John Kasich. The only state he won.
755532188955844608,2016-07-19 22:38:05,"Illinois GOP chair Tim Schneider casts votes Trump, Kasich, Cruz at rollcall"
755531087733030913,2016-07-19 22:33:43,The Land of Lincoln up next for roll call
755530212947951616,2016-07-19 22:30:14,"All the delegates lining up at roll call for , on a roll to ,237. Florida gave Rubio, Cruz some delegates. Just symbolic"
755489860752969728,2016-07-19 19:49:53,Democratic Washington DC Mayor Bowser working for DC statehood
755479575791108096,2016-07-19 19:09:01,re Trump family searches
755469431023800320,2016-07-19 18:28:42,Mary Mitchell interviewing Dr Ben Carson
755459421036089346,2016-07-19 17:48:56,stadium across from
755387836560510976,2016-07-19 13:04:29,"Former Trump campaign manager Lewandowski says Trumper involved Melania's plagerized speech must be ""accountable """
755228826855149568,2016-07-19 02:32:38,So Giuliani is the bad cop and Trump is the good cop. Get it.
755226889409683456,2016-07-19 02:24:56,". man of few words in introducing ""next first lady of the United States, Melania Trump."""
755212756001943552,2016-07-19 01:28:46,", battle cry of Milwaukee County Sheriff David Clarke - especially after Baton Rouge police shootings"
755197859214032897,2016-07-19 00:29:35,"Serious bashing starting. Mother of victim blames her ""personally for the death of my son."""
755195267431993344,2016-07-19 00:19:17,"Texas Gov. Rick Perry ""Making Amerca Great Again means taking care of our veterans."" Not really a speech. A speechette"
755194483545825280,2016-07-19 00:16:10,"Happy Days Scott Baio to Trumpers: ""Being American doesn't mean getting free stuff."" A reference to corporate welfare, perhaps?"
755193260897951744,2016-07-19 00:11:18,"Duck Dynasty Willie Robertson putting down marker of first convention night...that is about ""regular folks."""
755142581357539328,2016-07-18 20:49:55,Right by the camera taking panoramic picture of delegates supposed to be standing still
755138955922792448,2016-07-18 20:35:31,Stop moves brought a few minutes of excitement on floor.
755137978465394688,2016-07-18 20:31:38,Motion to change rules to try to dump Trump came from anti-Trump delegation
755137559198662657,2016-07-18 20:29:58,The NoTrump delegates lost a bid on floor to change rules to try to deny Trump nomination
755112243696664580,2016-07-18 18:49:22,More booze than food choices at . Bar is open. I eat not drink
754894878878887938,2016-07-18 04:25:39,". delegates &amp; GOP party, for some an arranged marriage. Plus, Stephen Colbert at GOP pre-convention."
754854452356669441,2016-07-18 01:45:00,Fireworks .. Before start. At Rock and Roll Hall of fame welcome party
754852869204041728,2016-07-18 01:38:43,welcome party at hall of fame
754728341425516544,2016-07-17 17:23:53,Stephen on convention floor as Flickerman from Hunger Games
754720231537336320,2016-07-17 16:51:39,And just in case you have not heard...
754719962145533952,2016-07-17 16:50:35,Ilinois delegation has decent seats at
754718898117804033,2016-07-17 16:46:21,Outside convention hall
754718458152124416,2016-07-17 16:44:37,The convention podium. Getting ready for
754344966583885826,2016-07-16 16:00:29,"Take away from ""outsider"" speech re Mike Pence vice president pick: chose him for ""party unity."""
753552302611456001,2016-07-14 11:30:43,"Partial list of speakers is out, here it is: Kicks off Monday in ."
753296853207093249,2016-07-13 18:35:40,"Transcript of ""House Divided"" speech."
753277816871890944,2016-07-13 17:20:01,"Talk re race relations, heal divides &amp; highlighting willful ignorance - roadshow tryout convention speech."
753277154603831297,2016-07-13 17:17:23,"A threat to democracy: with the ""Party of Lincoln"" is now the ""Party of Trump:"""
753276829142618112,2016-07-13 17:16:05,"""I do wish Donald Trump would listen to other people once in awhile, he might learn something,"" says"
753276530109788160,2016-07-13 17:14:54,Imagine if a President had more than Twitter and cable news to go after his opponents:
753275603042770946,2016-07-13 17:11:13,"It's ""all about him,"" pithy summation of divisive in Springfield speech."
753275077219586048,2016-07-13 17:09:08,"Re divisive campaigns: ""I have to do better too,"" from teeing up to slam"
753274139276775428,2016-07-13 17:05:24,"'We do need to do more to stop gun violence,"""
753273669892255745,2016-07-13 17:03:32,". delivering what is shaping up as a major speech on police, police shootings, gun violence. In Springfield, Ill."
753273181415231488,2016-07-13 17:01:36,"Need to listen to those who say ""Black Lives Matter,"" and police working to protect, saying"
753273051236605952,2016-07-13 17:01:05,"Must ""do a better job of listening to each other,"" saying mentioning Chicago LaQuan McDonald shooting."
753272110391267329,2016-07-13 16:57:20,"""America's long struggle with race is hardly finished,"" saying at site of Lincoln's ""House Divided"" June ,1858 speech."
753268935890317312,2016-07-13 16:44:44,"At site where Lincoln delivered ""House Divided"" speech, to say Party of Lincoln is ""Party of Trump"""
752900859663491072,2016-07-12 16:22:07,"What a hoot. ""We accept $27 donations too, you know, . Reference small contributions"
752894909779054592,2016-07-12 15:58:29,". acknowledges built a movement. 'This is a time for all of us to stand together,"" notes 'systemic racism'"
752893729984307200,2016-07-12 15:53:47,". on : ""intelligent"" &amp; ""will make an outstanding president and I am proud to stand with her here today"""
752890223923605504,2016-07-12 15:39:52,"Bernie Sanders on Hillary Clinton ""wants to see that all Americans have the right to choose a public option in their health care exchange"""
752888893922357249,2016-07-12 15:34:34,": ""must fix an economy in America that is rigged &amp; that sends almost all of the new wealth &amp; income to the top %."
752888150884687872,2016-07-12 15:31:37,It's official: endorses for president.
752877981089923077,2016-07-12 14:51:13,. returns to site Wed. where kicked off presidential campaign and later tapped Biden
751529605668884480,2016-07-08 21:33:15,. builds big fundraising lead over
751256023990611968,2016-07-08 03:26:08,"In slamming , did (vs.) a favor. ""Privileged, wealthy bully"""
750832840925802496,2016-07-06 23:24:33,. pretty defensive about trip to his golf resort in Scotland. Using a big chunk of time on this. Not a teleprompter night.
750831072720457728,2016-07-06 23:17:32,. in Cincinnati going on about his son and his Turnberry golf course in Scotland. A Trumpian swing state strategy.
750829880745484288,2016-07-06 23:12:47,. in Cincinnati pledging Newt Gingrich will be involved in a Trump White House in some capacity. A maybe VP pick.
750730418513588225,2016-07-06 16:37:34,". in front of failed Trump casino in Atlantic City, slamming over defaults on loans, how he ""rigs"" system"
750714873097490433,2016-07-06 15:35:48,"Not a nobody nobody sent. A take on Abner , a somebody."
750709607551475712,2016-07-06 15:14:52,": Sen. Dick Durbin floor tribute to Abner Mikva right now on Senate floor, LIVE on C-SPAN2 ... cc: …"
750699659161509888,2016-07-06 14:35:20,"Pres. on troop levels: not ,500 will have ,400 troops until end of his term. Leaves Thurs. for in"
750693823198613505,2016-07-06 14:12:09,Pres. delivers statement on at :25 a.m. ET
750426464177102848,2016-07-05 20:29:45,"""I'm ready to pass the baton,"" . Gives rousing endorsement for . In speech, no mention of , not that was eected"
750420227968479232,2016-07-05 20:04:59,"on A choice whether ""to cling to some imaginary past"" (yo ) or look to the future."
750419788560683008,2016-07-05 20:03:14,"What a putdown aimed at ""Sasha tweets,"" says stumping w but that does not qualify daughter pres."
750418682103275520,2016-07-05 19:58:50,"Hours after slaps over her emails, Obama stumping with her in NC says she was a ""great Secretary of State."""
750418237381160960,2016-07-05 19:57:04,"unsubtle message to folks, cites as he stumps w how she pitched in for him after her primary loss"
750416989563162624,2016-07-05 19:52:07,"""I'm here today because I believe in ,"" stumping for first time with HRC."
750413132074356736,2016-07-05 19:36:47,". stumping W/ in NC says Obama knows where he came from and if is tweeting, it's ."
750369781753057280,2016-07-05 16:44:31,"After Comey said rec no criminal charges, taking off w to stump in NC. Also on AF1: John Podesta, Huma Abedin"
750368480017342464,2016-07-05 16:39:21,: Abner Mikva ...3/8/1995: daughter Rachel was rd woman Rabbi to guest chaplain in House htt…
750366755625705472,2016-07-05 16:32:30,"Pres. Obama on the passing of Abner : ""I've lost a mentor and a friend."""
750348142604791808,2016-07-05 15:18:32,"FBI Comey's statement very very rare. He said ""unusual transparency"" was needed re email."
750347895350571008,2016-07-05 15:17:33,"FBI Director James Comey: FBI view: will not ask to bring criminal charges re email. ""No outside influence"" involved."
750347212211625984,2016-07-05 15:14:50,"FBI Director James Comey said of Clinton and team, a ""reasonable person"" should have known better."
750346817804447744,2016-07-05 15:13:16,"FBI Director James said and team ""were extremely careless"" with some emails."
750345299319590913,2016-07-05 15:07:14,"'s Comey speaking now saying story of e-mails more ""complicated"" than thought. More than server."
750331585052880900,2016-07-05 14:12:45,"Full Obama team swing state push: Pres. stumps for in NC today; Biden w/ her in Pennsylvania on Friday, July ."
750320014201282560,2016-07-05 13:26:46,"Abner Mikva died July . Former Judge, White House counsel, Representative. ""Don't want nobody nobody sent"""
749630850292027392,2016-07-03 15:48:16,"Pres. , huddling today w over Obama Center design."
749280748008419328,2016-07-02 16:37:05,"..""Out of respect for the investigative process, she will not comment further on her interview,"" per spox Nick Merrill"
749280526582755328,2016-07-02 16:36:13,"Per spox Merrill: ""pleased"" for ""opportunity to assist the Department of Justice in bringing this review to a conclusion.."
749279980589191170,2016-07-02 16:34:02,"This morning, at HQ for about hours campaign said for ""voluntary interview"" ""about her email arrangements."""
749259881987739648,2016-07-02 15:14:11,: Join us pE : …
748901485224665092,2016-07-01 15:30:02,"But no do overs. And AG Lynch says she wouldn't do it again- meet w on plane. ""Painful"" lesson."
748899249941872641,2016-07-01 15:21:09,". said in interview she ""gets"" why folks are concerned about her tarmac meeting w"
748567420655140864,2016-06-30 17:22:35,"Breaking: Pres. , pick architects - firms - to design Obama Center in"
748124915765809154,2016-06-29 12:04:14,Details on what Pres. is doing in today.
746432096302829568,2016-06-24 19:57:34,", looses George Lucas Museum. says its time for it to come home to San Francisco."
746312553299509250,2016-06-24 12:02:33,"On said ""yes"" when asked if he would vote for"
746305731012362240,2016-06-24 11:35:26,". in tonite for Hillary Victory Fund: top contribution level, $50,000 to host."
746001113258700800,2016-06-23 15:25:00,Pres. to deliver statement on decision at11:45AM ET
