id,created_at,text
697509939518918656,2016-02-10 19:58:23,"in Springfield calling for making it easier to vote, wants lawmakers to pass automatic registration bill."
697506565708886016,2016-02-10 19:44:58,"Pres. in : Refusing to compromise is ""not an accomplishment."" Awaiting react from"
697506094055165952,2016-02-10 19:43:06,"""Sometimes my Republican colleagues"" make a lot of points, doesn't make me a sellout to my party,"" . Hoots hitting Dem sellout Dunkin"
697505226371125248,2016-02-10 19:39:39,"""I am a progressive Democrat,"" says in Springfield, doing a riff that could emulate."
697505002974121984,2016-02-10 19:38:46,"in Political polarization not an abstract problem-but debates become ""as if there were no people involved."""
697502728570802176,2016-02-10 19:29:44,". new fundraising record: Last hours, since winning New Hampshire, raised more than $5.2 million, per Briggs."
697501895737225216,2016-02-10 19:26:25,"In , laments how ""the tone of our politics has not gotten better since I've been inaugurated, it's gotten worse."""
697485223986999296,2016-02-10 18:20:10,yup
697473490710966272,2016-02-10 17:33:33,Where it all began....
697471883520806912,2016-02-10 17:27:10,"landed in , Ill. AF1 on tarmac of Abraham Lincoln Capital Airport"
697467282977460224,2016-02-10 17:08:53,"Opps...that Springfield photo...make that years ago today...Feb. ,"
697465425177608192,2016-02-10 17:01:30,yrs ago today: Me at the Obama kick off in Springfield doing a live shot with Chris Matthews &amp; Howard Fineman
697462071701602304,2016-02-10 16:48:10,The band is getting back together....
697453042195562496,2016-02-10 16:12:17,"Air Force One is in the air, en route to Springfield. Who are the staffers with him?"
697444284329385984,2016-02-10 15:37:29,Tommy Vietor dug up the picture...Ben...is that outside of Oprah's house?
697423985462521856,2016-02-10 14:16:50,Anyone have the photo?
697423077437628416,2016-02-10 14:13:13,"As Obama heads to Springfield to preach bi-partisanship, the House Republicans on Obama's Air Force One no-fly list:"
697418753789661185,2016-02-10 13:56:02,How does campaign kick-off speech nine years ago stand the test of time? Read it for yourself.
697405248718053378,2016-02-10 13:02:23,"The White House schedule and press guidance for Pres. homecoming trip today to Springfield, ."
697250993575071744,2016-02-10 02:49:25,", returns to Illinois State Capitol on Wednesday, will ask lawmakers to end gerrymandering. Dems hold control."
697223950955388929,2016-02-10 01:01:58,"In New Hampshire, projects and the winners. And who would have guessed this six months ago..."
697095807590203393,2016-02-09 16:32:46,"Braced for defeat, plows ahead. Ramps up operation, where early vote started"
697057876049661952,2016-02-09 14:02:03,"Don't eect to be a back-seat driver when he visits Wednesday, mired in its own nasty politics."
696735401550094336,2016-02-08 16:40:39,"In Illinois, lags behind chief Dem rival in Senate fundraising; about even cash-on-hand."
696342484125773825,2016-02-07 14:39:20,"Variation on theme: to says barbs from team ""artistic smear."" Was ""artful smear"" Feb."
696341440998191105,2016-02-07 14:35:11,. tells 's she does not know if she can win
696339809065766913,2016-02-07 14:28:42,"Democratic debate added: March in , on . in Flint today."
696334774038716416,2016-02-07 14:08:42,Lowering eectations: tells 's he does not have to win
696180115776999424,2016-02-07 03:54:08,Big night for at
696180000731496448,2016-02-07 03:53:41,Did have a break out
696179873572790272,2016-02-07 03:53:10,Did break out of the pack at
696179226211278848,2016-02-07 03:50:36,Did Ben Carson make himself a factor in the
696178725889507328,2016-02-07 03:48:37,"Though got booed a few times, probably did not hurt himself at"
696178239299911680,2016-02-07 03:46:41,Was big loser at ?
696178019136729089,2016-02-07 03:45:48,". platform summarized: If president, ""we will win, we will win, we will win."""
696177188714840064,2016-02-07 03:42:30,"""I'm still here, and I'm not going anyplace,"" ben carson in closer"
696173996526538752,2016-02-07 03:29:49,"On abortion, makes point his exceptions put him in ""sweet spot"" of being more electable."
696172928065384448,2016-02-07 03:25:34,"Asking about paying ransom for hostage at referred to Jim Foley, grad. Debuting on : Jim: The James Foley Story"
696172285632208896,2016-02-07 03:23:01,Re GOP debate on helping veterans: That's a signature issue of Michelle Obama
696171832274063360,2016-02-07 03:21:13,"Vets should be able to get health care ""wherever they want to go,"" says"
696171040934723584,2016-02-07 03:18:05,Would be interested in knowing from all GOPers answer on women registering for draft.
696170887079464960,2016-02-07 03:17:28,"Background: Army, Marine Corps' top leaders on Tuesday backed women registering for draft as combat roles are opening to females."
696170423403180032,2016-02-07 03:15:37,Should women register for the draft? yes.
696169869075550208,2016-02-07 03:13:25,Has Trump done anything to hurt himself so far in this debate?
696169700816891904,2016-02-07 03:12:45,"But Dr. ben carson says need evidence before quarantine, a rebuttal to"
696169486882189312,2016-02-07 03:11:54,"Decisive, that's . Asked if would quarantine folks from Rio Olympics if fear of zika, he says, ""you bet I would."""
696168593088598017,2016-02-07 03:08:21,. ignoring point of question re race aspect of police abuse in his strong defense of police.
696164431252877313,2016-02-07 02:51:49,So would these Republicans back Obama FY budget ask for additional $1.1 billion to combat the nation’s opioid epidemic?
696163689548877825,2016-02-07 02:48:52,". wants governors to handle Medicaid, now a federal/state partnership."
696161725192802305,2016-02-07 02:41:04,Is water boarding torture? dodges
696161449006211072,2016-02-07 02:39:58,"""I would bring back water boarding,"" . said he would not."
696158573357731840,2016-02-07 02:28:32,". asked to elain carpet bombing against w/out hurting civilians.. retools, says mainly facilities."
696157249618575360,2016-02-07 02:23:16,"Once again, repeats how wants to change America. He must have good data to keep doing this, because he sounds like robot."
696156350439563264,2016-02-07 02:19:42,"Asked how he will bring back jobs in short term , talks a bit about taxes, but does not really present a plan."
696154857749647360,2016-02-07 02:13:46,"Lede so far at halftime: How fumbled when under attack. Strong showing christie, kasich, bush."
696153981232361474,2016-02-07 02:10:17,So far worst debate ever for . Now his decision to skip debate last week makes more sense.
696153528599875584,2016-02-07 02:08:29,"So when booed by the audience, insults the audience. That's huge."
696153065162874880,2016-02-07 02:06:39,Strong push by at makes distinction re eminent domain for public works &amp; Trump business.
696152600702382081,2016-02-07 02:04:48,"""You need eminent domain,"" says."
696151989277712385,2016-02-07 02:02:22,Not so. says self funding. But FEC report shows individuals gave last year $6.5 million; Trump loaned $12 million to bid
696150648262295552,2016-02-07 01:57:03,So what would it have hurt to let in this?
696150481987440640,2016-02-07 01:56:23,". off tonight, weak answer about fighting for his own immigration legislation, giving opening to"
696149145384431616,2016-02-07 01:51:04,"Weakest on the N. Korea aka commander-in-chief question: ,"
696148907273768961,2016-02-07 01:50:07,"""We have to have practical solutions,"" re . Cannot even ""imagine"" mass deportations. ."
696147845712318464,2016-02-07 01:45:54,"On N. Korea missile launch from at first tried to dodge, when pressed, said let China handle."
696147462327836672,2016-02-07 01:44:23,"""If a pre-emptive strike"" is needed ""to keep us safe, then we should do it,"" re N. Korea."
696147210904432640,2016-02-07 01:43:23,'s knows more about N.Korea missile launch situation than
696146908633403392,2016-02-07 01:42:11,. not looking like commander-in-chief in discussion of today's N. Korea missile launch.
696146690361851906,2016-02-07 01:41:19,"Really ? Blaming Wendy Sherman when asked about N. Korea missile launch today, which WH calls ""destabilizing"" ""provocative"""
696145956333494272,2016-02-07 01:38:24,". makes point like speaks well, but a one-term senator."
696145451716743170,2016-02-07 01:36:24,". deconstructing , making him look silly for repeating his talking points. Will he recover?"
696144675523002368,2016-02-07 01:33:19,"For nd time, says wants to change America, make it like other nations."
696144432425410565,2016-02-07 01:32:21,". broadside against Pres. for wanting to change America, asked to elain why a st term Senator should be prez."
696143747764133892,2016-02-07 01:29:37,. wielding some humor at
696143555274756096,2016-02-07 01:28:51,"Re rambling answers re carson: political saying, when you elain, you lose."
696143307039051776,2016-02-07 01:27:52,. not looking good beating up on elaining why his team messed up on Iowa vote mess-up.
696142729638760448,2016-02-07 01:25:35,"Softball lobbed at ben carson re vote mess-up, given chance to beat up on ."
696141771600842753,2016-02-07 01:21:46,"""I'm not one with the trigger,"" Weak answer. Now it's"
696141442364735488,2016-02-07 01:20:28,First question to on commander-in-chief temperament. Pivots to other things in answer so far
696141086318731264,2016-02-07 01:19:03,Seems a little confusion re and ben carson walking out on stage
696003514183471104,2016-02-06 16:12:23,A bill to make Pres. 's birthday a state holiday:
695665368656957440,2016-02-05 17:48:43,"""It's right to do it now, when gas prices are really low,"" saying about his $10 per barrel fee."
695665112657563648,2016-02-05 17:47:42,"talking about proposed ""$10 per barrel fee on oil paid by oil companies, which would be gradually phased in over five years.."""
695663792320094209,2016-02-05 17:42:27,"""We should feel good about the progress we made,"" saying."
695663240920047616,2016-02-05 17:40:16,"""We have recovered from the worst economic crisis since the s,"" Obama said. Decided to take questions from reporters in WH briefing room"
695662817605718016,2016-02-05 17:38:35,Pres. touting unemployment at % in January. Remember how in campaign hoovering at %
695656362273955840,2016-02-05 17:12:56,"Added to sked: at :30PM ET, delivers a statement on the economy"
695457815549366272,2016-02-05 04:03:58,"You don't have to chose between heart and head, says in closing pitch."
695457632241512448,2016-02-05 04:03:15,"""On our worst days we are times better than any Republican candidate,"" says Almost hugfest, NH"
695456580330876929,2016-02-05 03:59:04,Curious they were asked about since both agree so much
695453553712766977,2016-02-05 03:47:02,"On , both &amp; agree there is a federal role here. . Would not happen if Flint were white."
695450301646532609,2016-02-05 03:34:07,. again refrains from taking on on emails. She says thank you
695450043885596672,2016-02-05 03:33:05,"Absurd, says ""retroactive classification"""
695449827996528640,2016-02-05 03:32:14,"""I never sent or received classified material"" But there is an open FBI investigation into this..."
695449420658253825,2016-02-05 03:30:37,"Finally, the email issue."
695449037101662208,2016-02-05 03:29:05,"""I am the strongest candidate to take it to the Republicans,"" .Thrilled at all the young people w"
695448466751942656,2016-02-05 03:26:49,"Rachel Maddow to will you be Goldwater, McGovern? What is your general election strategy. Can socialist sell?"
695448156343930880,2016-02-05 03:25:35,"""I love and respect the caucus process in Iowa"" . Audit OK with"
695446704846348288,2016-02-05 03:19:49,Koch Brothers getting a lot of attention at . But will that move Dem voters to or
695444953917321216,2016-02-05 03:12:52,Meanwhile: Former California Gov. Arnold joins for a live Tele-Town Hall on Friday.
695443840199561218,2016-02-05 03:08:26,. never mentioned names of his foreign policy advisors
695443553774751744,2016-02-05 03:07:18,. keeps hitting for Iraq vote. Retort: trusted her judgement to be Secretary of State.
695443284416573440,2016-02-05 03:06:14,. says not passing the commander-in-chief test.
695442762179543041,2016-02-05 03:04:09,"Chuck Todd asks about why he is light on foreign policy, who are his advisors?"
695441122034712576,2016-02-05 02:57:38,...
695440831805681664,2016-02-05 02:56:29,Still: speaking fees loom as a problem.
695439258983669765,2016-02-05 02:50:14,Is all big business bad?
695438921904181248,2016-02-05 02:48:54,"""The business model of Wall St. is fraud,"""
695438641158488064,2016-02-05 02:47:47,"""We have a vigorous agreement here"" says Except unlike she has ""broader view."""
695438379861696512,2016-02-05 02:46:45,Are you willing to release transcripts of all paid speeches? asked.
695437919750791168,2016-02-05 02:44:55,"Pres. Obama took donations from Wall St. and cracked down on them, says"
695437394510635008,2016-02-05 02:42:50,"yes, and your point is.."
695435520357171201,2016-02-05 02:35:23,". offered generic complaints over fundraising, no specifics when challenged him to say how she's been bought."
695434406333317120,2016-02-05 02:30:57,"Oh yeah, those swaps."
695433882879938560,2016-02-05 02:28:52,"The lede just happened: ""Time to end the artful smear,"" to . If you have something to say, say it."
695433615656689664,2016-02-05 02:27:49,". defending herself over ""attacks over insinuation"" re donations and speaking fees from"
695433060725075968,2016-02-05 02:25:36,"So a woman running to be the first woman president is ""establishment"" asks. Will her straight talk play in NH?"
695432780042235905,2016-02-05 02:24:29,"So being the ""establishment"" candidate is not good, saying."
695432330874191872,2016-02-05 02:22:42,Wants it both ways Independent who has not run as a Democrat until now
695432051625820160,2016-02-05 02:21:36,Shoves back at over fundraising.
695431606551519234,2016-02-05 02:19:50,"Whoa. ""You being the self-proclaimed gatekeeper of progressivism,"" slings it"
695431335544885248,2016-02-05 02:18:45,"""Cherrypicking"" a quote does not change my record"
695430742487072768,2016-02-05 02:16:24,"The point is not ideas are ""radical."" It's how to get a GOP led Congress to pass a Democratic bill."
695430347199098880,2016-02-05 02:14:49,So is this debate for the soul of the progressive movement?
695430075714383872,2016-02-05 02:13:45,. hitting over who is progressive. Effective tactic?
695429877227360256,2016-02-05 02:12:57,. clarified after being pressed by that he does not want to dismantle Obamacare while pushing universal care
695429511068803073,2016-02-05 02:11:30,"""No disagreement"" between us re universal health care,"" saying."
695429181119672320,2016-02-05 02:10:11,. asked why he hasn't gotten his goals done while in the Senate...waiting for answer..
695428790789369858,2016-02-05 02:08:38,"""But the numbers just don't add up to what Sen. Sanders is proposing,"" saying. Progressive means making progress.."
695428663907524608,2016-02-05 02:08:08,"""Sen. Sanders and I share some very big progressive goals,"""
695428218929557506,2016-02-05 02:06:22,. in opening lays out broader issue agenda...
695428077233377283,2016-02-05 02:05:48,"""Happy to be here"" in NH"" says . ""Yes of course have special interests who are doing too much to rig"" game but..."
695427800052793345,2016-02-05 02:04:42,st opening starts with his economic system is rigged standard theme
695293849309151237,2016-02-04 17:12:26,"When returns to Illinois General Assembly Wednesday, he will be the th president to deliver address."
695259107943702528,2016-02-04 14:54:23,Background to Pres. Marquette Park reference in his National Prayer Breakfast speech and Rabbi Robert J. Marx
695258291241422848,2016-02-04 14:51:08,"In National Prayer Breakfast speech, Pres. citing civil rights work of Chicago's Rabbi Marx..."
694580330217500672,2016-02-02 17:57:10,"Democratic Party final precinct results, w % reporting: 9 state delegate equivalents to 2"
694499897114910720,2016-02-02 12:37:33,"Overnight, Democratic Party makes it official, wins, ""closest"" in Dem caucus history."
694208370786471937,2016-02-01 17:19:08,travelers on day: pre-blizzard low visibility on I-80 east of
694161927711256576,2016-02-01 14:14:35,Front page register on day
694013352129900544,2016-02-01 04:24:11,Turnout is the key.
693995285668765696,2016-02-01 03:12:24,Packed gym at final rally
693993603715051520,2016-02-01 03:05:43,"Bill Clinton said need cause she will keep bad things from happening"""
693992009086824448,2016-02-01 02:59:23,At pack rally bill Clinton and Chelsea
693545895938273280,2016-01-30 21:26:41,". on more debates w : ""Why won't they debate in Brooklyn? What's the matter with Brooklyn?"""
693529918261432321,2016-01-30 20:23:12,"Just in: Hillary for America Calls for Democratic Debate in Flint, MI .. Looking at more"
693486012798898176,2016-01-30 17:28:44,Glenn Beck rally in
693478171916656640,2016-01-30 16:57:35,Big ground game get out the caucus vote push on display at rally in
693477688011403264,2016-01-30 16:55:39,Packed rally coming up in .
693220912221425664,2016-01-29 23:55:19,"Using humor to make a point: campaign just announced, ""raised no money last year for a super PAC."""
693132537632165888,2016-01-29 18:04:09,Getting out the caucus vote in Des Moines
692932694108459009,2016-01-29 04:50:02,". using charity money to influence election? Campaign said vet orgs getting funds, ""a number"" In ."
692926694282362881,2016-01-29 04:26:12,Fox News says asked for $5 million to appear at . My take on the Trump show at U.
692884056254472192,2016-01-29 01:36:46,"Reporters covering at U, in the file room."
692823479406583808,2016-01-28 21:36:04,Hot in right now:
692801433901465601,2016-01-28 20:08:28,"Looking past early primary states, unveils backers."
692749363932606464,2016-01-28 16:41:33,Sex education: comes out against abstain only sex ed at high school
692743118270017536,2016-01-28 16:16:44,"""Start thinking about political issues,"" to high school students"
692742395956326401,2016-01-28 16:13:52,Actor Justin Long introducing
692732153340137473,2016-01-28 15:33:10,"Getting ready for rally, high school"
692526558553194497,2016-01-28 01:56:12,"After meeting w at White House, returned to to stump in Mason City with"
692525927524372481,2016-01-28 01:53:42,. slams at at West Des Moines rally not nearly as strong as Trump's direct hits on him. Agree?
692524254760456192,2016-01-28 01:47:03,". in West Des Moines ""We have faced the abyss."""
692520820804079619,2016-01-28 01:33:24,"In , zinging , linking him to . ""Hillarycare, Obamacare, Trumpcare."" Just two guys from New York"
692519401107648513,2016-01-28 01:27:46,"At rally in West Des Moines, talking Supreme Court ""we are just justice away from a justice left wing majority."""
692489925820825603,2016-01-27 23:30:38,none.
692489853141917696,2016-01-27 23:30:21,"The top surrogate: to Get Out the Caucus vote for in , stumping Friday, Saturday, Sunday"
692478414536712193,2016-01-27 22:44:54,With nixing campaign just announced counter event to benefit vets groups will be at Drake University
692418061110906880,2016-01-27 18:45:04,"In , calls Wisconsin company ""inversion"" ""perversion"""
692398243297144832,2016-01-27 17:26:19,". w bowling alley owner in Adel,"
692397349797261317,2016-01-27 17:22:46,"Teachers union t-shirt in Adel, Iowa at get out the caucus event"
692372006831067138,2016-01-27 15:42:04,"At bowling alley in Adel, Iowa for ""get out the caucus"" event."
692142632722657280,2016-01-27 00:30:37,From White House: President Obama and Senator will meet informally at the White House Wednesday
691987384343236608,2016-01-26 14:13:43,What Democrats want: Revolutionary or realist? My take on after
691833302681042944,2016-01-26 04:01:27,"On new ad: ""I love it,"" said."
691830472788328448,2016-01-26 03:50:12,. aiming at not by name ….”We must stand up against the bullying”
691824965809762304,2016-01-26 03:28:19,.: Obama did not invent the line re Fred Astaire Ginger Rogers do what he did but in high heels.
691816241095426049,2016-01-26 02:53:39,"Now is up at telling folks not to pay attention to those ""eastern"" pollsters and pundits"
691812178379300865,2016-01-26 02:37:31,Now defending himself on gun control record... . Clinton forces sees this as big Achilles heal
691811285110013953,2016-01-26 02:33:58,"For second time at , argues he is prepared for presidency citing vote against the Iraq war. Clinton voted yes"
691810109790502916,2016-01-26 02:29:18,". walks back accusation that , Human Rights Campaign are ""establishment"" Did not ""say it well."""
691809781313593345,2016-01-26 02:27:59,"At , playing it very safe. Biggest difference w is... Social Security means test."
691809476412833795,2016-01-26 02:26:47,"When cited Scandanavia, remember Mitt NH speech: accusing Obama of turning US into European-style entitlement society."
691677796691636225,2016-01-25 17:43:32,". cannot defy all conventions: launches traditional GOTV push in advance of vote, looking for phone bank volunteers."
690918840654532608,2016-01-23 15:27:42,"The birds found it! Filled it just in case when snow started,"
690610583020838913,2016-01-22 19:02:48,Live stream of DC snowfall frm Capitol balcony of . watching it now.
690511322048364544,2016-01-22 12:28:22,Interesting. new radio ad just out features Jerry Falwell Jr. Bolstering The Donald with conservatives.
690347538218663937,2016-01-22 01:37:33,Run on at secret in DC tonite. Getting ready for
689876380629258242,2016-01-20 18:25:21,"So far, talking about drugs, gangs; not asked about police shootings at US Conference of mayors"
689848387206656000,2016-01-20 16:34:06,Convergence: Flint mayor speaking as protestor not budging US Conference of Mayors
689847914659581952,2016-01-20 16:32:14,Next up mayor
689833869906935808,2016-01-20 15:36:25,". in DC now talking building trust w/ police at US Conf. of Mayors. White House, cabinet sec's meetings."
689562500484898816,2016-01-19 21:38:06,. endorses in . Click candy?
688963716071714816,2016-01-18 05:58:44,"My take on . unrealistic ""Medicare-for-all"" proposal gives opening to"
688908136237953029,2016-01-18 02:17:53,"Need to address ""systemic racism in police system,"" says"
688907564625580032,2016-01-18 02:15:37,". at says both and ""inconsistent"" on gun control."
688906354099138560,2016-01-18 02:10:48,Guns...
688906165015724034,2016-01-18 02:10:03,So &amp; decided on first round not to go after each other on health care. So far.
688905365791047680,2016-01-18 02:06:53,. safe opening at
688904968246562817,2016-01-18 02:05:18,"On eve of MLK Jr. day, recalls seeing him as a youth (in Chicago) at start of"
688899268287967232,2016-01-18 01:42:39,". pre to just out health plan: ""Details matter"" &amp; Sanders ""making them up"" as ""he goes along.”"
688750267932651520,2016-01-17 15:50:34,"""Iran will not get its hands on a nuclear bomb,"" saying re"
688739189349871616,2016-01-17 15:06:33,Just in: Pres. to deliver statement on :45AM ET
688726951649935364,2016-01-17 14:17:55,On set
688721707813703680,2016-01-17 13:57:05,..
688384584531185664,2016-01-16 15:37:29,. Senate primary rival Sunday endorsed by treasurer Kurt Summers. Useful if Summers ever runs for mayor.
688054449760161792,2016-01-15 17:45:38,"The raises relatively little money in , according to Friday disclosure. Story, donor list:"
688035257870856194,2016-01-15 16:29:23,Embattled gets front page in after release of another police shooting video
687989030638583808,2016-01-15 13:25:41,"Endorsement coming: In South Carolina, has joint presser w at :45 am ET ."
687857795924766720,2016-01-15 04:44:12,Oh Canada! Oh New York! The so much the Trump/Cruz show. My take:
687828642500460544,2016-01-15 02:48:22,". sidesteps direct answer when Bartiromo asks if ""is an enabler of sexual misconduct."" Whoa."
687822524424441856,2016-01-15 02:24:03,"Oh, so that's what it was: said not reporting GoldmanSachs loan to Senate campaign ""paperwork error,"" NYT hit piece. ."
687820999149015040,2016-01-15 02:17:59,"""Happy to get a question this early on,"" quips . Thought someone would have to ""wake him up."" . E atmosphere??"
687820728721215489,2016-01-15 02:16:55,"., present gloomy alternate universe compared to optimistic address."
687819714827915264,2016-01-15 02:12:53,". ""You cannot give Hillary Clinton a third (Obama) term."" ."
687819189474570240,2016-01-15 02:10:48,"No matter the question on jobs, starts slamming over the Iranians taking U.S. soldiers “hostage” A quick pivot."
687818392242290689,2016-01-15 02:07:38,"""The good news is the next Commander-in-Chief is standing on this stage,"""
687775092412026881,2016-01-14 23:15:34,"Interesting: Former Sen. Paul G. Kirk Jr., a past chairman of the Democratic National Committee endorsing for president."
687774431679090688,2016-01-14 23:12:57,Missing that at the on . Everyone so angy.
687772829262061568,2016-01-14 23:06:35,"At start of undercard debate, hurls really nasty swipe ; unlike HRC, likes spending time w husband."
687722496590802944,2016-01-14 19:46:35,". outraises chief Senate rivals , Zopp in last quarter."
687645040945029121,2016-01-14 14:38:48,A video tribute to Lois Weisberg via
687643580719083520,2016-01-14 14:33:00,Force of nature.
687642001404203008,2016-01-14 14:26:43,"Chicago has lost a treasure, Lois Weisberg. One of a kind. Condolences to Jacob, June."
687493260462415872,2016-01-14 04:35:40,"My scoop: Obama Center architect hunt advisors include husbands of , Meryl Streep."
687311700123611136,2016-01-13 16:34:13,"For your records...the actual transcript, followed by the prepared text of 's speech."
