id,created_at,text
657237103047147520,2015-10-22 16:48:30,"""I'm sorry this does not fit your narrative,"" to re Susan Rice et al statements after attack"
657236719901790208,2015-10-22 16:46:59,Body language says all: head in hand re lecture from who could not muster question to learn something new.
657232129357684737,2015-10-22 16:28:45,"So what do you want to debunk, defender asks"
657231858632151040,2015-10-22 16:27:40,Sanchez taking down Pompeo for incorrect statements that relied on Sidney for Libya intel.
657231114969444353,2015-10-22 16:24:43,Defender Rep. Linda Sanchez D-Calif. deconstructing relationship w Sidney
657229258142666752,2015-10-22 16:17:20,"Rep. Pompeo R-Ks. focus on , well known friend of who she says ""not at all an advisor"" on Libya."
657227889465819136,2015-10-22 16:11:54,"Breaking: getting largest single gift ever to a law school, $100 million from alum J.B. Pritzker and wife M.K."
657225550906322944,2015-10-22 16:02:36,Did get briefed on security dangers in Libya saying at
657224188357275648,2015-10-22 15:57:11,"Relied on diplomatic security eerts, saying under friend questions from Rep Smith"
657219074276114432,2015-10-22 15:36:52,"So far: questioning turned up nothing new, focused on security procedures."
657217923031945216,2015-10-22 15:32:18,"At hearing, framing her questions to in terms of her eerience as a platoon leader"
657217376451211265,2015-10-22 15:30:07,"Interesting because ...well, do you keep a computer in your office?"
657217074465525760,2015-10-22 15:28:55,"The backstory: running for seat. is backing Duckworth, who has Dem primary rival"
657216468560576512,2015-10-22 15:26:31,Rep. essentially asking about dept. and DOD security assessments at hearing
657215968146554880,2015-10-22 15:24:31,"""I am a very mission driven person,"" noting she has been on other committees looking at attacks"
657215385905840128,2015-10-22 15:22:13,"Questioning now Rep.Tammy Duckworth D-Ill.,wounded Iraq war vet"
657214475989327872,2015-10-22 15:18:36,"Interesting. said no computer in her State Dept. office. ""Most of my work was not done on emails"""
657213407939207168,2015-10-22 15:14:21,"minutes later, a fact question. Rep. Brooks asks how long Amb. Stevens to be in Libya. Open ended is answer."
657212863627530240,2015-10-22 15:12:11,yup.
657212761257201664,2015-10-22 15:11:47,": If you are going to use a visual,make sure it makes a big point-this did not show much"
657212460655579136,2015-10-22 15:10:35,Rep. Susan Brooks R-Ind. theatrical visual: showing her piles of e-mails at hearing.
657210612863356929,2015-10-22 15:03:15,"Republicans keep asking same questions over &amp; over again &amp; pretend they don't know answer, Cummings to at hearing."
657209560160194560,2015-10-22 14:59:04,So far: Lead off questioneer R-Ill.turned up nothing new. Showed his hand by calling Libya policy disaster.
657209057263099905,2015-10-22 14:57:04,"Rep. questioning about broad Libya policy, which he says is a ""disaster."" Did not ask about security"
657207568851456000,2015-10-22 14:51:09,"Rep. again asks if she needs time to look at her notes. He said it's a ""courtesy."" HRC sees it different"
657206928066682880,2015-10-22 14:48:36,"Right tone? tells he'll pause while she is ""reading notes from your staff"""
657206547886510080,2015-10-22 14:47:05,Lead-off question on panel to comes from R-Ill.
657206259863654400,2015-10-22 14:45:57,"""So I'm here,"" says to urging panel to rise above partisanship. ""Our members have questions,"""
657203712327340032,2015-10-22 14:35:49,And that is . US must lead in the world.. making point that diplomats accept a level of risk.
657203154396778497,2015-10-22 14:33:36,"Kicking off testimony, noting prior congressional investigations, and now doing three lessons learned...."
657201936094134272,2015-10-22 14:28:46,"Now turn: Wants to ""honor"" four men who died in"
657201614000910337,2015-10-22 14:27:29,"Data point: Select Committee in17 months spent $4.7 million, a ""taayer funded (GOP) fishing eedition,"" Cummings saying."
657201159061553152,2015-10-22 14:25:41,"Cummings in his opening statement putting hearing in context of GOP presidential politics, all to take down"
657199935461310464,2015-10-22 14:20:49,"Elijah Cummings, the Dem lead on , setting up argument that GOP led panel is just trying to ""derail"" pres. campaign"
657198793641693185,2015-10-22 14:16:17,Will Trey Gowdy get to a question for at hearing...
657197982807252993,2015-10-22 14:13:03,Do you think Trey Gowdy is taking on a combative tone in his opening hearing comments directed at ?
657197709359730689,2015-10-22 14:11:58,"""Let me assure you,"" saying to at hearing this is ""not about you."""
657197480975716352,2015-10-22 14:11:04,"Trey Gowdy kicking off hearing w is dismissing other Congress probes. ""How did they miss the e-mails"""
657195842458152960,2015-10-22 14:04:33,"Flashback: hearing in room where Sept. , '93 as she testified on Clinton health plan"
657160043033403392,2015-10-22 11:42:18,hearing w starts at am ET. Could last all day. Watch it on ;
656867766880903168,2015-10-21 16:20:54,. warning not by name not to run from record
656867407701626884,2015-10-21 16:19:28,Breaking Says he is NOT running for president. Just not time
656832281391140864,2015-10-21 13:59:53,Sets Elections for Oct. . via
656629693735673856,2015-10-21 00:34:53,If becomes ..is back in the Speaker game?
656629046953013248,2015-10-21 00:32:19,So will serve as if all the GOP factions rally around him. Will they?
656628676981825536,2015-10-21 00:30:50,"""I considered to do this with reluctance,"" saying. He's in for Speaker if..."
656628447633088512,2015-10-21 00:29:56,"'Government should do less and do it better,"" is saying."
656628230573703168,2015-10-21 00:29:04,"""People don't care about blame,"" saying at presser. So will Freedom Caucus block him?"
656628035588857857,2015-10-21 00:28:17,"speaking on becoming. Speaker. He'll do it if GOP unites, colleagues ok w/ not being won't be on road with endless fundraising."
656622765303201793,2015-10-21 00:07:21,Ryan will serve as speaker if GOP unites behind him
656566897727664129,2015-10-20 20:25:21,"Hello, : Immigrant crusader asking CEO's of , to drop you as host."
656529914523459584,2015-10-20 17:58:24,remind me...your email.
656518963912904708,2015-10-20 17:14:53,"In the presidential hard money chase, overwhelming all competition in native Illinois."
656516161572597760,2015-10-20 17:03:45,"He's out. She's in for a year. Sandi Jackson - Jesse Jackson Jr. wife - reported to Alderson, W. Va. prison today."
656304888498925568,2015-10-20 03:04:13,: Interesting: George W. Bush unleashes on
656215592513368064,2015-10-19 21:09:23,"Breaking: candidate hardly registering in the polls, to consider Independent run. Will have presser on Tuesday."
656202763320303616,2015-10-19 20:18:25,"Just in: President Obama will host Prime Minister Nawaz Sharif of Pakistan at the White House on Thursday, October ."
656177658632499200,2015-10-19 18:38:39,New poll - Obama approval rating hits an -month high... via
655359461859676161,2015-10-17 12:27:26,Brought my hat to
655356051982786560,2015-10-17 12:13:53,: And we're live on with host and our panel: and
655352986877595648,2015-10-17 12:01:42,Getting ready to be on
655014223303475200,2015-10-16 13:35:35,Big House race money: former Rep. Schneider outraises Rotering in Dem primary as GOP Rep Dold collects most Ill.
655012631707844608,2015-10-16 13:29:15,"Why is very different: Small-dollar donors dominate giving to Sanders, Carson, even"
654987504131645440,2015-10-16 11:49:24,So where is this morning?
654981307684917248,2015-10-16 11:24:47,"Mitt Romney tells has said some ""hurtful"" and ""childish"" things."
654870287419228160,2015-10-16 04:03:38,"gave $84,236 more than the federal limit so Trump campaign last month gave it back."
654865862990532608,2015-10-16 03:46:03,"Last month, campaign paid $40,000 to National Ballot Access in Georgia, which runs paid petition drives, per FEC report"
654677709381963781,2015-10-15 15:18:23,"Obama on keeping more troops in . Country ""will never be a perfect place."""
654675855768072192,2015-10-15 15:11:01,announcing there will not be a troop draw down in
654675649156661249,2015-10-15 15:10:12,"Obama on troops In ""key areas of the country, the security situation is still very fragile"""
654668403966275584,2015-10-15 14:41:25,: Cubs tickets to NLCS are most eensive ever on secondary market.
654667992547000320,2015-10-15 14:39:47,: Hastert eected to plead guilty; a change-of-plea hearing has been set for Oct. .
654658448706015239,2015-10-15 14:01:51,"What's next: at a.m. ET, Pres. delivers a statement on Afghanistan"
654429819577479168,2015-10-14 22:53:22,"Leader hits Chicago Thurs for funder, Friday w University of Chicago IOP"
654428836235472896,2015-10-14 22:49:27,Fundraising Q: Tammy Duckworth beats and Sen. in cash haul; Kirk has more COH.
654291792800518144,2015-10-14 13:44:54,"Buddy Guy, Queen Latifah, MC Lyte, Audra McDonald, Smokey Robinson, James Taylor, Usher &amp; more at White House today"
654143997271797761,2015-10-14 03:57:37,The damn what? Here is the transcript from the
654138342322372608,2015-10-14 03:35:08,Was so caught up in the ...did not mean to overlook....
654133563428896769,2015-10-14 03:16:09,"Top social moment, via came from Sanders: “The American people are sick and tired of hearing about your damn emails!"""
654121479039262720,2015-10-14 02:28:08,"So how would not be an Obama rd term? ""The first woman president will be quite a change."""
654116421300002816,2015-10-14 02:08:02,"A keeper: ""I never took a position on until I took a position,"""
654112129872621568,2015-10-14 01:50:59,"debate line of the night ""Enough of the e-mails!"""
654111826930610177,2015-10-14 01:49:47,"trying to minimize Benghazi probe, saying House committee is an ""arm of the RNC"""
654109351670607873,2015-10-14 01:39:56,"""I am not a pacifist"" Sanders wants to show he is tough enough."
654108793131831296,2015-10-14 01:37:43,Will rivals bring up email? So far nothing.
654104713768640512,2015-10-14 01:21:31,on defensive. gun control his achilles heal? that is for Dem primary voters
654100543883845632,2015-10-14 01:04:56,Debate sanders sidesteps how Democratic Socialist can win general election. Goes to electability.
654100017389637632,2015-10-14 01:02:51,"Is elanation for flips ..well, worked for you?"
654099716158918658,2015-10-14 01:01:39,"Chafee, Webb, O'Malley openings so very J.V. compared to Sanders, Clinton."
654098895748866049,2015-10-14 00:58:23,"""I'm Hillary Clinton."" Oh, so that's who."
654098695546347521,2015-10-14 00:57:36,"""Campaign finance system in corrupt,"" climate change real,"" too much incarceration."" No biography."
654097930853425154,2015-10-14 00:54:33,"""I have learned to be an effective leader,"" says O'Malley at . No magic."
654097474823561220,2015-10-14 00:52:45,"giving a bio opening, no break out in these two minutes. Nice to know about the kids"
654096972211748864,2015-10-14 00:50:45,"Lincoln Chafee flat opening but seemed a swipe at ""I have high ethical standards."""
654095093574594561,2015-10-14 00:43:17,"Play Ball! That is, the . The already won."
654094917879336960,2015-10-14 00:42:35,So Las Vegas! opening act for the
654092358875676672,2015-10-14 00:32:25,"Pres. Obama in pre debate video evokes slogan when he says ""still fired up,"" ""still ready to go."""
654090460588150784,2015-10-14 00:24:52,: But what colors are the four male candidates wearing to ?
654088740344696832,2015-10-14 00:18:02,: Rep. Wasserman Schultz and the DNC staff on stage at .
654087135537049600,2015-10-14 00:11:40,: bounce in four games to clinch first trip to NLCS since !
651867674214039552,2015-10-07 21:12:19,"The factor: on ""based on what I know so far, I can’t support this agreement."""
651548170862895105,2015-10-07 00:02:43,So where is ? What will I be doing tomorrow? My post:
651541001128050688,2015-10-06 23:34:14,"Comm Sec. landed in Havana today, the nd cabinet official in Cuba since re-establishment of diplomatic relations in July"
651454431729352704,2015-10-06 17:50:14,": “I would not just stand there and let him shoot me” --Ben Carson, on how he would've dealt with the Oregon gunman"
651050921359745024,2015-10-05 15:06:50,"It's pizza vs pierogi as the battle the . What Sens. Kirk, Toomey are wagering on the game."
651025355780845569,2015-10-05 13:25:14,"New: David Letterman, Sen. headline ""Serious fun"" fundraiser for Tammy Senate bid"
650679647546552320,2015-10-04 14:31:31,: . says he's not a masochist.
650375793160384512,2015-10-03 18:24:07,. makes another Chicago fundraising swing on Nov. . Here are all the details:
650050332370841601,2015-10-02 20:50:51,"""Pope Francis I love... And he gas a good sense of humor,"" Obama says."
650039645431037952,2015-10-02 20:08:23,": . on outgoing Secretary of Education, ."
650036752175005696,2015-10-02 19:56:53,". ""brought the values he learned at home in Hyde Park and the eerience of leading Chicago's public schools"" to dc"
650035490419306496,2015-10-02 19:51:52,"""Can't wait to come home,"" heading back to Chicago"
650034669468131328,2015-10-02 19:48:36,"says came to dc ""just wanted to be on his team"""
650033438678913024,2015-10-02 19:43:43,"Obama on returning to chicago: ""I've pushed Arne to stay"""
650030400631386112,2015-10-02 19:31:39,"At White House, Obama press conference to start soon"
649981434942222338,2015-10-02 16:17:04,quitting as Ed. Sec. Family already moved back to Chicago ; tells staff he does not know what's next.
649759878458810369,2015-10-02 01:36:41,". fundraises in Chicago, starts to build Illinois operation. Delegate petitions circulate Oct. ."
649708709770317825,2015-10-01 22:13:22,Pres. Obama to make a statement at :20 p.m. ET.
649638074876604417,2015-10-01 17:32:41,: Q3 fundraising numbers so far: Clinton: $28 million Sanders: $25 million Carson: $20 million Bush: &gt;$11 million
649625411345760257,2015-10-01 16:42:22,"quotes late on constant bashing: ""Deja vu all over again."""
649621427742769152,2015-10-01 16:26:32,"""The people of Israel live. Am Yisroel Chai!"""
649620957875666945,2015-10-01 16:24:40,"at "" ""The days when the Jewish people remain passive"" in the face of ""genocidal enemies, those days are over."""
649620220357836800,2015-10-01 16:21:44,"at : The world offers only ""deafening silence"" when threatens to wipe out Israel. Followed by his very long silence."
649580646004846592,2015-10-01 13:44:29,". in Chicago. ILL. petitions start Oct. . Ben, got nothing real going. My column:"
649347467939586048,2015-09-30 22:17:55,Rep. not running for leadership spot.
649311445851705344,2015-09-30 19:54:46,"Just in: lawyers blast prosecutors for suggesting Schock ""deceptively refused"" to produce documents."
649216724298956803,2015-09-30 13:38:23,Hi Mike...Try this...
649210200579112960,2015-09-30 13:12:28,"New developments in , Zopp big primary w walk on from 's Artl. My column:"
649074997416300544,2015-09-30 04:15:13,"contd. ""Fortunately, she was with colleagues at the time and taken to the hospital for treatment. Initial reports are very encouraging."""
649074865748713473,2015-09-30 04:14:41,"Pres. Clinton &amp; Chelsea on Donna Shalala: ""As some of you may have heard, Donna suffered a stroke this evening after CGI.."" contd"
648896173193957376,2015-09-29 16:24:38,: Jeb Bush has lost support across the board - even among moderates - new WSJ/NBC poll finds.
648676762553991168,2015-09-29 01:52:46,"Should post-Boehner House Republicans be more ""rhetorically aggressive?"" My column:"
648589952528351232,2015-09-28 20:07:49,launches Speaker bid; why he wants the job (and what's next for Rep. )
648522433750827008,2015-09-28 15:39:31,Dennis Hastert could go to trial as early as March or April: By Jon Seidel
648505072729595904,2015-09-28 14:30:32,"Obama at Nations can ""control information,"" but ""you cannot turn a lie to truth."" Just too much social media..."
648504582398681088,2015-09-28 14:28:35,"Obama at : ""We understand the United States cannot solve the world problems alone"""
648503428507828224,2015-09-28 14:24:00,"Obama speaking now at : The march to ""human progress""never"" marched ""in straight line."" meeting later today."
647792195383242752,2015-09-26 15:17:49,"In wake of departure, Rep. sets stage for move up: Wants meeting to heal ""fractures."""
647580877883580416,2015-09-26 01:18:07,"was busy, just posted. thanks for your note."
647580732618108928,2015-09-26 01:17:32,The China State Dinner invited guest list:
647578905730228225,2015-09-26 01:10:17,"Campaign of launches pre-emptive strike against unpublished, likely negative story:"
647578572039823360,2015-09-26 01:08:57,"yes, have been jammed today..give me a few minutes.."
647459300500242433,2015-09-25 17:15:01,"""It was never about the pope,"" saying"
647458869711622144,2015-09-25 17:13:18,seems very chipper.
647458497316065280,2015-09-25 17:11:49,Wow. Said he woke up today and decided now is time to quit
647457486493097984,2015-09-25 17:07:48,presser to start in two minutes
647455938488594432,2015-09-25 17:01:39,press conference to start in a few minutes.. Packed presser.
647445118916493312,2015-09-25 16:18:39,"Why is quitting: tells me he was ""very tired, fed up."" Predicts McCarthy new Speaker."
647404408163168256,2015-09-25 13:36:53,"from , Speaker John Boehner retiring from Congress at the end of October"
647102873810173953,2015-09-24 17:38:42,Help Wanted. But you will need a top secret security clearance for an archivist job at the Obama Library.
647087477400866816,2015-09-24 16:37:31,", summary invokes Golden Rule, immigration, gun control, death penalty, indirectly abortion."
647066067211321344,2015-09-24 15:12:26,". D-Ill. said being in the Chamber for speech was ""just electric."""
647065842958626820,2015-09-24 15:11:33,"And if you don't/can't pray ""Send good wishes my way."" ""&amp; ""God Bless America."""
647065679103950848,2015-09-24 15:10:54,"""So moving. ""I ask you all please to pray for me."" to crowd at West front of Capitol."
647065399754928128,2015-09-24 15:09:47,Make that flanked by addressing thousands West front of Capitol. In Spanish.
647065002688577536,2015-09-24 15:08:13,"History! Pope flanked by Biden, House Senate leaders greet crowd from Speakers balcony"
647064524953096192,2015-09-24 15:06:19,After speech waiting to see if Pope will greet thousands on the West Front of the Capitol.
647062353922560000,2015-09-24 14:57:41,"finished speech. To note: He stood under the chiseled words in the well of the House: ""In God We Trust."""
647061964917600258,2015-09-24 14:56:08,"""A nation can be considered great when it defends liberty as Lincoln did"""
647060682563825664,2015-09-24 14:51:03,tells Congress: duty to stop the arms trade.
647060296666759171,2015-09-24 14:49:31,What makes a good political leader... ..one ingredient...pragmatist
647059289668997120,2015-09-24 14:45:31,To ponder. How would Congress operate if members operated only on the . Gold Rule Caucus?
647058764714110976,2015-09-24 14:43:25,"""No doubt"" has ""an important role to play"" to combat poverty, protect nature."
647056969946267650,2015-09-24 14:36:18,"calling for the global abolition of the death penalty. ""Every life is sacred."""
647056741490950144,2015-09-24 14:35:23,"also ""to protect and defend human rights in every stage of its development"""
647056316691779585,2015-09-24 14:33:42,For one day at least: gives standing ovation to invoking the . Do unto others...
647055488669077504,2015-09-24 14:30:24,now on refugee crisis. BTW.. reached out to shake hand of Sec. Kerry when he entered House chamber
647055274654601216,2015-09-24 14:29:33,"More from on immigration: ""When a stranger "" is in our midst, "" we must not commit the sins and the errors of the past."""
647054713771261952,2015-09-24 14:27:20,"Big line from ""Most of us were once foreigners."""
647054472938713088,2015-09-24 14:26:22,"in DC gets standing ovation for his mention of anniversary of march and how US for many is ""land of dreams."""
647052889018486784,2015-09-24 14:20:05,"The mentioned ""great Americans."" They are Abraham Lincoln, Martin Luther King, Dorothy Day and Thomas Merton"
647051934642380800,2015-09-24 14:16:17,noting this year in th anniversary of Abe Lincoln assassination. .
647050458683600896,2015-09-24 14:10:25,"is a role model for , says"
647050040284999680,2015-09-24 14:08:45,"""I, too, as a son of this great continent,"" at"
647049083350335488,2015-09-24 14:04:57,"As enterered House chambers, members behaved and did not glad-hand him on the way in."
647033125541937152,2015-09-24 13:01:33,Now en route to the Capitol to address Congress.
646412116736524288,2015-09-22 19:53:53,"Among Pope Francis airport greeters: POTUS, FLOTUS; her mom + daughters Malia, Sasha; Bidens' w/ their grandkids. per pool report"
646387318149001216,2015-09-22 18:15:20,"Here's the link to media guide for Pope Francis U.S. visit - full of details about each stop, who's who"
646316333207003137,2015-09-22 13:33:16,Why incoherence is Donald Trump's friend
646083750510653440,2015-09-21 22:09:04,": lots of plausible factors contributing to Walker's collapse, but at the top of list would have to be just his performance as …"
646083629777616896,2015-09-21 22:08:35,"Scott Walker drops out of presidential race, urges rivals to quit-so a stronger contender can challenge the frontrunner..that would be Trump"
646014324125904896,2015-09-21 17:33:11,Former Sen. Adlai Stevenson III rescinds endorsement of former Rep. Brad Schneider over .
646012272087801856,2015-09-21 17:25:02,: Here’s what the tickets look like for the telecast of the Pope’s address.
645984848193040384,2015-09-21 15:36:04,Just In: President Obama will welcome President Joko Widodo of Indonesia to the White House on October .
644975215135588352,2015-09-18 20:44:09,Jesse Jackson Jr. completes prison sentence today. Sandi Jackson to report to prison within days.
644952144290926592,2015-09-18 19:12:28,"Just in: architecture firms throw hat in ring to design library, museum. My story:"
644845486965452800,2015-09-18 12:08:39,"For a change of pace, I write about a sex scandal and air marshals. My column:"
644712246174687232,2015-09-18 03:19:12,Clinton Campaign Chairman Questions Whether Biden Can Catch Up Organizationally via
644591806261297152,2015-09-17 19:20:37,"New: taps Hedieh “Roshan” Ghaffarian to be White House Chief Floral Designer. Born Iran, raised in Calif. Will do China state dinner"
644375951850213376,2015-09-17 05:02:53,outstanding night. hardly looking presidential. My take:
644344972557332480,2015-09-17 02:59:47,". would not put a woman on any bill. ""It's a gesture."""
644343858462097408,2015-09-17 02:55:21,What woman should be on $10 bill? Huckabee says his wife. But person has to be dead.
644341096781344768,2015-09-17 02:44:23,Walker?
644340428884561920,2015-09-17 02:41:44,said would give up his Social Security but sidestepped policy question if rich should not get benefit.
644339298838294528,2015-09-17 02:37:14,"Wow. In exchange about legalizing drugs, said she and husband ""buried a child because of drug addiction."""
644317913491443712,2015-09-17 01:12:16,"That exchange between Fiorina and Trump on her looks: Trump tone deaf in his reply about her ""beautiful face."""
644317120495517696,2015-09-17 01:09:07,"perfect reply slam on her looks "" women all over this country heard"" him very clearly"""
644316569930231813,2015-09-17 01:06:55,Walker just jumped in bickering between Trump and Bush over Bush and women's health and defunding Planned Parenthood
644316205260652544,2015-09-17 01:05:28,Scott Walker can't figure out a way to get in the game.
644313003014397952,2015-09-17 00:52:45,fact checks Trump. He did want Florida casinos.
644311094257954817,2015-09-17 00:45:10,"President Obama will host Xi Jinping, President of People’s Republic of China, at the White House for an official State Visit on Sept. ."
644311044941348864,2015-09-17 00:44:58,Scott walker point: Why is Obama giving a State Dinner for China's leader?
644309193692942336,2015-09-17 00:37:37,"""More energy, I like that,"" Trump said when Bush went after him re pushing for Florida casinos."
644307785216323584,2015-09-17 00:32:01,why not?
644306550031519744,2015-09-17 00:27:06,"Walker came ready ""We don't need an apprentice in the White House, we have one now."""
644306050435428352,2015-09-17 00:25:07,"So it's Trump who is looking for the fight, not the ten others in"
644305295540420608,2015-09-17 00:22:07,". Fiorina declines Jake's invite to stomp on Trump. Trump cant contain himself any longer, just attacks Rand Paul out of the blue"
644304550179020800,2015-09-17 00:19:10,", Kasich, striking just the right tone in the beginning. Christie OK."
644304228668866561,2015-09-17 00:17:53,"""From secretary to CEO,"" . Very steely."
644303972371705856,2015-09-17 00:16:52,". deliberate probably, opens very low key. Lots of self control. Walker does nothing special."
644303587334574080,2015-09-17 00:15:20,Could have been flatter?
644303526940774400,2015-09-17 00:15:06,"Very smart opening by Hucklebee, disarming critics of . ""We have our own Mr. T."""
644302424887455744,2015-09-17 00:10:43,Sen. Lindsey Graham wins the underdog debate. My take:
644292702637457408,2015-09-16 23:32:05,"Graham says Obama “is a weak, unqualified commander in chief.”"
644289739017875460,2015-09-16 23:20:18,Lindsey Graham taking over this debate. In tone and in substance.
644286816661716992,2015-09-16 23:08:42,you waiting on that?
644286060994928640,2015-09-16 23:05:41,Santorum re gay marriage “I’d like the left to give a list of jobs Christians” aren’t allowed to have. Really?
