id,created_at,text
866605247111868416,2017-05-22 10:42:46,: He also campaigned on preserving Medicaid!
866597626023694337,2017-05-22 10:12:29,:
866597211563589632,2017-05-22 10:10:50,: Who radicalized the man who killed Richard and what's being done to disrupt these networks?
866596228188000256,2017-05-22 10:06:56,Draining the swamp
866472888202866689,2017-05-22 01:56:49,: If only Trump could solve the mystery of the White House leaker!
866472338933641216,2017-05-22 01:54:38,lol
866471996896497665,2017-05-22 01:53:16,Seems clear to me. Either Bernie will run and win or else he'll stand aside in favor of someone younge…
866468174618820610,2017-05-22 01:38:05,"I like this one guy who got the warning not to look directly at the orb, lest his face melt like in Raiders of the…"
866467421204492288,2017-05-22 01:35:06,"Some fake news is made for clicks and money, this is propaganda designed to facilitate a coverup."
866452991221653504,2017-05-22 00:37:45,"Uber, but for orbs."
866451336510009345,2017-05-22 00:31:11,"This mentality is what's actually behind all the ""campus pc"" stuff conservatives then turn around and freak out abo…"
866447340722429952,2017-05-22 00:15:18,This one is good
866440064825425921,2017-05-21 23:46:23,The reason to come up with sound policy ideas to help you govern effectively not to win elections.
866435035288793094,2017-05-21 23:26:24,": Yes. Dems have to do the policy work now, so if/when we take back Congress (I understand it will be a while from now) we'r…"
866434845362311168,2017-05-21 23:25:39,: Pete Stark's underheralded AmeriCare plan is a very smart way of transitioning to single payer: http…
866429914886668289,2017-05-21 23:06:03,"""Medicare for All"" could describe a lot of different things. Get on the bus and fill it out with a smart program."
866429749664546817,2017-05-21 23:05:24,Well the nominee is going to be Bernie or someone he backs.
866429073110728704,2017-05-21 23:02:43,"Given that Dems are clearly going to end up running on single-payer, those with concerns should focus on trying to make it a smart plan."
866424981680525313,2017-05-21 22:46:27,Gold. Pressed. Latinum.
866416859729580032,2017-05-21 22:14:11,The tweep forum?
866403904904454144,2017-05-21 21:22:42,"Seriously, though, how does the world's mightiest superpower not rate solo orb time? It's an embarrassment."
866403094980173825,2017-05-21 21:19:29,Why was Sisi there?
866401404243636224,2017-05-21 21:12:46,"This only works because of Germany's eansive, sunny deserts and wind-swept plains; would never work in the USA."
866400829326188544,2017-05-21 21:10:29,"In truth, it turns out the power of the orbs and it always has."
866400700200357888,2017-05-21 21:09:58,: just now
866400567672877056,2017-05-21 21:09:26,: Here's just how much Hillary Clinton's emails dominated the campaign
866398521364230144,2017-05-21 21:01:19,: Lefferts Blvd. in Kew Gardens is a sad study in zoning. Post-1961 building wedged between two earlier garden apt bldgs…
866386899421863936,2017-05-21 20:15:08,"""Elites scoff, but in the working class suburbs of Grand Rapids voters are glad Trump is practicing orb magic with Arab dictators."""
866386055125184513,2017-05-21 20:11:46,"The advance work on this trip is hilarious: Sword dance, all-male Toby Keith concert, secret Tillerson press conference, magic globe, ..."
866385292974051328,2017-05-21 20:08:45,It's a palantír
866383842487279621,2017-05-21 20:02:59,America First!
866372469216751617,2017-05-21 19:17:47,I'm glad the US would never deny visas using national origin as a thin cover for religious discrimination.
866369231708971010,2017-05-21 19:04:55,Low energy?
866356371775795200,2017-05-21 18:13:49,Same
866354417536249856,2017-05-21 18:06:03,This honestly gets to so much of what ails us in modern American society.
866350232963043328,2017-05-21 17:49:26,"Well, yes, bad policies exist because of pressure to keep them in place. They are still bad."
866349735476592640,2017-05-21 17:47:27,Jon Ossoff has a nice-looking kitchen.
866349098441592833,2017-05-21 17:44:55,His latest ad buys seem to be all about health care.
866348482646421504,2017-05-21 17:42:28,"Well, the petrostates need to stick together. I dunno what’s up with this lottery."
866348081574490113,2017-05-21 17:40:53,The real scandal is the massive donations to the Clinton Foundation from the Swedish Postcode Lottery.
866347919712161792,2017-05-21 17:40:14,Huh. I’d have thought Trump would be less popular in GA-6.
866347344744370176,2017-05-21 17:37:57,White working class tho?
866346708241928192,2017-05-21 17:35:25,"If Hillary had only added Anthony Weiner to the Seth Rich contract, she’d be president today."
866346475202236420,2017-05-21 17:34:30,S H A BENGHAZI B A T
866343210003640324,2017-05-21 17:21:31,That seems like a smart way to campaign in Montana.
866339754706690048,2017-05-21 17:07:47,Plop a couple of volcanoes down in the San Francisco Bay and we’ll be in great shape.
866339533515829250,2017-05-21 17:06:55,No that was volcanoes.
866338348901773312,2017-05-21 17:02:12,Land is inherently scarce. We have the technology (dense buildings) to ameliorate land scarcity. Bad zoning pre…
866337861217529856,2017-05-21 17:00:16,The idea is that slavery-induced increases in cotton supply were critical…
866337533516492801,2017-05-21 16:58:58,That seems like a pretty loose summary of Baptist’s book.
866336637512556547,2017-05-21 16:55:24,Obama reads prepared text: Affirmative Action President Trump reads prepared text: Extremely Presidential
866336041686487040,2017-05-21 16:53:02,Sounds more like the Cuck Foundation
866335533131341825,2017-05-21 16:51:01,Wait slavery caused the industrial revolution?
866335346367352832,2017-05-21 16:50:16,"Must read. And remember that while this is an extreme case, there are deleterious lead levels in basically every Am…"
866335182214897665,2017-05-21 16:49:37,very presidential
866330165751709700,2017-05-21 16:29:41,omg it's really happening
866329903939170304,2017-05-21 16:28:39,The fact that Team Trump insist on acting as accessories after the fact for Russian hackers is certainly suggestive.
866328545156583424,2017-05-21 16:23:15,Trump did a competent delivery of a competently prepared text. Does this mean he's good again like last time?
866328378516926466,2017-05-21 16:22:35,": Trump ""forgets"" to mention Israel among nations suffering from terror. If it was Obama, the bombers would be on their way"
866302630628384768,2017-05-21 14:40:16,tfw you were going to put America first but the gulf states had some good bribes
866302261579980800,2017-05-21 14:38:48,King Salman had the greatest Electoral College win in Saudi History.
866301562074935297,2017-05-21 14:36:02,": Ivanka gives Saudi speech on female empowerment. Female reporters were kicked out, but were told later it was great! https…"
866292381888499712,2017-05-21 13:59:33,How I Met Your Mother
866292116544253952,2017-05-21 13:58:30,What's striking to me is the fairly rapid pace at which life comes at you.
866283458385125376,2017-05-21 13:24:05,What?
866282917462507521,2017-05-21 13:21:56,🤔🤔🤔
866282644950175744,2017-05-21 13:20:51,Okay but everyone knows what happens in the elite Tehran bubble doesn't count. Land area &gt; people.
866270790123212801,2017-05-21 12:33:45,The whole point of an obstruction of justice charge is that an otherwise legal act may be illegal if it's undertake…
866252768020967424,2017-05-21 11:22:08,"Look, he pretended to have been against the war in Libya"
866246839124856832,2017-05-21 10:58:35,This is why we plot a sick kid's fever in Kelvin with a y-axis starting at Absolute Zero. Anything else is dishones…
866115395920572416,2017-05-21 02:16:16,": ""what about the muslim ban steve"" ""yeah steve whose idea was the muslim ban"" ""who came up with the muslim ban steve"""
866104205517500417,2017-05-21 01:31:48,I need to wait for the sequel to come out on iTunes next week. Rewatching the original in anticipation.
866100476064018433,2017-05-21 01:16:59,"Among other things, it’s way too nice! If you’re in the market for this service, you’re not really paying for the amenities."
866099104794988544,2017-05-21 01:11:32,"Love a good revenge yard, but the business model of the Continental Hotel really doesn’t make much sense."
866098728767193088,2017-05-21 01:10:02,Cannot believe how many people are letting themselves get baited into hate-clicking this.
866079989493641225,2017-05-20 23:55:35,What kind of cuck visits friendly democracies before Saudi Arabia?
866078097073942530,2017-05-20 23:48:03,: BREAKING: Sheriff David Clarke plagiarized portions of his master's thesis on homeland security
866076679537643520,2017-05-20 23:42:25,He's like the Tim Duncan of Senators.
866074773029355520,2017-05-20 23:34:51,Can't believe said this thing that I am screenshotting out of context &amp; construing ungenerously. Please…
866067588580769792,2017-05-20 23:06:18,: Murphy is one of the too few Democrats who has credibility on this. He aggressively criticized sales to Saudi Arabia under…
866067245377744899,2017-05-20 23:04:56,[eyes emoji]
866046956099051521,2017-05-20 21:44:19,"Would rather read MT-AL polls than Trump approval polls, but people are only doing the latter."
866033324950683650,2017-05-20 20:50:09,More houses!
866032212856143877,2017-05-20 20:45:44,"I saw the Yeah Yeah Yeahs play in Stockholm once, which was sort of the opposite of that."
866031167975436288,2017-05-20 20:41:35,"I think ""all-male Toby Keith concert in Riyadh"" might be what the Ministry of Love has in my Room ."
866030210449321984,2017-05-20 20:37:46,What Channel is Hannity on anyway?
866029683665711105,2017-05-20 20:35:41,": In ""Get Me Roger Stone,"" look who appears to be at one of ’s speeches: Carter Page (who Roger claims to not…"
866029402903248901,2017-05-20 20:34:34,: The pooler is a woman
866026859611516929,2017-05-20 20:24:27,"Thanks to Trump, human rights matter even less than before in the US-Saudi relationship."
866025208930586624,2017-05-20 20:17:54,A misleading feature of the Menschiverse is that in the fiction there's reasonably robust opposition to Trump from the institutional GOP.
866021015566123009,2017-05-20 20:01:14,Arguably the smart move for Trump to keep the party on side and Fox ratings high would be to lock her up on Espionage Act charges.
866017213932810240,2017-05-20 19:46:08,You have to admit this would be a sensible rule to institute
866004874714075138,2017-05-20 18:57:06,: I was wondering how they'd deal with women in the press pool if the president attended.
866000671170056192,2017-05-20 18:40:24,Russians dunking on Trump too now
865999620396261376,2017-05-20 18:36:13,Why doesn't Trump declassify the intel that would prove Hillary killed Seth Rich to frame Russia for the DNC hack?
865993153832263681,2017-05-20 18:10:31,Is he also saying the Cultural Revolution belongs in the pro column?
865991743996653568,2017-05-20 18:04:55,Any day is a good day to honor those who serve.
865991640804151296,2017-05-20 18:04:31,"In the ad, I think you use this clip while the voiceover talks about Trump rolling back fuel efficiency standards t…"
865990748189196289,2017-05-20 18:00:58,¯\_(ツ)_/¯
865988923465531394,2017-05-20 17:53:43,That’s got to be like % of the whole state’s population.
865987715166334976,2017-05-20 17:48:55,A bitter legacy of is I’m now often confused if self-described socialists actually just mean they support a larger welfare state.
865986105992204288,2017-05-20 17:42:31,Jury’s still out on the hero of Tal Afar.
865985964010864640,2017-05-20 17:41:57,Trump taking action to facilitate more Saudi war crimes in Yemen.
865985359041228800,2017-05-20 17:39:33,"To be fair, counterinsurgency has also failed completely in Afghanistan so… um …"
865984134899957760,2017-05-20 17:34:41,I feel like revisionism has been the hegemonic position ever since George Packer’s profile of H.R. McMaster.
865982872112517120,2017-05-20 17:29:40,Another bit of outrageous misconduct from the Turkish government without a peep from the president.
865982038507237376,2017-05-20 17:26:21,: God bless America.
865981800165892098,2017-05-20 17:25:24,Broad social tolerance of the de facto quotas on Asian applicants to Ivy League universities is remarkable.
865981283243044865,2017-05-20 17:23:21,"And the reign of terror he promised to unleash on immigrant communities is, more or less, taking shape even without a “deportation force.”"
865981083006926848,2017-05-20 17:22:33,Trump is getting things done and delivering for the people he cares about (rich businessmen) — media coverage hasn’t always reflected that.
865980713916653568,2017-05-20 17:21:05,"Last but not least, he’s succeeded in deliberately introducing more instability and higher premiums into the individual insurance market."
865980482143518723,2017-05-20 17:20:10,Another important Trump success is aimed at making it easier for financial advisors to deliberately give their clients bad advice.
865980329965887488,2017-05-20 17:19:34,Trump’s also taken action to slow the pace of automobile fuel efficiency improvements. Nice.
865980137640218625,2017-05-20 17:18:48,"Thanks to Trump: It’s now easier to dump coal waste in streams, for oil companies to pay bribes, and for ISPs to sell user data."
865979976541188097,2017-05-20 17:18:10,"Right on day one, Trump acted to make mortgages more eensive for middle class homebuyers. He’s also signed a lot of important CRAs."
865979831061819393,2017-05-20 17:17:35,There has been somewhat excessive coverage of leaks and internal chaos relative to Trump’s policy successes. Let’s…
865978751330525185,2017-05-20 17:13:18,Says it lowered the growth rate by % not that it lowered GDP by %.
865973493170671618,2017-05-20 16:52:24,"Fox continues to operate like a state propaganda network, not an ideology-driven news source."
865973326740631554,2017-05-20 16:51:44,"""relative employment in New York, San Francisco, and San Jose also fell."""
865972517713981441,2017-05-20 16:48:31,"Never gonna own a home if you eat like this, though."
865972385941524481,2017-05-20 16:48:00,America First
865972037344534530,2017-05-20 16:46:37,Big if true (and it is).
865959696557109249,2017-05-20 15:57:35,Gross coziness with Gulf autocrats is probably the most mainstream thing about Trump.
865959021945257985,2017-05-20 15:54:54,He hasn't even locked her up!
865951822212628480,2017-05-20 15:26:17,: So when on this trip does Trump ask the Saudi royal family for a trillion dollars?
865943883133399042,2017-05-20 14:54:44,Land reform is the best cure for America's growth woes
865943290067210241,2017-05-20 14:52:23,What he's trying to say is that the prime age labor force participation rate still hasn't recovered to its lev…
865939673742540800,2017-05-20 14:38:01,Nothing contradictory here. Trump is just saying he judges matters by how much money he can make personally.
865936915534577668,2017-05-20 14:27:03,A lot of good journalism happened in campaign but the overall coverage gestalt utterly failed to convey what w…
865932040834777088,2017-05-20 14:07:41,I *think* Trump would honor Article V obligations but I'm not *sure* and neither is anyone else. That's incredibly dangerous.
865931703277297664,2017-05-20 14:06:20,"Trump/Russia thing isn't just a ""scandal"" it's a question of whether undermining NATO credibility will spark war or collapse the alliance."
865931282886381569,2017-05-20 14:04:40,This is an excellent point and crucial context for Trump talking about his desire to evade the Russia investigation.
865926580371152896,2017-05-20 13:45:59,Pretending to believe Mike Pence about this could be the best thing for everyone.
865921993056690178,2017-05-20 13:27:45,Now clearly below the AHCApocalypse One low point.
865919917995982849,2017-05-20 13:19:31,Just want America needs: More impulsiveness in blowing things up.
865917171628691456,2017-05-20 13:08:36,At least under Trump our president isn't bowing anymore...
865910121301499904,2017-05-20 12:40:35,"Stronger, even?"
865910003529506823,2017-05-20 12:40:07,"Looks to me like the latest smug ""humanities are nonsense"" hoaters actually played themselves."
865909759827992576,2017-05-20 12:39:09,: The journal is not a serious one. It looks like the joke is on the authors.
865902296743505920,2017-05-20 12:09:29,There is always an old Trump tweet
865884617039065089,2017-05-20 10:59:14,This is an absurd act of sabotage of the area's economy. Maine should be proud of this beautiful new addition to th…
865884399195357185,2017-05-20 10:58:22,Raisi didn't do enough campaign stops in Wisconsin
865766067578318849,2017-05-20 03:08:10,Seems like a false choice. X ignores Trump's obstruction of justice because they're working together to take peopl…
865764762508038144,2017-05-20 03:02:59,Can only poop in Trump-branded properties. Would elain so much.
865763711142809600,2017-05-20 02:58:48,"Thanks to extensive media coverage and multiple congressional hearings, the public ended up very well-informed about this critical matter."
865763098321399808,2017-05-20 02:56:22,"As Secretary of State, Hillary Clinton exempted herself from a generally applicable IT rule that she found inconvenient. It was a big deal."
865762470786478081,2017-05-20 02:53:52,"Interestingly, television news coverage of the campaign focused primarily on Hillary Clinton's choice of email accounts."
865754298998808576,2017-05-20 02:21:24,We need a special counsel to investigate what's happening in this game.
865753373513060353,2017-05-20 02:17:43,: How To Talk To Your Children About What The Cavaliers Are Doing To The Celtics
865749203624099840,2017-05-20 02:01:09,Gonna have to do an emergency pod about this game. An embarrassment to the country.
865748613766553602,2017-05-20 01:58:49,Makes you think
865747162046619648,2017-05-20 01:53:02,lol Celtics
865741995892985857,2017-05-20 01:32:31,": Re the Trump ACA nuclear button, do not forget that it is entirely in Congress's power to stop it at any moment. https:/…"
865741344823705601,2017-05-20 01:29:55,Much respect for the NYT and Washington Post but for the next few days it would be better to leak the juicy stuff to a Montana newspaper.
865740928211922945,2017-05-20 01:28:16,Every health group in America warns Trump is making millions of people's lives worse out of spite.
865734797565599746,2017-05-20 01:03:54,This would lead to a lot of corrupt kickback schemes.
865732545941524485,2017-05-20 00:54:58,The greed and lack of self-respect on the part of already wealthy conservative infotainment stars is remarkable.
865732056814415874,2017-05-20 00:53:01,: Apple WWDC17 Scholarship Winner
865732005526470656,2017-05-20 00:52:49,: But it reads better in its original Russian.
865731754006654976,2017-05-20 00:51:49,": That's quite a way of saying ""racists""..."
865719012407246849,2017-05-20 00:01:11,"At last, a Council of Economic Advisors."
865707100164501505,2017-05-19 23:13:51,When Beyoncé dropped the secret album. Opsec on that still blows my mind.
865706246955040768,2017-05-19 23:10:27,"Tax cuts, rollback of environmental protection and bank regulation, no minimum wage hike, Gorsuch on SCOTUS, net ne…"
865705376175489025,2017-05-19 23:07:00,Pence would keep on trying to take millions of people's health insurance away. Impeachment only fixes so much.
865705088601509888,2017-05-19 23:05:51,I *think* Murdoch will get sick of constant non-stop pro-Trump propaganda if it sinks his ratings.
865704184531832833,2017-05-19 23:02:16,: [INCEPTION BWONG SOUND]
865703681647312896,2017-05-19 23:00:16,": Meanwhile, in stuff we should actually be dealing with"
865703033887481857,2017-05-19 22:57:41,"I don't know any ""senior"" administration officials but there are definitely political appointees who eress little…"
865698462817546241,2017-05-19 22:39:32,Globalists falling into disfavor?
865690019750662144,2017-05-19 22:05:59,Some reading for the counsel's office
865689042385555458,2017-05-19 22:02:06,When you put it that way it sounds bad
865686810382528513,2017-05-19 21:53:13,This --&gt;
865679612751302656,2017-05-19 21:24:37,If they are so worried why are they constantly covering for his family's corruption?
865675334401884160,2017-05-19 21:07:37,": Joe Lieberman's political history and extreme views on a number of issues, would make him a divisive nominee. That is not w…"
865675227493261315,2017-05-19 21:07:12,: Trump staffers celebrating a successful week on the east balcony of the EEOB. Red cups in view.
865675166336135170,2017-05-19 21:06:57,"McMaster is an active duty military officer, he can’t decline an assignment."
865674695332556800,2017-05-19 21:05:05,Imagine having H.R. McMaster’s career and then being saddled with Michael Fucking Anton as your spokesman.
865668275123798016,2017-05-19 20:39:34,In this case I really wonder if Deputy Assistants are included.
865667807064621057,2017-05-19 20:37:43,Discussion of the Flynn/Turkey/Raqqa situation and Robert Mueller’s background and authority are still relevant!
865667342017019904,2017-05-19 20:35:52,: About to go on . Trying to catch up as everything is breaking around . Can we hit pause so…
865666443500716033,2017-05-19 20:32:18,True.
865663180353093632,2017-05-19 20:19:20,"Say what you will about Trump, so far his email server management has been rock solid -- exactly as promised"
865662335771320320,2017-05-19 20:15:58,This happened too
865661450081234944,2017-05-19 20:12:27,---&gt;
865661196912996352,2017-05-19 20:11:27,Fox was originally about conservative infotainment for profit but this kind of editorial decision making has to hur…
865658983855529985,2017-05-19 20:02:39,If my dad were a senator I'd try to get him to do something about this.
865657000230649858,2017-05-19 19:54:46,"When not yucking it up with the Russians about obstruction of justice, Trump is trying to wreck millions of people'…"
865656562899136512,2017-05-19 19:53:02,Amazing flub here
865655870595645442,2017-05-19 19:50:17,A real nutjob.
865655095500853249,2017-05-19 19:47:12,: i learned a new computer thing
865654492385103872,2017-05-19 19:44:48,Maybe Trump was just joking? Everyone is joking these days.
865648302141849601,2017-05-19 19:20:12,"I always wish outlets would publish official guidance as to which officials are considered the ""senior"" ones."
865646829584633858,2017-05-19 19:14:21,"In a real banana republic, Mattis would send some guys to take over the Fox studios and install Pence tonight."
865646546464849921,2017-05-19 19:13:14,: We know you've been craving more analysis of DC drama from the wonks . So starting today we get into The Weeds tw…
865646464256450560,2017-05-19 19:12:54,Just don't come back from the trip.
865644910396887040,2017-05-19 19:06:44,jfc
865641803344617472,2017-05-19 18:54:23,I really enjoyed “Evicted” but this passage is silly bothsidesism.
865641618530910210,2017-05-19 18:53:39,Oh it’s been dropped. Huh. Funny.
865640894522834944,2017-05-19 18:50:46,FRIDAY WEEDS on Soundcloud. All the Trump scandal drama you’ve been craving.
865640797017841666,2017-05-19 18:50:23,Nah. Zero marginal cost of distribution = free product.
865639476462206976,2017-05-19 18:45:08,: I did a podcast thing! Check us out!
865639378915172352,2017-05-19 18:44:45,"This was supposed to be Trump’s appeal, too."
865639230805954560,2017-05-19 18:44:10,“We held off on raising because financial markets figured out the president is a moron” is going to be hard to put into an FOMC statement.
865638287028793345,2017-05-19 18:40:25,Today is me with &amp; breaking down the Special Counsel and the latest Michael Flynn scandals.
865638029137821696,2017-05-19 18:39:23,Starting today THE WEEDS will be regularly podding twice a week.
865637835608530944,2017-05-19 18:38:37,I am excited about ’s book.
865636046603669505,2017-05-19 18:31:30,"Seems smart. If you value your reputation and/or are averse to jail time, might want to stay away from this adminis…"
865635638363660288,2017-05-19 18:29:53,"It seems profoundly dysfunctional that the whole imperial court has to travel, lest some particular faction bend th…"
865632954923352065,2017-05-19 18:19:13,Kerensky Would Have Won
865632304181288962,2017-05-19 18:16:38,Let’s not endlessly refight the Russian Civil War.
865632224800002049,2017-05-19 18:16:19,"As reminds us, as of August the big focus for the Bush administration was stem cells."
865631009902964736,2017-05-19 18:11:30,Seems legit
865630784840794112,2017-05-19 18:10:36,Shouldn’t have voted for AHCA.
865630294497296384,2017-05-19 18:08:39,Everything we think we know about life in the Trump Era is going to change when there’s a terrorist attack.
865629154380726272,2017-05-19 18:04:07,The evolution of American politics in one Google search.
865624307065434113,2017-05-19 17:44:51,I feel like there’s a pretty stark tradeoff between “fun” and “autocratic theocracy.”
865612798260150272,2017-05-19 16:59:08,It’s actually sort of worse than that.
865612697521364992,2017-05-19 16:58:44,Makes you think.
865606029337219072,2017-05-19 16:32:14,Have these people ever written a postcard?
865604327083134977,2017-05-19 16:25:28,Thank God this editorial survived the various purges at The New Republic.
865598071719075840,2017-05-19 16:00:36,Here comes the real bombshell
865592978961711104,2017-05-19 15:40:22,But these issues will all be treated more effectively if we treat them as largely separate problems rather than looking for a magic bullet.
865592839173840897,2017-05-19 15:39:49,We need better business cycle stabilization policy. We also need to reduce poverty. We also need better childcare &amp; infrastructure.
