id,created_at,text
869667753417990144,2017-05-30 21:32:04,": At :40 p.m., , , on her piece about Trump and Capitol Hill. Listen live FM or online"
869660615622656001,2017-05-30 21:03:42,"Ben, did the congressman also break your razor?"
869659496431407104,2017-05-30 20:59:16,"In my eerience, the anti-Semites always have the worst Jewdar."
869583846068670465,2017-05-30 15:58:39,"Read my review of ""Al Franken, Giant of the Senate"" by in the :"
869582997250617346,2017-05-30 15:55:17,"Read my piece from the weekend, about the Trump-induced fatalism that's setting in on Capitol Hill:"
869276830578216960,2017-05-29 19:38:41,"Care to comment, ?"
869213556654452736,2017-05-29 15:27:15,": Franken on Cruz: an ""absolutely toxic co-worker,” “singularly dishonest” and a “sociopath.” via …"
869179812006559745,2017-05-29 13:13:10,: . spent her week talking to Republicans on the Hill. The quotes here are unbelievable: h…
868454009627193344,2017-05-27 13:09:05,I will give you an Italian waiver.
868453351884808192,2017-05-27 13:06:28,What would you say is the best song about vitamins?
868436074158280704,2017-05-27 11:57:49,": We're on the air! Ahead: w/ latest on Russia, Trump trip abroad, etc. Then: a body slam heard round the worl…"
868333857094946817,2017-05-27 05:11:39,Last one for tonight. Best song about coal mining &amp; debt bondage: Sixteen Tons
868329335626883072,2017-05-27 04:53:41,
868328755403665408,2017-05-27 04:51:22,"Best song about your summer on a Eurail pass: Eurotrash Girl, Cracker"
868327804823318528,2017-05-27 04:47:36,Only two things will get you blocked by me: liking Sinatra &amp; hating Jimmy Buffett.
868326135360356353,2017-05-27 04:40:58,"Best song about Los Angeles (tie): Screenwriter's Blues, Soul Coughing L.A. County, Lyle Lovett"
868324672038940673,2017-05-27 04:35:09,"Best English-language song about Aung San Suu Kyi: Walk On, U2 (note, this is an awful song)"
868323998714802176,2017-05-27 04:32:28,": Best Song About Bugs: ""Boris The Spider"" The Who"
868322672844910592,2017-05-27 04:27:12,"Too cool for Jimmy Buffett but not too cool to be fussy about your tequila, that's an interesting place"
868322009704517632,2017-05-27 04:24:34,"Best song about nonconformism: It's Saturday, King Missile"
868321688253079556,2017-05-27 04:23:17,"Best song about class consciousness: Common People, Pulp"
868321093681131521,2017-05-27 04:20:56,Don't make me block you
868320315377672192,2017-05-27 04:17:50,": Best song about a state governor: ""California Uber Alles"" by the Dead Kennedys"
868319470569353216,2017-05-27 04:14:29,"Best song about an unbalanced diet: Cigarettes and Chocolate Milk, Rufus Wainwright"
868318006811799552,2017-05-27 04:08:40,"Best dirtbag Christmas song: Fairytale of New York, The Pogues"
868317598823395332,2017-05-27 04:07:02,At the very least NYILUBYBMD is the best song about the Bloomberg administration
868316862597214209,2017-05-27 04:04:07,That's really more about boys
868316619990331392,2017-05-27 04:03:09,Do tell
868316324988059648,2017-05-27 04:01:59,give it to me baby
868315394393681920,2017-05-27 03:58:17,This is the best song about deodorant.
868315004306681857,2017-05-27 03:56:44,"Ok this is going to be controversial, but the best song about New York is: New York, I Love You But You're Bringing Me Down, LCD Soundsystem"
868313333291773952,2017-05-27 03:50:05,Now just need a category for Pretty Fly for a White Guy
868312451825246208,2017-05-27 03:46:35,"Best song about the commodification of art: Rock 'n' Roll Lifestyle, Cake"
868311583616901120,2017-05-27 03:43:08,"Best song about werewolves (tie): Werewolves of London, Warren Zevon Les Zombies et les Loups-Garous, Raffi"
868309579989483520,2017-05-27 03:35:10,"Best song about the erotic potential of hugs: In Da Club, Cent"
868307349555040257,2017-05-27 03:26:19,"Best song about heroin (tie): Heroin, Velvet Underground Cop Shoot Cop, Spiritualized"
868307101071835137,2017-05-27 03:25:19,"Best answering machine song: Spiderwebs, No Doubt"
868306584107175938,2017-05-27 03:23:16,That is an extremely competitive category.
868306298080829440,2017-05-27 03:22:08,Best song about berries?
868306181768531968,2017-05-27 03:21:40,": Pull up to the Bumper, Grace Jones. Of course."
868305239086170116,2017-05-27 03:17:55,Margaritaville or GTFO
868304951319121925,2017-05-27 03:16:47,"Worlds Apart, Trail of Dead"
868304155542257664,2017-05-27 03:13:37,"I will accept Weezer, Buddy Holly"
868303052570324992,2017-05-27 03:09:14,": Best song about horchata: Horchata, Vampire Weekend"
868282131600093184,2017-05-27 01:46:06,"Best song about Native American genocide (tie): Run to the Hills, Iron Maiden Indian Reservation, Paul Revere &amp; the Raiders"
868278419225759745,2017-05-27 01:31:21,"Best song about Washington, D.C.: Washington, D.C., Magnetic Fields"
868278187402432512,2017-05-27 01:30:26,"Best song about the Vengaboys: Ho Ho Vengaboys!, The Vengaboys"
868276003411558402,2017-05-27 01:21:45,"Best marine mammal song (tie): Baby Beluga, Raffi I Am the Walrus, The Beatles"
868275402120331264,2017-05-27 01:19:22,"Best booty call song: Self Esteem, The Offspring"
868274626379608064,2017-05-27 01:16:17,Best weird metaphor for sex song: Cake by the Ocean
868262754112737280,2017-05-27 00:29:06,They also own Best Song About Sweden
868262081560268800,2017-05-27 00:26:26,Best song about parking?
868261808141938688,2017-05-27 00:25:21,"Best song about denial: It Wasn't Me, Shaggy"
868261409230073856,2017-05-27 00:23:46,": Best song about punctuation: Oxford Comma, Vampire Weekend"
868260909856296963,2017-05-27 00:21:47,So far I have learned there are way more songs about laundry than I eected!
868260659280171008,2017-05-27 00:20:47,"Yes, exactly"
868259691025104896,2017-05-27 00:16:56,: best song about bike theft: fever by carly rae jepsen
868259437798150145,2017-05-27 00:15:56,": Hay Fever, the Kinks"
868259360882950144,2017-05-27 00:15:37,: Best Tribute song to a celebrity (non-musician): REM - Man on the Moon
868258027803115520,2017-05-27 00:10:19,: Best song about fixing a hole: Fixing A Hole by The Beatles
868257950997073921,2017-05-27 00:10:01,"Best song about another musician or band: Alex Chilton, The Replacements"
868257752744964096,2017-05-27 00:09:14,"Best song about allergies: The Pop Singer's Fear of the Pollen Count, The Divine Comedy"
868257576139591685,2017-05-27 00:08:32,"Best song about identity politics: My President, Young Jeezy"
868257471588179968,2017-05-27 00:08:07,"Best song about aging: Ribs, Lorde"
868257354558701568,2017-05-27 00:07:39,"Best song about fame (tie): Little Room, the White Stripes Pictures of Me, Elliott Smith"
868257235469832192,2017-05-27 00:07:11,"First category: Best Song About Laundry: Hang Me Up to Dry, Cold War Kids"
868257009048670208,2017-05-27 00:06:17,I welcome (but will probably reject) your suggestions!
868256954698915840,2017-05-27 00:06:04,"Ok, nerds, it's time to start what I hope will be a long-running Twitter series on songs that rule a particular category."
867870402118373376,2017-05-25 22:30:02,"The first rule of Montana special election returns is, you do not talk about Montana special election returns."
867837781221023744,2017-05-25 20:20:25,This new transcription service has already won my heart
867819138420441088,2017-05-25 19:06:20,"The NFL's most loathsome team, and it's such a competitive category"
867818726263070720,2017-05-25 19:04:42,"here for this, adrienne"
867814307429535744,2017-05-25 18:47:08,There's some kind of irony in Las Vegas being the mark for a giant scam
867789222484348928,2017-05-25 17:07:28,: Here's on Gianforte and politics in the age of Trump: 'There is total weirdness out there.'
867771055615746048,2017-05-25 15:55:16,Tune into Inside Politics in mins to see me chat w &amp; special guest Carl Hulse's hair!
867742027605311489,2017-05-25 13:59:55,"BBC radio just referred to Donald Tusk as ""the world's second most famous Donald."" That seems...generous."
867548186415685633,2017-05-25 01:09:40,"I literally don't know what this means, maybe you can say it in Latin?"
867546450661707776,2017-05-25 01:02:46,Look us wimps are barred from quite enough jobs as it is
867546180712108032,2017-05-25 01:01:42,:
867542259033616384,2017-05-25 00:46:07,"Also, I definitely don't want to see the polling effect of assaulting journalists."
867536672824725504,2017-05-25 00:23:55,"Feels weird to say anything non-sarcastic about , but dude, hope you are OK."
867490981633032192,2017-05-24 21:22:21,": And how’s Trump doing in Europe? We’ll ask , , and ."
867140380919246849,2017-05-23 22:09:12,"In , a GOP congressman introduced Obama's budget plan to force Dems to vote on it. His name was...Mick Mulvaney."
867092339617038336,2017-05-23 18:58:18,"The temptation to make it my background photo is very, very strong"
867091083720785923,2017-05-23 18:53:18,": ""President's Fans Still Fans of President"" is a tired old genre. Here's one that Newsday ran on /1/1974. Nin resigned…"
866285197599309827,2017-05-21 13:31:00,"Much to discuss, Nation. Come face us!"
865941842667360256,2017-05-20 14:46:38,": SUNDAY: Our political panel this week is , , and"
865658918982242304,2017-05-19 20:02:24,"With Comey as their leader, this is a heck of a posse."
865653357855219716,2017-05-19 19:40:18,
865650826190012417,2017-05-19 19:30:14,: Straightforward from here . Fire 'Nut Job' Comey . Impeach Trump &amp; Pence . Liberate DC Zoo bobcat . Bobcat led cou…
865650329118887941,2017-05-19 19:28:16,: What the fuck o’clock came early today I see
865649046903439361,2017-05-19 19:23:10,"Kudos to President Trump, who has accomplished in just months what most presidents take years to achieve if at all, scandal-wise."
865646381951729667,2017-05-19 19:12:35,: Alright. Huelskamp has given me permission to post his response. (I don't actually have a cousin named Tim. Not sure how t…
865646227089539072,2017-05-19 19:11:58,: Vocal outburst in office to this story: “Oh my god.”
865624642823663616,2017-05-19 17:46:12,: You haven't lived until you've tried texting your cousin a crude bday message while driving and accidentally texted a former…
865596536658546688,2017-05-19 15:54:31,"agreed, and also resonated with the psychopath-kids piece for me"
865589274179141633,2017-05-19 15:25:39,"Quite the scoop from , confirming WH shakeup rumors"
865584492479754241,2017-05-19 15:06:39,!!!
865578524492550146,2017-05-19 14:42:56,do you really? which ones?
865574937108430848,2017-05-19 14:28:41,Omg we have the same hobby
865574649970565121,2017-05-19 14:27:32,"I used to think this was a usage error too, but it's actually a common idiom"
865394524075556864,2017-05-19 02:31:47,:
865315763049164800,2017-05-18 21:18:49,It's a golden triangle taco
865314688204234752,2017-05-18 21:14:33,NB: The AP will continue to refer to him as Ian Myuanmar
865306738651693056,2017-05-18 20:42:57,You're Joe Lieberman?!?!
865251704429846530,2017-05-18 17:04:16,", Senator?"
865182257061011458,2017-05-18 12:28:19,"It's cool having a historian in the White House, I'm learning so much"
865182008502308864,2017-05-18 12:27:19,": Hey look, has a new homepage!"
865032720380026881,2017-05-18 02:34:06,"Palm trees, like hipsters, are an invasive species"
865031693257908225,2017-05-18 02:30:01,Maybe they just heard LA is the new Brooklyn cc
865030328301367296,2017-05-18 02:24:36,No really everything is fine said the trees as they inched away from us w terrified looks on their big wooden faces
864926456119525376,2017-05-17 19:31:51,"(I guess this tweet should have come with a spoiler alert, sorry.)"
864924849797464064,2017-05-17 19:25:28,"Asked a longtime House GOP staffer where things are headed. ""This is like Reservoir Dogs. Everyone ends up dead on the floor."""
864449770865217537,2017-05-16 11:57:40,: “The moment when these officials can no longer recognize their own characters for what they once were” - https:…
864197926595252224,2017-05-15 19:16:56,"On the other hand, this is not how turtles generally react when they see a wolf."
864088488794370048,2017-05-15 12:02:04,: Today's show: on rumored West Wing bkowout (bad move to move or ) …
863112501097107456,2017-05-12 19:23:50,"Is the Fake Media, in fact, working overtime today? Or do y'all think we can make deadline and get out of here for happy hour?"
863109078297579520,2017-05-12 19:10:14,Plenty of people have been known to fall in love with a guy who screwed them a few years ago.
863106152099454976,2017-05-12 18:58:37,Still haven't read the epistemological analysis of Sean Spicer I'm craving.
863098067788206080,2017-05-12 18:26:29,
863091664554012676,2017-05-12 18:01:02,: Spicer is sick of “gotcha” questions like: Is the White House bugged?
863058587601559552,2017-05-12 15:49:36,": Roger Stone is on The View saying that he spoke to Trump ""very recently."""
863058313902252032,2017-05-12 15:48:31,The one and only.
863058044539863041,2017-05-12 15:47:27,.
863055997065101314,2017-05-12 15:39:19,"The View's tease just now: ""He's been called a political sleazeball. So what will the ladies say to Roger Stone when he comes to the table?"""
863040257658413056,2017-05-12 14:36:46,"Frankly, my dear, I don't give a damn, with a few exceptions."
863039994381963264,2017-05-12 14:35:43,": The only thing we have to fear is fear itself, with a few exceptions."
863039910479110144,2017-05-12 14:35:23,"I alone can fix it, with a few exceptions."
863039745680605185,2017-05-12 14:34:44,"We worship an awesome God in the blue states, with a few exceptions."
863039153587486721,2017-05-12 14:32:23,"Government of the people, by the people, for the people, shall not perish from the earth, with a few exceptions"
863038810065702912,2017-05-12 14:31:01,"Ask not what your country can do for you, with a few exceptions"
863038704964825088,2017-05-12 14:30:36,": The buck stops here, with a few exceptions"
863031096967081985,2017-05-12 14:00:22,: A few thoughts on the tactic of defending Trump by comparing him to Obama. /
863027100068040704,2017-05-12 13:44:29,"""Tapes"" is in quotes because come on, who even remembers cassettes anymore, right?"
863026198351409153,2017-05-12 13:40:54,": As is well known, President Nin has, in recent years, had a vigorous and varied involvement in public life. - RZ https://…"
863025835200172033,2017-05-12 13:39:28,We all know how well it worked out for good ole RMN
863024611189043201,2017-05-12 13:34:36,"What is the legal term for ""undisputable yet immaterial""?"
863020195035611141,2017-05-12 13:17:03,"""Oh, stop with the comparisons to Nin,"" they said. ""It's nothing like that at all,"" they said."
862738098316345346,2017-05-11 18:36:06,Just logged onto Twitter and I must say I'm surprised Bernie Sanders is getting so many Qs about White House goings-on.
862396709141438464,2017-05-10 19:59:32,"This was definitely, first &amp; foremost, a failure of communications strategy."
862396291896270852,2017-05-10 19:57:53,"""The problem with cover-ups: they tend not to work &amp; only get the perpetrator in more trouble."""
862394935047225345,2017-05-10 19:52:29,"Also GENUINELY aggrieved partisans, not PRETEND ones"
862368234879815681,2017-05-10 18:06:23,": is live w/ , talking the latest news in DC. On …"
862368192055967752,2017-05-10 18:06:13,"I'm just glad he didn't say ""human centipede."""
862365180499558402,2017-05-10 17:54:15,Centipedes wear a lot of shoes.
862364076382584837,2017-05-10 17:49:52,: ALBERTO GONZALES is being quoted as an authority on IMPROPER FIRINGS at the JUSTICE DEPARTMENT What a world
862359770795212800,2017-05-10 17:32:45,: The congressional response to Comey's dismissal vs the 'Saturday Night Massacre' by
862350295728353281,2017-05-10 16:55:06,"Wait, I think I've figured this out. After reading , Trump realized it was Comey who stuck him with this job he didn't want."
862333645440286720,2017-05-10 15:48:57,: Photos of Trump's meeting with Lavrov and Kislyak just hit the Getty wire and they're all credited to Russian news agency…
862331441144877059,2017-05-10 15:40:11,time to go live in the woods
862330345143840768,2017-05-10 15:35:50,Thanks
862305465061036032,2017-05-10 13:56:58,": of long series of tweets on Comey firing from WI GOP House freshman who rep's district (Green Bay, environs) Trump carried…"
862297041078190080,2017-05-10 13:23:29,"Be kind to your web-footed friends, Jen"
862296859188092928,2017-05-10 13:22:46,": Reporter: Does the Comey firing cast a shadow over your talks? Lavrov: ""Was he fired? You're kidding."""
862295033365622784,2017-05-10 13:15:31,"""It's times like this that give hypocrisy a bad name,"" says on ."
862294411715203072,2017-05-10 13:13:03,: Here at the Trump hotel: Rudy Giuliani. Tells me &amp; he's not a candidate to replace Comey
862294067081826306,2017-05-10 13:11:40,: Tune into today: and on Trump
862135905762648065,2017-05-10 02:43:12,Mean
862135625364930560,2017-05-10 02:42:05,"Also technically firing someone isn't a massacre, fact boy"
862102994518765568,2017-05-10 00:32:25,cc:
862102891754119170,2017-05-10 00:32:01,: Just get it together people! (CC: )
862101336745226240,2017-05-10 00:25:50,"Current motto much less versatile: ""Democracy Dies in Darkness?"""
862098025384226816,2017-05-10 00:12:40,"On second thought this is clearly what the Post should have put on the front instead of ""Democracy Dies in Darkness."""
862096639401631744,2017-05-10 00:07:10,Yes but think of all the traffic we've already forfeited!
862094741810421764,2017-05-09 23:59:38,Welp lotta ppl looking at their phones on my flight that just landed at DCA.
862090766839144448,2017-05-09 23:43:50,"At some point last year I wanted to write an article titled ""What the Fuck Is Happening"" &amp; just keep republishing it. Should have."
862076285857804295,2017-05-09 22:46:17,: it's......it's gonna be Sheriff Clarke isn't it
862053563333259264,2017-05-09 21:16:00,"If someone firebombs the sadist who designed the Miami airport, it won't be me, as I deplore violence. But I'll understand."
861705119032901635,2017-05-08 22:11:24,"Today I got to read the sentence ""Duck sex is intense and violent,"" so once again I owe a debt to"
861570962852106240,2017-05-08 13:18:19,My kids are fed and loved. Suffering builds character.
860637784847130624,2017-05-05 23:30:12,": TONIGHT p.m. : AP's , NYT's , The Atlantic's , The Post's …"
860600436696506368,2017-05-05 21:01:47,"Oh come on, DC is a nerdy town but there are definitely hotter clubs."
860596689916354560,2017-05-05 20:46:54,"In which and I talk politics, tech, &amp; mom life"
860594533549191168,2017-05-05 20:38:20,:
860528135263195136,2017-05-05 16:14:29,Happening now: Inside Politics on with &amp; me
860523607352627200,2017-05-05 15:56:30,One year ago today. Never forget. Are there taco bowls in Bedminster?
860505724794937345,2017-05-05 14:45:26,"Color me skeptical of ""scrutiny and uproar"" (esp from the left) as factors in the decision-making of Freedom Caucus members"
860505454992138240,2017-05-05 14:44:22,"I am the proud suggester of 's new Twitter bio, in which he quotes himself."
860505088816709634,2017-05-05 14:42:55,"I think it has a ""votes in Congress"" problem first and foremost"
860309952421916672,2017-05-05 01:47:31,: Joining tomorrow on :
860258877199220737,2017-05-04 22:24:33,: . And our roundtable…
860243292553916420,2017-05-04 21:22:38,Simpsonz
860242558764683264,2017-05-04 21:19:43,"little known fact, they're all the secret lives of minor Simpsons characters"
859967077905575936,2017-05-04 03:05:03,"""But now, she was being harassed by a sandwich"""
859965784495403016,2017-05-04 02:59:55,That's what the pizza said Lizzie
859938403957301250,2017-05-04 01:11:07,You think you feel old? Anthony Kiedis just turned
859918694985629696,2017-05-03 23:52:48,There's a clash of civilizations happening whether or not you choose to recognize it
859918135780147201,2017-05-03 23:50:34,Aging Radiohead fans are a historically marginalized group you know
859917366725050368,2017-05-03 23:47:31,"Ok this is p good but I am in no way endorsing your original tweet, which I consider an enactment of violence"
859906041567473664,2017-05-03 23:02:31,:
859886817608429569,2017-05-03 21:46:07,Did you buy it yet?
859884518035083264,2017-05-03 21:36:59,"I'm on tonight, talking about the history &amp; meaning of the Heritage blowup with"
859832658284748803,2017-05-03 18:10:55,Is it good?
859809594939514880,2017-05-03 16:39:16,"Nick Cave is a genius &amp; this piece about him (&amp; life, death, &amp; Russell Crowe &amp; an animatronic rhino) is so powerful"
859148735175176192,2017-05-01 20:53:15,Thank you!
857987620491722753,2017-04-28 15:59:24,: Inside Politics w/ &amp; Panel: &amp; p ET …
857250935420178434,2017-04-26 15:12:04,Have I been quoted in a delightful piece about hippo swimming? Why yes!
857199445762613248,2017-04-26 11:47:28,": Today: , , , ,"
857067831682269184,2017-04-26 03:04:29,": This is an impossibly poised, spritually profound and absolutely gutting eulogy. Please watch it."
856978392809447425,2017-04-25 21:09:05,But it's Tuesday
856893823909330944,2017-04-25 15:33:02,: : Build the wall and make Mexico pay for it : What if the real wall was the friends we made along the way
856584731621765120,2017-04-24 19:04:49,thank you
856574222692487168,2017-04-24 18:23:03,I've held onto a single pair for years &amp; I'm so proud of myself I want to put it on my re…
856573949899100160,2017-04-24 18:21:58,What kind is it?
856573802804850688,2017-04-24 18:21:23,I recently graduated to nice sunglasses but you never know if you're paying for quality or just brand. Thank you!
856573029370953728,2017-04-24 18:18:19,Assume (for the sake of argument) that you're not someone who tends to lose umbrellas
856572410388238339,2017-04-24 18:15:51,"So if you spend the money, there are high-quality umbrellas that don't break after uses?"
856572032171089920,2017-04-24 18:14:21,"Sincere Q: Is it more cost-effective to purchase one really nice umbrella or a bunch of cheap, disposable ones?"
856213492575109121,2017-04-23 18:29:38,I logged on for the first time all weekend just to see if you made this joke.
855526026797076480,2017-04-21 20:57:54,"""The value is in how the busy professional w no hands gets App reminders to press Lobster Packs before they eire."""
855517102060560385,2017-04-21 20:22:26,!!!!
855504064536358912,2017-04-21 19:30:38,"Love this pic of Paul Manafort, Roger Stone, &amp; Lee Atwater via"
855493930749763585,2017-04-21 18:50:22,Partying is a worldview now? Cc
855468710563368960,2017-04-21 17:10:09,"My bad, ""hell yeah"" was Harriet Beecher Stowe."
855457769721298944,2017-04-21 16:26:40,": Inside Politics on CNN npw -- w &amp; : days, Sessions, N…"
855449970715107328,2017-04-21 15:55:41,"""Hell yeah"""
855439251235852288,2017-04-21 15:13:05,A great day for
855415765717192705,2017-04-21 13:39:46,: Fascinating profile of Washington's quintessential happy warrior by .
855188387023683585,2017-04-20 22:36:14,Congrats ! Looking forward to seeing you at the table
855175449198170112,2017-04-20 21:44:50,Must confess I am not holding my breath
855175085862334464,2017-04-20 21:43:23,"Definitely don't see ""Hamilton"" in that case"
855174718990811139,2017-04-20 21:41:56,"""We don't believe history shd be written from a series of sensationalized anecdotes"" is Clinton camp's official response to ""Shattered"" ?!?"
855173414004428802,2017-04-20 21:36:44,I loved their latest album
855172347665448960,2017-04-20 21:32:30,Props to for asking the congressman from Colorado a /20-pegged question just now.
855171660177133569,2017-04-20 21:29:46,I guess I thought of that as
855171110572355585,2017-04-20 21:27:35,How do you figure?
855170764328378370,2017-04-20 21:26:13,"Rep. Mike Coffman on AHCA2.0 on : ""I'm certainly not ready to vote for it...I haven't seen any details."""
855168758687698951,2017-04-20 21:18:14,": On tonight's panel: , &amp;"
855070736804925442,2017-04-20 14:48:44,In which I elain what vaping is to a mystified Chris Matthews.
854798176045473792,2017-04-19 20:45:41,attn: re: my next contract
854795939667750913,2017-04-19 20:36:48,
854790494974562304,2017-04-19 20:15:09,"can you call your next book ""People: Even Worse Than You Thought""?"
854772406086455299,2017-04-19 19:03:17,John Madden has aged surprisingly well.
854771962010271748,2017-04-19 19:01:31,
854770859436892160,2017-04-19 18:57:08,. And this guy!
854769152896225281,2017-04-19 18:50:21,You know who else has eerience hosting a Fox News show? h/t
854764903919386635,2017-04-19 18:33:28,: Internal memo that the Murdochs just sent out to all staff at Fox News
854755517872340994,2017-04-19 17:56:10,"the people have spoken, John"
854755138128445440,2017-04-19 17:54:40,a new Lorde album &amp; another season of Girls.
854754947543572480,2017-04-19 17:53:54,they should move Fox &amp; Friends to prime time. or Outnumbered!
854752588343980032,2017-04-19 17:44:32,"nah, it's /20 &amp; I'm from Colorado, so it's generally pretty chill"
854751255410900995,2017-04-19 17:39:14,"Also: Hitler, Don Mattingly, Joey Lawrence, me"
854748424822022146,2017-04-19 17:27:59,: Just because. Here's 's Richard Nin bong.
854529878330400770,2017-04-19 02:59:34,:
854528303151157248,2017-04-19 02:53:18,Should I make this delightful fan art my new avi?
854525180890296324,2017-04-19 02:40:54,Congrats!
854524499714334721,2017-04-19 02:38:11,whither the Cook Out voter tho?
854521871659913216,2017-04-19 02:27:45,That's my playa name too!
854520667328438272,2017-04-19 02:22:57,Do tell
854519648926265345,2017-04-19 02:18:55,": The Ossoff party has turned off CNN and is now playing When Doves Cry. In other words, it's a runoff."
