id,created_at,text
795809777637068800,2016-11-08 02:06:51,"""Go win a good Super Bowl, or whatever you want to do."" - Trump's message to Belichick"
795803846475993088,2016-11-08 01:43:16,"nice avi, boss!"
795800020930936832,2016-11-08 01:28:04,"“You can have a healthy environment or capitalism. You can’t have both"" - liberal opponent of WA carbon tax"
795777276482899968,2016-11-07 23:57:42,": At Trump's rally in Manchester, N.H., we have smoke machines, lasers and *NSYNC."
795775589240205313,2016-11-07 23:50:59,Reupping this piece from March bc it feels relevant: Why was *Trump* the man for this moment?
795773794128429056,2016-11-07 23:43:51,need more info on this! cc
795769187528572929,2016-11-07 23:25:33,"you mean that doesn't happen in your newsroom? Man, this biz has gone soft."
795768081813475328,2016-11-07 23:21:10,"Such a nice piece on Trump's movement by , who has been a sensitive &amp; unsparing chronicler of the campaign"
795714966246592512,2016-11-07 19:50:06,"results! Good job, Congressman."
795707874248900609,2016-11-07 19:21:55,I wonder how long Rep. has had a typo in his Twitter bio.
795698481822388224,2016-11-07 18:44:36,me too!
795697702340325376,2016-11-07 18:41:30,"like the Hillary for Prison shirts, they allow seamless blending in with Hillary supporters!"
795697428527796224,2016-11-07 18:40:24,Grab a tissue before you read this masterfully done piece.
795648165626204160,2016-11-07 15:24:39,": Another history fact to know for Tues, via in his must-read look at the groups that will decide htt…"
795646498394542084,2016-11-07 15:18:02,": Think YOU'RE tired? I asked , , , &amp; others about their post-election plans. https:/…"
795473479533555712,2016-11-07 03:50:31,:
795349494246293506,2016-11-06 19:37:50,: Amazing details in this &amp; co tick-tock on the Trump campaign's last days.
795279728357834753,2016-11-06 15:00:37,Romney won men by and whites by . Trump underperforming with both groups.
795056015330971648,2016-11-06 00:11:40,Remember this you guys?
795039762239410176,2016-11-05 23:07:05,this eraser is currently my daughter's favorite pet. Her name is Witchy Poo
795038183729876992,2016-11-05 23:00:48,EVERYBODY LOVES OWLS!
795009044582985729,2016-11-05 21:05:01,"Fascinating look at a CO town that went all in on the marijuana business &amp; now is reconsidering, by"
795005507937464320,2016-11-05 20:50:58,": &lt;&lt;whispers&gt;&gt; ""no actually knows what's going to happen on Tuesday because it's in the future."""
795002028443533312,2016-11-05 20:37:08,
794998116273557504,2016-11-05 20:21:35,"Such a moving piece by my friend . Hope your surgery goes as well as the Cubs' series, only much shorter."
794983461794807808,2016-11-05 19:23:22,I...did not know this story!
794971182697238528,2016-11-05 18:34:34,: Are political consultants worth the cost?
794706130400382977,2016-11-05 01:01:21,: Sources tell my colleague that Chris Christie events in New Hampshire on behalf of Donald Trump are cancelled.
794705477917622272,2016-11-05 00:58:45,Hmm I think maybe democracy is gonna survive
794705036236431360,2016-11-05 00:57:00,Vile smell outside the arena in Hershey. Trump press corps' best guess: spirit cooking.
794703890428153857,2016-11-05 00:52:27,": Trump says Obama screamed at a protester today. Not quite. Instead, Obama said the crowd had to respect the man's right to p…"
794694696148811776,2016-11-05 00:15:54,"Trump can't do ""drain the swamp"" w/o complaining about it. ""I keep telling people, I hated that eression! It's so hokey!...Now I love it."""
794692965121789952,2016-11-05 00:09:02,"Trump: ""I didn't have to bring J-Lo or Jay-Z. I am here all by myself."""
794690558497345536,2016-11-04 23:59:28,Kellyanne Conway is also speaking at Trump's rally in Hershey PA.
794689334121234433,2016-11-04 23:54:36,Reince Priebus is here at Trump's PA rally.
794685019277107205,2016-11-04 23:37:27,"Huge crowd waiting for Trump at hockey arena in Hershey PA. Intro speaker: ""Let's put Hillary Clinton in the penalt…"
794680706471493632,2016-11-04 23:20:19,that's the joke Ezra
794674531814309888,2016-11-04 22:55:47,Whoa if true
794651011327606785,2016-11-04 21:22:19,": Last night, Trump said at least ,000 were at his rally in Selma, NC. In NH this morning, he upped it to ,000. Just now in…"
794641809888649220,2016-11-04 20:45:45,"Canada Trump. Wilmington, Ohio."
794639031808249856,2016-11-04 20:34:43,Not a lot of takers for the Hispanics for Trump signs here in rural Ohio
794636963492012032,2016-11-04 20:26:30,also casually dropped it in last radio interview I heard
794636237097160704,2016-11-04 20:23:37,"For someone who doesn't want to be on a national ticket, Hickenlooper sure mentions this a lot"
794529674504323076,2016-11-04 13:20:10,"Trey Gowdy's new ad: ""Consistent Conservative. Inconsistent Haircuts."""
794512909363777537,2016-11-04 12:13:33,": If actually lost NH but offset w/ NV or NC (much less FL), the blue-collar Rustbelt vs diverse Sunbelt r…"
794382427372273667,2016-11-04 03:35:04,Same
794377543889653760,2016-11-04 03:15:39,it's almost as if marriage is a system of patriarchal oppression!
794336383783440384,2016-11-04 00:32:06,Cameras also are not allowed to go into the crowd &amp; get a better shot of it
794321013668532224,2016-11-03 23:31:02,: The Cubs' superior ground game locked in early runs weeks before Game .
794320744662630400,2016-11-03 23:29:57,Jew S A!
794308611195490308,2016-11-03 22:41:45,": People really don't know this is how you coax an on the record comment out of reluctant sources, do they?"
794306990889639936,2016-11-03 22:35:18,gotta live life out loud Betsy
794260893404168192,2016-11-03 19:32:08,"This makes sense, you see ""Post-Structuralists for Trump"" signs at virtually every rally."
794257208351588358,2016-11-03 19:17:29,": ""When you take a step back, you start to see the election with clearer eyes."""
794251891639255043,2016-11-03 18:56:22,More early votes doesn't necessarily mean higher turnout election in the end - share of electorate that votes early has steadily increased.
794208374187495424,2016-11-03 16:03:26,better: years ago I covered a Bette Midler-emceed drag show for Obama at a Vegas club
794193661605117952,2016-11-03 15:04:58,"Now that the billy goat has been defeated, I'm hopeful that my Rockies can defeat their curse (the Curse of Being Bad at Baseball)."
794161450403110913,2016-11-03 12:56:59,: This is a serious betrayal for Pence. He's known the guy for years. they were in similar ideological circles on the hil…
794158109606498304,2016-11-03 12:43:42,:
794157727903875073,2016-11-03 12:42:11,": And then you rewrite the lede, cut the kicker, and stomp that heart into the floor, said a man who was raised on a newspaper…"
794038437267509248,2016-11-03 04:48:10,On to Game !
794038180483833857,2016-11-03 04:47:09,The year is . The '16 World Series enters its millionth inning. Tension mounts as the Cubs pull ahead &amp; another pitcher dies of exhausti
794033301942075392,2016-11-03 04:27:46,Still beats dating.
794032747987763200,2016-11-03 04:25:34,Every once in a while I feel good about my decision to outsource my emotional life to professional sports.
794026037055209473,2016-11-03 03:58:54,: Just when you think sports is an escape from politics they bring out the Troubled Asset Relief Program
794025785539563520,2016-11-03 03:57:54,"Little known fact, if a playoff game goes into extra innings you're allowed to put wild animals in the lineup."
794024571972231168,2016-11-03 03:53:04,: FREE BASEBALL!
794014943599214592,2016-11-03 03:14:49,Rooting for both teams in this World Series continues to pay off.
793998826105438208,2016-11-03 02:10:46,Baby bears!
793989104497201153,2016-11-03 01:32:08,Make Mexico Great Again Also!
793988786233507841,2016-11-03 01:30:52,that's President Giuliani to you
793988541634199553,2016-11-03 01:29:54,: Amazing. This was the front page of the Times the last time the Cubs won the World Series
793946020178788353,2016-11-02 22:40:56,I don't think George Will is voting for Trump
793899902896054276,2016-11-02 19:37:41,"Yes, it's really Wednesday. But for how long, no one knows."
793607053776269312,2016-11-02 00:14:00,"Hey, I know you've had a long day. Why not get comfy &amp; read my Hillary piece?"
793591996103462912,2016-11-01 23:14:10,"My interview w : ""Most of the time who's going to win is the least interesting story about an election."""
793585355987574784,2016-11-01 22:47:47,: Are political consultants worth the millions they charge politicians each year? joins
793582763752423424,2016-11-01 22:37:29,!
793578668731854848,2016-11-01 22:21:13,"wait a second, that's not actually a compliment, is it?"
793539619807719424,2016-11-01 19:46:03,": Tonight: Tommy Hilfiger, , and an update on politics with , and . https://…"
793444198573809664,2016-11-01 13:26:53,: . on the campaign that Hillary Clinton never eected:
793434835230593026,2016-11-01 12:49:40,Lovely piece on the scene at Standing Rock
793432601998594048,2016-11-01 12:40:48,it's not an endorsement of beans so much as a rejection of lentils &amp; all they represent
793431658720534528,2016-11-01 12:37:03,": RYAN on TRUMP: ""I stand where I've stood all fall and all summer. "" He said he voted for Trump last week in early voting"
793430211744374784,2016-11-01 12:31:18,"""Actually, it's much lonelier at the bottom,"" said the unsuccessful contrarian."
793421039049007104,2016-11-01 11:54:51,Makes sense.
793420751902826502,2016-11-01 11:53:42,we're just endorsing all over the place now?
793420048132177921,2016-11-01 11:50:55,: “Every political reporter’s campaign tech article ever” by Nick Marcelli
793418975506030592,2016-11-01 11:46:39,Good look at weak African American turnout in FL early vote
793415296233111552,2016-11-01 11:32:02,the lone and level sands stretch far away
793414780711215104,2016-11-01 11:29:59,makes sense. and it's worked so well for the GOP thus far!
793414070728818689,2016-11-01 11:27:10,What does that mean in practice?
793411991473942529,2016-11-01 11:18:54,"I wrote something about Hillary, since she's probably going to be the next president."
793405930700283905,2016-11-01 10:54:49,Of everything.
793405125201055744,2016-11-01 10:51:37,picked the wrong college I guess
793404946192314368,2016-11-01 10:50:54,spelling-based militias are my favorite kind
793404334226575360,2016-11-01 10:48:28,this is a good compromise
793404027069267969,2016-11-01 10:47:15,counterpoint: no
793403182357549056,2016-11-01 10:43:54,when he's president we'll all have to spell it like that
793402902236790788,2016-11-01 10:42:47,same
793402651169914880,2016-11-01 10:41:47,"Fun times in the Kentucky Senate race, via"
793256692066750464,2016-11-01 01:01:48,: Scooplet: voted absentee today. And he wrote in John McCain.
793121451926626304,2016-10-31 16:04:24,: What makes Trump so unique among politicians? His obsession with retaliation and violence. Deep dive here:
792696781150695424,2016-10-30 11:56:54,": Grab your coffee. It's Inside Politics time. , , , and me coming up next. https:/…"
792552146818523136,2016-10-30 02:22:11,: FBI Oct. stunner: Clinton pushes back as Trump seizes on political gift a Sun …
792414211867549696,2016-10-29 17:14:05,I always assumed was a liberal parodying the right. The real story is more interesting
792060766165794816,2016-10-28 17:49:37,it's the opposite of baffling
792021902839713792,2016-10-28 15:15:11,I'll be talking about this piece in a minute with on
791838006940434432,2016-10-28 03:04:27,"we're all verbs, Christian. Some of us just don't know it yet."
791833871272796161,2016-10-28 02:48:01,I'm just saying we've never seen James and Shia in the same room
791829402510393345,2016-10-28 02:30:15,That's Stuff-stuff. This is Heavy:
791827717197103106,2016-10-28 02:23:33,
791827298362228736,2016-10-28 02:21:54,"My cats are named for a Trillin bit, but they're not on Twitter either."
791824575118139392,2016-10-28 02:11:04,James is that you
791822067607998464,2016-10-28 02:01:06,the power of the human heart to heal
791821943725035520,2016-10-28 02:00:37,": In , the Senate will likely include two Corys and two Tammys. Generation X taking over at last."
791821808525774849,2016-10-28 02:00:05,it never takes as long to get over him as you think. Before you know it you won't think about him at all.
791776243922440192,2016-10-27 22:59:01,Time to ball rill hard on . Join us!
791675583688302592,2016-10-27 16:19:02,at least I'm not a puppet of the Chocolate Mafia's globalist cabal
791671445512392709,2016-10-27 16:02:35,"Actually, , all chocolate is bad."
791477882069651456,2016-10-27 03:13:26,This World Series going well for people like me who are rooting for both teams.
791467575133761536,2016-10-27 02:32:29,": In essence, the memo &amp; footnotes describe Teneo as the revenue-generating arm of Clinton, Inc.--for Clinton speeches, f…"
791466616882167809,2016-10-27 02:28:40,a target audience of one exceeds my eectations frankly
791465752041840640,2016-10-27 02:25:14,ICYMI: [Jarvis Cocker voice] Help the aged...
791462811574661120,2016-10-27 02:13:33,: STEP : Improve your cocktail party conversation STEP : Don't go to parties; stay home and read the dictionary https:/…
791385174709862400,2016-10-26 21:05:03,STILL waiting to read the exegesis of Trump-related train imagery I requested months ago
791088516419706880,2016-10-26 01:26:14,: There is no such thing as paranoia. Your worst fears can come true at any moment.
791035862779846656,2016-10-25 21:57:01,": ""They are adrift in a world that no longer speaks a language they recognize­."" on Trump's gray area:"
791024869769084928,2016-10-25 21:13:20,": Trump halts big-money fundraising, cutting off cash to the Republican party, by"
790995619934531585,2016-10-25 19:17:06,": Brexit, in which people ignored polls in favor of their own narrative, parallels nicely, but maybe not for the reaso…"
790992851320598528,2016-10-25 19:06:06,Essential piece on populism vs. conservatism in the GOP
790989731559530496,2016-10-25 18:53:42,Thank you! I feel a kinship with anyone with a rhyming name.
790989079995359232,2016-10-25 18:51:07,"actually, I should fix that, it's ideology, not voting."
790975166067118080,2016-10-25 17:55:49,"Meanwhile, back in the U.S. Senate"
790968831657336832,2016-10-25 17:30:39,he joins the large club of ppl spinning in their graves this year
790968519051579392,2016-10-25 17:29:25,: this dispatch from the world's largest age-restricted gated community in florida is worth your time:
790960038089154560,2016-10-25 16:55:43,"if the real Auden were on twitter, surely he too would overwork a cryptic meme fora couple weeks &amp; then quit"
790958506392379392,2016-10-25 16:49:37,"Finally, Auden gets a news cycle. cc"
790934002672828416,2016-10-25 15:12:15,...particularly if it is literally that journalist's job to travel Real America talking to all kinds of voters.
790933757687635968,2016-10-25 15:11:17,"Before telling a journalist ""get out of your bubble, everyone I know is voting for X,"" consider the possibility you are the one in a bubble."
790925737742204928,2016-10-25 14:39:25,Alternate headline: Why your grandparents are voting for Trump
790925646851637248,2016-10-25 14:39:03,literally!
790925342454255616,2016-10-25 14:37:50,My new piece looks at Trump's real base: the old.
790925221456994304,2016-10-25 14:37:22,"related to your original pt tho, my new piece"
790925011351592961,2016-10-25 14:36:32,I'm free-to-be on the whole comma thing
790924571780194304,2016-10-25 14:34:47,"I think I'm the asshole here, but yeah"
790924383170793473,2016-10-25 14:34:02,"""for whom"""
790910746951553024,2016-10-25 13:39:51,": SIREN, SIREN, SIREN Cook Political Report predicts Dems will gain -7 Senate seats to retake chamber"
790890977326170112,2016-10-25 12:21:17,Read on how the GOP abandoned women to stand with Trump
790278462690959360,2016-10-23 19:47:22,": With all this Schilling talk, it's worth reading the great on a popular Mass. Republican: Chahlie Baykah https:…"
790032529806024704,2016-10-23 03:30:07,": As pic of Hillary enjoying the Cubs circulates, you should read this delightfully blunt reminder:"
790024745500672000,2016-10-23 02:59:11,still waiting for a presidential candidate who will promise to support a constitutional amendment banning the DH
790024175452905472,2016-10-23 02:56:56,:
789652763705835520,2016-10-22 02:21:04,This is the piece I wanted to read about the reality of voting in Philadelphia.
789638129888141312,2016-10-22 01:22:55,so like mostly frittatas?
789490502592761856,2016-10-21 15:36:18,: Democrats in Iowa are knocking on doors of GOP houses asking for women &amp; being turned away by their husbands
789483638731726848,2016-10-21 15:09:02,: The special post-debate episode of Says Who is out! We're joined by and battles a ghost: ht…
789482533234900992,2016-10-21 15:04:38,nope! I was not there.
789479628490547200,2016-10-21 14:53:05,: In which and I discuss whether elections were ever about ideas:
789447397952876544,2016-10-21 12:45:01,": At charity roast, Donald Trump gave a speech that might as well have been a eulogy for his presidential campaign:"
789233636625309696,2016-10-20 22:35:36,: The new will be up TOMORROW! Special guests: and . Time to deal with DEBATE…
788950371364249601,2016-10-20 03:50:01,": Rest assured, the are not rigged."
788947773160759297,2016-10-20 03:39:41,: I do not accept the results of the Detroit Tigers season.
788936943824363520,2016-10-20 02:56:39,": As in debate II did best when he was most conventional small-govt R-but the ""won't accept"" elodes all…"
788931784369053696,2016-10-20 02:36:09,: Oh YEAH she nasty
788929993988464641,2016-10-20 02:29:02,all you man
788928666210152448,2016-10-20 02:23:46,Dickerson didn't do a general-election debate!
788928174310567940,2016-10-20 02:21:48,"we have seen the leppo, and it is us"
788927164808765441,2016-10-20 02:17:48,personally I think America is an Old Navy
788926236705693697,2016-10-20 02:14:07,"So ""the element of surprise"" is Trump's approach to both ISIS and American democracy I guess."
788925902730121217,2016-10-20 02:12:47,"just like THIS amazing race, am I right"
788925783200845824,2016-10-20 02:12:18,"Via , Trump lost the Emmys to The Amazing Race."
788925489339523072,2016-10-20 02:11:08,who did Trump lose to?
788924880238497792,2016-10-20 02:08:43,"""I'll keep you in suspense"" !"
788924539287707648,2016-10-20 02:07:22,"""The media is so dishonest that the New York Times wrote an article about it"""
788917934353678339,2016-10-20 01:41:07,So Trump is saying our allies won't appreciate the relationship if we don't regularly neg them?
788916545820819456,2016-10-20 01:35:36,: Much better
788916341394710528,2016-10-20 01:34:47,WRONG is the new Sad!
788914840584585216,2016-10-20 01:28:49,": Hang on, do we not have a border and a country, or has Obama been deporting millions of people to enforce immigration law…"
788914139842215936,2016-10-20 01:26:02,: bad ombres
788911460420165633,2016-10-20 01:15:24,: . was watching response when Heller decision was issued? Surprising.
788910273100812289,2016-10-20 01:10:41,or the fact that it has slot machines!
788909911132340227,2016-10-20 01:09:14,"Hokey pokey, call your office"
788908212250562561,2016-10-20 01:02:29,"Last-ditch reminder/plea: Your ""what happens in Vegas"" debate-story lede is not clever or original."
788907885812068352,2016-10-20 01:01:11,because rich people need to feel like they matter
788907576993775616,2016-10-20 00:59:58,Tonight's debate is the only one this cycle being held at a public university.
788907406885396480,2016-10-20 00:59:17,whaaaaaaaat
788907246902054912,2016-10-20 00:58:39,: .'s politics team is live-blogging tonight's debate here:
788845567644307456,2016-10-19 20:53:34,: NEXT on → and join live from on…
788844275412799488,2016-10-19 20:48:25,Whoever wins the election should declare Nov. to be National Take a Shower Day.
788837656515915776,2016-10-19 20:22:07,thank you!
788834467464945665,2016-10-19 20:09:27,This is my favorite weird scam of
788638342107664384,2016-10-19 07:10:07,
788531265305587712,2016-10-19 00:04:38,Pepe??
788452070231724032,2016-10-18 18:49:56,I don't recall coining that. Catchy tho!
788408525571493888,2016-10-18 15:56:55,Perhaps the most dangerous thing Trump has done is enable Dems to run the all-interpretive-dance campaign they've a…
788396700876406785,2016-10-18 15:09:55,. has written the piece I wanted to read about if/how Trump TV could work in practice
788394450040926211,2016-10-18 15:00:59,Great piece on lefties united in theory but paralyzed by infighting
788319801508765696,2016-10-18 10:04:21,". has been doing great work on Senate races all over, including this excellent dispatch from Nevada"
788202799670685696,2016-10-18 02:19:26,": Analysis of NC absentee vote by : Rs far behind '12 pace, while Ds/Unaffiliate over % ahead of '12 https:…"
788199753066680320,2016-10-18 02:07:19,"My god, if Trump hasn't even nailed down Ryan Lochte's vote..."
788176734029885444,2016-10-18 00:35:51,...
788174962028937216,2016-10-18 00:28:49,cc
788174441482219523,2016-10-18 00:26:45,"Given the changing demographics of the electorate, if dead people really could vote, Trump would probably be polling a lot better."
788168788483121152,2016-10-18 00:04:17,"Fun fact: the GOP rep. from Green Bay, where Trump is speaking now, was the first R in Congress:"
788164962527154176,2016-10-17 23:49:05,: Joining tonight: …
788157236765978624,2016-10-17 23:18:23,"ICYMI, read my piece on the presidential election's resonance in the black community post-Ferguson"
788122552979914752,2016-10-17 21:00:33,": Coming up at pm, joins on her recent reporting and her perspective of the election."
788117985995218944,2016-10-17 20:42:25,looks like about a third of women are right about about a third of men
788082221425065989,2016-10-17 18:20:18,": Monmouth Poll National, Self-IDed R RVs* Is the GOP leadership giving Trump enough support? Too much % Not enough % Ri…"
788069681944866816,2016-10-17 17:30:28,Did you read the piece?
788054591489409024,2016-10-17 16:30:30,"If Trump loses, people of color will be a big part of the reason. My report from Ferguson:"
787757050319233024,2016-10-16 20:48:11,: The quotes in this story are amazing. Arizona Republicans sound the alarm that Trump camp could lose the state. https://…
787741115533369344,2016-10-16 19:44:52,The response to threats based on their endorsement is powerful
787740073823444993,2016-10-16 19:40:43,: Remarkable story o/white nationalist: “It’s not just that I was wrong. It’s that it caused real damage.”
787492606297145344,2016-10-16 03:17:22,look at you trying to drag me into a Saturday night fast food debate
787110031720325124,2016-10-15 01:57:10,": In '89, 's Fdn gave $7 to the Boy Scouts. Thought I'd never figure out why. Thanks to you all, I think I d…"
787080048830480384,2016-10-14 23:58:01,"People, pull yrselves away from Trump for something even better: w &amp; me!"
787079231536717825,2016-10-14 23:54:46,"somebody's doing the raping, Jason"
787079011470077952,2016-10-14 23:53:54,: the GIF
787078307951087616,2016-10-14 23:51:06,"And the campaign's transformation into a punk rock show, complete with skinheads and smashed guitars, is complete."
787077036124798981,2016-10-14 23:46:03,Not a metaphor: Trump has literally smashed his teleprompters. Free at last!
787073532333264896,2016-10-14 23:32:07,"Are we sure this airplane ""eyewitness"" isn't actually Roger Stone with a fake English accent?"
787072637960945677,2016-10-14 23:28:34,I'm still waiting for crop subsidies to come up in a debate
787035193509048320,2016-10-14 20:59:47,: NEXT on → and join 's panel at pET on !
787032535679107073,2016-10-14 20:49:13,": ""If I Did It: A Memoir of the Election"""
787001492322578432,2016-10-14 18:45:52,": Molly Ball warns of Donald Trump's ""salted-earth campaign"" worst case scenario"
786999469342613504,2016-10-14 18:37:49,: . on the McMullin moment
786955368781971456,2016-10-14 15:42:35,"Wow, did not realize Trump was in the infamous Giuliani-in-drag skit—as a groper! via"
786930136738328576,2016-10-14 14:02:19,"Sign at Wednesday's Trump rally: ""GRAB THEM IN THE PAUL RYAN"""
786924831111516160,2016-10-14 13:41:14,"In the final phase of the campaign, Trump seems determined to sic the GOP base on its leaders. My piece from Florida"
786677994408509440,2016-10-13 21:20:24,: Joining us tomorrow on : h…
785812904717148160,2016-10-11 12:02:50,Great news for &amp;
785692829452476416,2016-10-11 04:05:42,"I was there and saw this confrontation. Thought you were compassionate, not condescending or dismissive."
785663443886112768,2016-10-11 02:08:56,A Canadian team winning=creeping globalism!
785663311539007488,2016-10-11 02:08:25,Just imagine a contest where both sides were lovable underdogs worth cheering for. Imagine!
785661356687159296,2016-10-11 02:00:38,An Indians-Cubs World Series would be the perfect antidote to this campaign season.
785564720879247360,2016-10-10 19:36:39,"In the new issue of , I profile , the disaffected conservative in the season of Trump"
785538634204053504,2016-10-10 17:52:59,": . on Ken Bone, a hero for our fallen times:"
785461755493232640,2016-10-10 12:47:30,": We'll recap last night's , LIVE /9c w/ , and callers Carl and Don!"
785292465762869248,2016-10-10 01:34:48,"in fairness, started it"
785291605276291072,2016-10-10 01:31:23,"Hillary talking about health care policy while Trump lurks behind her, frowning and swaying, is this whole campaign."
785290689764528129,2016-10-10 01:27:45,Anyone who's ever planned a wedding knows it takes WAY more than three or four or five emails.
785285052666118144,2016-10-10 01:05:21,PRESS ROOM RIGHT NOW: ooooooohhhh
