id,created_at,text
759067084483624960,2016-07-29 16:44:30,: . on where the election goes from here:
759064073237585920,2016-07-29 16:32:32,AMERICA IS ALREADY GREAT
759040587530199040,2016-07-29 14:59:13,"FYI: We may get a few hints/polls on Clinton's convention bounce over the weekend, but will need until next week to have a clearer idea."
759017986061578241,2016-07-29 13:29:24,": And after the pullback in those cities, murders rose. Will same thing happen in Baton Rouge? https…"
759017963244498946,2016-07-29 13:29:18,": Baton Rouge police seem to have reduced ""proactive policing"" since Alton Serling's death. https:/…"
758897984490786816,2016-07-29 05:32:33,: Hello West Coast bar-hoppers and Ulaanbaatarans taking a mid-afternoon break. Our DNC wrap-up pod is live--&gt;
758884191643635712,2016-07-29 04:37:45,Here's my view of where the race stands and what to look for over the next few weeks:
758882608843325440,2016-07-29 04:31:27,: . on where the election goes from here:
758816955851608064,2016-07-29 00:10:35,We're not sure about Four More Years but we're giving you One More Liveblog. It's Day at the DNC:
758801891060912128,2016-07-28 23:10:43,"Why the California delegation boos so much, elained:"
758781756946382849,2016-07-28 21:50:42,"We did a quick podcast this AM on Obama's speech, Clinton's eectations, and what the convention looks like so far."
758649624576069632,2016-07-28 13:05:40,"Even if your model (like ours) is mostly based on state polls, you need national polls to help detect trends, or your model will lag behind."
758649266009214977,2016-07-28 13:04:14,"Short answer: model is more aggressive than some others at detecting trends, and there's been a big trend to Trump in polls this month."
758647874708185091,2016-07-28 12:58:42,Why does our forecast love Trump so much?
758515765159063552,2016-07-28 04:13:45,: That's about where I was drawing the line. Maybe a th percentile bounce if you look from onward.
758514668050718720,2016-07-28 04:09:24,"FYI: About or % of conventions produce discernible convention bounces, Trump's was in maybe the th or th percentile of those."
758458717646053376,2016-07-28 00:27:04,
758454495567372289,2016-07-28 00:10:17,"We're liveblogging DNC Day , which feels awfully high stakes:"
758432147908726784,2016-07-27 22:41:29,: Rigged.
758382522556379137,2016-07-27 19:24:18,We have some thoughts here about Obama's impact on the campaign. Probably still Democrats' biggest asset.
758352415196344322,2016-07-27 17:24:39,"You can get a small-to-medium, Trump-sized convention bounce by moving undecided ""leaners"" into your column. Lots of undecideds this year."
758351392356564995,2016-07-27 17:20:36,"With that said, Trump's convention bounce is meh by historical standards. Seems larger because he was gaining on Clinton before conventions."
758349979475927041,2016-07-27 17:14:59,Lesson seems to be that you can get a convention bounce even with a mediocre convention.
758341745096679424,2016-07-27 16:42:15,I seriously wonder if Trump's going especially nuts because the DNC is getting better TV ratings than the RNC.
758334668366307328,2016-07-27 16:14:08,"I wonder if Biden makes the full-throttle, Trump-unfit-for-office case tonight."
758301327701049345,2016-07-27 14:01:39,"Sanders coalition is unusual too. Not just ""liberal Democrats"". In fact, many aren't Democrats. More leftist than liberal. Many new voters."
758300413644988416,2016-07-27 13:58:01,But Sanders got m people to vote for him. Less than Clinton's m. But cobbled together a whole new coalition.
758299680107298817,2016-07-27 13:55:06,"As a horse race, the primary wasn't very close. Clinton established a big lead early and held it. Followed predictable demographic patterns."
758298997056495616,2016-07-27 13:52:24,"Looking back on the Democratic primary, I think the conventional wisdom underestimated both Clinton AND Sanders."
758285864489328640,2016-07-27 13:00:13,: Was the Democratic primary a close call or a landslide?
758137168372064256,2016-07-27 03:09:21,ri_rupar the r4
758119713339768832,2016-07-27 01:59:59,": Further polling has tended to confirm that Trump has gotten a convention bounce, but not an especially large one: http…"
758092427404214272,2016-07-27 00:11:34,"FiveThirtyEight DNC liveblog, party time, excellent --&gt;"
758074015273680896,2016-07-26 22:58:24,DEMOCRATS NOMINATE CLINTON!!
758069841525895168,2016-07-26 22:41:49,Looks like South Dakota got Clinton there instead. First woman to be nominated by a major US party.
758066268779974656,2016-07-26 22:27:37,"Clinton won pledged delegates in Vermont. So that means it would need to put her over the top with superdelegates, one of whom is BERNIE!"
757978600205344768,2016-07-26 16:39:15,"IIRC, TV ratings aren't too predictive of polling bounces. Still, surprising that DNC &gt;= the Trump show ratings-wise"
757966120150306816,2016-07-26 15:49:40,Remarkable how *little* discussion there's been about Clinton becoming the first woman nominee of a major party --&gt;
757958735402860544,2016-07-26 15:20:19,"tlr: Clinton will probably gain as Sanders voters come home. But NOT a done deal, yet. Among the most important factors in election. (7/7)"
757958034312327168,2016-07-26 15:17:32,"And Sanders supporters are somewhat irregular voters—especially if they're young, but also if you control for age. So turnout is a risk. (6/"
757957233556742144,2016-07-26 15:14:21,"But Sanders holdouts are NOT very fond of the Democratic party. Many are independents. Ergo, Johnson &amp; Stein are real options for them. (5/"
757956577139752961,2016-07-26 15:11:44,"To be sure, there's some relatively low-hanging fruit for Clinton here. Lots of Sanders voters that would lean her way in a -way race. (4/"
757955546200862720,2016-07-26 15:07:39,"But LOTS of Sanders voters are in Johnson/Stein/undecided camp. Maybe %, depending on the poll. So party unity stuff is high-stakes. (3/"
757954925385179136,2016-07-26 15:05:10,"% is what you get if you *force* Sanders voters to choose between Clinton and Trump. No Johnson, Stein, undecided or ""won't vote"". (2/"
757954632601796608,2016-07-26 15:04:01,Seeing the number everywhere that % of Sanders voters back Clinton. It comes from a Pew poll -- Pew is great -- but a bit misleading. (1/
757767219413647360,2016-07-26 02:39:18,: It's basically all California.
757732730142650368,2016-07-26 00:22:15,Here's a longer reflection on mood of the convention tonight. Charged but not the negative vibes others reported.
757730565198057473,2016-07-26 00:13:39,"Live from Philadelphia, it's our Monday night liveblog!"
757716745461329920,2016-07-25 23:18:44,": Here you go, . I made you a chart."
757709049018343425,2016-07-25 22:48:09,"Unfortunately for Clinton, most vocal boo-ers seem to be in California (or Oklahoma?) delegation, near where TV broadcasts are, stage-right."
757708575439482884,2016-07-25 22:46:16,"When the speaker isn't exciting people, they can be quite noticeable. Otherwise they get drowned out."
757708053735235584,2016-07-25 22:44:12,"How many people were booing mentions of Hillary? I'd guess -5% of the delegates, or something like that. A few loud pockets of people."
757696947771809792,2016-07-25 22:00:04,Big cheers for adopting party platform. This convention may be a shitshow -- most gatherings of Democrats are -- but not yet a clusterfuck.
757688674201047040,2016-07-25 21:27:11,"So if people are going to win over the recalcitrant Sanders delegates, it's going to have to be Sanders himself, and maybe Warren."
757688101191946244,2016-07-25 21:24:55,"Does seem though that there's much more enthusiasm for pro-Bernie speakers. Nobody paying attention to Steny Hoyer right now, for instance."
757687286603587584,2016-07-25 21:21:40,...way more pro-Bernie than anti-Hillary. Big cheers for party unity a few minutes ago. Maybe mood has changed in past minutes.
757686924068937729,2016-07-25 21:20:14,"Just got to floor, but not seeing same negative vibe from convention that others are repoting. It feels *charged* and unpredictable, but..."
757650813615505408,2016-07-25 18:56:45,": Hasn't changed. Our now-cast has Trump ahead, other models are more conservative &amp; still have Clinton up."
757634636629549057,2016-07-25 17:52:28,"Sanders supporters aren't consistent Democrats, and turn out at relatively low rates. Sort of a new constiutency."
757621505752723457,2016-07-25 17:00:17,"One implication is that maybe you'll see bigger swings after conventions, debates, breaking news. But also means a small lead is less safe."
757620687079088128,2016-07-25 16:57:02,"A related thought: This year have looked more like elections from s/80s/90s. Many undecideds. Polls volatile. Not as steady as , , ."
757619345774247937,2016-07-25 16:51:42,"Democrats were maybe too complacent about what happened to Clinton's numbers in July. If you go from +7 to +3 in a month, easy to go to ."
757618812002926596,2016-07-25 16:49:35,If you want to ignore polls for the next weeks that's OK. Polls can be wild during conventions. Trump's bounce pretty average. HOWEVER...
757616971894718468,2016-07-25 16:42:16,"*Before* the conventions, Trump had a -40% chance of winning, per our models. That's high! Race had already gotten much closer."
757616561062633472,2016-07-25 16:40:38,"Here's my longer take on the polls, post Trump's convention bounce:"
757609510160793600,2016-07-25 16:12:37,: Interested in working with us? We have lots of open positions (including internships)!
757605139935031297,2016-07-25 15:55:15,This looks prescient right now --&gt;
757602823764865025,2016-07-25 15:46:03,"Trump voters are loyal Republicans, but aren't very conservative. Bernie voters are very liberal, but aren't partisan/loyal Democrats."
757565933573603332,2016-07-25 13:19:28,": Polls-plus is the most accurate, historically. But the now-cast is fun if you like to panic!"
757561481403723777,2016-07-25 13:01:46,Trump trailed by around points in our forecasts a week ago. Typical convention bounce is points. So you end up at Trump +1 or so.
757560640013733889,2016-07-25 12:58:26,It's not Trump's convention bounce per se that should worry Dems. That's pretty normal. It's how it became so close to begin with.
757559058924699648,2016-07-25 12:52:09,"CLINTON still leads in our polls-plus model, which adjusts for Trump's convention bounce."
757558402667188224,2016-07-25 12:49:32,"TRUMP now leads in 's now-cast, our estimate of what would happen in an election today."
757285054921965568,2016-07-24 18:43:21,: The shooting disappeared off the media radar so fast after we learned he wasn't Muslim that most people don't know h…
757038763793145856,2016-07-24 02:24:41,: Holy shit. Holy shit. Holy shit.
756975247606312960,2016-07-23 22:12:17,"Provisional conclusion: Trump seems to be getting a bounce, although it seems to be on the small/medium side as these things go."
756973671302963200,2016-07-23 22:06:01,We have a few post-RNC polls in. Is Trump getting a convention bounce?
756966780426412033,2016-07-23 21:38:38,": About the same as and . Also about the same as , when Kerry led in the month before the conventions."
756965274188967936,2016-07-23 21:32:39,"Don't get me wrong, I thought Kaine's speech was good, I just think it stands out mostly in comparison to the apocalyptic tone in Cleveland."
756886776774524928,2016-07-23 16:20:44,: Tim Kaine is a mainstream Democrat across three ideological measures.
756681961809272832,2016-07-23 02:46:52,Don't think people are really grasping how plausible it is that Trump could become president. It's a close election right now.
756668662174609408,2016-07-23 01:54:01,: What does the Tim Kaine pick mean? It means Clinton thinks she has Trump beat.
756655285419343872,2016-07-23 01:00:52,"Clinton now a % favorite in Virginia per our polls-plus forecast, which makes an adjustment for her VP pick."
756648622872227840,2016-07-23 00:34:24,"Agree with this. Making a ""safe"" choice became more obvious as Trump has tilted even more toward demagoguery."
756642289506746368,2016-07-23 00:09:14,": Clinton selects Tim Kaine, according to a campaign official."
756609029061939200,2016-07-22 21:57:04,": ISO ""a journalist who’s interested in both the drama of a game and the numbers behind it"""
756606384788086784,2016-07-22 21:46:33,: It's Crist
756571464787234818,2016-07-22 19:27:48,"But VP picks just don't make all that much difference, in their home states or otherwise, under most circumstances."
756571052612919296,2016-07-22 19:26:10,"That's actually not bad by comparison. Virginia is the th best state for a Clinton veep pick after FL, OH, PA, NC. More impact than Iowa."
756570090863198208,2016-07-22 19:22:20,Tim Kaine would increase Clinton's chance of winning the Electoral College by ... %.
756566436638760960,2016-07-22 19:07:49,: We're hiring a copy editor!
756565472330604544,2016-07-22 19:03:59,"Clinton Kaine finished rd at Talladega this year, behind Jimmie Johnson and Martin Truex, Jr."
756484085808304129,2016-07-22 13:40:35,Clinton has to decide between a strategy and a strategy against Trump:
756354384171298816,2016-07-22 05:05:12,: Refresh your elections feed! Our late-night RNC wrap-up pod is live --&gt;
756314361619111936,2016-07-22 02:26:10,"Trump's staying on script so far. Added a graf at the beginning, but basically matches the leaked speech."
756304004997525504,2016-07-22 01:45:00,This song is plagiarized from Matt Parker and Trey Stone.
756303307711258624,2016-07-22 01:42:14,": It's actually your SOBER uncle, which can be so much worse."
756301866900660224,2016-07-22 01:36:31,This whole election is one giant culture war. Maybe the biggest one ever.
756301552906702848,2016-07-22 01:35:16,: Great that Peter Thiel says he's proud to be gay &amp; American - also notable he funded lawsuits to bankrupt Gawker for writing…
756298977281126401,2016-07-22 01:25:02,"Peter Thiel ain't no libertarian, not if he's endorsing Trump, who might be the most statist candidate in years."
756280860865814528,2016-07-22 00:13:02,"We're liveblogging Day of the Republican National Convention, potentially a momentous night in American history."
756251052815581184,2016-07-21 22:14:36,"Here's what , and I are thinking about as we enter a pivotal -hour campaign stretch."
756193530561826816,2016-07-21 18:26:01,: We're hiring a social media editor. Come work with us!
756189953021870080,2016-07-21 18:11:48,: Why are so many black Americans killed by police?
756138667954081792,2016-07-21 14:48:01,"Only % of voters are ""real Americans"" like the Duck Dynasty guys."
756120015934525440,2016-07-21 13:33:54,"Maybe the normal rules don't apply to Trump. We'll know in a few weeks. From a politics standpoint, the RNC isn't going well."
756119268635402240,2016-07-21 13:30:56,Trump's convention is flirting with disaster.
755981619081674752,2016-07-21 04:23:58,Many RNC speeches have coyly avoided Trump endorsement. But you'd barely notice without a transcript. Cruz drew attention to it.
755980067361157121,2016-07-21 04:17:48,"I was surprised by just one mention of Trump, and passive-aggressive subtext, in Cruz remarks as prepared. But was a lot worse as delivered."
755978853433114624,2016-07-21 04:12:58,"Cruz mostly stuck to prepared remarks, but he ad-libbed and drew out pregnant pauses at a couple moments where he might have endorsed Trump."
755963914182127617,2016-07-21 03:13:36,: Now Cruz is retweeting people:
755952710202064898,2016-07-21 02:29:05,: The version the RNC blasted out at didn't have anything like that. Maybe there were other versions.
755949248743604224,2016-07-21 02:15:20,"Not sure whether Cruz tried, and failed, to walk a fine line. Or deliberately wanted to undermine Trump."
755944569318019072,2016-07-21 01:56:44,What a total and complete shitshow this convention has been.
755928977789902848,2016-07-21 00:54:47,: Americans ️ NASA:
755917459421589510,2016-07-21 00:09:01,Time for our liveblog R U ready? M P
755602695663325184,2016-07-20 03:18:15,"We've confirmed that ""Hillary"" and ""Clinton"" were the most common words spoken tonight. ""Work"" was tied for th."
755591970072829953,2016-07-20 02:35:38,"""Trump"" mentioned times. ""job"" or ""jobs"" mentioned times."
755591725062598661,2016-07-20 02:34:40,"Tally for Make America Work Again night: ""work"" (or working, etc.) mentioned times ""Clinton"" mentioned times"
755582310922063872,2016-07-20 01:57:15,Maybe Trump figures the only way he can win is by dragging Clinton down with him. It's sort of working so far.
755559800734306305,2016-07-20 00:27:48,"We're blogging, live, for our Day RNC liveblog."
755541383520321536,2016-07-19 23:14:37,GOP NOMINATES TRUMP!!!
755521704760193024,2016-07-19 21:56:25,"Grim mood in Cleveland, inside and outside arena. Will the sense that the world is in crisis help Trump—or Clinton?"
755519828354535424,2016-07-19 21:48:58,Ticker at the Q promotes fake Twitter accounts and .
755462646317670404,2016-07-19 18:01:45,Plane crash? Not when % of the passengers arrived in one piece!
755451356706705408,2016-07-19 17:16:53,: Missed and 's Facebook Live chat? Here's a snippet discussing Melania Trump's plagiarism: ht…
755431419283996672,2016-07-19 15:57:40,'s pro-Trump bias is showing.
755421155268386817,2016-07-19 15:16:53,"One caution, though. In , there were days between the convention and the election. This year? days. Gonna be a LONG campaign."
755420452932161537,2016-07-19 15:14:05,We'll know a lot more about where the race stands in days.
755279592928243712,2016-07-19 05:54:22,
755274060557418496,2016-07-19 05:32:23,It's the perfect Trump controversy. The future of the country is at stake and people are talking about it like some reality TV shitshow.
755253095609794561,2016-07-19 04:09:04,"Trump will, of course, deny it's plagiarism, blame the media for ganging up on his wife."
755236493787004928,2016-07-19 03:03:06,Feel like I'm gonna be writing a lot of this kind of thing over the next few months.
755197138833969152,2016-07-19 00:26:43,"Speakers tonight will mention ""America"" times, and ""conservative"" times."
755193929461563393,2016-07-19 00:13:58,"Trump is still incredibly unpopular. So is Hillary Clinton, which is why it's a close-ish race."
755193289381470208,2016-07-19 00:11:25,"We're liveblogging from Cleveland, about Scott Baio, because ."
755160471683072000,2016-07-18 22:01:01,"In case you missed it, here's 's excellent feature on WTF happened to the Republican Party:"
755025553569316865,2016-07-18 13:04:54,: The end of a Republican Party:
754897402289655808,2016-07-18 04:35:40,: Hello east coast night owls and people heading to work in Ashgabat. Here's your podcast RNC preview https…
754711046200422400,2016-07-17 16:15:09,"A % lead isn't nothing. But it's early, and there are a LOT of undecided and rd party voters. Hence, our model is pretty cautious."
754710367536832512,2016-07-17 16:12:28,"Lots of new polls...but our forecast is unchanged. Our model ""thinks"" Clinton's up by ~4%."
754508759179767808,2016-07-17 02:51:20,": Hip-hop is turning on Donald Trump, according to lyrics:"
754493830204907520,2016-07-17 01:52:01,"There's about a in chance that NEITHER candidate gets a majority, per our forecast. (Although note: this isn't that rare historically.)"
754491418874445824,2016-07-17 01:42:26,Usually the major-party candidates gain votes from undecided &amp; rd parties as time passes. Sort of the opposite so far this year!
754490918963523585,2016-07-17 01:40:27,"Gary Johnson up to % in our national poll average, his high point of the year so far."
754357552280768513,2016-07-16 16:50:30,- Optics of Trump-Pence have been awkward. - VP picks are mostly about optics. - Optics don't matter much. - VP picks don't matter much.
754088562874781696,2016-07-15 23:01:38,. seems like a good follow for Turkey news.
754078304018268160,2016-07-15 22:20:52,He'll probably be Prime Minister by Tuesday at the rate things are going.
754077468248698880,2016-07-15 22:17:33,": This was just a regular day for most of th century. We've become accustomed, rightly, to calm."
754071518540337152,2016-07-15 21:53:54,: I can't even figure out who I'm supposed to be rooting for.
754020327664082944,2016-07-15 18:30:29,Per our model Trump's chances are up to about % as we head into the conventions. My view on where the race stands:
753976684756529153,2016-07-15 15:37:04,Our Indiana forecast now accounts for selection of Pence. But Trump was way ahead there already so no major impact.
753932215327813632,2016-07-15 12:40:22,": It recontacts the same K people repeatedly throughout the election, which is better for detecting trends than levels."
753931850943520768,2016-07-15 12:38:55,": I personally like the methodology, which is similar to what the RAND American Life Panel did in '12. A lot of people won't tho."
753687216279392256,2016-07-14 20:26:49,: This story on hip-hop references to &amp; is amazing. http…
753684768684990464,2016-07-14 20:17:06,": unplug ur headphones, turn up max volume &amp; listen as hip hop tells us everything we need to know about the world"
753677411481427968,2016-07-14 19:47:52,"Trump already an % favorite in Indiana, so no real Electoral College benefit, but that can be overrated."
753676879408824321,2016-07-14 19:45:45,"My heuristic is: a ""generic Republican"" would be running even with or ahead of Clinton, so not so bad to have one on your ticket."
753676672747073536,2016-07-14 19:44:56,"Can't quite call Pence a ""safe"" choice since he's so unknown, but he seems better than Trump's alternatives."
753668715451912192,2016-07-14 19:13:18,: Mike Pence would be a really conservative and mostly unknown VP pick:
753664772588077056,2016-07-14 18:57:38,"Hmm, rewriting my Pence article in the subjunctive. Or is that the conditional?"
753653640146083840,2016-07-14 18:13:24,Tipping-point states are back! Here are the states most likely to decide November's outcome.
753589212331511809,2016-07-14 13:57:23,National polls don't show gains for Trump per se. More about Clinton losing ground to Johnson/Stein/undecided.
753588150296047616,2016-07-14 13:53:10,"Betting markets put Trump's chances at more like %. So our model is pro-Trump, relative to the conventional wisdom!"
753587360626016256,2016-07-14 13:50:02,"Trump continues to gain in our forecast, as state &amp; national polls trend against Clinton. Now a % chance to win."
753411512333729792,2016-07-14 02:11:16,: Trump's wild card pick is said to be GRAVEL; Kushner thinks he could appeal to Sanders voters.
753405828716257280,2016-07-14 01:48:41,": Manhattan location suggests PATAKI, but Manafort is said to be lobbying for GILMORE."
753364509444702210,2016-07-13 23:04:30,"If you're really up by % nationally, as Clinton was at her peak, your swing state polls should be excellent. Not a mix of good and meh."
753363021313998848,2016-07-13 22:58:35,"It's not a huge decline. Our model ""thinks"" Clinton went from leading by -7% nationally, to more like -5%."
753362210840252416,2016-07-13 22:55:22,The key (as is often the case) is the trendlines. Clinton's numbers declined from the previous editions of the same polls.
753361148699897856,2016-07-13 22:51:09,"Here's my thoughts on today's bounty of swing state polls, which our model thought were mostly good news for Trump."
753359985665576960,2016-07-13 22:46:31,: Why does the West have such high rates of gun suicide? And what can we do about it?
753350952049049601,2016-07-13 22:10:38,: I think the presumption is bad until proven otherwise. It's a tough state to poll.
753349206740303872,2016-07-13 22:03:42,"These big Clinton leads in Colorado make some sense given the polling in Arizona, Utah. But they make tight race in Nevada more confusing."
753290313888854016,2016-07-13 18:09:40,"Those Marist polls actually helped Trump a bit. They had OK numbers for Clinton, but down from where she was before."
753264886835187712,2016-07-13 16:28:38,": When we started on this, I had no idea that nearly two-thirds of gun deaths were suicides:"
753250362291851264,2016-07-13 15:30:55,": The U.S. gun homicide rate is less than per ,000. For young black men, it is ."
753241464344158209,2016-07-13 14:55:34,"And homicides among the urban poor, in cities such as New Orleans."
753241222110523392,2016-07-13 14:54:36,"We wanted to focus on gun deaths that do *not* usually make headlines. For example, suicides in rural areas:"
753240912927436800,2016-07-13 14:53:22,More important than the polls: is out with a massive project on gun deaths in America:
753239235516260352,2016-07-13 14:46:42,But nat'l polls haven't shown too much tightening (people are guilty of cherry-picking those a bit). Clinton up ~5%.
753238439189811204,2016-07-13 14:43:33,"Yes, those Quinnipiac polls have been Republican-leaning. Our model accounts for that. They're bad for Clinton nevertheless."
753236366826156032,2016-07-13 14:35:18,"Pretty sharp uptick for Trump in our forecast, after this morning's polling. Chances up to % in polls-only model."
752967846658007042,2016-07-12 20:48:18,: Job : is eanding our econ coverage and looking for freelance writers. Interested? ben.casselman…
752959429054763012,2016-07-12 20:14:51,: We're hiring a social media editor. Come work with us!
752954305410392064,2016-07-12 19:54:30,"There have been some strong individual polls for Trump, and Clinton but -- as is often the case -- they more or less cancel out."
752953979487805440,2016-07-12 19:53:12,No real change in polls over the past week. Trump at % in our polls-only forecast today. Was % a week ago.
752941355970813952,2016-07-12 19:03:02,": We'll post a job listing soon. But in the meantime, if you're interested, email me."
