id,created_at,text
826142192381095938,2017-01-30 18:57:02,: My longer takeout for : NBA Players Can Go Home Again -- But the Ticket Moochers Will Be Waiting
826134086037159936,2017-01-30 18:24:49,It does seem safe to assume that any blue or purple-state Democrat who votes for Trump's SCOTUS pick will have hell to pay from the base.
826132927083864065,2017-01-30 18:20:13,"Not that many votes yet, so scores will change significantly over next few weeks. Also, we'll be adding new features &amp; functionality."
826132269689663489,2017-01-30 18:17:36,(Pleasantly) surprised at how interested people are in this future. Haven't seen this much interest in Congress sin…
826132051678093313,2017-01-30 18:16:44,: Trump's nominee will almost certainly move the court to the right. But exactly how far right could vary widely: https:…
826086829304774660,2017-01-30 15:17:02,I was affected by the Delta outage last night. People grumpily sat around and played with their phones. Some of the…
826078871078498305,2017-01-30 14:45:25,"These senators have the most negative plus-minus scores so far, which means they OPPOSE Trump more often than peers…"
826078398720176128,2017-01-30 14:43:32,We're also calculating a plus-minus score—how often you've voted with Trump compared to Trump's share of the vote in your district or state.
826076630607097857,2017-01-30 14:36:31,"We're tracking which members of Congress vote in support of Trump most often. Congratulations, ! --&gt;…"
825830921177808896,2017-01-29 22:20:09,: Trump is doing what he said he'd do. So why are people surprised?
825816493631893508,2017-01-29 21:22:49,Did Trump's voters take him literally?
825478620936302595,2017-01-28 23:00:14,"Still, Trump is pushing things to the absolute brink. Not really even trying to eand beyond his ~45% coalition."
825478035134615552,2017-01-28 22:57:54,A big caveat here is that many of the issues raised by Trump's executive order haven't really been asked about in detail by pollsters.
825476725941424129,2017-01-28 22:52:42,Reducing refugees would be a fairly popular policy. Banning them? Probably not.
825425658230747136,2017-01-28 19:29:47,"That's why Trump keeps relitigating the election results. He's governing like he's FDR or Reagan, not a guy who lost the popular vote."
825424889184153603,2017-01-28 19:26:43,The most striking thing is the juxtaposition between the boldness of Trump's actions and the narrowness of his mandate.
825207135755722752,2017-01-28 05:01:27,So sorry for the interruption but one might almost be inclined to remark that we ought to have taken Trump literall…
825200170325401600,2017-01-28 04:33:46,": Reporting on environment, environmental regulation/enforcement and EPA. Contact maggiekb.com. Now with PGP (…"
825106506261606400,2017-01-27 22:21:35,Need to read beyond headlines. Signal-to-noise ratio should improve over time but it's tough being a news consumer (or reporter) right now.
825104685027713024,2017-01-27 22:14:21,". Prematurely or incompletely reported rumors misreported as stuff that already happened. . Relatively normal POTUS stuff, exaggerated."
825103715258527746,2017-01-27 22:10:30,. Genuinely unprecedented and troubling stuff. . Sensational but inconsequential stuff Trump does to troll or distract people.
825103520768614401,2017-01-27 22:09:43,"After his first week in office, seems like we're all having trouble distinguishing between about categories of Trump stories..."
825073463337611264,2017-01-27 20:10:17,: SABR Analytics awards voting is open here: I was nominated for a piece with : ht…
824985573035212800,2017-01-27 14:21:02,": Excited to debut TrumpBeat, 's new column recapping &amp; analyzing the week in Trump admin policy news. http…"
824742346206146562,2017-01-26 22:14:32,"Trump's got this clever strategy of leaking trial balloons, then blaming ""dishonest media"" for misreporting the story if &amp; when they flop."
824721922051207168,2017-01-26 20:53:23,Trump could pretty easily trigger a recession in Mexico.
824714330507767808,2017-01-26 20:23:13,Also: there's a big difference between citing numbers (which everybody does) and being empirical (which is where th…
824711359988371456,2017-01-26 20:11:25,"Part : People misinterpreted early voting data, wrongly using it to conclude Clinton would outperform her polls."
824683983590064130,2017-01-26 18:22:38,": Perceptions on immigration stances, vs. :"
824425506854633473,2017-01-26 01:15:32,: How Trump was able to ignore protections for govt scientists so easily:
824374583121874946,2017-01-25 21:53:11,A mistake by both reporters &amp; quants was in treating election as independent contests instead of looking at rela…
824368983168139266,2017-01-25 21:30:56,"Part : Ohio wasn't a ""must-win"" for Clinton. But her struggles there were another (mostly ignored) sign of trouble."
824329118888165376,2017-01-25 18:52:31,": Starting a weekly column called The Four-Point Play, looking at the NBAs odd statistical trends. https://…"
824297617555419136,2017-01-25 16:47:21,": Chicago's murder rate has risen dramatically in past two years, but it's still below mid-90s level. http…"
823971720293969921,2017-01-24 19:12:21,"Clinton got % of the vote in PA/WI/MI, which matched/exceeded her polls. But Trump hugely beat his polls because undecideds broke his way."
823970053859278848,2017-01-24 19:05:44,Part : Why weren't reporters—and models—paying more attention to the huge number of undecided voters?
823925114286800905,2017-01-24 16:07:09,"Here's 's Oscars tracker -- hopefully, we'll be wrong about Casey Affleck."
823744596396097536,2017-01-24 04:09:50,"Maybe the presidency will be different, but the campaign taught me to be skeptical when the CW was that the wheels were coming off Trump."
823662158512848897,2017-01-23 22:42:16,"There are many valid critiques of those ""fundamentals"" models. Still, this is another case where bad data for Clinton was mostly ignored."
823661835488555008,2017-01-23 22:40:59,Article : Political science models based on the economy &amp; other non-polling data had Clinton as &lt;=50% to win.
823568849979244545,2017-01-23 16:31:29,"A lot of it was the national media's *belief* in the Emerging Democratic Majority. I say ""belief"" because the case…"
823568099370762241,2017-01-23 16:28:30,"Article of TK: Why did (most) reporters assume the Electoral College would help Clinton, when it hurt her instead?"
823553165874331648,2017-01-23 15:29:10,"So while everyone's fulminating over Sean Spicer &amp; inauguration crowd sizes, looks like Trump will get ~100% GOP su…"
823539190235332608,2017-01-23 14:33:38,But women's March participants also more heavily concentrated in blue states &amp; big cities. A bit like popular vote…
823533958663204864,2017-01-23 14:12:50,"Still, this was a very big march. About x as many total participants as the tea party protests on /15/09."
823533504025817088,2017-01-23 14:11:02,Some crowd size estimates probably ARE exaggerated—organizers can inflate the numbers—so we correct for that.
823532959097614337,2017-01-23 14:08:52,We estimate -- and this is an inexact science -- about m people partcipated in the Women's Marches on Saturday.
822954121942695938,2017-01-21 23:48:47,". I have no foolproof solutions, but a more iterative approach might help? Build on prior knowledge but be ready to revise conclusions."
822953414799851520,2017-01-21 23:45:58,". Sometimes the reverse is true also. In a well-reported story, the conclusion should hold even if some nonessential details are wrong."
822953200558993414,2017-01-21 23:45:07,". A story can be % factually accurate (narrowly true) and yet basically be BS. Many stories driven by ""the narrative"" have this problem."
822952837609095170,2017-01-21 23:43:40,". Still, this gets into some hiccups for how the press evaluates itself. There can be too much focus on narrow truth vs. broader truth."
822952649716801537,2017-01-21 23:42:56,". In general, the correct response is to disengage and not let the other guy dictate the terms of the debate."
822952455327678466,2017-01-21 23:42:09,. This is challenging to deal with. You can be % right and a skilled debater can usually pivot the conversation to the % you got wrong.
822952124984262659,2017-01-21 23:40:50,". Buried among the many bad arguments there are usually a few grains of truth, i.e. examples of stories the media really did screw up."
822951918179876864,2017-01-21 23:40:01,. Spicer (&amp; Trump) are skilled at what we used to call “the spread” in high school debate. Make a lot of dubious arguments really fast.
822922004978397184,2017-01-21 21:41:09,"Because of this, Trump can make out pretty well if ~45% of the country supports him. But bottom will fall out quickly if it's only -40%."
822917985388138498,2017-01-21 21:25:11,Hard to overstate how clustering/gerrymandering of Dems helps GOP. Trump lost pop vote but won median congressional district by ~3.5 points.
822911265114877952,2017-01-21 20:58:29,But it's a BIG adjustment to go from underdog/insurgent to incumbent. One of the reasons presidents often struggle in their first -2 years.
822910370717302786,2017-01-21 20:54:55,"Not unique to Trump, btw. Reagan, Clinton, Obama were also underdogs in their way. True pretty much whenever the presidency changes parties."
822908963897430016,2017-01-21 20:49:20,"Trump benefited from always being seen as an underdog during the campaign. The minute you become president, you aren't an underdog anymore."
822869915937996801,2017-01-21 18:14:10,Women's March numbers likely to way exceed Tea Party overall. But curious what numbers will look like in small &amp; medium-sized towns.
822869267637014528,2017-01-21 18:11:36,"Here's a list of Tea Party crowd sizes from April . About ,000 people at the various rallies combined."
822841792265588736,2017-01-21 16:22:25,: Trump's executive order on ACA means everything and does nothing:
822453093950509058,2017-01-20 14:37:52,Our final liveblog of the campaign!:
822190228710555649,2017-01-19 21:13:20,": Our big, pull-back look at how the Democrats lost their electoral edge, even with Obama in the White House:"
822180680763396097,2017-01-19 20:35:24,Chelsea % Liverpool % Arsenal % Spurs % Man City %
822165062622334976,2017-01-19 19:33:20,: The machines are coming for poker:
822090664309559297,2017-01-19 14:37:42,"In the meantime, here's my macro view on why Trump won. Doesn't compress well into characters so here are par…"
822089131606020096,2017-01-19 14:31:37,"*Misinterpreting* the polls was a big problem. So was confirmation bias, reading ambiguous signs as good for Clinton. Many examples to come."
822088082405134336,2017-01-19 14:27:27,"As I'll argue, it's irresponsible to blame the polls for the overconfidence in Clinton's chances. They showed a competitive, uncertain race."
822087432778772481,2017-01-19 14:24:52,We have a long series coming out on journalistic &amp; analytic errors in the general election. Here's the intro:
821885706800943104,2017-01-19 01:03:17,": Bonds and Clemens are likely to make the Hall--probably not this year, but soon."
821766028397019136,2017-01-18 17:07:43,: New politics pod! We discuss favorability ratings and I force Harry to elain crowd size estimates https…
821709913953026048,2017-01-18 13:24:44,The US becoming more progressive on social issues is perhaps the clearest legacy of the Obama era.…
821703951439511554,2017-01-18 13:01:03,: How political opinions have changed under Obama. The race relations trend is depressing.
821523482961989632,2017-01-18 01:03:56,"Here's are some benchmarks for estimating a *realistic*, empirically-derived margin of error."
821522230114996224,2017-01-18 00:58:57,"(Yes, but this would be a great time for reporters to re-acquaint themselves with sources of polling error &amp; uncertainty.)"
821521740287406081,2017-01-18 00:57:00,Can You Trust Trump’s Approval Rating Polls?
821365455961067520,2017-01-17 14:35:59,Doing that would *really* have changed the election story. But doesn't change the story on Trump entering as fairly unpopular president.
821364890426343424,2017-01-17 14:33:44,"When you see a poll cited, mentally add and subtract a few points in either direction and consider how much it would change the story."
821364330616725505,2017-01-17 14:31:31,"Which is to say, polls were OK but a long way from perfect. Reporting often fails to convey the uncertainty in polling. Failed badly in '16."
821363951560749057,2017-01-17 14:30:00,"Polls were roughly as accurate as they've been since '68. Trump beat his average nat'l poll by points, swing st…"
821342801728327681,2017-01-17 13:05:58,: What do presidents really do in their first days? My latest piece
821009957797629953,2017-01-16 15:03:22,: That Packers-Cowboys game was as great as it seemed:
820821015324426240,2017-01-16 02:32:34,
820816646868639745,2017-01-16 02:15:13,: i did a quick etch a sketch of tony romo reacting to the cowboys' loss
820344006953619457,2017-01-14 18:57:07,: Six types of data story + their dangers from
820072505939554307,2017-01-14 00:58:16,": in the NFL, screaming at refs works: they call DPI % more often when they're on the offensive team's sideline"
820054034258202624,2017-01-13 23:44:52,": &amp; the ways in which kid science mirrors professional adult science. Like this results summary, which I may totally steal f…"
819980423287767040,2017-01-13 18:52:22,: First byline for ! Ironically on a topic I spent my last months of grad school researching.
819757798204571649,2017-01-13 04:07:44,I side with the latter view (the traditions have failed). But this is the implicit question behind many arguments on how to cover Trump.
819754435261952000,2017-01-13 03:54:22,"Conflict: Is the distrust in political journalism a result of it having departed from its traditions, or proof that those traditions failed?"
819749524176601088,2017-01-13 03:34:51,": I am wary of any formulation about how journalists should deal with Trump that is even in part, ""Don't misbehave and giv…"
819745283223547904,2017-01-13 03:18:00,THIS IS WHY TRUMP WON
819663255593422848,2017-01-12 21:52:03,: L.A. is already way more interested in the Chargers than the Rams
819662721918582784,2017-01-12 21:49:56,: Apt advice to the American press from a Russian journalist. (Trump is not a cruder Romney but a softer Putin.)
819541106337705985,2017-01-12 13:46:40,I'm .
819330598653296640,2017-01-11 23:50:11,THIS IS WHY TRUMP WON
819189222766768128,2017-01-11 14:28:25,: Come on. The difference in how this Trump revelation is being handled vs. how the Comey letter was handled is too hyperbolic t…
819176222659899392,2017-01-11 13:36:45,"e.g. if you flew EWR (Newark) to FRA (Frankfurt) to PRG (Prague), you'd get a passport stamp in Germany. Very few direct flights to PRG."
819175140357455872,2017-01-11 13:32:27,"Minor point, but a passport wouldn't prove much about whether you'd been to Prague since you'd likely enter from el…"
818806093170245634,2017-01-10 13:05:59,: Packed confirmation hearing schedules are nothing new.
818617678218850304,2017-01-10 00:37:18,": First live podcast of . Confirmation hearings, etc. Hope they didn't cut talking pasta, though. https:/…"
818543138851745793,2017-01-09 19:41:06,": That big increase in murder in U.S. big cities in continued in , found. http…"
818321011812790272,2017-01-09 04:58:27,THIS IS WHY TRUMP WON
818223434111057920,2017-01-08 22:30:43,"In the final scene in ""The Natural"", why isn't everybody running for their lives as shards of hot eloding glass f…"
818149067805097985,2017-01-08 17:35:12,Not even sure if they're an *intentional* distraction. Just saying they produce a lot of -hour and -hour stories that lack staying power.
818145933540159500,2017-01-08 17:22:45,When you're not immersed in the news cycle—been on vacation for weeks—much clearer how much of a distraction most of Trump's tweets are.
818095967673208836,2017-01-08 14:04:12,The Detroit Lions have won playoff game in the Super Bowl era:
817433266005413888,2017-01-06 18:10:52,: Dolphins are mammals.
817133939290767360,2017-01-05 22:21:27,: My latest for : The Milwaukee Bucks' Mediocre Record Is Hiding a Dangerous Team
817120577118937089,2017-01-05 21:28:21,: Registered voters who stayed home probably cost Clinton the election:
817075441680912384,2017-01-05 18:29:00,"Basically you eliminate divisions and championship games. Instead, have flex weeks where matchups are paired based…"
817073484882968576,2017-01-05 18:21:13,"Here's my radical proposal, which involves making college football more like high-school debate tournaments."
816755777469816832,2017-01-04 21:18:46,: Just posted: summer in: -Data reporting -Copy editing -Podcast/video -Dataviz Apply! https:…
816423446288723968,2017-01-03 23:18:12,They're pretty into Comic Sans in Italy.
815653213168955392,2017-01-01 20:17:34,This doesn't bode well for how some of the big news orgs will cover President Trump. More concerned about appearanc…
815339077197238272,2016-12-31 23:29:18,"Upon further review, is indistinguishable from except that everyone is drunk and/or eating pizza."
815336350316634112,2016-12-31 23:18:28,"Buon Anno from Firenze, Italia, where we're already in and it's **amazing**."
814965459997036545,2016-12-30 22:44:41,: our weirdest and best charts of !
814168661942484992,2016-12-28 17:58:30,": Jealous of 's Jealousy list, we made our own. I was especially envious of 's work."
813890135712550912,2016-12-27 23:31:44,: this is a bad take
813798233319182337,2016-12-27 17:26:33,I think l'll have the risotto.
812448643605233664,2016-12-24 00:03:45,
812304736619732992,2016-12-23 14:31:55,Here's what the electoral map would look like if only people who weren't burnt to a crisp in the nuclear holocaust…
812130159407091722,2016-12-23 02:58:13,: Oh my God. Trump has been planning to team up with Russians on nukes against others since . Found old interview. htt…
811631392211763200,2016-12-21 17:56:17,: Our who-will-wield-the-most-political-power-in-2017 draft. Trump whisperers prominently featured.
811234358849896449,2016-12-20 15:38:37,"These were the same voters being re-surveyed, so data suggests Trump win wasn't ""baked in"" -- something changed at the end of the campaign."
811232122396610565,2016-12-20 15:29:44,"Overall, it shows a ~4 point net shift to Trump from Oct. onward (Fiesta del Comey began Oct. ) between switchers &amp; late-deciders."
811230076981407744,2016-12-20 15:21:36,"Here's more evidence, from a panel survey, of a late shift to Trump during final weeks of campaign.…"
811221785421250561,2016-12-20 14:48:40,: More evidence of a late swing towards Trump:
811021476203728900,2016-12-20 01:32:42,"candidates received at least electoral vote, which looks like the most since ."
810999344237252608,2016-12-20 00:04:45,: Here you have it. Closing thoughts on . (Note: we've still got a couple special episodes next week &amp; week after) https:…
810983612862595072,2016-12-19 23:02:15,: The Electoral College has become another partisan issue -- even more so than it was in https:/…
810952000234024961,2016-12-19 20:56:38,"These weren't just after-the-fact protest votes, either. Some WA electors refused ahead of time to vote for Clinton."
810951097087119362,2016-12-19 20:53:02,There are some not-too-distant alternate realities where these votes would have cost Clinton the Electoral Colleg…
810857640934903808,2016-12-19 14:41:41,Democrats might also recall how quickly Republicans stymied Obama's agenda in . And Obama had *much* wider majorities than Trump.
810856367913312256,2016-12-19 14:36:37,Democrats have a lot of opportunity in against a possibly-very-unpopular President Trump. But they lack a deep roster of candidates.
810855790819033088,2016-12-19 14:34:20,I think the talk of flipping electors is a bad idea on its own. But also a bad use of Democrats' energy.
810243976578158596,2016-12-17 22:03:12,"Data was clear that white noncollege voters were overrepresented in swing states, helping Trump in EC. Narrative-driven coverage ignored it."
810240936403992580,2016-12-17 21:51:07,A lot of the flaws in campaign coverage this year boiled down to inattention to or indifference toward facts and details like these.
810239560001187840,2016-12-17 21:45:39,Lots of media folk continue to ignore that Clinton would still have lost the Electoral College if she'd won WI &amp; MI (also needed PA or FL).
809990276890628096,2016-12-17 05:15:05,: The last weeks of campaign stops in one handy gif:
809822848835526656,2016-12-16 18:09:47,: I dug into 's finding of a k vote discrepancy between NYC's/NYS's presidential vote count in NYC https://…
809780324901208064,2016-12-16 15:20:49,: Trump campaign had internal polls. Or could have made calls based on public polling data. model liked playing in MI/WI/MN.
809776555278868480,2016-12-16 15:05:50,"Talked to Michael Lewis about his new book, ""The Undoing Project"", which I'd recommend. Transcript &amp; podcast here:"
809455431873503232,2016-12-15 17:49:48,How Trump could screw with government data:
809410871030140928,2016-12-15 14:52:44,: How Trump’s White House could mess with government data:
809148635812401154,2016-12-14 21:30:42,Now you can see how winning &amp; losing their next game will affect your team's NFL playoff odds. It's pretty sweet.…
809125235186397184,2016-12-14 19:57:43,"Or at least, that was the intent. They picked the wrong word and it translated to ""overload"" instead of ""reset""."
809124844486934530,2016-12-14 19:56:10,Thought our caption here was in error but forgot that Clinton literally presented Russia with a reset button.…
809121798524719105,2016-12-14 19:44:04,The consensus at the time was that Clinton's electoral strategy was genius and that the strategy that won Trump the…
809120855347363843,2016-12-14 19:40:19,"I know these told-you-so tweets are annoying, but it's important to check what folks said in real time vs. with benefit of hindsight."
809120197063938048,2016-12-14 19:37:42,This went very much against the conventional wisdom at the time.
809106484420366336,2016-12-14 18:43:13,Clinton actually outran most of the econometric models—which predict the popular vote &amp; not the Electoral College—by a couple points.
809105926993178624,2016-12-14 18:41:00,"A coherent case is that the ""fundamentals"" (no incumbent, middling economy, high partisanship) predicted a close race &amp; that's what we got."
809105287202344961,2016-12-14 18:38:27,This is an underrated theory IMO.
809092027736588288,2016-12-14 17:45:46,: The first on from : What Percent Virus Are You?
809055092175470593,2016-12-14 15:19:00,What does the Tillerson pick tell us about Trump's approach?
808910506639720448,2016-12-14 05:44:28,": Once more: A close look at why the Bulls beat the NBA's best teams, then lose to the worst ones"
808888690118393856,2016-12-14 04:17:46,
808691204732768256,2016-12-13 15:13:02,: Rex Tillerson is already a diplomat -- for Exn Mobil's shareholders.
808684665217417216,2016-12-13 14:47:03,: I think Romney thought he could do a lot more to temper Trump's worst impulses as SOS than on the outside. We'll never know.
808683656160153601,2016-12-13 14:43:02,: Romney was one of *very* few GOPers to speak out against Trump with intellectual &amp; moral force. So I give him some credit.
808680958501199872,2016-12-13 14:32:19,"Trump's picking a fight over Tillerson. Confirmation a long way from assured, especially on Foreign Relations Cmte.…"
808664823416373249,2016-12-13 13:28:12,": For your commute, this week's politics podcast is up:"
808556551162200064,2016-12-13 06:17:58,My premise is that Romney was reasonable to believe he'd be a better SOS for the country than the alternatives. Not just personal ambition.
808553285347057664,2016-12-13 06:05:00,"Sympathetic to Romney, who's smart enough to know he had an % chance of being humiliated. But SOS=high reward. Took some guts &amp; integrity."
808479532168650752,2016-12-13 01:11:55,Tillerson would be a difficult confirmation for Trump. Lots of Russia hawks on the Sen. Foreign Relations Committee.
808474717946519553,2016-12-13 00:52:48,: Lack of trustworthiness hurt Clinton a lot &amp; reluctant support from Sanders voters hurt some. Russialeaks plays into those.
808474018185625600,2016-12-13 00:50:01,: Hard to gauge electoral effect of Russia hacking because it happened over long period. Doesn't mean it had zero effect.
808469002544644097,2016-12-13 00:30:05,Interesting comparing hyperbolic NYT coverage of Comey letter to skeptical coverage of Russia/Trump links:
808421053236125697,2016-12-12 21:19:33,: Correct link this time:
808418903064014848,2016-12-12 21:11:00,: Do you have eerience ... . writing/reporting on politics? . using data to understand politics? Write for us:
808387776232194048,2016-12-12 19:07:19,"OK, revised list, adding Jerry Moran (KS). That's recently + before election. Counting GOPers only. Not adding…"
808381695602855936,2016-12-12 18:43:09,I count GOP senators who recently endorsed an investigation into Russian hacking + more who did so before elec…
808004439806242823,2016-12-11 17:44:05,: A few of us had that Bolton idea- given Trump's biz negotiating strategy of staking out extreme position to move the compro…
808001382494117888,2016-12-11 17:31:56,Why? Maybe to make the replacement choice (Bolton?) seem more acceptable by comparison. Or maybe to show his dominance / troll everyone.
808000494270611456,2016-12-11 17:28:24,"...or to deny that Tillerson had ever been picked the first place (can't trust the lyin' media), which he's sort of already doing."
808000172110266368,2016-12-11 17:27:07,:
