id,created_at,text
842469097082376192,2017-03-16 20:14:19,We congratulate &amp; his staff for being cleared of all charges day &amp; we were glad to stand by them during a period of such scrutiny
842468048552488960,2017-03-16 20:10:09,Mayor de Blasio w/me &amp; others on /7/16 when they announced the investigation of him &amp; his staff. We stood w/him &amp;…
842467323986468864,2017-03-16 20:07:16,"Live on ""Keepin' It Real w/ Al Sharpton"" until pm ET. Tune in and dial to call in…"
842466306746134528,2017-03-16 20:03:14,WH spokesman Sean Spicer quotes the media as evidence of wire tapping! Are you serious? U rely on fake news rather than Intelligence heads?
842455945590513665,2017-03-16 19:22:04,We are glad to see our trust of NYC Mayor was vindicated by the prosecutor.
842431243157442560,2017-03-16 17:43:54,"Live w/ () in my weekly youth hour on ""Keepin' it Real w/ Al Sharpton"". Tune in and dia…"
842424332328538112,2017-03-16 17:16:26,"Pulling up my socks, READY to go! Live on Keepin' it Real w/ Al Sharpton from -4 pm/et on local stations &amp; SIRIUS…"
842391981301104641,2017-03-16 15:07:53,"Let me stop playing with reporters on twitter. I don't want them to confuse me with President Trump. He spells words wrong, a Wharton man."
842390844648882176,2017-03-16 15:03:22,I went to Tilden High Skol or is it School? Then years at Brooklyn Collage or maybe College. Pre K molds the child's mind for education.
842388905332772864,2017-03-16 14:55:40,"It's ""preceding "" not proceeding as Josh continues to correct our Twitter grammar. We have bad grammar which is why I support pre k now!!"
842385339280982020,2017-03-16 14:41:30,Mayor. Bill de Blasio is obviously who we referred to in the proceeding tweet . Thanks to Josh for tweeting the misspell.
842385073756372993,2017-03-16 14:40:26,"Congratulations to Mayor de Blasio, now that the clouds have been lifted and the skies are clear LET'S FINISH THE FLIGHT. Work to be done."
842310938690764802,2017-03-16 09:45:51,I preach at Howard University's Rankin Chapel this Sunday3/19 at am in DC. Come worship w/ us on campus at Crampton Auditorium/ Sun. am
842100377830998016,2017-03-15 19:49:10,"Get up off the couch and exercise your trust in God! Giving my closing remarks on ""Keepin' it…"
842096968386121730,2017-03-15 19:35:37,Talking with my Senior Producer Moshe about what's in store for Sunday. Tune in…
842092611645112320,2017-03-15 19:18:18,
842092168202354706,2017-03-15 19:16:32,The results of the GOP Health Bill.
842069369756778497,2017-03-15 17:45:57,"I am live on ""Keepin' it Real w/ Al Sharpton"" until pm ET. Visit for listings &amp; dial …"
842069247782223872,2017-03-15 17:45:28,": Tune In - ""Keepin' It Real w/ Al Sharpton"" pm-4pm ET. Check for listings &amp; dial -877-532-5797 to call in. …"
842069194673909761,2017-03-15 17:45:15,: The Importance Of Continuing The Investigation In Ferguson
842068979015393289,2017-03-15 17:44:24,: says the Mike Brown video proves that we weren't told everything and anything we were told is suspect.
842067870683156480,2017-03-15 17:39:59,Back in my office after the storm talking w/ Politics Nation crew. I go live on Keeping it Real…
841957781884268544,2017-03-15 10:22:32,I am live on the Tom Joyner Morning Show at am/et doing my weekly commentary. Tune in.
841735028660924416,2017-03-14 19:37:24,"Live in my Church Roundtable hour w/ Pastor ( Sr Pastor) on ""Keepin' it Real w/ Al Sharpton""…"
841733142264348672,2017-03-14 19:29:54,Join us at our Nat'l Convention ️ ️ ️ ️ ️ ️…
841717936062631937,2017-03-14 18:29:28,Join &amp; I at our National Convention. Registration is FREE REGISTER TODAY:…
841717086258909186,2017-03-14 18:26:06,": Tune In - ""Keepin' It Real w/ Al Sharpton"" pm-4pm ET. Check for listings &amp; dial -877-532-5797 to call in. …"
841716908856659969,2017-03-14 18:25:24,Check out my weekly blog via . Find out my thoughts on the new footage of . ?
841683155253891072,2017-03-14 16:11:16,"Braving the snow, I am live on Keeping it Real w/ Al Sharpton from -4 pm/et on local stations and SIRIUS XM . C…"
841682708023656448,2017-03-14 16:09:29,: Check out 's new weekly blog. Find out what he says about the new footage of .
841025320018952193,2017-03-12 20:37:16,: NEW video raises questions about 's death. What does it change?We asked the eerts. …
841013343976591360,2017-03-12 19:49:41,"At Sylvia's Resturant in Harlem for a meeting, I stopped to pose for photo w/ a new friend."
841012830258249729,2017-03-12 19:47:38,"New Hope Memorial Baptist Church in Elizabeth, NJ. Rev. Steffie Bartley celebrated years as Pastor."
841012119919349763,2017-03-12 19:44:49,"Preaching at New Hope in Elizabeth, NJ for Rev. Bartley's anniversary."
841012079247151106,2017-03-12 19:44:39,"With Rev. Steffie Bartley, NJ State Director of NAN and his grandson at Bartley's th…"
841012016668168192,2017-03-12 19:44:24,: . and discuss the scandal surrounding the firing of
841011654297079808,2017-03-12 19:42:58,: .: I think I feel better about the press ... reporters have done all the work in terms of what's been eed ab…
841011578635997185,2017-03-12 19:42:40,: . on how State Department apparently is being dismantled under Sec. of State Tillerson and what Putin wants http…
841011534096662528,2017-03-12 19:42:29,: Rachel Maddow on 's first days via
840973824082485249,2017-03-12 17:12:38,"Back at Rock, going live on MSNBC, tune in."
840946947456409601,2017-03-12 15:25:50,"I am at New Hope Memorial Baptist Church in Elizabeth, NJ getting to preach the anniversary of Rev. Sheffield Bartley. Bartley is NAN NJ."
840910938823884801,2017-03-12 13:02:45,NFL player Mike Jenkins &amp; Author Mike Tanier on talking the effects of NFL players taking political…
840905658748792832,2017-03-12 12:41:46,We I just called out racial gerrymandering in the state of Georgia!
840904682700722176,2017-03-12 12:37:54,Did you see what Rachel said about how she views the first days of the New Administration in the White House? Do…
840881801681915906,2017-03-12 11:06:59,: . with starts in less than one hour with special guest . See you at AM ET on …
840664201005801473,2017-03-11 20:42:18,: Don't miss tomorrow morning on with - am ET on
840664134966484995,2017-03-11 20:42:03,: Thank you for allowing me to share your stage today and share my story …
840614968298987521,2017-03-11 17:26:40,Visit to watch my full keynote address and today's rally in entirety.
840597205362831360,2017-03-11 16:16:05,Speaking on the case during my keynote address at NAN's Saturday rally.
840580413324165121,2017-03-11 15:09:22,Taking the podium to deliver my weekly keynote address at our NAN Saturday Rally. Tune in via WLIB am or…
840577458017574913,2017-03-11 14:57:37,In my office at NAN's House of Justice w/NAN's NY Crisis Dep't Director and Gwen Carr. We're headed into…
840577440699318272,2017-03-11 14:57:33,: Looking forward to being a part of this Brother
840372011939581952,2017-03-11 01:21:15,"Tune in to this Sunday at am ET, Rachel Maddow will be one of my special guests."
840330456172228609,2017-03-10 22:36:07,Our annual National Action Network Convention is quickly approaching! Save the date and register today for free at…
840310094235607040,2017-03-10 21:15:13,Leaving my studio at Rock and ran into my friend Alec Baldwin and his son Rafael.
840308165187117058,2017-03-10 21:07:33,"Thanks for tuning in to ""Keepin' it Real w/ Al Sharpton"" this afternoon. Be sure to tune into…"
840274410883973120,2017-03-10 18:53:25,"In studio,ready to go! Tune in to Keeping it Real w/Al Sharpton live from -4 pm/et on local stations &amp; SIRIUS XM …"
840258632981852160,2017-03-10 17:50:44,The Senate rolling back the law protecting the regulations on student achievement. A blow to educational inequality. MUST be resisted.
840243411533852674,2017-03-10 16:50:14,Meeting with some of the team from
839898141717594112,2017-03-09 17:58:16,": On the , discussed a private meeting he had with Attorney General Jeff Sessions:"
839898119911387136,2017-03-09 17:58:10,: In case you missed it: Church and education come together for at-risk children …
839898063388954624,2017-03-09 17:57:57,In my office headed to the studio to go live on Keeping it Real w/ Al Sharpton. We're live from -4 pm/et on local…
839701689036910593,2017-03-09 04:57:38,Dr. Ben Chavis and I earlier tonight at NAN's House of Justice in Harlem.
839699594363686912,2017-03-09 04:49:18,": ""Teenagers are being treated like they were in slavery right now"""
839676627109961732,2017-03-09 03:18:02,: What does want Jeff Sessions to do with the Eric Garner case? He told on
839646450678173696,2017-03-09 01:18:08,"Check out my new blogpost for this week,"
839644884122406912,2017-03-09 01:11:54,I'm on Inside City Hall w/ Erroll Lewis on NY One at and pm tonight.
839644592756690946,2017-03-09 01:10:45,On MSNBC's Morning Joe.
839504152422154241,2017-03-08 15:52:41,: Civil rights leaders ask to scuttle voter fraud probe via
839504095937462273,2017-03-08 15:52:28,": Civil rights leaders give Jeff Sessions an earful on voting rights, police reform"
839503863778537473,2017-03-08 15:51:33,: is holding AG Sessions feet the fire. But did he just call Ben Carson the Secretary of Immigration? Yep!
839503830547107840,2017-03-08 15:51:25,: Great profile of the Henry Cohen Lecture with and by News blog: https:/…
839458642504085508,2017-03-08 12:51:51,"Proud of NAN's National Youth Director, becoming the youngest person to run for office in Georgia."
839438232060366848,2017-03-08 11:30:45,"Our meeting w/ the Attorney General will be my subject, on my weekly commentary on the Tom Joyner Morning Show. I'm live at am/et."
839437540469981185,2017-03-08 11:28:00,I am live on MSNBC's Morning Joe at am/et. Tune in.
839279812346802176,2017-03-08 01:01:14,I am live on MSNBC's Morning Joe at am/stand my live commentary on the Tom Joyner Morning Show at am/et.
839273835631370240,2017-03-08 00:37:30,Back in NYC speaking at a NAN/NUL meeting of AT&amp;T and black owned media companies. We must bring revenue into our black business community .
839271394873655296,2017-03-08 00:27:48,The six national civil rights leader's held a presser to lay out our meeting &amp; the agenda we paved out to AG Jeff S…
839269080775405568,2017-03-08 00:18:36,": ., Along With Other Civil Rights Leaders, Met With To Push Civil Rights Issues Read:"
839265556066861056,2017-03-08 00:04:36,Addressing the media outside of the US Attorney General's office after the meeting earlier today
839218444318932992,2017-03-07 20:57:23,: To echo this was not a photo opp. This was an opportunity to address our concerns for the future of civil ri…
839218228157120515,2017-03-07 20:56:32,": : ""All Americans must be heard without equivocation or compromise."" -"
839218221786009600,2017-03-07 20:56:30,: : Sessions asked to move forward on case
839218194195841024,2017-03-07 20:56:24,: speaks upon leaving a meeting with other civil rights leaders &amp; re critical civil rts issues https…
839195470908047366,2017-03-07 19:26:06,": ""NAN opposes the bail bonds industry. We support bail reform alt's w/o cash for anyone who isn't a public threat."" …"
839168460043190273,2017-03-07 17:38:46,: . on from DC discussing today's meeting btwn Civil Rights Leaders &amp; AG Jeff Session &amp; also his comments…
839136288527757312,2017-03-07 15:30:56,I'm live on MSNBC at am/et from DC.
838814751996186624,2017-03-06 18:13:15,Getting ready to go live on Keeping it Real w/ Al Sharpton. We're live from -4pm/et on local…
838400082663788544,2017-03-05 14:45:31,Rev. Jones &amp; taught me &amp; my generation the importance of today. I ended talking to Rev. Jackson abt it.
838399581339648000,2017-03-05 14:43:31,"Today is the nd anniv. of the Voting Rights March in . I was , at I joined the movement in NY under Re…"
838396633876422656,2017-03-05 14:31:48,: Thanks to and for advancing this important convo on the history &amp; future of …
838391577374568449,2017-03-05 14:11:43,Thanks to all who tuned in this morning. Be sure to tune in to MSNBC every Sunday at am ET.
838391146619502592,2017-03-05 14:10:00,"Live hosting ""Sunday morning w/ Al Sharpton"" until am ET. Visit for listings to tune in &amp;…"
838390220466835458,2017-03-05 14:06:19,"Sharing my closing thoughts on Selma, Jeff Sessions, and more on . Thank you for…"
838388588882640896,2017-03-05 13:59:50,Rev. Jesse Jackson joins me on to discuss the fight for voting rights commemorated by .
838387300602167297,2017-03-05 13:54:43,joins me on on the th anniversary of joining the U.S. commonwealth
838384441265369089,2017-03-05 13:43:21,": On th anniversary of joining U.S. commonwealth, Puerto Rico still grappling with its identity. We're discussing it n…"
838384342401372161,2017-03-05 13:42:58,Sirius XM's Joe Madison discusses Trump's wiretap accusations live with me on
838382882074800129,2017-03-05 13:37:10,": Here's why Scott Pruitt and 's are the subject of this week's ""Gotcha!"" --&gt; …"
838382842849681410,2017-03-05 13:37:00,"This week's ""We Gotcha!"" on ...the massive cuts coming up from the administration."
838380098130694146,2017-03-05 13:26:06,: .: is one of slickest presidents we have ever had... He was able to switch conversation from Ses…
838380087242280962,2017-03-05 13:26:03,": .: speech reaction is reaction of political class that wants its old world back, is never going to get…"
838380016094298114,2017-03-05 13:25:46,filmmaker discusses the importance of and more with me on
838379920149590016,2017-03-05 13:25:23,Matt Welch and Joe Madison join me now on .
838377944540131328,2017-03-05 13:17:32,": Coming up, once again President Trump goes on the attack, and once again he makes allegations without offering any proo…"
838377034430758912,2017-03-05 13:13:55,Live on w/ CEO Dr. Michael Lomax &amp; filmmaker Stanley Nelson discussing Trump's me…
838369272065830913,2017-03-05 12:43:05,starts in less than minutes on . Tune in at AM ET
838368598334787584,2017-03-05 12:40:24,: Going on w/ at am ET to talk current events.
838368585407942656,2017-03-05 12:40:21,: WATCH LIVE TODAY at am ET as CEO &amp; filmmaker join on 's …
838350282018996225,2017-03-05 11:27:37,: See you in minutes for at AM ET on with
838111031830462464,2017-03-04 19:36:55,"With students from the Barack Obama Elementary school in Asbury Park,NJ who came to visit the House of Justice for…"
838060301895467009,2017-03-04 16:15:21,"If I take my stand, God will make a way out of no way. Stand up and Let God use you! For a full…"
838049946813272064,2017-03-04 15:34:12,Delivering my weekly keynote address at the NAN Saturday Action Rally.Tune in to WLIB am (radio) or…
838048221528215552,2017-03-04 15:27:20,Full house at the NAN Action Rally on this cold Saturday morning.
838047693410807808,2017-03-04 15:25:14,It's AISHA'S Birthday! Love and Kisses to my lady.
838047648548519936,2017-03-04 15:25:04,In my office at the NAN House of Justice in Harlem getting ready to go out and speak. Tune in…
838047601085788160,2017-03-04 15:24:52,Landed back in NY LaGuardia Airport greeting well wishers and bundling up after a day working in…
837765451430117376,2017-03-03 20:43:43,After my speech Congresswoman Frederica Wilson (Fla) Congressman James Clyburn (SC) and Clergy…
837765325542260737,2017-03-03 20:43:13,Hundreds attended the Mentoring Luncheon in Miami.
837756488647073796,2017-03-03 20:08:06,"Speaking in Miami, Florida at the Role Model Mentoring Luncheon in Miami."
837755049350684673,2017-03-03 20:02:23,Speaking at the Role Model Mentoring Luncheon in Miami.
837754215413997569,2017-03-03 19:59:04,In Miami having a quick salad before speaking for Congresswoman Frederica Wilson's Mentorship Program.
837380478575468544,2017-03-02 19:13:58,I am live on Keeping it Real w/ Al Sharpton from -4 pm/et on local stations and SIRIUS XM .…
837136806957182979,2017-03-02 03:05:42,: Time stopped for the Browder family when Kalief was sent to Rikers Island. Hear his story. 'TIME: The Story' prem…
837128048164155393,2017-03-02 02:30:54,: This is important. spike tv pm/9c
837120501155774464,2017-03-02 02:00:55,"Tune in to Spike TV tonight at pm ET to watch this extremely important new docuseries called ""TIME: The Story of…"
837049794837299200,2017-03-01 21:19:57,"Visit to read my new article, 'Donald Trump: Good Performance. Bad Policy.'"
837012171003428865,2017-03-01 18:50:27,"I am live w/ and on ""Keepin' it Real w/ Al Sharpton"" discussing Trump's speech last night…"
836999734674014213,2017-03-01 18:01:02,In studio going live on Keeping it Real w/ Al Sharpton. We are live from -4 pm/et on local stations &amp; SIRIUS XM …
836960895100153856,2017-03-01 15:26:42,": . honors , rips and AG Sessions"
836894479051276289,2017-03-01 11:02:47,"I review the President's speech on the Tom Joyner Morning Show in my weekly commentary. Tune in, I'm live at am/et."
836766365881073667,2017-03-01 02:33:42,Speaking to students at about the current state of humanity and social justice
836765715856306176,2017-03-01 02:31:07,With President David Van Zandt &amp; SVP of Social Justice &amp; Henry Cohen professor
836739307213836289,2017-03-01 00:46:11,I'm speaking w/ at on last day of discussing social justice &amp; civil righ…
836690081658376192,2017-02-28 21:30:35,"Addressing US Sec Devos in my closing remarks on "" Keepin' it Real w/ Al Sharpton"". Thanks to those who called in &amp;…"
836677176707645442,2017-02-28 20:39:18,Are you tuned in to Keepin' it Real w/ Al Sharpton? Visit for listings and dial …
836672278695927809,2017-02-28 20:19:50,"Someone should tell Ed/Sec Devos that HBCU's are not examples of school choice, they were started because of NO CHOICE policies for blacks."
836651954088652801,2017-02-28 18:59:04,"Tune In - ""Keepin' It Real w/ Al Sharpton"" pm-4pm ET. Check for listings &amp; dial -877-532-5797 to call in.…"
836651602773696518,2017-02-28 18:57:40,Tonight tune in at :30 p.m. to watch the live stream of my speech at on civil rights
836630828696416256,2017-02-28 17:35:08,Keeping it Real w/ Al Sharpton from -4pm/et. Call in at .
836630718759505920,2017-02-28 17:34:41,: Tonight at :30 p.m. watch the live stream of 's speech at on civil rights.
836439249260015616,2017-02-28 04:53:51,Speaking at the National Jazz Museum in Harlem before the screening of the Obama Years by the Smithsonian Channel.
836438928693542912,2017-02-28 04:52:35,Arriving at the screening of the Obama Years to air on the Smithsonian Channel. The screening was at the National J…
836437184836173826,2017-02-28 04:45:39,: We’re proud to support the &amp; the for a special documentary screening. h…
836321394522796034,2017-02-27 21:05:33,"Join and I at in NYC tomorrow Tuesday, February th at :30pm."
836286216299499520,2017-02-27 18:45:46,: Closing out with + Prof talking social justice on /28. RSVP: http…
835957252871892997,2017-02-26 20:58:35,"""Five years ago today was attacked and shot by George Zimmerman in Sanford,…"
835952721043812352,2017-02-26 20:40:34,Congratulations to my lil' brother NYS Assemblyman Michael Blake. He was elected a DNC Vice Chair. I've watched him grow and proud of him
835867011657973761,2017-02-26 14:59:59,"Closing out my ""Sunday Morning w/ Al Sharpton"" radio show program today, thanks for tuning in."
835859765192425474,2017-02-26 14:31:12,: Thank you for the opportunity to talk diversity at the
835859058083115009,2017-02-26 14:28:23,"I am live hosting ""Sunday morning w/ Al Sharpton"" until am ET. Visit for listings to tune…"
835857032410460160,2017-02-26 14:20:20,Sharing my closing thoughts on the year memorial anniversary of . See you next week…
835850610998145025,2017-02-26 13:54:49,": .: Countless stories from not just African-Americans, but with Hispanics and Asians, exist but their stories…"
835850038106554368,2017-02-26 13:52:33,Jacque Reid and Gil Robertson are live with me on discussing as one of the most diverse…
835847039300874241,2017-02-26 13:40:38,Anthony Gangi of Tier Talk joins me on to discuss private prisons in America. Are you tuned in to M…
835845331501871104,2017-02-26 13:33:50,: Now on on administration throwing out Obama directive to reduce private prisons. Wei…
835845302506643456,2017-02-26 13:33:44,"Sorry Congressman Gohmert, We Gotcha!"
835843740606558209,2017-02-26 13:27:31,: .: First thing did as new chair was make his deputy chair
835843268818661376,2017-02-26 13:25:39,Jaime Harrison joined me on to discuss how the Democrats must build state parties to do critical gr…
835839992459059201,2017-02-26 13:12:38,: . on how needs to accept public scrutiny as part of the role of president
835839955343720449,2017-02-26 13:12:29,": .: While goes at war with the media, he is not serving the American people https…"
835839183474339840,2017-02-26 13:09:25,: I'll be on with on in -10 mins talking about the new / team at th…
835839118739443712,2017-02-26 13:09:09,Michael Steele &amp; Elizabeth Plank join me on to discuss announcing that he will not attend th…
835835229667536896,2017-02-26 12:53:42,: . with will be live at AM ET . Be sure to tune in.
835823418763329536,2017-02-26 12:06:46,: I'll be on this morning with and to talk the week in politics at AM!
835675958002737152,2017-02-26 02:20:49,: is coming up tomorrow. See you Sunday morning on MSNBC at AM ET.
835675700451508224,2017-02-26 02:19:47,"For a full replay of my keynote address at the NAN Saturday action rally, log onto . I'm bac…"
835514677765500929,2017-02-25 15:39:56,"NAN Saturday Action Rally, tune in via WLIB am or until am ET."
835504652942721024,2017-02-25 15:00:06,Keynoting the NAN weekly Saturday Rally. Join us at W th st. or tune in via WLIB am (radio)/…
835500789590343682,2017-02-25 14:44:45,Speaking w/ Minister Kirsten John Foy before keynoting the Saturday Action Rally. Tune in LIVE WLIB-1190am or via…
835492124141498368,2017-02-25 14:10:19,": Join us or tune in! am-11am we are live on &amp; on NY radio, WLIB am. https:/…"
835491825586737154,2017-02-25 14:09:08,"""...When Zimmerman shot Trayvon, Barack Obama had been in the White House for three years and,…"
835491349277310976,2017-02-25 14:07:15,": Five years after his death, struggle for civil rights continues"
835203165947584512,2017-02-24 19:02:06,"Shelia Tyson, NAN Chapter Prez and I present a NAN chapter award to Principal Hope."
835203102697349120,2017-02-24 19:01:51,Speaking at Unity Breakfast of Wenonah HS in Birmingham.
835181313980248065,2017-02-24 17:35:16,"Keynoting the Unity Breakfast of Wenonah High School in Birmingham, Ala."
835181302806679552,2017-02-24 17:35:14,"Speaking at a press conference in Birmingham, Alabama flanked by Shelia Tyson, NAN Birmingham chapter, Rev. Tommy L…"
835163218012143616,2017-02-24 16:23:22,": . referring to Wenonah HS killings, ""There's something going on with our young people that they don't value huma…"
835162814830497793,2017-02-24 16:21:46,:
834910551713120256,2017-02-23 23:39:22,": NEXT WEEK: &amp; discuss civil rights, social justice, &amp; criminal justice reform. Register here: https:/…"
834910520511709184,2017-02-23 23:39:14,At Radio One in DC w/ the one and only radio/tv personality Donnie Simpson earlier today
834841488227987458,2017-02-23 19:04:56,DNC Chair candidate Tom Perez is live on Keeping it Real w/ Al Sharpton. Tune in on local stations or XM .
834775074137894913,2017-02-23 14:41:01,"Saddened to hear of the passing of . I've done his show many times through the years, he was always fair. My prayers his family"
834708341989502976,2017-02-23 10:15:51,Any REAL believer in civil rights must support transgender rights. U can't fight for anyone's rights if u don't fight for everyone's. STAND!
834464735433281539,2017-02-22 18:07:51,": Tune In - ""Keepin' It Real w/ Al Sharpton"" pm-4pm ET. Check for listings &amp; dial -877-532-5797 to call in. …"
834460147623874560,2017-02-22 17:49:37,Join Maya Wiley and I at the New School on Tuesday /28.
834456053928644615,2017-02-22 17:33:21,Congratulations to my friend and brother being named the President of Operations of LA Lakers.
834444998116573187,2017-02-22 16:49:25,On MSNBC
834444592787443712,2017-02-22 16:47:48,Making the case on MSNBC's Morning Joe.
834442421035425792,2017-02-22 16:39:11,MSNBC Morning Joe /22
834374839041454080,2017-02-22 12:10:38,: I am live on MSNBC's Morning Joe at am/et and then my weekly commentary on the atom Joyner Morning Show at am/et
834343874915074048,2017-02-22 10:07:35,I am live on MSNBC's Morning Joe at am/et and then my weekly commentary on the atom Joyner Morning Show at am/et
834159003282370561,2017-02-21 21:52:58,I am live on MSNBC's Morning Joe tomorrow /22 at am/et. Tune in.
834135310141423618,2017-02-21 20:18:50,"Click the link to read my piece for this week,"
834121213731598336,2017-02-21 19:22:49,"Join &amp; I at the Henry Cohen Lecture Series at on Tuesday, February th :30pm-8pm…"
834099596775264262,2017-02-21 17:56:55,Keeping it Real w/ Al Sharpton today!
834068055470792704,2017-02-21 15:51:35,Good conversation w/ 's Editor in Chief salutes her on her new role
833783282236006401,2017-02-20 21:00:00,": An honor to hear the Rev. Al Sharpton speak today at the SC People's March in support of refugees, immigrants and the ACA. h…"
833783207447449600,2017-02-20 20:59:42,Happy President's Day
833782847206998016,2017-02-20 20:58:16,Speaking at the funeral services of my friend SC Rep. Rev. Joe Neal.
833738806062903296,2017-02-20 18:03:16,Joining Native Americans at the SC State Capitol rally.
833738494568710144,2017-02-20 18:02:01,Joining progressive leaders in South Carolina.
833738225760006149,2017-02-20 18:00:57,"President's Day rally at the State Capitol in Columbia, S.C."
