id,created_at,text
817120495531425792,2017-01-05 21:28:02,: speaking at bkfst w/ leaders to discuss path . Join us tonight
817093746143666177,2017-01-05 19:41:44,Marc Morial &amp; I leave the White House after a lunch meeting. We are fighting to the end of the Obama Administration…
817071688718360576,2017-01-05 18:14:05,Mobilizing Leaders in PHILLY for the March in DC /14.
817070990215745537,2017-01-05 18:11:19,Speaking at Leadership Breakfast in Philadelphia about the /14/17 DC March. Great support. Penn. State Hughes host…
816788581616336896,2017-01-04 23:29:07,First day of back in the city and catches me for an interview on Trump outside Rock.
816742495241535489,2017-01-04 20:25:59,"Discussing some controversial topics on ""Keepin' It Real w/Al Sharpton"". Visit for listings…"
816741997302128640,2017-01-04 20:24:01,: Spending day with my mentor in NYC .....we got work to do in the next four years!
816715499795050497,2017-01-04 18:38:43,: On /14 stand w/ immigrants. Stand w/ African American communities. Stand w/ Muslim Americans. Stand w/ refugees. …
816715463111622656,2017-01-04 18:38:34,Back in the saddle at Rock in NY. Tune in to Keeping it Real w/ Al Sharpton from -4 pm/et on local stations and…
816658851374178304,2017-01-04 14:53:37,: Think Marching Is A Waste Of Time? Rev. Al Elains Why It’s Anything But
816658716145623040,2017-01-04 14:53:05,: What good ever came out of marching? says VOTING that's what.
816658599657226241,2017-01-04 14:52:37,": ""We not on the agenda because we don't put ourselves on the agenda"""
816658190058274816,2017-01-04 14:50:59,: I would love to see a biographical film about the life of Al Sharpton.
816589110752268289,2017-01-04 10:16:30,Don't miss my weekly commentary on the Tom Joyner Morning Show this morning at am et.
816309975052156929,2017-01-03 15:47:19,"Roll Call,will you be at the march on January in Washington, DC? Visit for full informat…"
816305146460336130,2017-01-03 15:28:07,: Join for The March . We shall not be moved. Reserve Bus Seat: -284-4700 https://…
816305074762870784,2017-01-03 15:27:50,: to host March &amp; Rally ahead of inauguration: 'There must be an organized resistance movement'
816304865634816000,2017-01-03 15:27:00,"In Anguilla watching the Revvie Awards on Politics Nation w/ Al Sharpton this past Sunday. If you missed it,visit…"
816304180373622784,2017-01-03 15:24:17,Charlemagne the God and I brought in the New Year. Happy . Get ready!
815886370220687360,2017-01-02 11:44:03,"Been up studying and writing since am. In order to help make big change, you must focus on big things. Avoid petty thoughts, it reduces u."
815884642196787200,2017-01-02 11:37:11,The new GOP Congress pledges to come in w/ an agenda to repeal ACA. What will that do to m new insured Americans?Resist!! DC /14 A Must.
815531910776680448,2017-01-01 12:15:34,Watch the Reviis Awards on Politics Nation w/ Al Sharpton on MSNBC at am/et. Then tune in my radio show at and call in at .
815530989225148416,2017-01-01 12:11:54,"Happy New Year to all. Leave baggage both spiritual and mental in '. Grow into the more evolved, refined, and defined YOU in '."
815415507033751552,2017-01-01 04:33:01,"Our convenor, Kevin Liles."
815414319928250368,2017-01-01 04:28:18,Part of the Anguilla New Years celebration. It's Here!!
815413696965079040,2017-01-01 04:25:49,Judge Greg Mathis and I at the New Years celebration in Anguilla.
815413239123181568,2017-01-01 04:24:00,"After working on my book I went to join the group at Tasty's in Anguilla w/ the owner Chef Dale Carty , Aisha and M…"
814920795436830720,2016-12-30 19:47:12,"I am live on ""Keepin' It Real w/ Al Sharpton"" from Anguilla on the last of . Tune in and …"
814920513919348737,2016-12-30 19:46:05,: Make sure you check out the ! This Sunday at am on
814606588065484800,2016-12-29 22:58:39,"Charlamagne The God, Kevin Liles in the house"
814604393949655040,2016-12-29 22:49:56,: .’s Biggest Lessons Of
814595877327273984,2016-12-29 22:16:06,"Music Mogul Kevin Liles, D Nice, and KennyBurns and l in Anguilla before our pow wow."
814589565595947009,2016-12-29 21:51:01,Entertainment industry leader Marvette Britto who is coordinating the meetings for NAN Triumph Awards ' for me do…
814588743797669888,2016-12-29 21:47:45,Aisha and I in the ferry headed to the hotel in St. Martin for my weekend work/getaway.
814588443812626434,2016-12-29 21:46:33,Boarding my flight. I will be working on my new book &amp; have a couple of meetings on NAN Triumph Awards '. I will…
814587872498110464,2016-12-29 21:44:17,: Rev. Al Sharpton’s Biggest Lessons Of
814463850250727424,2016-12-29 13:31:28,Headed to the islands to work on a new book and meetings on NAN Triumph Awards '. The book is going to shake up some stuff. Myth buster!
814338902974668800,2016-12-29 05:14:58,Talking with press about our celebration tonight with Dr. Maulana Karenga.
814313957242601474,2016-12-29 03:35:51,"""We strive to succeed, we strive to advance, we strive to excel.""- Dr. Maulana Karenga embraces me before keynoting…"
814312818640113664,2016-12-29 03:31:19,Dr. Maulana Karenga (The Creator of Kwanzaa) &amp; his wife Mrs. Karenga join us at our th Anniversary Kwanzaa celebr…
814310100705935360,2016-12-29 03:20:31,Welcoming Dr. Maulana Karenga to the House of Justice.
814309683209109505,2016-12-29 03:18:52,Introducing Dr. Maulana Karenga (The Creator of Kwanzaa) at our NAN House of Justice at our th Anniversary Kwanza…
814309440530841601,2016-12-29 03:17:54,Dr. Maulana Karenga joins us for our th anniversary of Kwanzaa program on the rd day of Kwanzaa.…
814220908042784768,2016-12-28 21:26:06,"Habari gani?! Today is the rd day of ,we celebrate the principle of Ujima. Tonight, Maulana Karenga will j…"
814187787545100288,2016-12-28 19:14:30,In studio live on Keeping it Real w/ Al Sharpton from -4 pm/et on local stations and SIRIUS XM . Call in at …
814086690277101568,2016-12-28 12:32:46,Tune in to my weekly commentary on the Tom Joyner Morning Show. I am live at am/et.
813881027206778884,2016-12-27 22:55:32,: Mark your calendars:
813855923294896128,2016-12-27 21:15:47,"Habari gani?! Today is the nd day of ,we celebrate the principle of Kujichagulia (Self Determination). Joi…"
813812780419678208,2016-12-27 18:24:21,Ready to go! Tune in to Keeping it Real w/ Al Sharpton on local stations from -4 pm/et. Call in .
813809324778721281,2016-12-27 18:10:37,"I am live on ""Keepin' it Real w/ Al Sharpton"" until pm ET. Check for listings to tune in and dial to c…"
813807346396909569,2016-12-27 18:02:45,In my office at Rock opening a gift from
813795335772508160,2016-12-27 17:15:02,"“I’m no longer accepting the things I can’t change,I’m changing what I can’t accept” – . We are marchin…"
813497933320650753,2016-12-26 21:33:16,"This is what the next wave of the civil rights movement looks like. We stand for &amp; w/ the people, will you?…"
813497264933109760,2016-12-26 21:30:36,Have you visited to sign up and find out about ? Will you join us /14 on Mart…
813451258602385414,2016-12-26 18:27:47,I am in studio live on Keeping it Real w/ Al Sharpton from -4 pm/et on local stations and SIRIUS XM . Call in …
813451170836520961,2016-12-26 18:27:26,": Tune In - ""Keepin' It Real w/ Al Sharpton"" pm-4pm ET. Check for listings &amp; dial to call in. h…"
813418630578847744,2016-12-26 16:18:08,Habari gani?! Today is the st day of Kwanzaa where we celebrate the principle of Umoja (Unity). Join us /28 to c…
813418302294937605,2016-12-26 16:16:50,": We are making history, will you join us?"
813416126633963520,2016-12-26 16:08:11,"Join us Wednesday /28 to celebrate the th anniv. of w/ the founder of Kwanzaa, Dr. Maulana Karenga.…"
813024868174360576,2016-12-25 14:13:28,"Headed back to DC for our march on /14 w/o Mr.Brown, but I'm going back on the weekend that he…"
813024127514738688,2016-12-25 14:10:31,st time I went to the WH was . James Brown asked me to join him to meet w/ Pres. Reagan to lobby to make Dr.…
813017968301010944,2016-12-25 13:46:03,"yrs ago on Christmas,I got a call that James Brown passed away.He took me everywhere &amp; we shared life together l…"
813013869245370368,2016-12-25 13:29:46,"At the White House last week, Aisha and I with the President and First Lady, wish you a Happy Holiday."
812894254410436608,2016-12-25 05:34:27,Thankful
812892412284731392,2016-12-25 05:27:08,Serving the community earlier this afternoon with …
812889668673040385,2016-12-25 05:16:14,Earlier at the NAN Christmas Rally before NYC Mayor de Blasio spoke.
812889130535387136,2016-12-25 05:14:06,Earlier at NAN speaking to Senator Jeff Klein &amp; Bronx Assemblyman Michael Blake after feeding the community.…
812734979994189825,2016-12-24 19:01:33,: Great spending some time today w/ to spread some holiday cheer! https://…
812732279730688000,2016-12-24 18:50:49,"Packed house today since am for our annual events. Thank you to everybody who volunteered, contribu…"
812729457698111491,2016-12-24 18:39:37,Talking to a little boy before he got his toys from Mayor de Blasio and I.
812715348088733696,2016-12-24 17:43:33,"Serving the community at our annual National Action Network Christmas Event w/Mayor de Blasio, Melissa Viverito, an…"
812713071437377536,2016-12-24 17:34:30,Mayor de Blasio &amp; I giving out toys to children in the Harlem community at the House of Justice this afternoon.…
812711909971599361,2016-12-24 17:29:53,"With my daughters Dominique &amp; Ashley, NYC Mayor Bill de Blasio, and City Council Speaker Melissa Viverito.…"
812699616445681664,2016-12-24 16:41:02,Gwen Carr is with us for the holiday. We are preparing to feed the homeless and give away toys to kids.…
812671886983303168,2016-12-24 14:50:51,In my office getting ready for the Holiday rally w/Dominique &amp; Kirsten. I go on at am.We feed the hungry &amp; give a…
812446466769821697,2016-12-23 23:55:06,"Spend Christmas Eve w/ ! Join us tomorrow on Saturday, December th for our annual dinner &amp; toy giv…"
812443801205751810,2016-12-23 23:44:31,: Join &amp; at the 's Annual Christmas Day Toy Give-Away &amp; Community Meal for Hungry at H…
812404451004837888,2016-12-23 21:08:09,"Join us on WHERE: NAN House of Justice West th Street WHEN: SATURDAY, DECEMBER , – :…"
812393834617380864,2016-12-23 20:25:58,"I am live w/ of on ""Keepin' it Real w/ Al Sharpton"". It's , dial …"
812391799725654016,2016-12-23 20:17:53,"This yr we will celebrate the th anniversary of w/its creator, Dr. Maulana Karenga, at NAN's House of Ju…"
812388757844410372,2016-12-23 20:05:47,"“I had no idea it would grow to this level,”Mr. Sharpton said.""There was a need.”"
812383447197032448,2016-12-23 19:44:41,ICYMI:
812362356575633408,2016-12-23 18:20:53,"Yes, I am working today. Tune in to Keeping it Real w/ Al Sharpton from -4 pm/et on local stations and SIRIUS XM …"
812049969226141696,2016-12-22 21:39:34,Leaving my Rock office after my radio show to head to NAN Corporate for daily calls and march…
812021163039789056,2016-12-22 19:45:06,"Live on ""Keepin' it Real w/Al Sharpton"" in my policy hr w/ . Visit for radio list…"
812020013297188864,2016-12-22 19:40:32,: Rev. Sharpton Reminds Us To Remember The Real Meaning Of Christmas
812019383803510785,2016-12-22 19:38:02,On the phone in my office earlier finishing last minute calls. I am live on Keeping it Real from -4 pm et on local…
811685407922515968,2016-12-21 21:30:56,"Not one more hashtag, not one more hurting mother, we demand criminal justice reform. …"
811644307690164225,2016-12-21 18:47:37,"Don’t just read history, make history. Join us /14"
811638045866860544,2016-12-21 18:22:44,Headed into the studio to go live on Keeping it Real w/ Al Sharpton. Tune in from -4 pm/ et on local stations &amp; SI…
811633212065742849,2016-12-21 18:03:31,ICYMI:
811521029763952641,2016-12-21 10:37:45,"Tune in to my weekly commentary on the Tom Joyner Morning Show, I am live at am/et."
811447134302179329,2016-12-21 05:44:07,Speaking at the th yr commemoration of the racial killing of Michael Griffith. I was given one of the civil right…
811313075534135297,2016-12-20 20:51:25,Tune in to Keeping it Real w/ Al Sharpton weekdays from -4 pm/et on local stations and SIRIUS XM . Call in and…
811312784847884291,2016-12-20 20:50:16,": Tune In - ""Keepin' It Real w/ Al Sharpton"" pm-4pm ET. Check for listings &amp; dial to call in. h…"
811262004317011969,2016-12-20 17:28:29,
811261487851388928,2016-12-20 17:26:25,ICYMI:
811252251331272706,2016-12-20 16:49:43,"In Dec we stood for Griffith in Howard Beach. Today,we stand for Crutcher in Tulsa.Never forget how far we've co…"
811241819006783488,2016-12-20 16:08:16,": Not one more hashtag, not one more hurting mother, we demand criminal justice reform. …"
811241791437553664,2016-12-20 16:08:09,": Join NAN in NYC on Sat., Dec. th, from :00am-3:00pm for our annual Feed the Community &amp; Toy Giveaway Event http…"
811179974547963905,2016-12-20 12:02:31,: This is what the nd wave of the civil rights movement looks like. Join us /14 to march days before Trump is inaugurated …
811173434264788992,2016-12-20 11:36:32,"At the premiere of last night, I talk with actor Russell Hornsby, his wife and Mom. He plays Lyons in the m…"
811171473935257600,2016-12-20 11:28:44,"As I look back years since Howard Beach it's w/ mixed feelings. We've come so far and then face so many setbacks.We fight on, We must!"
811170213009981440,2016-12-20 11:23:44,"years ago the racial killing of Michael Griffith occurred. I led marches in Howard Beach, Queens to protest this.3 were convicted later."
810968960481038336,2016-12-19 22:04:01,This is what the nd wave of the civil rights movement looks like. Join us /14 to march days before Trump is ina…
810908426373124096,2016-12-19 18:03:29,"Tune In - ""Keepin' It Real w/ Al Sharpton"" pm-4pm ET. Check for listings &amp; dial to call in. …"
810908131224076289,2016-12-19 18:02:19,": Tune In - ""Keepin' It Real w/ Al Sharpton"" pm-4pm ET. Check for listings &amp; dial to call in. h…"
810908022759444480,2016-12-19 18:01:53,Reviewing show notes in my office. Tune in to Keeping it Real w/ Al Sharpton from -4 pm et on local stations &amp; SIR…
810900903091904517,2016-12-19 17:33:35,Part of my keynote at NAN AC Townhall for . March with us /14…
810811840754319361,2016-12-19 11:39:41,
810806436536209408,2016-12-19 11:18:13,A full house at Atlantic City NAN Town Hall Meeting. DC here we come /14/17.
810805847446065152,2016-12-19 11:15:52,"Greeting the crowd at the NAN Atlantic City,NJ Chapter Town Hall meeting. They are fired up! Ready to March in DC o…"
810805219810545665,2016-12-19 11:13:23,Speaking at a Clergy/Community Leaders meeting of the NAN Atlantic City Chapter. They are organizing for the /14 M…
810487581959946240,2016-12-18 14:11:12,"Politics Nation is over, turn on you radio to Sunday Morning w/ Al Sharpton from -10 am et. Call in at"
810487293207347200,2016-12-18 14:10:03,Join us
810485879861116928,2016-12-18 14:04:26,Closing the show out today with some thoughts on the Dylan Roof verdict &amp; the Charleston . Thank you for tuning in…
810483260719529984,2016-12-18 13:54:02,Kristen Clarke of The Lawyers Committee joins me on to discuss the voter id fight and more.
810480477685645313,2016-12-18 13:42:58,In my Roundtable w/ Beth Fouhy &amp; Susan del Percio
810476213542256641,2016-12-18 13:26:01,"Discussing ""Hamilton Electors' calling for electoral college revolt against President Elect Trump."
810474539348062208,2016-12-18 13:19:22,"Live w/ Rep. Gregory Meeks on , tune in via MSNBC"
810473232780431360,2016-12-18 13:14:11,Bill Richardson (Former Ambassador to UN) and Rep. Gregory Meeks join me on
810464663053991936,2016-12-18 12:40:08,"I am live on ""Politics Nation w/ Al Sharpton"" at am ET, tune in only via MSNBC."
810431839311687680,2016-12-18 10:29:42,Don't miss Politics Nation w/ Al Sharpton on MSNBC at am/et. Then turn on live live radio show from -10 am and call in at .
810279788518797312,2016-12-18 00:25:30,At Metropolitan Baptist Church in Newark NJ w/ young men of Eagle Academy. They have their own bus for /14.…
810279329930342400,2016-12-18 00:23:41,The NAN Newark NJ pre rally.
810278807311675393,2016-12-18 00:21:36,Speaking at the NAN NJ Wake Up Call To Action Rally mobilizing members to march on Washington on /14 in DC.…
810276623647932416,2016-12-18 00:12:55,In Newark at the NJ Pre March Rally at Metropolitan Baptist Church. Mayor RAS Baraka gives me a police escort in Ne…
810276387978362880,2016-12-18 00:11:59,: is speaking at the NJ membership rally at Metropolitan Baptist Church in !! …
810240307904315392,2016-12-17 21:48:37,Join Us tonight as we prepare for .
810198933955891201,2016-12-17 19:04:13,": Monday at pm EST on The Show we talk holiday health w/, political update w/ &amp; talks…"
810198846596845572,2016-12-17 19:03:52,Visit to view the full livestream of today's National Action Network Saturday Action Rally.
810153480904212481,2016-12-17 16:03:36,
810149130941112320,2016-12-17 15:46:19,Keynoting the National Action Network Saturday Action Rally. Tune in via WLIB am or .
810144173194149888,2016-12-17 15:26:37,Getting ready to keynote the Saturday Action Rally. Tune in live from -11 am/et at WLIB AM or livestream at…
809876084376432640,2016-12-16 21:41:19,"Closing out ""Keepin' it Real w/ Al Sharpton"". Be sure to tune in M-F at pm ET, visit for l…"
809831648103727104,2016-12-16 18:44:45,"At Rock, ready to go. Turn on Keeping it Real w/ Al Sharpton from -4 pm/et on local stations &amp; XM . Its EXHA…"
809782182889848832,2016-12-16 15:28:12,": .: ""I hope for the country’s sake that he changes, but I wouldn’t bet much on it"""
809764960716910593,2016-12-16 14:19:45,"Breakfast action meeting to mobilize for Jan. ,2017. We are marching in DC on King weekend in the King spirit of…"
809763043085324288,2016-12-16 14:12:08,NY Leadership Meeting. Join us January th during Martin Luther King Weekend to march on Washin…
809736382633668608,2016-12-16 12:26:12,": Also discussing the Slager case, our January th March on Washington, and more on MSNBC's Morning Joe. ht…"
809736059705761795,2016-12-16 12:24:55,"Also discussing the Slager case, our January th March on Washington, and more on MSNBC's Morni…"
809732743651270657,2016-12-16 12:11:44,On MSNBC's Morning Joe this morning
809731303625097216,2016-12-16 12:06:01,On Morning Joe discussing the Dylann Roof verdict in the Charleston case and more.
809715582564257796,2016-12-16 11:03:33,": Updated Fri. guest list: Mike Barnicle, Donny Deutsch, John Heilemann, Gabe Gutierrez, Rev. Al Sharpton, Kasie Hunt, Eugen…"
809559204696653825,2016-12-16 00:42:09,I am live in MSNBC's Morning Joe at am/ et in the morning. Tune in.
809481257671421952,2016-12-15 19:32:25,"I am live w/ Jennifer Jones-Austin of in my Policy Roundtable hour on ""Keepin' it Real w/ Al Sharpton"". Tune…"
809477564376944640,2016-12-15 19:17:45,": “Freedom is never really won, you earn it &amp; win it every generation.” – Coretta Scott King. It’s our turn to fight for…"
809472971362471936,2016-12-15 18:59:30,Former NYC Mayor David Dinkins and I at the NY CSR luncheon.
809472445715542016,2016-12-15 18:57:24,": Tune In - ""Keepin' It Real w/ Al Sharpton"" pm-4pm ET. Check for listings &amp; dial to call in. h…"
809472204207489024,2016-12-15 18:56:27,At NY CSR Luncheon talking with Rev. A.R. Bernard and media guru Ken Sunshine.
809466343871414272,2016-12-15 18:33:10,: Mayor Dinkins and honoring Ken Sunshine
809466277198700544,2016-12-15 18:32:54,: There are some incredible voices in the room! Listening to kick things off!
809466215714459648,2016-12-15 18:32:39,": At , and former NYC Mayor David Dinkins fete honoree and PR maven Ken Sunshine."
809425183622778881,2016-12-15 15:49:36,“Power concedes nothing w/o demand. It never did &amp; it never will.” – Frederick Douglas.We are bringing our demands…
809421968617443328,2016-12-15 15:36:50,ICYMI:
809421395356712960,2016-12-15 15:34:33,: . &amp; other local activists announced will be in A.C. to recruit residents to march on D.C.
809255882177515520,2016-12-15 04:36:52,Back in NY at Advent Capital's Christmas Party with Aisha and Gigi.
809183008553046016,2016-12-14 23:47:17,"Sitting on a Panel Discussion ""Is Justice the Answer: A Civil Rights Response"" w/ Cornel Brooks, Dr. W. Franklyn R…"
809180144904634370,2016-12-14 23:35:55,Speaker NGOs at NCBC in Charleston
809179412516241408,2016-12-14 23:33:00,"Addressing the Congress of National Black Churches in Charleston, SC."
809178475143823360,2016-12-14 23:29:16,: On /14 we will recommit to an who will stand for criminal justice &amp; for communities that are free from offici…
809178411080044544,2016-12-14 23:29:01,: Make sure to catch the th annual Revvie Awards airing Sunday January on
809143564898803712,2016-12-14 21:10:33,"On /14 we will recommit to an that stands w/the nation’s workers &amp; protects their right to organize,union…"
809142561772306432,2016-12-14 21:06:34,On /14 we will recommit to an that believes in the rights of all people to have an undisturbed right to…
809141885121990656,2016-12-14 21:03:53,"On Dr. Martin Luther King Jr.'s weekend, we will recommit to an that is not infused with bigotry…"
809138205966630913,2016-12-14 20:49:16,": ""Is Justice the Answer? A Civil Rights Response"" Reginald T Jackson, W Franklin Richardson https:…"
809138086361829381,2016-12-14 20:48:47,: -'s sermon on standing up to the challenges America faces with the coming administration
809121704270266369,2016-12-14 19:43:41,": today: President , &amp; will discuss civil rights challenges wit…"
809121583143014401,2016-12-14 19:43:12,"Arriving in Charleston, S.C. Airport headed to the Conference of the National Black Churches."
808983295333728256,2016-12-14 10:33:42,"Purpose and focus drives me. People ask me how I keep going and do so much, I answer that I can't understand how u stay idle and do nothing."
808982306677489664,2016-12-14 10:29:46,"Tune in to my weekly commentary on the Tom Joyner Morning Show live at am/et. On to Charleston, SC today for Black Church Leaders Conf."
808906718654713857,2016-12-14 05:29:25,"Preaching at /14/17 Pre-march rally in Stamford, Conn. at Union Baptist Church earlier tonight."
808737935675838464,2016-12-13 18:18:44,Back in NY ready to go. I'm live on Keeping it Real w/ Al Sharpton from -4 pm/et on local stations and Sirius XM …
808735270107549697,2016-12-13 18:08:08,"is calling for Trump &amp; Congress to protect voting &amp; civil rights, access to healthcare, &amp; police re…"
808734378377547776,2016-12-13 18:04:36,is to commemorate Dr. King &amp; to give notice that we are dedicated &amp; fully committed to moving his leg…
808731996730048512,2016-12-13 17:55:08,"Have you signed up to register to march in DC w/ NAN, NAACP, NUL, clergy, and many others on Jan. ,2017?…"
808722084457316352,2016-12-13 17:15:44,Aisha and I at the White House Christmas Party for TV news hosts and correspondents. The last one for the Obama pre…
808695359056871424,2016-12-13 15:29:33,": Just interviewed about his ""We Shall Not Be Moved"" March /14/17 in DC to warn &amp; Congress our fight…"
808509445600935936,2016-12-13 03:10:47,": Make sure you tune in for our th annual Revvie Awards! Sunday, January st at am on"
808410969378607104,2016-12-12 20:39:29,: Check out 's “uplifting” sermon for those disappointed with Trump’s win
808409753588236288,2016-12-12 20:34:39,"Newark City Council Mildred Crump, NAN Board Member Rev. Bartley &amp; Rachel Noerdlinger discuss NAN's Jan th March…"
808375893047525380,2016-12-12 18:20:06,"Live from DC, Tune in to Keeping it Real w/ Al Sharpton on local stations or SIRIUS XM and call in at …"
808375809870282752,2016-12-12 18:19:46,": .'s Network announces /14 march and rally in Washington, demanding accountability from Trump. …"
808361034876600320,2016-12-12 17:21:03,join us for a kickoff rally /18 as we prepare for our /14 DC March.
808360350722719746,2016-12-12 17:18:20,Congressman Espaillat &amp; I called for black-Latino unity in the face of a possibly hostile incoming administration.
808341875447001090,2016-12-12 16:04:56,"""The question is not what Trump will do. The question is, what are we going to do?"" - Full article via"
808310718915366913,2016-12-12 14:01:07,: Al Sharpton talks while delivering sermon in :
808079392320745472,2016-12-11 22:41:55,"Wow, glad to see years after releasing the book, people still line up for me to sign a copy of the Rejected Stone."
808077289309241348,2016-12-11 22:33:33,"In Camden, NJ autographing copies of my book the Rejected Stone at Parkside Church."
808076830632714241,2016-12-11 22:31:44,"With Dr. Amir Khan of Camden , NJ NAN Chapter."
808076209049501697,2016-12-11 22:29:16,"Preaching at Parkside United Methodist Church in Camden, NJ earlier today"
808075821713858560,2016-12-11 22:27:43,Preaching at Parkside United Methodist
807959903713234944,2016-12-11 14:47:06,"Are you tuned in to my national radio show, 'Sunday Morning w/ Rev. Al Sharpton'? Check for listings and …"
807956303318491137,2016-12-11 14:32:48,"I preach at the am service at Parkside United Methodist Church on Khaigns AV. In Camden, NJ. Come out!"
807954442251366400,2016-12-11 14:25:24,"Politics Nation done, now radio time.Arrived at studio to go live on Sunday Morning w/Al Sharpton. Call in at …"
807946075583746048,2016-12-11 13:52:09,In my Roundtable
807943279249682432,2016-12-11 13:41:03,Former Prosecutor Paul Butler joins me on to discuss the mistrial in the case &amp; Dylan…
807940213284732928,2016-12-11 13:28:52,"Nice try, but we got ya!"
