id,created_at,text
792692649312550912,2016-10-30 11:40:29,"I am live hosting 'Politics Nation w/ Al Sharpton' at am ET, tune in only via MSNBC."
792690962141220864,2016-10-30 11:33:47,Tune in to at am ET
792478293786234885,2016-10-29 21:28:43,I ran into Lorenzo Upton who was on my jury in my trial. He voted (with the other jurors) Not Guilty. I really…
792477931348033536,2016-10-29 21:27:17,"The NY State Legislators present a proclamation to Harlem activist, Beverly Alston at her retirement party."
792477477914415104,2016-10-29 21:25:28,At the retirement party of longtime community activist and my friend Beverly Alston w/ Atty. Michael Hardy.
792395296911294464,2016-10-29 15:58:55,: ICYMI: will be on w/ Sun. on at a.m. Tune in! https:/…
792395180620087296,2016-10-29 15:58:27,"I was so surprised to see my history teacher from Tilden High School, Elliot Salow came to the rally today. Wow. Th…"
792369510112174080,2016-10-29 14:16:27,"Esaw, 's widow &amp; the mother of his children thanks NAN for standing by her &amp; their children since the da…"
792367345486422016,2016-10-29 14:07:51,": Join us or tune in! am-11am we are live on &amp; on NY radio, WLIB am. https:…"
792367319146266625,2016-10-29 14:07:45,"I'm delivering my message &amp; after the broadcast Valerie Bell, 's mother will sign her book ""Just ."" Esaw…"
792367067945205760,2016-10-29 14:06:45,"Esaw, 's widow and the mother of his children thanks for standing by…"
792366811392147460,2016-10-29 14:05:43,At my desk at NAN's HOJ in Harlem checking my notes before giving the keynote address at the Saturday Rally. Tune i…
792364490696318976,2016-10-29 13:56:30,"I'm delivering my message and right after the broadcast Valerie Bell, 's mother will…"
792335066114494464,2016-10-29 11:59:35,"Valerie Bell, the Mother of Sean Bell, will join me this morning for the weekly NAN w/ her new…"
792050663777796097,2016-10-28 17:09:28,Live on Keeping it Real w/Al Sharpton.Tune in from -4 pm est on local stations or SIRIUS XM . It's EXHALE FRIDA…
792050251804844032,2016-10-28 17:07:50,: Join in on 016 at PM.
791687888803168256,2016-10-27 17:07:56,Live w/VP Democratic Nominee on 'Keeping it Real w/Sharpton'. Tune in until pm ET on local stations &amp; S…
791679576137207808,2016-10-27 16:34:54,Tune in to Keeping it Real w/ Al Sharpton from -4 pm est on local stations and SIRIUS XM . Call in w/ your view…
791679327372992513,2016-10-27 16:33:54,"My interview w/ Sen. Tim Kaine, US Democratic VP Nominee, will air at pm ET on my radio show. He &amp; I discuss civi…"
791677375012564992,2016-10-27 16:26:09,: Joins the Garner Family to Discuss Grand Jury Decision WE WANT JUSTICE for ! https:…
791668854732750850,2016-10-27 15:52:18,: [AUDIO] to the Tom Joyner Morning Show about the importance of early voting.
791366720367632384,2016-10-26 19:51:43,An old program from The Appreciate Banquet sponsored by the Senior Usher Board of Glover…
791346185755848706,2016-10-26 18:30:07,"I am live hosting ""Keepin' it Real w/ Al Sharpton until pm ET. Visit"
791346154059472896,2016-10-26 18:30:00,Headed into studio to go live on Keeping it Real w/ Al Sharpton from -4 pm est on local…
791206265393414144,2016-10-26 09:14:08,Tune in to my weekly commentary on the Tom Joyner Morning Show live at am est.
791012881227743233,2016-10-25 20:25:41,"I introduced my daughter Ashley to VP Candidate Tim Kaine, she attended school in Virginia where he is the Senator."
791011122723819520,2016-10-25 20:18:42,"Coming out of my radio studio today &amp; ran into Democratic VP Candidate, Tim Kaine. He and I campaigned together on…"
791010792007229440,2016-10-25 20:17:23,: . is a former Member turned Elected Official.
790999965468389376,2016-10-25 19:34:22,"Live w/ Georgia State Rep Erica Thomas (5th youngest in the country) &amp; Rev. Walrond of on ""Keepin' it Rea…"
790970241971003393,2016-10-25 17:36:15,"I am live hosting ""Keepin' it Real w/ Al Sharpton"" until pm ET. Visit for local listings t…"
790602956206989312,2016-10-24 17:16:48,": Tune In - ""Keepin' It Real w/ Al Sharpton"" pm-4pm ET. Check for listings &amp; dial to call in. h…"
790602943280082945,2016-10-24 17:16:45,: that from day one has supported &amp; fought to give a voice to 'Mothers of the Movement'. http…
790602716384985088,2016-10-24 17:15:50,": . aide says could attend ""summit on policing"""
790602670360948736,2016-10-24 17:15:39,In studio going live on Keeping it Real w/ Al Sharpton from -4 pm est local stations and SIRIUS . Call in at …
790273166753038336,2016-10-23 19:26:20,"Anthony Anderson, Cathy Hughes, Congressman Elijah Cummings at the Cathy Hughes brunch at Howard."
790272523309092868,2016-10-23 19:23:46,The one and only
790272182312132610,2016-10-23 19:22:25,At the brunch for Cathy Hughes at Howard University.
790271732254969856,2016-10-23 19:20:38,The great Dick Gregory at the Howard University brunch for Cathy Hughes.
790247904824922113,2016-10-23 17:45:57,: at Appreciate Banquet sponsored by the Senior Usher Board of Glover Memorial Baptist Church Sept.29th
790247503019012097,2016-10-23 17:44:21,"US Congresspersons Elijah Cummings &amp; Eleanor Holmes Norton, Baltimore Mayor Rawlings and Howard U Pres Dr. Wayne Fr…"
790243575623802880,2016-10-23 17:28:45,"Cathy Hughes, the icon,under the plaque officially naming the Cathy Hughes School of Communications at Howard Unive…"
790238599698669568,2016-10-23 17:08:58,Delivering the Sermon at the dedication of Cathy Hughes School of Communications at Howard U.
790238329941925888,2016-10-23 17:07:54,TV star Anthony Anderson introduced me to give the sermon at the renaming of the Cathy Hughes School of Communicati…
790209859761340416,2016-10-23 15:14:46,"I am now at Howard University to speak for the re naming of their School of Communications in honor of media mogul, Cathy Hughes. Great lady"
790187766940327936,2016-10-23 13:46:59,"Are you tuned in to my national radio show,'Sunday Morning w/Rev. Al Sharpton'? Check for listings and dial …"
790186826652872704,2016-10-23 13:43:15,Thanks for tuning in to w/Al Sharpton.Visit for recaps &amp; tune in every Sund…
790183642098270209,2016-10-23 13:30:35,A snippet of my Roundtable around if Trump wants to be President or a media mogul
790181872911417345,2016-10-23 13:23:34,Maria Teresa Kumar &amp; Rich Galen joined me in my Roundtable to discuss GOP fears around the Pre…
790180246494572544,2016-10-23 13:17:06,I asked about some things he can take pride in after all these years in the continued fight for justic…
790175131968692224,2016-10-23 12:56:46,Interviewing on via
790172539460972544,2016-10-23 12:46:28,Rev. Jesse Jackson (Civil Rights Leader &amp; my mentor) joins me on .
790170823655034880,2016-10-23 12:39:39,Stephanie Schriock joins me on to discuss Trump's comments and the backlash surrounding…
790168904719015936,2016-10-23 12:32:02,Judith Browne Dianis of the Advancement Project joined me on to discuss Trumps bogus voter fraud cl…
790167952553304065,2016-10-23 12:28:15,Are you tuned in to on MSNBC? Great show this morning
790161888747347969,2016-10-23 12:04:09,"I am live on 'Politics Nation w/ Al Sharpton' until am ET, tune in via MSNBC. At am call in to my national radio…"
789842197248143360,2016-10-22 14:53:49,"""They can rattle our logic but they can't rattle our faith. It's not enough to win a case. We…"
789833446239703040,2016-10-22 14:19:02,We are joined by Comptroller Scott Stringer as we discuss our call for a Summit on police &amp;…
789830945268457472,2016-10-22 14:09:06,"We are at the House of Justice, NAN's Harlem headquarters &amp; joined by Councilmembers Rory…"
789814741971701760,2016-10-22 13:04:43,I speak at the Saturday Action Rally in Harlem. Tune in live from -11 am est at WLIB AM or .
789212337496530944,2016-10-20 21:10:58,Some of the Deltas greet me at the Civil Rights Museum in Memphis.
789211194615881729,2016-10-20 21:06:26,"I stand again, looking at the motel room Dr. King spent his last night. I am always recharged every time I make thi…"
789210631874420736,2016-10-20 21:04:12,"In Memphis, I always stop where Dr. King was assassinated. I became the Youth Director of his SCLC Operation Breadb…"
789177124846309378,2016-10-20 18:51:03,My statement on the police shooting of
789173328372039682,2016-10-20 18:35:58,": Join civil rights leaders as they GET OUT THE VOTE! Rallies &amp; events in Cleveland, Akron &amp; Canton:"
789173172910235649,2016-10-20 18:35:21,is around the corner - equip yourself w/info &amp; resources. Start by heading to rallies…
788821042584248320,2016-10-19 19:16:06,What would you like to hear addressed tonight at the last Presidential Debate before the election? to share.
788808851118256128,2016-10-19 18:27:40,I am live w/ Charles Ellison of on Keeping it Real w/ Al Sharpton from -4 pm ET on local stations and SIR…
788790764797132801,2016-10-19 17:15:48,": Tune In - ""Keepin' It Real w/ Al Sharpton"" pm-4pm ET. Check for listings &amp; dial to call in. h…"
788790739996147712,2016-10-19 17:15:42,: says will claim election is rigged &amp; create Trump TV w/ Roger Ailes. The whole thing is a ruse!
788790574744829952,2016-10-19 17:15:02,"I am live hosting ""Keepin' it Real w/ Al Sharpton"" until pm ET. Visit for local listings t…"
788672207308333056,2016-10-19 09:24:41,Catch my weekly commentary on the Tom Joyner Morning Show at am est.
788583421501120512,2016-10-19 03:31:53,"Proud to be standing with the Godfather of Black Talk Radio and my mentor since my teenage years, Bob Law."
788582870390607872,2016-10-19 03:29:42,Greeting the folks at the First Church in Brooklyn w/ Bob Law.
788582306206408704,2016-10-19 03:27:27,"In my hometown of Brooklyn, New York speaking at First Church of God in Christ at a Voter Education Rally hosted by…"
788432309494087680,2016-10-18 17:31:25,"I am live w/Cathy Hughes (Founder &amp; CEO of ) on ""Keepin' It Real w/Al Sharpton. Tune in and dial to call in."
788426270078038016,2016-10-18 17:07:25,": What would the impact of a Trump lost be? discusses the idea of ""Trump tv"""
788426202180677632,2016-10-18 17:07:09,"Tune In - ""Keepin' It Real w/ Al Sharpton"" pm-4pm ET. Check for listings &amp; dial to call in."
788425902124335104,2016-10-18 17:05:57,: It's time to KEEP IT REAL with
788407062690668544,2016-10-18 15:51:06,"TONIGHT!!! Watch 's Triumph Awards on TV One at pm ET. If you haven't seen it yet,you owe it to you…"
788402289237262336,2016-10-18 15:32:08,ICYMI:
788359596998004740,2016-10-18 12:42:29,"TONIIGHT!!! Watch National Action Network's Triumph Awards on TV One at pm est. if you haven't seen it yet, you owe it to yourself."
788097304943292417,2016-10-17 19:20:14,"At my desk at NAN DC Bureau office reviewing things with Ebonie Riley, NAN Bureau Chief. NAN staffers Magalie Normi…"
787722490617430016,2016-10-16 18:30:51,"""Al Sharpton &amp; his nonprofit 'step up' to support ravaged Haiti -"
787665211822080000,2016-10-16 14:43:15,My sign off on Politics Nation w/ Al Sharpton this morning in MSNBC.
787642420578123776,2016-10-16 13:12:41,Headed in studio now to do my national call in radio show Sunday Morning w/ Al Sharpton. Call in at fr…
787642175131615232,2016-10-16 13:11:42,"Thank you for tuning in to , I am live on Sundays at am ET only on MSNBC."
787638858842341376,2016-10-16 12:58:32,"Live with Baruch Dean David Birdsell on , tune in"
787636081206431745,2016-10-16 12:47:29,"Back in my Roundtable w/ Republican Strategist Susan del Percio, Democratic Strategist Lis Smith, a…"
787630858236727296,2016-10-16 12:26:44,"Ohio Congresswoman Marcia Fudge joins me on , tune in."
787630703542501376,2016-10-16 12:26:07,Live w/ Terry O'Neill of The National Organization of Women on discussing the presidential election…
787627811502718976,2016-10-16 12:14:38,"I am live in my Roundtable, tune in via MSNBC"
787618708546056192,2016-10-16 11:38:28,: Tune in to w/ at am est on
787618411220172800,2016-10-16 11:37:17,: Al Sharpton &amp; his nonprofit 'step up' support ravaged Haiti - …
787618076967727104,2016-10-16 11:35:57,"I am live hosting at am ET, tune in only on MSNBC."
787586162747641856,2016-10-16 09:29:08,Catch Politics Nation w/ Al Sharpton on MSNBC at am est and then my national radio show at am. Call in at and be heard.
787351536808714240,2016-10-15 17:56:49,"Me, &amp; Oscar Grant's mother"
787351259259043878,2016-10-15 17:55:43,"My daughters and common with Dr. Tiffany Crutcher, Terrence Crutcher's twin sister and Attorney…"
787349348174757892,2016-10-15 17:48:07,Judge Glenda Hatchett &amp; me at
787348951993167872,2016-10-15 17:46:33,I'm with Dr. Tiffany Crutcher the twin sister of who was killed by a police…
787348066655494144,2016-10-15 17:43:01,I'm addressing Circle of Sisters speaking about the importance of voting!
787340878172024832,2016-10-15 17:14:28,I'm with &amp; Raqiyah Mays at Circle of Sisters having a discussion about his new record…
787291346142887936,2016-10-15 13:57:38,"If you can't make it to the ""House of Justice"" watch the live stream at…"
787273773384892416,2016-10-15 12:47:49,The Consul General of to be at NAN rally this a.m. abt recovery in the wake of cholera &amp; other maladies as NAN launches relief drive
787079234984566785,2016-10-14 23:54:47,"Yesterday, Panasonic Chairman &amp; CEO Joseph M. Taylor announced that the company would become the anchor funder of t…"
787071202934140928,2016-10-14 23:22:52,"Join us Sat., Oct. as we collect supplies to send 🇭🇹 to support relief efforts. Find out more here:…"
787069899122237441,2016-10-14 23:17:41,": Join us Sat., Oct. as we collect supplies to send 🇭🇹 to support relief efforts. Find out more here:"
787011735597125632,2016-10-14 19:26:34,"I am live w/ on ""Keepin' it Real w/ Al Sharpton"" until pm ET. It's , tune in and dial …"
787011001564618752,2016-10-14 19:23:39,: : &amp; opens National Action Network Newark Tech World in conjunction with …
786974669165498368,2016-10-14 16:59:17,Tune in live -4 pm est to Keeping it Real w/ Al Sharpton. I'm on local stations and Sirius . Tune in or call in…
786680619489169409,2016-10-13 21:30:50,:
786680042520797184,2016-10-13 21:28:32,"Earlier opening w/ Joseph M. Taylor, Newark Mayor Ras Baraka, Pastor David Jefferson &amp; NAN's Te…"
786675227216506881,2016-10-13 21:09:24,Discussing all to come w/Pastor Bartley &amp; Mayor Baraka at our which will serve as a hightech co…
786672004795658240,2016-10-13 20:56:36,In one of the classrooms at our new NAN Newark Tech World.
786671671843360770,2016-10-13 20:55:16,NAN Tech Chair Lord Dowdell shares remarks at the NAN Newark Tech World Opening Program.
786670796135686144,2016-10-13 20:51:48,Very proud of all the work Rev. David Jefferson Sr. and Pastor Bartley has done and will continue to do.…
786670090771136512,2016-10-13 20:48:59,NAN Newark Tech World Opening Program.
786667427178229760,2016-10-13 20:38:24,Speaking at the NAN Newark Tech World Opening Program.
786664890480021505,2016-10-13 20:28:20,Speaking at the NAN Newark Tech World Opening Program. Thank you to everyone who was a part of making this happen.…
786663368925077505,2016-10-13 20:22:17,"NAN New Jersey Chapter President, Pastor David Jefferson Sr, introduces me at the NAN Newark Tech World Opening Pro…"
786662699015008256,2016-10-13 20:19:37,Newark Mayor RAS Baraka discusses why this Tech Center is so important at the NAN Newark Tech World Opening Program…
786661804881637376,2016-10-13 20:16:04,Councilwoman Mildred Crump shares remarks at the NAN Newark Tech World Opening before introducing Mayor Ras Baraka.…
786635725714456576,2016-10-13 18:32:26,NAN Newark Tech World Opening
786632632088010752,2016-10-13 18:20:09,Excited as we prepare to unveil the NAN Newark Tech Academy!
786630537955926016,2016-10-13 18:11:49,"I am live from Newark hosting ""Keepin' it Real w/ Al Sharpton"". Visit for local listings to…"
786598413538324480,2016-10-13 16:04:10,"TODAY Newark &amp; NAN will hold a groundbreaking ceremony,in of the most underserved communities a huge tech center…"
786596877269659649,2016-10-13 15:58:04,ICYMI:
786594962293088260,2016-10-13 15:50:27,"Join us Sat., Oct. as we collect supplies to send 🇭🇹 to support relief efforts. Find out more here:…"
786515521302827008,2016-10-13 10:34:47,My prayers for the family of Tommy Ford of the sitcom Martin. May he rest in peace.
786504396221911040,2016-10-13 09:50:35,"Landed back in NYC. I'm excited about the opening of the NAN Tech World in Newark, NJ. This a monumental achievement for Nwk and NAN NJ. WOW"
786428130281926656,2016-10-13 04:47:32,Very good NAN Town Hall meeting in Watts/LA tonight at Beulah Baptist Church. Headed to LAX to get the red eye to NYC.
786370163956445184,2016-10-13 00:57:11,I will never forget Melvin Hightower in LA. They brought this yr old man to NAN LA to fulfill his wish to meet m…
786368459114504192,2016-10-13 00:50:25,"This yr old man, Mr. Melvin, said to us at the LA Leadership luncheon that his only two wishes was to meet Presi…"
786367661647208448,2016-10-13 00:47:15,Dr. Maulana Karenga (Creator of the holiday Kwanzaa) and I talk at NAN's Leadership Luncheon at NAN LA.
786366603344633856,2016-10-13 00:43:02,Packed house at NAN's Leadership Luncheon at our LA offices.
786366181229879296,2016-10-13 00:41:22,Alfred Olango Press Conference at NAN's LA office.
786365563866062848,2016-10-13 00:38:55,Press Conference at the NAN West Coast office with &amp; the family of San Diego police shoo…
786255174784475136,2016-10-12 17:20:16,: Today is the deadline in Missouri to register to vote for the November election. Learn more:
786255154001698816,2016-10-12 17:20:11,: says &amp; should have mentioned Haiti's hurricane victims at debate. He's right.
786255022640291841,2016-10-12 17:19:39,: and to unveil the Newark Tech World on /13 p at Hawthorne…
786255010787196928,2016-10-12 17:19:37,": Tune into , NAN's Nat'l Membership Director tonight FaceBook Live Living Room Conversatio…"
786254821477212160,2016-10-12 17:18:52,"Tune In - ""Keepin' It Real w/ Al Sharpton"" pm-4pm ET. Check for listings &amp; dial to call in."
786198948331401216,2016-10-12 13:36:50,"In LA talking by phone w/ Atty. Peter Bernard, Consul General of Haiti. They need our help. We must step up."
786051845185761280,2016-10-12 03:52:18,Leaving Oakland headed to LA. I'll be live from there at am est in the morning on the Tom Joyner Morning Show. Tune in.
786037622569336832,2016-10-12 02:55:47,"Former Congressman Kendrick Meek, OKC Council President Lynette McElhaney and NAN Oakland President Rev. Hames At N…"
786036980987625472,2016-10-12 02:53:14,"NAN Oakland Chapter Leadership Lunch on Criminal Justice in Oakland, Calif."
785981854478397440,2016-10-11 23:14:11,In San Francisco meetings. Headed to Town Hall Meeting in Oakland tonight and LA tomorrow.
785899420168708096,2016-10-11 17:46:37,": Tune In - ""Keepin' It Real w/ Al Sharpton"" pm-4pm ET. Check for listings &amp; dial to call in. htt…"
785587528715894785,2016-10-10 21:07:17,: . Rips Hillary Clinton and Donald Trump for Ignoring Haiti During Debate
785556735742181402,2016-10-10 19:04:55,"Live w/ on ""Keepin' It Real w/ Al Sharpton"" discussing the Presidential Debate, what's at stake this election, &amp; more. Tune in"
785532222384189441,2016-10-10 17:27:30,"It's on ""Keepin' It Real w/ Al Sharpton"" until pm ET. Visit for listings…"
785529090581209088,2016-10-10 17:15:04,"In prayer w/Father Pfleger, Mrs. Jacqueline Jackson and my mentor Rev. Jesse Jackson this past weekend in Chicago a…"
785507480386297856,2016-10-10 15:49:12,Our press conference outside the Haitian Consulate was an opportunity to amplify the tragedy in…
785500350908424192,2016-10-10 15:20:52,"Me, Councilman Mathieu Eugene, Rev. Emmanuel Asse, &amp; Minister Kirsten John Foy outside of the…"
785499250662772736,2016-10-10 15:16:29,"Standing outside the Haitian Consulate in NYC along with Councilman Mathieu Eugene, Emmanuel…"
785481870196834306,2016-10-10 14:07:26,
785481819965751296,2016-10-10 14:07:14,: W/Haitian clergy &amp; electeds ? candidates ignoring &amp; miles from no policing ?'s. RIP …
785415793278418944,2016-10-10 09:44:52,"I watched the debate last night, I couldn't believe that it occurred miles from Ferguson and police reform was NOT discussed."
785268563334561792,2016-10-09 23:59:49,Deeply saddened at the news of the passing of Ken Thompson. He had Thurgood Marshall like passion for justice. RIP.
785200929272389632,2016-10-09 19:31:04,
785106052198957057,2016-10-09 13:14:04,"I am live on ""Sunday Morning w/ Al Sharpton"" until am ET and dial to call in."
785104996178153474,2016-10-09 13:09:52,"Live w/ political analyst Hugh Hewitt on , tune in to MSNBC."
785104780284669952,2016-10-09 13:09:00,"Trump vows not to quit, live with Trump surrogate Steve Cortes on"
785095369613012992,2016-10-09 12:31:37,"Discussing tonight's Presidential Debate on , tune in to MSNBC."
785094747614568448,2016-10-09 12:29:08,"I am live in my Politics Nation Roundtable, tune in to MSNBC"
785094058641358848,2016-10-09 12:26:24,"I am live on , tune in only via MSNBC"
785082419951075328,2016-10-09 11:40:09,Politics Nation w/ Al Sharpton is live in minutes (8 am est) on MSNBC. Tune in.
785074311182901248,2016-10-09 11:07:56,: Tune in to w/ at am est on
784950970031730692,2016-10-09 02:57:49,"Tune to Politics Nation w/ Al Sharpton, I'll be live at am est on MSNBC and then at am call in to my national radio show at"
784950195083743232,2016-10-09 02:54:44,"Just landed back in NY, had a great day in Chicago and Cincinatti. I'll be back up early to go live on both my tv and radio show."
784933262904922112,2016-10-09 01:47:27,Cincinatti businessman J.C. Battle surprised me with this beautiful tapestry in honor of my /3 birthday.
784932740248563712,2016-10-09 01:45:23,"Mayor John Cranley of Cincinatti presents me with an official proclamation naming this ""Al Sharpton Day"" in Cincinn…"
784932232867831808,2016-10-09 01:43:22,I keynote the Greater Cincinnati NAN Chapter dinner.
784931858459090944,2016-10-09 01:41:53,Packed house at Greater Cincinatti NAN Equity and Social Justice Dnner.
784914207250743296,2016-10-09 00:31:44,"Wow, a packed house and wonderful program at the Greater Cincinatti NAN Chapters Award Dinner tonight. I am so proud of Bishop Bobby Hilton."
784863004223471616,2016-10-08 21:08:16,Moving through Cincinnati Airport headed to keynote the Greater Cincinnati NAN Equity and Social Justice Dinner. A…
784861980096094208,2016-10-08 21:04:12,Catch the re-airing of NAN's Triumph Awards ON DEMAND or on at the dates above.
784860563130224640,2016-10-08 20:58:34,"Rev. Jackson and his pastor, Rev. Clay Evans."
784860276147515395,2016-10-08 20:57:26,Rev. Jackson and I on the platform of Rainbow PUSH on his th birthday.
784858548945752065,2016-10-08 20:50:34,Just landed in Cincinatti to keynote the Greater Cincinatti NAN Equity Awards Dinner. I will deal with Voting in Ohio. This is a challenge.
784814136819613697,2016-10-08 17:54:06,: announces NAN's Haitian relief efforts. Join us at the Haitian Consul office Mon. /10 :30am nd…
784762688832434176,2016-10-08 14:29:39,Rev. Jackson and I go over notes in his office.
784762226527928320,2016-10-08 14:27:49,At Rev. Jackson's birthday with Congressman Robin Kelly.
784683828044496896,2016-10-08 09:16:17,"In life, don't ever forget the bridges that brought you across dangerous waters. Think, if they had not been there, you may have drowned."
784683305056759808,2016-10-08 09:14:13,"On my way to Chicago to salute Rev. Jesse Jackson on his th birthday, a mentor and movement father. Then on to Cincinatti for NAN Cincy."
784682514904408064,2016-10-08 09:11:04,On All Due Respect on Bloomberg TV
784508321801838592,2016-10-07 21:38:54,On All Due Respect on Bloomberg TV
784505171107774464,2016-10-07 21:26:22,I am live on All Due Respect on Bloomberg TV. Tune in.
784498808327704576,2016-10-07 21:01:05,I am live on All Due Respect on Bloomberg TV at pm est and MSNBC at pm est. Tune in.
784477130876792832,2016-10-07 19:34:57,"Taking a phone call during my radio break. I'm coming back w/ to take your calls on ""Keepin' It Real w/ A…"
784471078655655936,2016-10-07 19:10:54,"I am live w/ on ""Keepin' it Real w/ Al Sharpton"", he turns years old tomorrow."
784465304172781568,2016-10-07 18:47:57,: Tune in!! I'm waiting to exhale with on -4pm on …
784455212966748160,2016-10-07 18:07:51,"I am live w/ on ""Keepin' It Real w/Al Sharpton"" listening to his .Visit for listings to tune in"
784454616796848129,2016-10-07 18:05:29,": ""We had another solid job report. We saw growth of ,000 jobs, and steady growth in both jobs and wages."" - …"
784450974500941824,2016-10-07 17:51:01,": If you missed it, Catch the Triumph Awards re-run live on On Demand streaming from Oct. -Oct.30 ! …"
784450896864415745,2016-10-07 17:50:42,": COMING UP: At :55pm ET, and discuss today's ."
784450599618224128,2016-10-07 17:49:31,"It's on ""Keepin' it Real w/Al Sharpton"" until pm ET.Visit for listings &amp; dia…"
784435691145035777,2016-10-07 16:50:17,Pray for those in the path of Hurricane Matthew. Let us rally around those families who have lost love ones and those areas that have fallen
784152301149757440,2016-10-06 22:04:12,Doing a segment for a documentary w/ Stanley Nelson and Phil Bertelsen on President Obama.
784135503864102916,2016-10-06 20:57:27,"If you missed NAN's Triumph Awards catch it again tonight at midnight, /9, and /18 on .…"
784085492828479490,2016-10-06 17:38:43,"I am live w/ Glynda Carr of Higher Heights on ""Keepin' It Real w/ Al Sharpton"" discussing . Tune in…"
